23:53:27.498517 IP ubuntu18-virtual-machine.44917 > _gateway.domain: 2835+ [1au] A? mozilla.cloudflare-dns.com. (55)
23:53:27.499086 IP ubuntu18-virtual-machine.58470 > _gateway.domain: 36715+ [1au] AAAA? mozilla.cloudflare-dns.com. (55)
23:53:27.679286 IP _gateway.domain > ubuntu18-virtual-machine.58470: 36715 2/0/1 AAAA 2606:4700::6810:f9f9, AAAA 2606:4700::6810:f8f9 (111)
23:53:27.774095 IP ubuntu18-virtual-machine.52472 > _gateway.domain: 62012+ [1au] PTR? 2.49.168.192.in-addr.arpa. (54)
23:53:27.877383 IP _gateway.domain > ubuntu18-virtual-machine.52472: 62012 NXDomain 0/0/1 (54)
23:53:27.877553 IP ubuntu18-virtual-machine.52472 > _gateway.domain: 62012+ PTR? 2.49.168.192.in-addr.arpa. (43)
23:53:27.926971 IP _gateway.domain > ubuntu18-virtual-machine.52472: 62012 NXDomain 0/0/0 (43)
23:53:27.927573 IP ubuntu18-virtual-machine.33692 > _gateway.domain: 28308+ [1au] PTR? 136.49.168.192.in-addr.arpa. (56)
23:53:27.934834 IP ubuntu18-virtual-machine.42649 > _gateway.domain: 44902+ [1au] A? detectportal.firefox.com. (53)
23:53:27.935085 IP ubuntu18-virtual-machine.42686 > _gateway.domain: 53319+ [1au] AAAA? detectportal.firefox.com. (53)
23:53:27.976922 IP _gateway.domain > ubuntu18-virtual-machine.42686: 53319 3/0/1 CNAME detectportal.prod.mozaws.net., CNAME prod.detectportal.prod.cloudops.mozgcp.net., AAAA 2600:1901:0:38d7:: (176)
23:53:27.982005 IP _gateway.domain > ubuntu18-virtual-machine.42649: 44902 3/0/1 CNAME detectportal.prod.mozaws.net., CNAME prod.detectportal.prod.cloudops.mozgcp.net., A 34.107.221.82 (164)
23:53:27.982696 IP ubuntu18-virtual-machine.52354 > 82.221.107.34.bc.googleusercontent.com.http: Flags [S], seq 145091263, win 64240, options [mss 1460,sackOK,TS val 3282465666 ecr 0,nop,wscale 7], length 0
23:53:28.020053 IP _gateway.domain > ubuntu18-virtual-machine.33692: 28308 NXDomain 0/0/1 (56)
23:53:28.020186 IP ubuntu18-virtual-machine.33692 > _gateway.domain: 28308+ PTR? 136.49.168.192.in-addr.arpa. (45)
23:53:28.072808 IP _gateway.domain > ubuntu18-virtual-machine.33692: 28308 NXDomain 0/0/0 (45)
23:53:28.079526 IP 82.221.107.34.bc.googleusercontent.com.http > ubuntu18-virtual-machine.52354: Flags [S.], seq 1617116106, ack 145091264, win 64240, options [mss 1460], length 0
23:53:28.079560 IP ubuntu18-virtual-machine.52354 > 82.221.107.34.bc.googleusercontent.com.http: Flags [.], ack 1, win 64240, length 0
23:53:28.079858 IP ubuntu18-virtual-machine.52354 > 82.221.107.34.bc.googleusercontent.com.http: Flags [P.], seq 1:302, ack 1, win 64240, length 301: HTTP: GET /canonical.html HTTP/1.1
23:53:28.080063 IP 82.221.107.34.bc.googleusercontent.com.http > ubuntu18-virtual-machine.52354: Flags [.], ack 302, win 64240, length 0
23:53:28.345820 IP ubuntu18-virtual-machine.44917 > _gateway.domain: 2835+ [1au] A? mozilla.cloudflare-dns.com. (55)
23:53:28.381581 IP ubuntu18-virtual-machine.35249 > _gateway.domain: 5397+ [1au] A? www.google.com. (43)
23:53:28.381791 IP ubuntu18-virtual-machine.39523 > _gateway.domain: 57072+ [1au] A? google.com. (39)
23:53:28.389932 IP ubuntu18-virtual-machine.41848 > _gateway.domain: 13539+ [1au] A? forcesafesearch.google.com. (55)
23:53:28.390162 IP ubuntu18-virtual-machine.42556 > _gateway.domain: 22767+ [1au] A? www.youtube.com. (44)
23:53:28.390346 IP ubuntu18-virtual-machine.37210 > _gateway.domain: 11324+ [1au] A? m.youtube.com. (42)
23:53:28.390514 IP ubuntu18-virtual-machine.50581 > _gateway.domain: 40931+ [1au] A? youtubei.googleapis.com. (52)
23:53:28.390718 IP ubuntu18-virtual-machine.58224 > _gateway.domain: 43293+ [1au] A? youtube.googleapis.com. (51)
23:53:28.415531 IP _gateway.domain > ubuntu18-virtual-machine.39523: 57072 6/0/1 A 74.125.131.138, A 74.125.131.101, A 74.125.131.100, A 74.125.131.113, A 74.125.131.139, A 74.125.131.102 (135)
23:53:28.418539 IP ubuntu18-virtual-machine.57469 > _gateway.domain: 52733+ [1au] A? www.youtube-nocookie.com. (53)
23:53:28.421553 IP _gateway.domain > ubuntu18-virtual-machine.41848: 13539 1/0/1 A 216.239.38.120 (71)
23:53:28.421956 IP ubuntu18-virtual-machine.54813 > _gateway.domain: 62892+ [1au] A? restrict.youtube.com. (49)
23:53:28.427311 IP _gateway.domain > ubuntu18-virtual-machine.44917: 2835 2/0/1 A 104.16.248.249, A 104.16.249.249 (87)
23:53:28.428029 IP ubuntu18-virtual-machine.44657 > _gateway.domain: 54379+ [1au] A? restrictmoderate.youtube.com. (57)
23:53:28.428518 IP ubuntu18-virtual-machine.37946 > 104.16.248.249.https: Flags [S], seq 2933942363, win 64240, options [mss 1460,sackOK,TS val 2742919317 ecr 0,nop,wscale 7], length 0
23:53:28.428621 IP ubuntu18-virtual-machine.37950 > 104.16.248.249.https: Flags [S], seq 1185567957, win 64240, options [mss 1460,sackOK,TS val 2742919317 ecr 0,nop,wscale 7], length 0
23:53:28.428699 IP ubuntu18-virtual-machine.37954 > 104.16.248.249.https: Flags [S], seq 3589107195, win 64240, options [mss 1460,sackOK,TS val 2742919317 ecr 0,nop,wscale 7], length 0
23:53:28.428781 IP ubuntu18-virtual-machine.37956 > 104.16.248.249.https: Flags [S], seq 857451221, win 64240, options [mss 1460,sackOK,TS val 2742919317 ecr 0,nop,wscale 7], length 0
23:53:28.429124 IP ubuntu18-virtual-machine.37964 > 104.16.248.249.https: Flags [S], seq 3760430087, win 64240, options [mss 1460,sackOK,TS val 2742919317 ecr 0,nop,wscale 7], length 0
23:53:28.429245 IP ubuntu18-virtual-machine.37970 > 104.16.248.249.https: Flags [S], seq 1660155279, win 64240, options [mss 1460,sackOK,TS val 2742919318 ecr 0,nop,wscale 7], length 0
23:53:28.429348 IP ubuntu18-virtual-machine.37984 > 104.16.248.249.https: Flags [S], seq 2422651041, win 64240, options [mss 1460,sackOK,TS val 2742919318 ecr 0,nop,wscale 7], length 0
23:53:28.429459 IP ubuntu18-virtual-machine.37988 > 104.16.248.249.https: Flags [S], seq 4157673565, win 64240, options [mss 1460,sackOK,TS val 2742919318 ecr 0,nop,wscale 7], length 0
23:53:28.429568 IP ubuntu18-virtual-machine.37992 > 104.16.248.249.https: Flags [S], seq 614543123, win 64240, options [mss 1460,sackOK,TS val 2742919318 ecr 0,nop,wscale 7], length 0
23:53:28.429670 IP ubuntu18-virtual-machine.37996 > 104.16.248.249.https: Flags [S], seq 3214699506, win 64240, options [mss 1460,sackOK,TS val 2742919318 ecr 0,nop,wscale 7], length 0
23:53:28.439837 IP _gateway.domain > ubuntu18-virtual-machine.35249: 5397 6/0/1 A 173.194.222.104, A 173.194.222.106, A 173.194.222.103, A 173.194.222.99, A 173.194.222.147, A 173.194.222.105 (139)
23:53:28.440574 IP ubuntu18-virtual-machine.56902 > _gateway.domain: 51679+ [1au] A? sitereview.zscaler.com. (51)
23:53:28.443074 IP 82.221.107.34.bc.googleusercontent.com.http > ubuntu18-virtual-machine.52354: Flags [P.], seq 1:299, ack 302, win 64240, length 298: HTTP: HTTP/1.1 200 OK
23:53:28.443091 IP ubuntu18-virtual-machine.52354 > 82.221.107.34.bc.googleusercontent.com.http: Flags [.], ack 299, win 63942, length 0
23:53:28.453844 IP _gateway.domain > ubuntu18-virtual-machine.50581: 40931 12/0/1 A 142.251.1.95, A 209.85.233.95, A 108.177.14.95, A 74.125.131.95, A 74.125.205.95, A 64.233.165.95, A 64.233.162.95, A 173.194.221.95, A 64.233.161.95, A 173.194.222.95, A 142.250.150.95, A 173.194.73.95 (244)
23:53:28.454351 IP ubuntu18-virtual-machine.45390 > _gateway.domain: 10779+ [1au] A? use-application-dns.net. (52)
23:53:28.459526 IP _gateway.domain > ubuntu18-virtual-machine.57469: 52733 3/0/1 CNAME youtube-ui.l.google.com., CNAME wide-youtube.l.google.com., A 173.194.222.198 (130)
23:53:28.459553 IP _gateway.domain > ubuntu18-virtual-machine.42556: 22767 3/0/1 CNAME youtube-ui.l.google.com., CNAME wide-youtube.l.google.com., A 64.233.161.198 (121)
23:53:28.460140 IP ubuntu18-virtual-machine.60442 > _gateway.domain: 17981+ [1au] A? example.org. (40)
23:53:28.460291 IP ubuntu18-virtual-machine.56119 > _gateway.domain: 19341+ [1au] AAAA? example.org. (40)
23:53:28.465874 IP _gateway.domain > ubuntu18-virtual-machine.54813: 62892 1/0/1 A 216.239.38.120 (65)
23:53:28.467175 IP ubuntu18-virtual-machine.45828 > _gateway.domain: 52879+ [1au] A? ipv4only.arpa. (42)
23:53:28.468054 IP ubuntu18-virtual-machine.42222 > _gateway.domain: 45542+ [1au] AAAA? ipv4only.arpa. (42)
23:53:28.473499 IP _gateway.domain > ubuntu18-virtual-machine.58224: 43293 14/0/1 A 74.125.205.95, A 64.233.164.95, A 64.233.165.95, A 64.233.162.95, A 64.233.163.95, A 173.194.220.95, A 64.233.161.95, A 173.194.222.95, A 142.250.150.95, A 173.194.73.95, A 142.251.1.95, A 209.85.233.95, A 108.177.14.95, A 74.125.131.95 (275)
23:53:28.474951 IP ubuntu18-virtual-machine.52356 > 82.221.107.34.bc.googleusercontent.com.http: Flags [S], seq 2284255119, win 64240, options [mss 1460,sackOK,TS val 3282466158 ecr 0,nop,wscale 7], length 0
23:53:28.490346 IP _gateway.domain > ubuntu18-virtual-machine.56902: 51679 1/0/1 A 104.129.193.93 (67)
23:53:28.490406 IP _gateway.domain > ubuntu18-virtual-machine.45390: 10779 3/0/1 A 44.236.48.31, A 44.236.72.93, A 44.235.246.155 (100)
23:53:28.505522 IP _gateway.domain > ubuntu18-virtual-machine.44657: 54379 1/0/1 A 216.239.38.119 (73)
23:53:28.514827 IP _gateway.domain > ubuntu18-virtual-machine.56119: 19341 1/0/1 AAAA 2606:2800:220:1:248:1893:25c8:1946 (68)
23:53:28.514844 IP _gateway.domain > ubuntu18-virtual-machine.45828: 52879 2/0/1 A 192.0.0.170, A 192.0.0.171 (74)
23:53:28.520709 IP _gateway.domain > ubuntu18-virtual-machine.60442: 17981 1/0/1 A 93.184.216.34 (56)
23:53:28.534811 IP _gateway.domain > ubuntu18-virtual-machine.42222: 45542 0/1/1 (99)
23:53:28.540757 IP 82.221.107.34.bc.googleusercontent.com.http > ubuntu18-virtual-machine.52356: Flags [S.], seq 1098524414, ack 2284255120, win 64240, options [mss 1460], length 0
23:53:28.540878 IP ubuntu18-virtual-machine.52356 > 82.221.107.34.bc.googleusercontent.com.http: Flags [.], ack 1, win 64240, length 0
23:53:28.541540 IP ubuntu18-virtual-machine.52356 > 82.221.107.34.bc.googleusercontent.com.http: Flags [P.], seq 1:304, ack 1, win 64240, length 303: HTTP: GET /success.txt?ipv4 HTTP/1.1
23:53:28.542161 IP 82.221.107.34.bc.googleusercontent.com.http > ubuntu18-virtual-machine.52356: Flags [.], ack 304, win 64240, length 0
23:53:28.601031 IP 82.221.107.34.bc.googleusercontent.com.http > ubuntu18-virtual-machine.52356: Flags [P.], seq 1:217, ack 304, win 64240, length 216: HTTP: HTTP/1.1 200 OK
23:53:28.601050 IP ubuntu18-virtual-machine.52356 > 82.221.107.34.bc.googleusercontent.com.http: Flags [.], ack 217, win 64024, length 0
23:53:28.678652 IP ubuntu18-virtual-machine.38000 > 104.16.248.249.https: Flags [S], seq 1991965986, win 64240, options [mss 1460,sackOK,TS val 2742919567 ecr 0,nop,wscale 7], length 0
23:53:28.678789 IP ubuntu18-virtual-machine.38016 > 104.16.248.249.https: Flags [S], seq 1331662347, win 64240, options [mss 1460,sackOK,TS val 2742919567 ecr 0,nop,wscale 7], length 0
23:53:28.678869 IP ubuntu18-virtual-machine.38026 > 104.16.248.249.https: Flags [S], seq 3926439452, win 64240, options [mss 1460,sackOK,TS val 2742919567 ecr 0,nop,wscale 7], length 0
23:53:28.678972 IP ubuntu18-virtual-machine.38032 > 104.16.248.249.https: Flags [S], seq 976808630, win 64240, options [mss 1460,sackOK,TS val 2742919567 ecr 0,nop,wscale 7], length 0
23:53:28.679347 IP ubuntu18-virtual-machine.38040 > 104.16.248.249.https: Flags [S], seq 3620700913, win 64240, options [mss 1460,sackOK,TS val 2742919568 ecr 0,nop,wscale 7], length 0
23:53:28.679471 IP ubuntu18-virtual-machine.38054 > 104.16.248.249.https: Flags [S], seq 681540637, win 64240, options [mss 1460,sackOK,TS val 2742919568 ecr 0,nop,wscale 7], length 0
23:53:28.679592 IP ubuntu18-virtual-machine.38056 > 104.16.248.249.https: Flags [S], seq 2379046273, win 64240, options [mss 1460,sackOK,TS val 2742919568 ecr 0,nop,wscale 7], length 0
23:53:28.679734 IP ubuntu18-virtual-machine.38066 > 104.16.248.249.https: Flags [S], seq 2449044958, win 64240, options [mss 1460,sackOK,TS val 2742919568 ecr 0,nop,wscale 7], length 0
23:53:28.679860 IP ubuntu18-virtual-machine.38080 > 104.16.248.249.https: Flags [S], seq 2848183930, win 64240, options [mss 1460,sackOK,TS val 2742919568 ecr 0,nop,wscale 7], length 0
23:53:28.680009 IP ubuntu18-virtual-machine.38096 > 104.16.248.249.https: Flags [S], seq 3263775805, win 64240, options [mss 1460,sackOK,TS val 2742919568 ecr 0,nop,wscale 7], length 0
23:53:28.797778 IP ubuntu18-virtual-machine.57096 > _gateway.domain: 16239+ [1au] PTR? 82.221.107.34.in-addr.arpa. (55)
23:53:28.856589 IP _gateway.domain > ubuntu18-virtual-machine.57096: 16239 1/0/1 PTR 82.221.107.34.bc.googleusercontent.com. (107)
23:53:28.858294 IP ubuntu18-virtual-machine.39186 > _gateway.domain: 34702+ [1au] PTR? 249.248.16.104.in-addr.arpa. (56)
23:53:28.903480 IP _gateway.domain > ubuntu18-virtual-machine.39186: 34702 NXDomain 0/1/1 (118)
23:53:28.903782 IP ubuntu18-virtual-machine.39186 > _gateway.domain: 34702+ PTR? 249.248.16.104.in-addr.arpa. (45)
23:53:28.958305 IP _gateway.domain > ubuntu18-virtual-machine.39186: 34702 NXDomain 0/1/0 (107)
23:53:29.435738 IP ubuntu18-virtual-machine.37996 > 104.16.248.249.https: Flags [S], seq 3214699506, win 64240, options [mss 1460,sackOK,TS val 2742920324 ecr 0,nop,wscale 7], length 0
23:53:29.435854 IP ubuntu18-virtual-machine.37992 > 104.16.248.249.https: Flags [S], seq 614543123, win 64240, options [mss 1460,sackOK,TS val 2742920324 ecr 0,nop,wscale 7], length 0
23:53:29.435902 IP ubuntu18-virtual-machine.37988 > 104.16.248.249.https: Flags [S], seq 4157673565, win 64240, options [mss 1460,sackOK,TS val 2742920324 ecr 0,nop,wscale 7], length 0
23:53:29.435943 IP ubuntu18-virtual-machine.37984 > 104.16.248.249.https: Flags [S], seq 2422651041, win 64240, options [mss 1460,sackOK,TS val 2742920324 ecr 0,nop,wscale 7], length 0
23:53:29.436068 IP ubuntu18-virtual-machine.37970 > 104.16.248.249.https: Flags [S], seq 1660155279, win 64240, options [mss 1460,sackOK,TS val 2742920324 ecr 0,nop,wscale 7], length 0
23:53:29.436186 IP ubuntu18-virtual-machine.37964 > 104.16.248.249.https: Flags [S], seq 3760430087, win 64240, options [mss 1460,sackOK,TS val 2742920325 ecr 0,nop,wscale 7], length 0
23:53:29.436298 IP ubuntu18-virtual-machine.37956 > 104.16.248.249.https: Flags [S], seq 857451221, win 64240, options [mss 1460,sackOK,TS val 2742920325 ecr 0,nop,wscale 7], length 0
23:53:29.436412 IP ubuntu18-virtual-machine.37954 > 104.16.248.249.https: Flags [S], seq 3589107195, win 64240, options [mss 1460,sackOK,TS val 2742920325 ecr 0,nop,wscale 7], length 0
23:53:29.436523 IP ubuntu18-virtual-machine.37950 > 104.16.248.249.https: Flags [S], seq 1185567957, win 64240, options [mss 1460,sackOK,TS val 2742920325 ecr 0,nop,wscale 7], length 0
23:53:29.436649 IP ubuntu18-virtual-machine.37946 > 104.16.248.249.https: Flags [S], seq 2933942363, win 64240, options [mss 1460,sackOK,TS val 2742920325 ecr 0,nop,wscale 7], length 0
23:53:29.519394 IP ubuntu18-virtual-machine.38100 > 104.16.248.249.https: Flags [S], seq 44220176, win 64240, options [mss 1460,sackOK,TS val 2742920408 ecr 0,nop,wscale 7], length 0
23:53:29.519675 IP ubuntu18-virtual-machine.38114 > 104.16.248.249.https: Flags [S], seq 3138783280, win 64240, options [mss 1460,sackOK,TS val 2742920408 ecr 0,nop,wscale 7], length 0
23:53:29.691829 IP ubuntu18-virtual-machine.38096 > 104.16.248.249.https: Flags [S], seq 3263775805, win 64240, options [mss 1460,sackOK,TS val 2742920580 ecr 0,nop,wscale 7], length 0
23:53:29.691918 IP ubuntu18-virtual-machine.38032 > 104.16.248.249.https: Flags [S], seq 976808630, win 64240, options [mss 1460,sackOK,TS val 2742920580 ecr 0,nop,wscale 7], length 0
23:53:29.691945 IP ubuntu18-virtual-machine.38026 > 104.16.248.249.https: Flags [S], seq 3926439452, win 64240, options [mss 1460,sackOK,TS val 2742920580 ecr 0,nop,wscale 7], length 0
23:53:29.691961 IP ubuntu18-virtual-machine.38016 > 104.16.248.249.https: Flags [S], seq 1331662347, win 64240, options [mss 1460,sackOK,TS val 2742920580 ecr 0,nop,wscale 7], length 0
23:53:29.691975 IP ubuntu18-virtual-machine.38000 > 104.16.248.249.https: Flags [S], seq 1991965986, win 64240, options [mss 1460,sackOK,TS val 2742920580 ecr 0,nop,wscale 7], length 0
23:53:29.691997 IP ubuntu18-virtual-machine.38080 > 104.16.248.249.https: Flags [S], seq 2848183930, win 64240, options [mss 1460,sackOK,TS val 2742920580 ecr 0,nop,wscale 7], length 0
23:53:29.692016 IP ubuntu18-virtual-machine.38066 > 104.16.248.249.https: Flags [S], seq 2449044958, win 64240, options [mss 1460,sackOK,TS val 2742920580 ecr 0,nop,wscale 7], length 0
23:53:29.692033 IP ubuntu18-virtual-machine.38056 > 104.16.248.249.https: Flags [S], seq 2379046273, win 64240, options [mss 1460,sackOK,TS val 2742920580 ecr 0,nop,wscale 7], length 0
23:53:29.771046 IP ubuntu18-virtual-machine.38124 > 104.16.248.249.https: Flags [S], seq 4255276243, win 64240, options [mss 1460,sackOK,TS val 2742920659 ecr 0,nop,wscale 7], length 0
23:53:29.771343 IP ubuntu18-virtual-machine.38126 > 104.16.248.249.https: Flags [S], seq 2908447206, win 64240, options [mss 1460,sackOK,TS val 2742920660 ecr 0,nop,wscale 7], length 0
23:53:29.815528 IP ubuntu18-virtual-machine.38134 > 104.16.248.249.https: Flags [S], seq 3790793316, win 64240, options [mss 1460,sackOK,TS val 2742920704 ecr 0,nop,wscale 7], length 0
23:53:29.815706 IP ubuntu18-virtual-machine.38138 > 104.16.248.249.https: Flags [S], seq 3550077048, win 64240, options [mss 1460,sackOK,TS val 2742920704 ecr 0,nop,wscale 7], length 0
23:53:30.065849 IP ubuntu18-virtual-machine.38146 > 104.16.248.249.https: Flags [S], seq 3762236564, win 64240, options [mss 1460,sackOK,TS val 2742920954 ecr 0,nop,wscale 7], length 0
23:53:30.065979 IP ubuntu18-virtual-machine.38160 > 104.16.248.249.https: Flags [S], seq 945811136, win 64240, options [mss 1460,sackOK,TS val 2742920954 ecr 0,nop,wscale 7], length 0
23:53:30.096125 IP ubuntu18-virtual-machine.37210 > _gateway.domain: 11324+ [1au] A? m.youtube.com. (42)
23:53:30.176808 IP _gateway.domain > ubuntu18-virtual-machine.37210: 11324 6/0/1 A 142.251.1.102, A 142.251.1.139, A 142.251.1.138, A 142.251.1.113, A 142.251.1.101, A 142.251.1.100 (138)
23:53:30.524047 IP ubuntu18-virtual-machine.38114 > 104.16.248.249.https: Flags [S], seq 3138783280, win 64240, options [mss 1460,sackOK,TS val 2742921412 ecr 0,nop,wscale 7], length 0
23:53:30.524220 IP ubuntu18-virtual-machine.38100 > 104.16.248.249.https: Flags [S], seq 44220176, win 64240, options [mss 1460,sackOK,TS val 2742921413 ecr 0,nop,wscale 7], length 0
23:53:30.779784 IP ubuntu18-virtual-machine.38126 > 104.16.248.249.https: Flags [S], seq 2908447206, win 64240, options [mss 1460,sackOK,TS val 2742921668 ecr 0,nop,wscale 7], length 0
23:53:30.779941 IP ubuntu18-virtual-machine.38124 > 104.16.248.249.https: Flags [S], seq 4255276243, win 64240, options [mss 1460,sackOK,TS val 2742921668 ecr 0,nop,wscale 7], length 0
23:53:30.843832 IP ubuntu18-virtual-machine.38138 > 104.16.248.249.https: Flags [S], seq 3550077048, win 64240, options [mss 1460,sackOK,TS val 2742921732 ecr 0,nop,wscale 7], length 0
23:53:30.843909 IP ubuntu18-virtual-machine.38134 > 104.16.248.249.https: Flags [S], seq 3790793316, win 64240, options [mss 1460,sackOK,TS val 2742921732 ecr 0,nop,wscale 7], length 0
23:53:31.018992 IP ubuntu18-virtual-machine.57917 > _gateway.domain: 41592+ [1au] A? contile.services.mozilla.com. (57)
23:53:31.019235 IP ubuntu18-virtual-machine.47879 > _gateway.domain: 8868+ [1au] AAAA? contile.services.mozilla.com. (57)
23:53:31.068401 IP ubuntu18-virtual-machine.38160 > 104.16.248.249.https: Flags [S], seq 945811136, win 64240, options [mss 1460,sackOK,TS val 2742921957 ecr 0,nop,wscale 7], length 0
23:53:31.068478 IP ubuntu18-virtual-machine.38146 > 104.16.248.249.https: Flags [S], seq 3762236564, win 64240, options [mss 1460,sackOK,TS val 2742921957 ecr 0,nop,wscale 7], length 0
23:53:31.142492 IP _gateway.domain > ubuntu18-virtual-machine.57917: 41592 1/0/1 A 34.117.237.239 (73)
23:53:31.150402 IP _gateway.domain > ubuntu18-virtual-machine.47879: 8868 0/1/1 (138)
23:53:31.151348 IP ubuntu18-virtual-machine.48860 > 239.237.117.34.bc.googleusercontent.com.https: Flags [S], seq 3995250091, win 64240, options [mss 1460,sackOK,TS val 2989842664 ecr 0,nop,wscale 7], length 0
23:53:31.151895 IP ubuntu18-virtual-machine.41486 > 104.16.248.249.https: Flags [S], seq 456277790, win 64240, options [mss 1460,sackOK,TS val 2742922040 ecr 0,nop,wscale 7], length 0
23:53:31.317422 IP ubuntu18-virtual-machine.45532 > _gateway.domain: 63290+ [1au] A? content-signature-2.cdn.mozilla.net. (64)
23:53:31.318136 IP ubuntu18-virtual-machine.59358 > _gateway.domain: 35466+ [1au] AAAA? content-signature-2.cdn.mozilla.net. (64)
23:53:31.402199 IP ubuntu18-virtual-machine.48868 > 239.237.117.34.bc.googleusercontent.com.https: Flags [S], seq 2759142292, win 64240, options [mss 1460,sackOK,TS val 2989842914 ecr 0,nop,wscale 7], length 0
23:53:31.402970 IP ubuntu18-virtual-machine.41496 > 104.16.248.249.https: Flags [S], seq 2162855439, win 64240, options [mss 1460,sackOK,TS val 2742922291 ecr 0,nop,wscale 7], length 0
23:53:31.430800 IP ubuntu18-virtual-machine.56856 > _gateway.domain: 63005+ [1au] A? firefox.settings.services.mozilla.com. (66)
23:53:31.431473 IP ubuntu18-virtual-machine.42431 > _gateway.domain: 54433+ [1au] AAAA? firefox.settings.services.mozilla.com. (66)
23:53:31.450144 IP _gateway.domain > ubuntu18-virtual-machine.45532: 63290 3/0/1 CNAME content-signature-chains.prod.autograph.services.mozaws.net., CNAME prod.content-signature-chains.prod.webservices.mozgcp.net., A 34.160.144.191 (218)
23:53:31.451672 IP ubuntu18-virtual-machine.37946 > 104.16.248.249.https: Flags [S], seq 2933942363, win 64240, options [mss 1460,sackOK,TS val 2742922340 ecr 0,nop,wscale 7], length 0
23:53:31.451814 IP ubuntu18-virtual-machine.37950 > 104.16.248.249.https: Flags [S], seq 1185567957, win 64240, options [mss 1460,sackOK,TS val 2742922340 ecr 0,nop,wscale 7], length 0
23:53:31.452038 IP ubuntu18-virtual-machine.37954 > 104.16.248.249.https: Flags [S], seq 3589107195, win 64240, options [mss 1460,sackOK,TS val 2742922340 ecr 0,nop,wscale 7], length 0
23:53:31.452239 IP ubuntu18-virtual-machine.37956 > 104.16.248.249.https: Flags [S], seq 857451221, win 64240, options [mss 1460,sackOK,TS val 2742922341 ecr 0,nop,wscale 7], length 0
23:53:31.452430 IP ubuntu18-virtual-machine.37992 > 104.16.248.249.https: Flags [S], seq 614543123, win 64240, options [mss 1460,sackOK,TS val 2742922341 ecr 0,nop,wscale 7], length 0
23:53:31.452895 IP ubuntu18-virtual-machine.37996 > 104.16.248.249.https: Flags [S], seq 3214699506, win 64240, options [mss 1460,sackOK,TS val 2742922341 ecr 0,nop,wscale 7], length 0
23:53:31.458264 IP 239.237.117.34.bc.googleusercontent.com.https > ubuntu18-virtual-machine.48868: Flags [S.], seq 587345781, ack 2759142293, win 64240, options [mss 1460], length 0
23:53:31.458384 IP ubuntu18-virtual-machine.48868 > 239.237.117.34.bc.googleusercontent.com.https: Flags [.], ack 1, win 64240, length 0
23:53:31.465199 IP ubuntu18-virtual-machine.48868 > 239.237.117.34.bc.googleusercontent.com.https: Flags [P.], seq 1:518, ack 1, win 64240, length 517
23:53:31.465842 IP 239.237.117.34.bc.googleusercontent.com.https > ubuntu18-virtual-machine.48868: Flags [.], ack 518, win 64240, length 0
23:53:31.489258 IP ubuntu18-virtual-machine.54455 > _gateway.domain: 56322+ [1au] A? incoming.telemetry.mozilla.org. (59)
23:53:31.489989 IP ubuntu18-virtual-machine.54975 > _gateway.domain: 6633+ [1au] AAAA? incoming.telemetry.mozilla.org. (59)
23:53:31.529075 IP 239.237.117.34.bc.googleusercontent.com.https > ubuntu18-virtual-machine.48868: Flags [.], seq 1:1461, ack 518, win 64240, length 1460
23:53:31.529253 IP ubuntu18-virtual-machine.48868 > 239.237.117.34.bc.googleusercontent.com.https: Flags [.], ack 1461, win 62780, length 0
23:53:31.529388 IP 239.237.117.34.bc.googleusercontent.com.https > ubuntu18-virtual-machine.48868: Flags [P.], seq 1461:2801, ack 518, win 64240, length 1340
23:53:31.529407 IP ubuntu18-virtual-machine.48868 > 239.237.117.34.bc.googleusercontent.com.https: Flags [.], ack 2801, win 62780, length 0
23:53:31.529487 IP 239.237.117.34.bc.googleusercontent.com.https > ubuntu18-virtual-machine.48868: Flags [.], seq 2801:4261, ack 518, win 64240, length 1460
23:53:31.529499 IP ubuntu18-virtual-machine.48868 > 239.237.117.34.bc.googleusercontent.com.https: Flags [.], ack 4261, win 61320, length 0
23:53:31.529568 IP 239.237.117.34.bc.googleusercontent.com.https > ubuntu18-virtual-machine.48868: Flags [P.], seq 4261:4574, ack 518, win 64240, length 313
23:53:31.529585 IP ubuntu18-virtual-machine.48868 > 239.237.117.34.bc.googleusercontent.com.https: Flags [.], ack 4574, win 61320, length 0
23:53:31.530003 IP _gateway.domain > ubuntu18-virtual-machine.56856: 63005 1/0/1 A 35.241.9.150 (82)
23:53:31.539646 IP _gateway.domain > ubuntu18-virtual-machine.59358: 35466 3/0/1 CNAME content-signature-chains.prod.autograph.services.mozaws.net., CNAME prod.content-signature-chains.prod.webservices.mozgcp.net., AAAA 2600:1901:0:92a9:: (230)
23:53:31.545073 IP _gateway.domain > ubuntu18-virtual-machine.42431: 54433 0/1/1 (150)
23:53:31.545387 IP ubuntu18-virtual-machine.41506 > 104.16.248.249.https: Flags [S], seq 246452016, win 64240, options [mss 1460,sackOK,TS val 2742922434 ecr 0,nop,wscale 7], length 0
23:53:31.545871 IP ubuntu18-virtual-machine.41514 > 104.16.248.249.https: Flags [S], seq 4257786396, win 64240, options [mss 1460,sackOK,TS val 2742922434 ecr 0,nop,wscale 7], length 0
23:53:31.546459 IP ubuntu18-virtual-machine.41520 > 104.16.248.249.https: Flags [S], seq 3564009645, win 64240, options [mss 1460,sackOK,TS val 2742922435 ecr 0,nop,wscale 7], length 0
23:53:31.570200 IP _gateway.domain > ubuntu18-virtual-machine.54455: 56322 3/0/1 CNAME telemetry-incoming.r53-2.services.mozilla.com., CNAME prod.ingestion-edge.prod.dataops.mozgcp.net., A 34.120.208.123 (191)
23:53:31.576108 IP _gateway.domain > ubuntu18-virtual-machine.54975: 6633 2/1/1 CNAME telemetry-incoming.r53-2.services.mozilla.com., CNAME prod.ingestion-edge.prod.dataops.mozgcp.net. (265)
23:53:31.577170 IP ubuntu18-virtual-machine.40463 > _gateway.domain: 40339+ [1au] AAAA? prod.ingestion-edge.prod.dataops.mozgcp.net. (72)
23:53:31.598696 IP _gateway.domain > ubuntu18-virtual-machine.44917: 2835 2/0/1 A 104.16.249.249, A 104.16.248.249 (87)
23:53:31.598747 IP ubuntu18-virtual-machine > _gateway: ICMP ubuntu18-virtual-machine udp port 44917 unreachable, length 123
23:53:31.644805 IP _gateway.domain > ubuntu18-virtual-machine.40463: 40339 0/1/1 (165)
23:53:31.647859 IP ubuntu18-virtual-machine.47332 > 123.208.120.34.bc.googleusercontent.com.https: Flags [S], seq 3565120312, win 64240, options [mss 1460,sackOK,TS val 164394339 ecr 0,nop,wscale 7], length 0
23:53:31.648735 IP ubuntu18-virtual-machine.47344 > 123.208.120.34.bc.googleusercontent.com.https: Flags [S], seq 3753392280, win 64240, options [mss 1460,sackOK,TS val 164394340 ecr 0,nop,wscale 7], length 0
23:53:31.707605 IP ubuntu18-virtual-machine.38080 > 104.16.248.249.https: Flags [S], seq 2848183930, win 64240, options [mss 1460,sackOK,TS val 2742922596 ecr 0,nop,wscale 7], length 0
23:53:31.707759 IP ubuntu18-virtual-machine.38000 > 104.16.248.249.https: Flags [S], seq 1991965986, win 64240, options [mss 1460,sackOK,TS val 2742922596 ecr 0,nop,wscale 7], length 0
23:53:31.707817 IP ubuntu18-virtual-machine.38016 > 104.16.248.249.https: Flags [S], seq 1331662347, win 64240, options [mss 1460,sackOK,TS val 2742922596 ecr 0,nop,wscale 7], length 0
23:53:31.707852 IP ubuntu18-virtual-machine.38026 > 104.16.248.249.https: Flags [S], seq 3926439452, win 64240, options [mss 1460,sackOK,TS val 2742922596 ecr 0,nop,wscale 7], length 0
23:53:31.707887 IP ubuntu18-virtual-machine.38032 > 104.16.248.249.https: Flags [S], seq 976808630, win 64240, options [mss 1460,sackOK,TS val 2742922596 ecr 0,nop,wscale 7], length 0
23:53:31.707935 IP ubuntu18-virtual-machine.38096 > 104.16.248.249.https: Flags [S], seq 3263775805, win 64240, options [mss 1460,sackOK,TS val 2742922596 ecr 0,nop,wscale 7], length 0
23:53:31.708667 IP ubuntu18-virtual-machine.44771 > _gateway.domain: 53230+ [1au] A? push.services.mozilla.com. (54)
23:53:31.709048 IP ubuntu18-virtual-machine.48117 > _gateway.domain: 10401+ [1au] AAAA? push.services.mozilla.com. (54)
23:53:31.779358 IP _gateway.domain > ubuntu18-virtual-machine.44771: 53230 9/0/1 CNAME autopush.prod.mozaws.net., A 44.224.175.124, A 54.191.251.76, A 52.41.124.48, A 52.34.49.10, A 52.43.61.95, A 35.162.52.254, A 54.148.70.121, A 35.163.38.240 (220)
23:53:31.796247 IP ubuntu18-virtual-machine.41526 > 104.16.248.249.https: Flags [S], seq 2997482948, win 64240, options [mss 1460,sackOK,TS val 2742922685 ecr 0,nop,wscale 7], length 0
23:53:31.796591 IP ubuntu18-virtual-machine.41538 > 104.16.248.249.https: Flags [S], seq 2121472563, win 64240, options [mss 1460,sackOK,TS val 2742922685 ecr 0,nop,wscale 7], length 0
23:53:31.796949 IP ubuntu18-virtual-machine.41550 > 104.16.248.249.https: Flags [S], seq 3803799493, win 64240, options [mss 1460,sackOK,TS val 2742922685 ecr 0,nop,wscale 7], length 0
23:53:31.811014 IP 123.208.120.34.bc.googleusercontent.com.https > ubuntu18-virtual-machine.47332: Flags [S.], seq 509171475, ack 3565120313, win 64240, options [mss 1460], length 0
23:53:31.811093 IP ubuntu18-virtual-machine.47332 > 123.208.120.34.bc.googleusercontent.com.https: Flags [.], ack 1, win 64240, length 0
23:53:31.811562 IP ubuntu18-virtual-machine.47332 > 123.208.120.34.bc.googleusercontent.com.https: Flags [P.], seq 1:212, ack 1, win 64240, length 211
23:53:31.811752 IP 123.208.120.34.bc.googleusercontent.com.https > ubuntu18-virtual-machine.47332: Flags [.], ack 212, win 64240, length 0
23:53:31.868898 IP ubuntu18-virtual-machine.51906 > _gateway.domain: 6421+ [1au] PTR? 239.237.117.34.in-addr.arpa. (56)
23:53:31.899661 IP ubuntu18-virtual-machine.48495 > _gateway.domain: 6961+ [1au] A? services.addons.mozilla.org. (56)
23:53:31.899747 IP ubuntu18-virtual-machine.47356 > 123.208.120.34.bc.googleusercontent.com.https: Flags [S], seq 1402303949, win 64240, options [mss 1460,sackOK,TS val 164394591 ecr 0,nop,wscale 7], length 0
23:53:31.899929 IP ubuntu18-virtual-machine.34249 > _gateway.domain: 57669+ [1au] AAAA? services.addons.mozilla.org. (56)
23:53:31.949577 IP 123.208.120.34.bc.googleusercontent.com.https > ubuntu18-virtual-machine.47332: Flags [P.], seq 1:1401, ack 212, win 64240, length 1400
23:53:31.949595 IP ubuntu18-virtual-machine.47332 > 123.208.120.34.bc.googleusercontent.com.https: Flags [.], ack 1401, win 63000, length 0
23:53:31.955611 IP 123.208.120.34.bc.googleusercontent.com.https > ubuntu18-virtual-machine.47332: Flags [P.], seq 1401:2801, ack 212, win 64240, length 1400
23:53:31.955630 IP ubuntu18-virtual-machine.47332 > 123.208.120.34.bc.googleusercontent.com.https: Flags [.], ack 2801, win 63000, length 0
23:53:31.969491 IP _gateway.domain > ubuntu18-virtual-machine.51906: 6421 1/0/1 PTR 239.237.117.34.bc.googleusercontent.com. (109)
23:53:31.970787 IP ubuntu18-virtual-machine.38037 > _gateway.domain: 6238+ [1au] PTR? 123.208.120.34.in-addr.arpa. (56)
23:53:32.019142 IP _gateway.domain > ubuntu18-virtual-machine.48495: 6961 4/0/1 A 54.192.99.102, A 54.192.99.32, A 54.192.99.78, A 54.192.99.62 (120)
23:53:32.019190 IP _gateway.domain > ubuntu18-virtual-machine.34249: 57669 0/1/1 (137)
23:53:32.024223 IP 123.208.120.34.bc.googleusercontent.com.https > ubuntu18-virtual-machine.47356: Flags [S.], seq 2124160433, ack 1402303950, win 64240, options [mss 1460], length 0
23:53:32.024346 IP ubuntu18-virtual-machine.47356 > 123.208.120.34.bc.googleusercontent.com.https: Flags [.], ack 1, win 64240, length 0
23:53:32.031786 IP ubuntu18-virtual-machine.47356 > 123.208.120.34.bc.googleusercontent.com.https: Flags [P.], seq 1:518, ack 1, win 64240, length 517
23:53:32.032395 IP 123.208.120.34.bc.googleusercontent.com.https > ubuntu18-virtual-machine.47356: Flags [.], ack 518, win 64240, length 0
23:53:32.074039 IP 123.208.120.34.bc.googleusercontent.com.https > ubuntu18-virtual-machine.47344: Flags [S.], seq 223808488, ack 3753392281, win 64240, options [mss 1460], length 0
23:53:32.074217 IP ubuntu18-virtual-machine.47344 > 123.208.120.34.bc.googleusercontent.com.https: Flags [.], ack 1, win 64240, length 0
23:53:32.081429 IP ubuntu18-virtual-machine.47344 > 123.208.120.34.bc.googleusercontent.com.https: Flags [P.], seq 1:518, ack 1, win 64240, length 517
23:53:32.082182 IP 123.208.120.34.bc.googleusercontent.com.https > ubuntu18-virtual-machine.47344: Flags [.], ack 518, win 64240, length 0
23:53:32.112720 IP ubuntu18-virtual-machine.58664 > _gateway.domain: 58535+ [1au] A? www.digitalocean.com. (49)
23:53:32.113436 IP ubuntu18-virtual-machine.57882 > _gateway.domain: 1850+ [1au] AAAA? www.digitalocean.com. (49)
23:53:32.114100 IP ubuntu18-virtual-machine.49307 > _gateway.domain: 60054+ [1au] A? www.cyberforum.ru. (46)
23:53:32.114804 IP ubuntu18-virtual-machine.57870 > _gateway.domain: 44326+ [1au] AAAA? www.cyberforum.ru. (46)
23:53:32.115447 IP ubuntu18-virtual-machine.55307 > _gateway.domain: 55411+ [1au] A? support.google.com. (47)
23:53:32.116347 IP ubuntu18-virtual-machine.37384 > _gateway.domain: 7048+ [1au] AAAA? support.google.com. (47)
23:53:32.137956 IP 123.208.120.34.bc.googleusercontent.com.https > ubuntu18-virtual-machine.47356: Flags [.], seq 1:1461, ack 518, win 64240, length 1460
23:53:32.137994 IP ubuntu18-virtual-machine.47356 > 123.208.120.34.bc.googleusercontent.com.https: Flags [.], ack 1461, win 62780, length 0
23:53:32.138189 IP 123.208.120.34.bc.googleusercontent.com.https > ubuntu18-virtual-machine.47356: Flags [.], seq 1461:2921, ack 518, win 64240, length 1460
23:53:32.138218 IP ubuntu18-virtual-machine.47356 > 123.208.120.34.bc.googleusercontent.com.https: Flags [.], ack 2921, win 62780, length 0
23:53:32.138301 IP 123.208.120.34.bc.googleusercontent.com.https > ubuntu18-virtual-machine.47356: Flags [P.], seq 2921:3449, ack 518, win 64240, length 528
23:53:32.138314 IP ubuntu18-virtual-machine.47356 > 123.208.120.34.bc.googleusercontent.com.https: Flags [.], ack 3449, win 62252, length 0
23:53:32.138446 IP 123.208.120.34.bc.googleusercontent.com.https > ubuntu18-virtual-machine.47356: Flags [P.], seq 3449:3518, ack 518, win 64240, length 69
23:53:32.138461 IP ubuntu18-virtual-machine.47356 > 123.208.120.34.bc.googleusercontent.com.https: Flags [.], ack 3518, win 62183, length 0
23:53:32.145082 IP _gateway.domain > ubuntu18-virtual-machine.38037: 6238 1/0/1 PTR 123.208.120.34.bc.googleusercontent.com. (109)
23:53:32.155984 IP ubuntu18-virtual-machine.41486 > 104.16.248.249.https: Flags [S], seq 456277790, win 64240, options [mss 1460,sackOK,TS val 2742923044 ecr 0,nop,wscale 7], length 0
23:53:32.156174 IP ubuntu18-virtual-machine.48860 > 239.237.117.34.bc.googleusercontent.com.https: Flags [S], seq 3995250091, win 64240, options [mss 1460,sackOK,TS val 2989843668 ecr 0,nop,wscale 7], length 0
23:53:32.199267 IP 123.208.120.34.bc.googleusercontent.com.https > ubuntu18-virtual-machine.47344: Flags [.], seq 1:1461, ack 518, win 64240, length 1460
23:53:32.199283 IP ubuntu18-virtual-machine.47344 > 123.208.120.34.bc.googleusercontent.com.https: Flags [.], ack 1461, win 62780, length 0
23:53:32.199346 IP 123.208.120.34.bc.googleusercontent.com.https > ubuntu18-virtual-machine.47344: Flags [P.], seq 1461:2049, ack 518, win 64240, length 588
23:53:32.199367 IP ubuntu18-virtual-machine.47344 > 123.208.120.34.bc.googleusercontent.com.https: Flags [.], ack 2049, win 62780, length 0
23:53:32.211275 IP 123.208.120.34.bc.googleusercontent.com.https > ubuntu18-virtual-machine.47344: Flags [.], seq 2049:3509, ack 518, win 64240, length 1460
23:53:32.211292 IP ubuntu18-virtual-machine.47344 > 123.208.120.34.bc.googleusercontent.com.https: Flags [.], ack 3509, win 62780, length 0
23:53:32.211386 IP 123.208.120.34.bc.googleusercontent.com.https > ubuntu18-virtual-machine.47344: Flags [P.], seq 3509:3518, ack 518, win 64240, length 9
23:53:32.211392 IP ubuntu18-virtual-machine.47344 > 123.208.120.34.bc.googleusercontent.com.https: Flags [.], ack 3518, win 62780, length 0
23:53:32.214717 IP _gateway.domain > ubuntu18-virtual-machine.58664: 58535 2/0/1 A 104.16.182.15, A 104.16.181.15 (81)
23:53:32.219229 IP _gateway.domain > ubuntu18-virtual-machine.37384: 7048 4/0/1 AAAA 2a00:1450:4010:c0b::65, AAAA 2a00:1450:4010:c0b::66, AAAA 2a00:1450:4010:c0b::8b, AAAA 2a00:1450:4010:c0b::71 (159)
23:53:32.224619 IP _gateway.domain > ubuntu18-virtual-machine.49307: 60054 1/0/1 A 178.208.71.14 (62)
23:53:32.251506 IP _gateway.domain > ubuntu18-virtual-machine.55307: 55411 6/0/1 A 173.194.222.101, A 173.194.222.100, A 173.194.222.138, A 173.194.222.102, A 173.194.222.139, A 173.194.222.113 (143)
23:53:32.252770 IP ubuntu18-virtual-machine.47758 > _gateway.domain: 14477+ [1au] A? www.wikipedia.org. (46)
23:53:32.253028 IP ubuntu18-virtual-machine.47448 > _gateway.domain: 8837+ [1au] AAAA? www.wikipedia.org. (46)
23:53:32.331782 IP _gateway.domain > ubuntu18-virtual-machine.47758: 14477 2/0/1 CNAME dyna.wikimedia.org., A 91.198.174.192 (91)
23:53:32.343047 IP _gateway.domain > ubuntu18-virtual-machine.47448: 8837 2/0/1 CNAME dyna.wikimedia.org., AAAA 2620:0:862:ed1a::1 (103)
23:53:32.346256 IP ubuntu18-virtual-machine.55276 > _gateway.domain: 61742+ [1au] AAAA? wide-youtube.l.google.com. (54)
23:53:32.347812 IP 123.208.120.34.bc.googleusercontent.com.https > ubuntu18-virtual-machine.47332: Flags [P.], seq 2801:3439, ack 212, win 64240, length 638
23:53:32.347896 IP ubuntu18-virtual-machine.47332 > 123.208.120.34.bc.googleusercontent.com.https: Flags [.], ack 3439, win 63000, length 0
23:53:32.350862 IP ubuntu18-virtual-machine.47332 > 123.208.120.34.bc.googleusercontent.com.https: Flags [P.], seq 212:305, ack 3439, win 63000, length 93
23:53:32.351643 IP 123.208.120.34.bc.googleusercontent.com.https > ubuntu18-virtual-machine.47332: Flags [.], ack 305, win 64240, length 0
23:53:32.411705 IP ubuntu18-virtual-machine.41496 > 104.16.248.249.https: Flags [S], seq 2162855439, win 64240, options [mss 1460,sackOK,TS val 2742923300 ecr 0,nop,wscale 7], length 0
23:53:32.480819 IP 123.208.120.34.bc.googleusercontent.com.https > ubuntu18-virtual-machine.47332: Flags [P.], seq 3439:3803, ack 305, win 64240, length 364
23:53:32.480836 IP ubuntu18-virtual-machine.47332 > 123.208.120.34.bc.googleusercontent.com.https: Flags [.], ack 3803, win 63000, length 0
23:53:32.494584 IP _gateway.domain > ubuntu18-virtual-machine.55276: 61742 1/0/1 AAAA 2a00:1450:4010:c0b::c6 (82)
23:53:32.494961 IP ubuntu18-virtual-machine.38516 > _gateway.domain: 30407+ [1au] AAAA? autopush.prod.mozaws.net. (53)
23:53:32.495407 IP ubuntu18-virtual-machine.40599 > _gateway.domain: 40772+ [1au] A? www.avito.ru. (41)
23:53:32.495497 IP ubuntu18-virtual-machine.38156 > _gateway.domain: 32984+ [1au] AAAA? www.avito.ru. (41)
23:53:32.558435 IP _gateway.domain > ubuntu18-virtual-machine.38516: 30407 0/1/1 (138)
23:53:32.561603 IP ubuntu18-virtual-machine.38148 > ec2-35-163-38-240.us-west-2.compute.amazonaws.com.https: Flags [S], seq 624055440, win 64240, options [mss 1460,sackOK,TS val 1895536767 ecr 0,nop,wscale 7], length 0
23:53:32.571791 IP ubuntu18-virtual-machine.41520 > 104.16.248.249.https: Flags [S], seq 3564009645, win 64240, options [mss 1460,sackOK,TS val 2742923460 ecr 0,nop,wscale 7], length 0
23:53:32.571887 IP ubuntu18-virtual-machine.41514 > 104.16.248.249.https: Flags [S], seq 4257786396, win 64240, options [mss 1460,sackOK,TS val 2742923460 ecr 0,nop,wscale 7], length 0
23:53:32.571932 IP ubuntu18-virtual-machine.41506 > 104.16.248.249.https: Flags [S], seq 246452016, win 64240, options [mss 1460,sackOK,TS val 2742923460 ecr 0,nop,wscale 7], length 0
23:53:32.615250 IP _gateway.domain > ubuntu18-virtual-machine.38156: 32984 0/1/1 (94)
23:53:32.814901 IP ubuntu18-virtual-machine.38150 > ec2-35-163-38-240.us-west-2.compute.amazonaws.com.https: Flags [S], seq 1966807253, win 64240, options [mss 1460,sackOK,TS val 1895537020 ecr 0,nop,wscale 7], length 0
