    1 0.000000000    127.0.0.1 → 127.0.0.1    TCP 74 58778 → 25 [SYN] Seq=0 Win=43690 Len=0 MSS=65495 SACK_PERM=1 TSval=685752974 TSecr=0 WS=128
    2 1522669095.871706435    127.0.0.1 → 127.0.0.1    TCP 74 25 → 58778 [SYN, ACK] Seq=0 Ack=1 Win=43690 Len=0 MSS=65495 SACK_PERM=1 TSval=685752974 TSecr=685752974 WS=128
    3 0.000055353    127.0.0.1 → 127.0.0.1    TCP 66 58778 → 25 [ACK] Seq=1 Ack=1 Win=43776 Len=0 TSval=685752974 TSecr=685752974
    4 0.083861507    127.0.0.1 → 127.0.0.1    SMTP 133 S: 220 ubuntu ESMTP Exim 4.82 Ubuntu Fri, 30 Jan 2015 12:31:43 +0100
    5 0.083917423    127.0.0.1 → 127.0.0.1    TCP 66 58778 → 25 [ACK] Seq=1 Ack=68 Win=43776 Len=0 TSval=685752999 TSecr=685752999
    6 0.083975965    127.0.0.1 → 127.0.0.1    SMTP 91 C: EHLO openssl.client.net
    7 0.083989767    127.0.0.1 → 127.0.0.1    TCP 66 25 → 58778 [ACK] Seq=68 Ack=26 Win=43776 Len=0 TSval=685752999 TSecr=685752999
    8 0.126807508    127.0.0.1 → 127.0.0.1    SMTP 179 S: 250-ubuntu Hello localhost [127.0.0.1] | 250-SIZE 52428800 | 250-8BITMIME | 250-PIPELINING | 250-STARTTLS | 250 HELP
    9 0.126893521    127.0.0.1 → 127.0.0.1    SMTP 76 C: STARTTLS
   10 0.126918454    127.0.0.1 → 127.0.0.1    TCP 66 25 → 58778 [ACK] Seq=181 Ack=36 Win=43776 Len=0 TSval=685753012 TSecr=685753012
   11 0.206087435    127.0.0.1 → 127.0.0.1    SMTP 84 S: 220 TLS go ahead
   12 0.206267348    127.0.0.1 → 127.0.0.1    TLSv1 428 Client Hello
   13 0.206285327    127.0.0.1 → 127.0.0.1    TCP 66 25 → 58778 [ACK] Seq=199 Ack=398 Win=44800 Len=0 TSval=685753036 TSecr=685753036
   14 0.268450652    127.0.0.1 → 127.0.0.1    TLSv1.2 1939 Server Hello, Certificate, Server Key Exchange, Server Hello Done
   15 0.268481083    127.0.0.1 → 127.0.0.1    TCP 66 58778 → 25 [ACK] Seq=398 Ack=2072 Win=174720 Len=0 TSval=685753055 TSecr=685753055
   16 0.303199926    127.0.0.1 → 127.0.0.1    TLSv1.2 424 Client Key Exchange, Change Cipher Spec, Finished
   17 0.303220477    127.0.0.1 → 127.0.0.1    TCP 66 25 → 58778 [ACK] Seq=2072 Ack=756 Win=45952 Len=0 TSval=685753065 TSecr=685753065
   18 0.362428851    127.0.0.1 → 127.0.0.1    TLSv1.2 72 Change Cipher Spec
   19 0.401345833    127.0.0.1 → 127.0.0.1    TCP 66 58778 → 25 [ACK] Seq=756 Ack=2078 Win=174720 Len=0 TSval=685753095 TSecr=685753083
   20 0.444258899    127.0.0.1 → 127.0.0.1    TLSv1.2 343 Finished
   21 0.444296642    127.0.0.1 → 127.0.0.1    TCP 66 58778 → 25 [ACK] Seq=756 Ack=2355 Win=178432 Len=0 TSval=685753107 TSecr=685753107
   22 16.283653485    127.0.0.1 → 127.0.0.1    SMTP 151 C: EHLO lekensteyn
   23 16.283688222    127.0.0.1 → 127.0.0.1    TCP 66 25 → 58778 [ACK] Seq=2355 Ack=841 Win=45952 Len=0 TSval=685757859 TSecr=685757859
   24 16.329180661    127.0.0.1 → 127.0.0.1    SMTP 423 S: 250-ubuntu Hello localhost [127.0.0.1] | 250-SIZE 52428800 | 250-8BITMIME | 250-PIPELINING | 250 HELP
   25 16.329198353    127.0.0.1 → 127.0.0.1    TCP 66 58778 → 25 [ACK] Seq=841 Ack=2712 Win=182272 Len=0 TSval=685757873 TSecr=685757873
   26 47.468285079    127.0.0.1 → 127.0.0.1    SMTP 167 C: MAIL FROM: <peter@lekensteyn.nl>
   27 47.468318868    127.0.0.1 → 127.0.0.1    TCP 66 25 → 58778 [ACK] Seq=2712 Ack=942 Win=45952 Len=0 TSval=685767215 TSecr=685767215
   28 47.511590035    127.0.0.1 → 127.0.0.1    SMTP 263 S: 250 OK
   29 47.511607309    127.0.0.1 → 127.0.0.1    TCP 66 58778 → 25 [ACK] Seq=942 Ack=2909 Win=185984 Len=0 TSval=685767228 TSecr=685767228
   30 58.932380230    127.0.0.1 → 127.0.0.1    TLSv1.2 503 Client Hello
   31 58.932409198    127.0.0.1 → 127.0.0.1    TCP 66 25 → 58778 [ACK] Seq=2909 Ack=1379 Win=46976 Len=0 TSval=685770654 TSecr=685770654
   32 59.019571858    127.0.0.1 → 127.0.0.1    SMTP 343 S: 421 ubuntu lost input connection
   33 59.019621317    127.0.0.1 → 127.0.0.1    TCP 66 25 → 58778 [FIN, ACK] Seq=3186 Ack=1379 Win=46976 Len=0 TSval=685770680 TSecr=685770654
   34 59.019645654    127.0.0.1 → 127.0.0.1    TCP 66 58778 → 25 [ACK] Seq=1379 Ack=3186 Win=189696 Len=0 TSval=685770680 TSecr=685770680
   35 59.019738676    127.0.0.1 → 127.0.0.1    TLSv1.2 135 Alert (Level: Fatal, Description: Unexpected Message)
   36 59.019754533    127.0.0.1 → 127.0.0.1    TCP 66 25 → 58778 [ACK] Seq=3187 Ack=1448 Win=46976 Len=0 TSval=685770680 TSecr=685770680
   37 59.019827085    127.0.0.1 → 127.0.0.1    TCP 66 58778 → 25 [FIN, ACK] Seq=1448 Ack=3187 Win=189696 Len=0 TSval=685770680 TSecr=685770680
   38 59.019837680    127.0.0.1 → 127.0.0.1    TCP 66 25 → 58778 [ACK] Seq=3187 Ack=1449 Win=46976 Len=0 TSval=685770680 TSecr=685770680
