    1 0.000000000    127.0.0.1 → 127.0.0.1    TCP 74 53477 → 143 [SYN] Seq=0 Win=43690 Len=0 MSS=65495 SACK_PERM=1 TSval=689475886 TSecr=0 WS=128
    2 1538646470.976976100    127.0.0.1 → 127.0.0.1    TCP 74 143 → 53477 [SYN, ACK] Seq=0 Ack=1 Win=43690 Len=0 MSS=65495 SACK_PERM=1 TSval=689475886 TSecr=689475886 WS=128
    3 0.000064030    127.0.0.1 → 127.0.0.1    TCP 66 53477 → 143 [ACK] Seq=1 Ack=1 Win=43776 Len=0 TSval=689475886 TSecr=689475886
    4 0.085845698    127.0.0.1 → 127.0.0.1    IMAP 187 Response: * OK [CAPABILITY IMAP4rev1 LITERAL+ SASL-IR LOGIN-REFERRALS ID ENABLE IDLE STARTTLS AUTH=PLAIN] Dovecot (Ubuntu) ready.
    5 0.085878805    127.0.0.1 → 127.0.0.1    TCP 66 53477 → 143 [ACK] Seq=1 Ack=122 Win=43776 Len=0 TSval=689475912 TSecr=689475912
    6 0.085925680    127.0.0.1 → 127.0.0.1    IMAP 80 Request: . CAPABILITY
    7 0.085933382    127.0.0.1 → 127.0.0.1    TCP 66 143 → 53477 [ACK] Seq=122 Ack=15 Win=43776 Len=0 TSval=689475912 TSecr=689475912
    8 0.129305283    127.0.0.1 → 127.0.0.1    IMAP 230 Response: * CAPABILITY IMAP4rev1 LITERAL+ SASL-IR LOGIN-REFERRALS ID ENABLE IDLE STARTTLS AUTH=PLAIN
    9 0.129372652    127.0.0.1 → 127.0.0.1    IMAP 78 Request: . STARTTLS
   10 0.129408710    127.0.0.1 → 127.0.0.1    TCP 66 143 → 53477 [ACK] Seq=286 Ack=27 Win=43776 Len=0 TSval=689475925 TSecr=689475925
   11 0.172196978    127.0.0.1 → 127.0.0.1    IMAP 99 Response: . OK Begin TLS negotiation now.
   12 0.172371764    127.0.0.1 → 127.0.0.1    TLSv1 428 Client Hello
   13 0.172390479    127.0.0.1 → 127.0.0.1    TCP 66 143 → 53477 [ACK] Seq=319 Ack=389 Win=44800 Len=0 TSval=689475938 TSecr=689475938
   14 0.223766163    127.0.0.1 → 127.0.0.1    TLSv1.2 1454 Server Hello, Certificate, Server Key Exchange, Server Hello Done
   15 0.223854958    127.0.0.1 → 127.0.0.1    TCP 66 53477 → 143 [ACK] Seq=389 Ack=1707 Win=175744 Len=0 TSval=689475954 TSecr=689475954
   16 0.229111332    127.0.0.1 → 127.0.0.1    TLSv1.2 224 Client Key Exchange, Change Cipher Spec, Finished
   17 0.229133637    127.0.0.1 → 127.0.0.1    TCP 66 143 → 53477 [ACK] Seq=1707 Ack=547 Win=45952 Len=0 TSval=689475955 TSecr=689475955
   18 0.274455690    127.0.0.1 → 127.0.0.1    TLSv1.2 292 New Session Ticket, Change Cipher Spec, Finished
   19 0.313602597    127.0.0.1 → 127.0.0.1    TCP 66 53477 → 143 [ACK] Seq=547 Ack=1933 Win=178560 Len=0 TSval=689475981 TSecr=689475969
   20 4.640755689    127.0.0.1 → 127.0.0.1    IMAP 111 Request: a001 CAPABILITY
   21 4.640787492    127.0.0.1 → 127.0.0.1    TCP 66 143 → 53477 [ACK] Seq=1933 Ack=592 Win=45952 Len=0 TSval=689477279 TSecr=689477279
   22 4.684734105    127.0.0.1 → 127.0.0.1    IMAP 253 Response: * CAPABILITY IMAP4rev1 LITERAL+ SASL-IR LOGIN-REFERRALS ID ENABLE IDLE AUTH=PLAIN
   23 4.684751461    127.0.0.1 → 127.0.0.1    TCP 66 53477 → 143 [ACK] Seq=592 Ack=2120 Win=181376 Len=0 TSval=689477292 TSecr=689477292
   24 6.088853138    127.0.0.1 → 127.0.0.1    TLSv1.2 467 Client Hello
   25 6.088886113    127.0.0.1 → 127.0.0.1    TCP 66 143 → 53477 [ACK] Seq=2120 Ack=993 Win=46976 Len=0 TSval=689477713 TSecr=689477713
   26 6.182237288    127.0.0.1 → 127.0.0.1    TLSv1.2 1574 Server Hello, Certificate, Server Key Exchange, Server Hello Done
   27 6.182268840    127.0.0.1 → 127.0.0.1    TCP 66 53477 → 143 [ACK] Seq=993 Ack=3628 Win=312320 Len=0 TSval=689477741 TSecr=689477741
   28 6.188778680    127.0.0.1 → 127.0.0.1    TLSv1.2 272 Client Key Exchange, Change Cipher Spec, Encrypted Handshake Message
   29 6.188793690    127.0.0.1 → 127.0.0.1    TCP 66 143 → 53477 [ACK] Seq=3628 Ack=1199 Win=48000 Len=0 TSval=689477743 TSecr=689477743
   30 6.234961510    127.0.0.1 → 127.0.0.1    TLSv1.2 340 New Session Ticket, Change Cipher Spec, Encrypted Handshake Message
   31 6.273623920    127.0.0.1 → 127.0.0.1    TCP 66 53477 → 143 [ACK] Seq=1199 Ack=3902 Win=315264 Len=0 TSval=689477769 TSecr=689477757
   32 10.032861130    127.0.0.1 → 127.0.0.1    TLSv1.2 111 Application Data
   33 10.032898054    127.0.0.1 → 127.0.0.1    TCP 66 143 → 53477 [ACK] Seq=3902 Ack=1244 Win=48000 Len=0 TSval=689478896 TSecr=689478896
   34 10.077192410    127.0.0.1 → 127.0.0.1    TLSv1.2 253 Application Data
   35 10.077210160    127.0.0.1 → 127.0.0.1    TCP 66 53477 → 143 [ACK] Seq=1244 Ack=4089 Win=318336 Len=0 TSval=689478910 TSecr=689478910
   36 11.304899307    127.0.0.1 → 127.0.0.1    TLSv1.2 97 Encrypted Alert
   37 11.304930970    127.0.0.1 → 127.0.0.1    TCP 66 143 → 53477 [ACK] Seq=4089 Ack=1275 Win=48000 Len=0 TSval=689479278 TSecr=689479278
   38 11.304967926    127.0.0.1 → 127.0.0.1    TCP 66 53477 → 143 [FIN, ACK] Seq=1275 Ack=4089 Win=318336 Len=0 TSval=689479278 TSecr=689479278
   39 11.343635472    127.0.0.1 → 127.0.0.1    TCP 66 143 → 53477 [ACK] Seq=4089 Ack=1276 Win=48000 Len=0 TSval=689479290 TSecr=689479278
   40 11.349704283    127.0.0.1 → 127.0.0.1    TLSv1.2 97 Encrypted Alert
   41 11.349743463    127.0.0.1 → 127.0.0.1    TCP 54 53477 → 143 [RST] Seq=1276 Win=0 Len=0
