    1 0.000000000 192.168.49.139 → 192.168.49.2 DNS 76 Standard query 0x5e4e A ya.ru OPT
    2 0.000278612 192.168.49.139 → 192.168.49.2 DNS 76 Standard query 0x4b0e AAAA ya.ru OPT
    3 0.062514221 192.168.49.2 → 192.168.49.139 DNS 104 Standard query response 0x4b0e AAAA ya.ru AAAA 2a02:6b8::2:242 OPT
    4 0.067057646 192.168.49.2 → 192.168.49.139 DNS 92 Standard query response 0x5e4e A ya.ru A 87.250.250.242 OPT
    5 0.069016882 192.168.49.139 → 87.250.250.242 ICMP 98 Echo (ping) request  id=0xd051, seq=1/256, ttl=64
    6 0.129291811 87.250.250.242 → 192.168.49.139 ICMP 98 Echo (ping) reply    id=0xd051, seq=1/256, ttl=128 (request in 5)
    7 0.129712380 192.168.49.139 → 192.168.49.2 DNS 98 Standard query 0x59ab PTR 242.250.250.87.in-addr.arpa OPT
    8 0.182833021 192.168.49.2 → 192.168.49.139 DNS 117 Standard query response 0x59ab PTR 242.250.250.87.in-addr.arpa PTR ya.ru OPT
    9 1.070614714 192.168.49.139 → 87.250.250.242 ICMP 98 Echo (ping) request  id=0xd051, seq=2/512, ttl=64
   10 1.129319416 87.250.250.242 → 192.168.49.139 ICMP 98 Echo (ping) reply    id=0xd051, seq=2/512, ttl=128 (request in 9)
   11 2.073316159 192.168.49.139 → 87.250.250.242 ICMP 98 Echo (ping) request  id=0xd051, seq=3/768, ttl=64
   12 2.120031436 87.250.250.242 → 192.168.49.139 ICMP 98 Echo (ping) reply    id=0xd051, seq=3/768, ttl=128 (request in 11)
   13 3.075514945 192.168.49.139 → 87.250.250.242 ICMP 98 Echo (ping) request  id=0xd051, seq=4/1024, ttl=64
   14 3.132414194 87.250.250.242 → 192.168.49.139 ICMP 98 Echo (ping) reply    id=0xd051, seq=4/1024, ttl=128 (request in 13)
   15 4.077437973 192.168.49.139 → 87.250.250.242 ICMP 98 Echo (ping) request  id=0xd051, seq=5/1280, ttl=64
   16 4.131017807 87.250.250.242 → 192.168.49.139 ICMP 98 Echo (ping) reply    id=0xd051, seq=5/1280, ttl=128 (request in 15)
   17 5.080030889 192.168.49.139 → 87.250.250.242 ICMP 98 Echo (ping) request  id=0xd051, seq=6/1536, ttl=64
   18 5.162678291 87.250.250.242 → 192.168.49.139 ICMP 98 Echo (ping) reply    id=0xd051, seq=6/1536, ttl=128 (request in 17)
   19 6.082023968 192.168.49.139 → 87.250.250.242 ICMP 98 Echo (ping) request  id=0xd051, seq=7/1792, ttl=64
   20 6.133095631 87.250.250.242 → 192.168.49.139 ICMP 98 Echo (ping) reply    id=0xd051, seq=7/1792, ttl=128 (request in 19)
   21 7.083671955 192.168.49.139 → 87.250.250.242 ICMP 98 Echo (ping) request  id=0xd051, seq=8/2048, ttl=64
   22 7.135053973 87.250.250.242 → 192.168.49.139 ICMP 98 Echo (ping) reply    id=0xd051, seq=8/2048, ttl=128 (request in 21)
   23 8.086435067 192.168.49.139 → 87.250.250.242 ICMP 98 Echo (ping) request  id=0xd051, seq=9/2304, ttl=64
   24 8.142234840 87.250.250.242 → 192.168.49.139 ICMP 98 Echo (ping) reply    id=0xd051, seq=9/2304, ttl=128 (request in 23)
   25 9.088271813 192.168.49.139 → 87.250.250.242 ICMP 98 Echo (ping) request  id=0xd051, seq=10/2560, ttl=64
   26 9.157349427 87.250.250.242 → 192.168.49.139 ICMP 98 Echo (ping) reply    id=0xd051, seq=10/2560, ttl=128 (request in 25)
   27 10.089811201 192.168.49.139 → 87.250.250.242 ICMP 98 Echo (ping) request  id=0xd051, seq=11/2816, ttl=64
   28 10.141055427 87.250.250.242 → 192.168.49.139 ICMP 98 Echo (ping) reply    id=0xd051, seq=11/2816, ttl=128 (request in 27)
   29 10.204887749 Vmware_74:97:e4 → Vmware_ee:2d:b6 ARP 42 Who has 192.168.49.2? Tell 192.168.49.139
   30 10.205473891 Vmware_ee:2d:b6 → Vmware_74:97:e4 ARP 60 192.168.49.2 is at 00:50:56:ee:2d:b6
   31 13.554200271 192.168.49.139 → 192.168.49.2 DNS 97 Standard query 0x81a9 A mozilla.cloudflare-dns.com OPT
   32 13.554499625 192.168.49.139 → 192.168.49.2 DNS 97 Standard query 0x0ca1 AAAA mozilla.cloudflare-dns.com OPT
   33 13.677429229 192.168.49.2 → 192.168.49.139 DNS 97 Standard query response 0x81a9 Refused A mozilla.cloudflare-dns.com OPT
   34 13.677567077 192.168.49.139 → 192.168.49.2 DNS 97 Standard query 0x81a9 A mozilla.cloudflare-dns.com OPT
   35 13.709916594 192.168.49.2 → 192.168.49.139 DNS 153 Standard query response 0x0ca1 AAAA mozilla.cloudflare-dns.com AAAA 2606:4700::6810:f9f9 AAAA 2606:4700::6810:f8f9 OPT
   36 13.877262905 192.168.49.139 → 192.168.49.2 DNS 95 Standard query 0x4c52 A detectportal.firefox.com OPT
   37 13.877451029 192.168.49.139 → 192.168.49.2 DNS 95 Standard query 0x84b7 AAAA detectportal.firefox.com OPT
   38 13.954859737 192.168.49.2 → 192.168.49.139 DNS 218 Standard query response 0x84b7 AAAA detectportal.firefox.com CNAME detectportal.prod.mozaws.net CNAME prod.detectportal.prod.cloudops.mozgcp.net AAAA 2600:1901:0:38d7:: OPT
   39 13.957729489 192.168.49.2 → 192.168.49.139 DNS 206 Standard query response 0x4c52 A detectportal.firefox.com CNAME detectportal.prod.mozaws.net CNAME prod.detectportal.prod.cloudops.mozgcp.net A 34.107.221.82 OPT
   40 13.958457279 192.168.49.139 → 34.107.221.82 TCP 74 37506 → 80 [SYN] Seq=0 Win=64240 Len=0 MSS=1460 SACK_PERM=1 TSval=2367883529 TSecr=0 WS=128
   41 14.024639802 34.107.221.82 → 192.168.49.139 TCP 60 80 → 37506 [SYN, ACK] Seq=0 Ack=1 Win=64240 Len=0 MSS=1460
   42 14.024677817 192.168.49.139 → 34.107.221.82 TCP 54 37506 → 80 [ACK] Seq=1 Ack=1 Win=64240 Len=0
   43 14.024969221 192.168.49.139 → 34.107.221.82 HTTP 355 GET /canonical.html HTTP/1.1 
   44 14.025155468 34.107.221.82 → 192.168.49.139 TCP 60 80 → 37506 [ACK] Seq=1 Ack=302 Win=64240 Len=0
   45 14.084474089 34.107.221.82 → 192.168.49.139 HTTP 351 HTTP/1.1 200 OK  (text/html)
   46 14.084639590 192.168.49.139 → 34.107.221.82 TCP 54 37506 → 80 [ACK] Seq=302 Ack=298 Win=63943 Len=0
   47 14.185701801 192.168.49.139 → 192.168.49.2 DNS 82 Standard query 0xcea6 A example.org OPT
   48 14.185910668 192.168.49.139 → 192.168.49.2 DNS 82 Standard query 0x2432 AAAA example.org OPT
   49 14.186447847 192.168.49.139 → 192.168.49.2 DNS 84 Standard query 0x216e A ipv4only.arpa OPT
   50 14.186714087 192.168.49.139 → 192.168.49.2 DNS 84 Standard query 0xa0e7 AAAA ipv4only.arpa OPT
   51 14.187712042 192.168.49.139 → 34.107.221.82 TCP 74 37514 → 80 [SYN] Seq=0 Win=64240 Len=0 MSS=1460 SACK_PERM=1 TSval=2367883758 TSecr=0 WS=128
   52 14.263345111 34.107.221.82 → 192.168.49.139 TCP 60 80 → 37514 [SYN, ACK] Seq=0 Ack=1 Win=64240 Len=0 MSS=1460
   53 14.263383416 192.168.49.139 → 34.107.221.82 TCP 54 37514 → 80 [ACK] Seq=1 Ack=1 Win=64240 Len=0
   54 14.263447838 192.168.49.2 → 192.168.49.139 DNS 110 Standard query response 0x2432 AAAA example.org AAAA 2606:2800:220:1:248:1893:25c8:1946 OPT
   55 14.263462363 192.168.49.2 → 192.168.49.139 DNS 98 Standard query response 0xcea6 A example.org A 93.184.216.34 OPT
   56 14.263464808 192.168.49.2 → 192.168.49.139 DNS 116 Standard query response 0x216e A ipv4only.arpa A 192.0.0.170 A 192.0.0.171 OPT
   57 14.263467004 192.168.49.2 → 192.168.49.139 DNS 141 Standard query response 0xa0e7 AAAA ipv4only.arpa SOA sns.dns.icann.org OPT
   58 14.264070329 192.168.49.139 → 34.107.221.82 HTTP 357 GET /success.txt?ipv4 HTTP/1.1 
   59 14.264383883 34.107.221.82 → 192.168.49.139 TCP 60 80 → 37514 [ACK] Seq=1 Ack=304 Win=64240 Len=0
   60 14.322176381 192.168.49.139 → 192.168.49.2 DNS 85 Standard query 0xd7a1 A www.google.com OPT
   61 14.322348985 192.168.49.139 → 192.168.49.2 DNS 81 Standard query 0x0d58 A google.com OPT
   62 14.322498597 192.168.49.139 → 192.168.49.2 DNS 97 Standard query 0xa76a A forcesafesearch.google.com OPT
   63 14.322645634 192.168.49.139 → 192.168.49.2 DNS 86 Standard query 0x7a61 A www.youtube.com OPT
   64 14.322986752 192.168.49.139 → 192.168.49.2 DNS 84 Standard query 0x2ae2 A m.youtube.com OPT
   65 14.323342186 34.107.221.82 → 192.168.49.139 HTTP 270 HTTP/1.1 200 OK  (text/plain)
   66 14.323352558 192.168.49.139 → 34.107.221.82 TCP 54 37514 → 80 [ACK] Seq=304 Ack=217 Win=64024 Len=0
   67 14.323853389 192.168.49.139 → 192.168.49.2 DNS 94 Standard query 0x2a5f A youtubei.googleapis.com OPT
   68 14.340721147 192.168.49.2 → 192.168.49.139 DNS 129 Standard query response 0x81a9 A mozilla.cloudflare-dns.com A 104.16.249.249 A 104.16.248.249 OPT
   69 14.341320730 192.168.49.139 → 192.168.49.2 DNS 93 Standard query 0xbaca A youtube.googleapis.com OPT
   70 14.341551121 192.168.49.139 → 104.16.249.249 TCP 74 43370 → 443 [SYN] Seq=0 Win=64240 Len=0 MSS=1460 SACK_PERM=1 TSval=4103471716 TSecr=0 WS=128
   71 14.341659389 192.168.49.139 → 104.16.249.249 TCP 74 43386 → 443 [SYN] Seq=0 Win=64240 Len=0 MSS=1460 SACK_PERM=1 TSval=4103471716 TSecr=0 WS=128
   72 14.341759741 192.168.49.139 → 104.16.249.249 TCP 74 43392 → 443 [SYN] Seq=0 Win=64240 Len=0 MSS=1460 SACK_PERM=1 TSval=4103471717 TSecr=0 WS=128
   73 14.341867172 192.168.49.139 → 104.16.249.249 TCP 74 43398 → 443 [SYN] Seq=0 Win=64240 Len=0 MSS=1460 SACK_PERM=1 TSval=4103471717 TSecr=0 WS=128
   74 14.342177815 192.168.49.139 → 104.16.249.249 TCP 74 43402 → 443 [SYN] Seq=0 Win=64240 Len=0 MSS=1460 SACK_PERM=1 TSval=4103471717 TSecr=0 WS=128
   75 14.342538125 192.168.49.139 → 104.16.249.249 TCP 74 43406 → 443 [SYN] Seq=0 Win=64240 Len=0 MSS=1460 SACK_PERM=1 TSval=4103471717 TSecr=0 WS=128
   76 14.342797508 192.168.49.139 → 104.16.249.249 TCP 74 43410 → 443 [SYN] Seq=0 Win=64240 Len=0 MSS=1460 SACK_PERM=1 TSval=4103471718 TSecr=0 WS=128
   77 14.342938077 192.168.49.139 → 104.16.249.249 TCP 74 43418 → 443 [SYN] Seq=0 Win=64240 Len=0 MSS=1460 SACK_PERM=1 TSval=4103471718 TSecr=0 WS=128
   78 14.343095473 192.168.49.139 → 104.16.249.249 TCP 74 43430 → 443 [SYN] Seq=0 Win=64240 Len=0 MSS=1460 SACK_PERM=1 TSval=4103471718 TSecr=0 WS=128
   79 14.343264249 192.168.49.139 → 104.16.249.249 TCP 74 43436 → 443 [SYN] Seq=0 Win=64240 Len=0 MSS=1460 SACK_PERM=1 TSval=4103471718 TSecr=0 WS=128
   80 14.382410541 192.168.49.2 → 192.168.49.139 DNS 113 Standard query response 0xa76a A forcesafesearch.google.com A 216.239.38.120 OPT
   81 14.384185740 192.168.49.139 → 192.168.49.2 DNS 95 Standard query 0xb66c A www.youtube-nocookie.com OPT
   82 14.387556721 192.168.49.2 → 192.168.49.139 DNS 206 Standard query response 0x2a5f A youtubei.googleapis.com A 64.233.161.95 A 142.251.1.95 A 173.194.221.95 A 173.194.222.95 A 173.194.73.95 A 74.125.131.95 A 64.233.165.95 OPT
   83 14.387599432 192.168.49.2 → 192.168.49.139 DNS 163 Standard query response 0x7a61 A www.youtube.com CNAME youtube-ui.l.google.com CNAME wide-youtube.l.google.com A 173.194.220.198 OPT
   84 14.387607586 192.168.49.2 → 192.168.49.139 DNS 177 Standard query response 0x0d58 A google.com A 173.194.222.113 A 173.194.222.100 A 173.194.222.139 A 173.194.222.138 A 173.194.222.101 A 173.194.222.102 OPT
   85 14.387609622 192.168.49.2 → 192.168.49.139 DNS 180 Standard query response 0x2ae2 A m.youtube.com A 173.194.222.102 A 173.194.222.113 A 173.194.222.138 A 173.194.222.100 A 173.194.222.139 A 173.194.222.101 OPT
   86 14.388386649 192.168.49.139 → 192.168.49.2 DNS 91 Standard query 0x0392 A restrict.youtube.com OPT
   87 14.388652415 192.168.49.139 → 192.168.49.2 DNS 99 Standard query 0xfc93 A restrictmoderate.youtube.com OPT
   88 14.388783572 192.168.49.139 → 192.168.49.2 DNS 93 Standard query 0xa814 A sitereview.zscaler.com OPT
   89 14.389083055 192.168.49.139 → 192.168.49.2 DNS 94 Standard query 0xace8 A use-application-dns.net OPT
   90 14.397679263 192.168.49.2 → 192.168.49.139 DNS 181 Standard query response 0xd7a1 A www.google.com A 64.233.162.103 A 64.233.162.106 A 64.233.162.105 A 64.233.162.99 A 64.233.162.147 A 64.233.162.104 OPT
   91 14.397760962 104.16.249.249 → 192.168.49.139 TCP 60 443 → 43386 [SYN, ACK] Seq=0 Ack=1 Win=64240 Len=0 MSS=1460
   92 14.397884504 192.168.49.139 → 104.16.249.249 TCP 54 43386 → 443 [ACK] Seq=1 Ack=1 Win=64240 Len=0
   93 14.397952157 104.16.249.249 → 192.168.49.139 TCP 60 443 → 43370 [SYN, ACK] Seq=0 Ack=1 Win=64240 Len=0 MSS=1460
   94 14.397963991 192.168.49.139 → 104.16.249.249 TCP 54 43370 → 443 [ACK] Seq=1 Ack=1 Win=64240 Len=0
   95 14.398013501 104.16.249.249 → 192.168.49.139 TCP 60 443 → 43430 [SYN, ACK] Seq=0 Ack=1 Win=64240 Len=0 MSS=1460
   96 14.398031620 192.168.49.139 → 104.16.249.249 TCP 54 43430 → 443 [ACK] Seq=1 Ack=1 Win=64240 Len=0
   97 14.398074994 104.16.249.249 → 192.168.49.139 TCP 60 443 → 43436 [SYN, ACK] Seq=0 Ack=1 Win=64240 Len=0 MSS=1460
   98 14.398082490 192.168.49.139 → 104.16.249.249 TCP 54 43436 → 443 [ACK] Seq=1 Ack=1 Win=64240 Len=0
   99 14.400123013 192.168.49.139 → 104.16.249.249 TLSv1 571 Client Hello
  100 14.400350438 104.16.249.249 → 192.168.49.139 TCP 60 443 → 43386 [ACK] Seq=1 Ack=518 Win=64240 Len=0
  101 14.402393450 104.16.249.249 → 192.168.49.139 TCP 60 443 → 43406 [SYN, ACK] Seq=0 Ack=1 Win=64240 Len=0 MSS=1460
  102 14.402577241 192.168.49.139 → 104.16.249.249 TCP 54 43406 → 443 [ACK] Seq=1 Ack=1 Win=64240 Len=0
  103 14.403092898 192.168.49.139 → 104.16.249.249 TLSv1 571 Client Hello
  104 14.404288651 104.16.249.249 → 192.168.49.139 TCP 60 443 → 43370 [ACK] Seq=1 Ack=518 Win=64240 Len=0
  105 14.406173018 192.168.49.139 → 104.16.249.249 TLSv1 571 Client Hello
  106 14.406996227 104.16.249.249 → 192.168.49.139 TCP 60 443 → 43436 [ACK] Seq=1 Ack=518 Win=64240 Len=0
  107 14.407445580 104.16.249.249 → 192.168.49.139 TCP 60 443 → 43402 [SYN, ACK] Seq=0 Ack=1 Win=64240 Len=0 MSS=1460
  108 14.407464429 192.168.49.139 → 104.16.249.249 TCP 54 43402 → 443 [ACK] Seq=1 Ack=1 Win=64240 Len=0
  109 14.408618579 192.168.49.139 → 104.16.249.249 TLSv1 571 Client Hello
  110 14.408903762 104.16.249.249 → 192.168.49.139 TCP 60 443 → 43430 [ACK] Seq=1 Ack=518 Win=64240 Len=0
  111 14.410075430 192.168.49.2 → 192.168.49.139 DNS 205 Standard query response 0xbaca A youtube.googleapis.com A 74.125.131.95 A 74.125.205.95 A 64.233.164.95 A 64.233.165.95 A 64.233.161.95 A 173.194.222.95 A 173.194.73.95 OPT
  112 14.410449721 192.168.49.139 → 104.16.249.249 TLSv1 571 Client Hello
  113 14.410693771 104.16.249.249 → 192.168.49.139 TCP 60 443 → 43406 [ACK] Seq=1 Ack=518 Win=64240 Len=0
  114 14.412456215 192.168.49.139 → 104.16.249.249 TLSv1 571 Client Hello
  115 14.412754617 104.16.249.249 → 192.168.49.139 TCP 60 443 → 43402 [ACK] Seq=1 Ack=518 Win=64240 Len=0
  116 14.414181455 104.16.249.249 → 192.168.49.139 TCP 60 443 → 43392 [SYN, ACK] Seq=0 Ack=1 Win=64240 Len=0 MSS=1460
  117 14.414209642 192.168.49.139 → 104.16.249.249 TCP 54 43392 → 443 [ACK] Seq=1 Ack=1 Win=64240 Len=0
  118 14.414238577 104.16.249.249 → 192.168.49.139 TCP 60 443 → 43398 [SYN, ACK] Seq=0 Ack=1 Win=64240 Len=0 MSS=1460
  119 14.414244677 192.168.49.139 → 104.16.249.249 TCP 54 43398 → 443 [ACK] Seq=1 Ack=1 Win=64240 Len=0
  120 14.416058670 192.168.49.139 → 104.16.249.249 TLSv1 571 Client Hello
  121 14.416248314 104.16.249.249 → 192.168.49.139 TCP 60 443 → 43398 [ACK] Seq=1 Ack=518 Win=64240 Len=0
  122 14.417653423 192.168.49.139 → 104.16.249.249 TLSv1 571 Client Hello
  123 14.417841557 104.16.249.249 → 192.168.49.139 TCP 60 443 → 43392 [ACK] Seq=1 Ack=518 Win=64240 Len=0
  124 14.428752453 104.16.249.249 → 192.168.49.139 TCP 60 443 → 43410 [SYN, ACK] Seq=0 Ack=1 Win=64240 Len=0 MSS=1460
  125 14.428779984 192.168.49.139 → 104.16.249.249 TCP 54 43410 → 443 [ACK] Seq=1 Ack=1 Win=64240 Len=0
  126 14.428808130 104.16.249.249 → 192.168.49.139 TCP 60 443 → 43418 [SYN, ACK] Seq=0 Ack=1 Win=64240 Len=0 MSS=1460
  127 14.428813341 192.168.49.139 → 104.16.249.249 TCP 54 43418 → 443 [ACK] Seq=1 Ack=1 Win=64240 Len=0
  128 14.431276682 192.168.49.139 → 104.16.249.249 TLSv1 571 Client Hello
  129 14.431614185 104.16.249.249 → 192.168.49.139 TCP 60 443 → 43418 [ACK] Seq=1 Ack=518 Win=64240 Len=0
  130 14.432811201 192.168.49.139 → 104.16.249.249 TLSv1 571 Client Hello
  131 14.433143191 104.16.249.249 → 192.168.49.139 TCP 60 443 → 43410 [ACK] Seq=1 Ack=518 Win=64240 Len=0
  132 14.447483706 192.168.49.2 → 192.168.49.139 DNS 115 Standard query response 0xfc93 A restrictmoderate.youtube.com A 216.239.38.119 OPT
  133 14.447511582 192.168.49.2 → 192.168.49.139 DNS 107 Standard query response 0x0392 A restrict.youtube.com A 216.239.38.120 OPT
  134 14.453411245 192.168.49.2 → 192.168.49.139 DNS 109 Standard query response 0xa814 A sitereview.zscaler.com A 104.129.193.93 OPT
  135 14.453447103 192.168.49.2 → 192.168.49.139 DNS 142 Standard query response 0xace8 A use-application-dns.net A 44.235.246.155 A 44.236.48.31 A 44.236.72.93 OPT
  136 14.487741876 104.16.249.249 → 192.168.49.139 TLSv1.3 1414 Server Hello, Change Cipher Spec
  137 14.487858937 192.168.49.139 → 104.16.249.249 TCP 54 43406 → 443 [ACK] Seq=518 Ack=1361 Win=63920 Len=0
  138 14.488019934 104.16.249.249 → 192.168.49.139 TCP 1514 443 → 43406 [ACK] Seq=1361 Ack=518 Win=64240 Len=1460 [TCP segment of a reassembled PDU]
  139 14.488097912 192.168.49.139 → 104.16.249.249 TCP 54 43406 → 443 [ACK] Seq=518 Ack=2821 Win=62780 Len=0
  140 14.488173665 104.16.249.249 → 192.168.49.139 TLSv1.3 121 Application Data
  141 14.488193097 192.168.49.139 → 104.16.249.249 TCP 54 43406 → 443 [ACK] Seq=518 Ack=2888 Win=62780 Len=0
  142 14.488805182 104.16.249.249 → 192.168.49.139 TLSv1.3 1414 Server Hello, Change Cipher Spec
  143 14.488816842 192.168.49.139 → 104.16.249.249 TCP 54 43402 → 443 [ACK] Seq=518 Ack=1361 Win=63920 Len=0
  144 14.488866483 104.16.249.249 → 192.168.49.139 TCP 1414 443 → 43402 [PSH, ACK] Seq=1361 Ack=518 Win=64240 Len=1360 [TCP segment of a reassembled PDU]
  145 14.488873049 192.168.49.139 → 104.16.249.249 TCP 54 43402 → 443 [ACK] Seq=518 Ack=2721 Win=62560 Len=0
  146 14.488893373 104.16.249.249 → 192.168.49.139 TLSv1.3 1514 Server Hello, Change Cipher Spec
  147 14.488898687 192.168.49.139 → 104.16.249.249 TCP 54 43398 → 443 [ACK] Seq=518 Ack=1461 Win=62780 Len=0
  148 14.488934165 104.16.249.249 → 192.168.49.139 TLSv1.3 1481 Application Data
  149 14.488942224 192.168.49.139 → 104.16.249.249 TCP 54 43398 → 443 [ACK] Seq=518 Ack=2888 Win=62780 Len=0
  150 14.488965236 104.16.249.249 → 192.168.49.139 TLSv1.3 1414 Server Hello, Change Cipher Spec
  151 14.488970829 192.168.49.139 → 104.16.249.249 TCP 54 43392 → 443 [ACK] Seq=518 Ack=1361 Win=63920 Len=0
  152 14.488990855 104.16.249.249 → 192.168.49.139 TLSv1.3 1414 Server Hello, Change Cipher Spec
  153 14.488995071 192.168.49.139 → 104.16.249.249 TCP 54 43370 → 443 [ACK] Seq=518 Ack=1361 Win=63920 Len=0
  154 14.489371386 104.16.249.249 → 192.168.49.139 TCP 1414 443 → 43370 [PSH, ACK] Seq=1361 Ack=518 Win=64240 Len=1360 [TCP segment of a reassembled PDU]
  155 14.489380400 192.168.49.139 → 104.16.249.249 TCP 54 43370 → 443 [ACK] Seq=518 Ack=2721 Win=62560 Len=0
  156 14.491118174 104.16.249.249 → 192.168.49.139 TLSv1.3 221 Application Data
  157 14.491142774 192.168.49.139 → 104.16.249.249 TCP 54 43370 → 443 [ACK] Seq=518 Ack=2888 Win=62393 Len=0
  158 14.491190468 104.16.249.249 → 192.168.49.139 TCP 1414 443 → 43392 [PSH, ACK] Seq=1361 Ack=518 Win=64240 Len=1360 [TCP segment of a reassembled PDU]
  159 14.491201518 192.168.49.139 → 104.16.249.249 TCP 54 43392 → 443 [ACK] Seq=518 Ack=2721 Win=62560 Len=0
  160 14.491229594 104.16.249.249 → 192.168.49.139 TLSv1.3 221 Application Data
  161 14.491233851 192.168.49.139 → 104.16.249.249 TCP 54 43392 → 443 [ACK] Seq=518 Ack=2888 Win=62393 Len=0
  162 14.491255966 104.16.249.249 → 192.168.49.139 TLSv1.3 222 Application Data
  163 14.491260754 192.168.49.139 → 104.16.249.249 TCP 54 43402 → 443 [ACK] Seq=518 Ack=2889 Win=62392 Len=0
  164 14.500145543 104.16.249.249 → 192.168.49.139 TLSv1.3 1514 Server Hello, Change Cipher Spec
  165 14.500205843 192.168.49.139 → 104.16.249.249 TCP 54 43418 → 443 [ACK] Seq=518 Ack=1461 Win=62780 Len=0
  166 14.500248852 104.16.249.249 → 192.168.49.139 TLSv1.3 1481 Application Data
  167 14.500259887 192.168.49.139 → 104.16.249.249 TCP 54 43418 → 443 [ACK] Seq=518 Ack=2888 Win=62780 Len=0
  168 14.500285067 104.16.249.249 → 192.168.49.139 TLSv1.3 1514 Server Hello, Change Cipher Spec
  169 14.500290218 192.168.49.139 → 104.16.249.249 TCP 54 43410 → 443 [ACK] Seq=518 Ack=1461 Win=62780 Len=0
  170 14.500315083 104.16.249.249 → 192.168.49.139 TCP 1314 443 → 43410 [PSH, ACK] Seq=1461 Ack=518 Win=64240 Len=1260 [TCP segment of a reassembled PDU]
  171 14.500320517 192.168.49.139 → 104.16.249.249 TCP 54 43410 → 443 [ACK] Seq=518 Ack=2721 Win=62780 Len=0
  172 14.500339800 104.16.249.249 → 192.168.49.139 TLSv1.3 222 Application Data
  173 14.500344072 192.168.49.139 → 104.16.249.249 TCP 54 43410 → 443 [ACK] Seq=518 Ack=2889 Win=62612 Len=0
  174 14.500363522 104.16.249.249 → 192.168.49.139 TLSv1.3 1514 Server Hello, Change Cipher Spec
  175 14.500368533 192.168.49.139 → 104.16.249.249 TCP 54 43436 → 443 [ACK] Seq=518 Ack=1461 Win=62780 Len=0
  176 14.500387185 104.16.249.249 → 192.168.49.139 TLSv1.3 1481 Application Data
  177 14.500392010 192.168.49.139 → 104.16.249.249 TCP 54 43436 → 443 [ACK] Seq=518 Ack=2888 Win=62780 Len=0
  178 14.500410350 104.16.249.249 → 192.168.49.139 TLSv1.3 1514 Server Hello, Change Cipher Spec
  179 14.500415890 192.168.49.139 → 104.16.249.249 TCP 54 43386 → 443 [ACK] Seq=518 Ack=1461 Win=62780 Len=0
  180 14.500468335 104.16.249.249 → 192.168.49.139 TLSv1.3 1481 Application Data
  181 14.500475090 192.168.49.139 → 104.16.249.249 TCP 54 43386 → 443 [ACK] Seq=518 Ack=2888 Win=62780 Len=0
  182 14.505237897 104.16.249.249 → 192.168.49.139 TLSv1.3 1514 Server Hello, Change Cipher Spec
  183 14.505271310 192.168.49.139 → 104.16.249.249 TCP 54 43430 → 443 [ACK] Seq=518 Ack=1461 Win=62780 Len=0
  184 14.505301383 104.16.249.249 → 192.168.49.139 TCP 1314 443 → 43430 [PSH, ACK] Seq=1461 Ack=518 Win=64240 Len=1260 [TCP segment of a reassembled PDU]
  185 14.505307756 192.168.49.139 → 104.16.249.249 TCP 54 43430 → 443 [ACK] Seq=518 Ack=2721 Win=62780 Len=0
  186 14.505326883 104.16.249.249 → 192.168.49.139 TLSv1.3 221 Application Data
  187 14.505330635 192.168.49.139 → 104.16.249.249 TCP 54 43430 → 443 [ACK] Seq=518 Ack=2888 Win=62613 Len=0
  188 14.951383173 192.168.49.2 → 192.168.49.139 DNS 172 Standard query response 0xb66c A www.youtube-nocookie.com CNAME youtube-ui.l.google.com CNAME wide-youtube.l.google.com A 64.233.162.198 OPT
  189 15.460090518 192.168.49.139 → 104.16.249.249 TCP 54 43402 → 443 [FIN, ACK] Seq=518 Ack=2889 Win=63920 Len=0
  190 15.460559297 192.168.49.139 → 104.16.249.249 TCP 54 43406 → 443 [FIN, ACK] Seq=518 Ack=2888 Win=62780 Len=0
  191 15.460617850 104.16.249.249 → 192.168.49.139 TCP 60 443 → 43402 [ACK] Seq=2889 Ack=519 Win=64239 Len=0
  192 15.460919694 104.16.249.249 → 192.168.49.139 TCP 60 443 → 43406 [ACK] Seq=2888 Ack=519 Win=64239 Len=0
  193 15.461207000 192.168.49.139 → 104.16.249.249 TCP 74 40232 → 443 [SYN] Seq=0 Win=64240 Len=0 MSS=1460 SACK_PERM=1 TSval=4103472836 TSecr=0 WS=128
  194 15.461306484 192.168.49.139 → 104.16.249.249 TCP 74 40246 → 443 [SYN] Seq=0 Win=64240 Len=0 MSS=1460 SACK_PERM=1 TSval=4103472836 TSecr=0 WS=128
  195 15.517706371 104.16.249.249 → 192.168.49.139 TCP 60 443 → 43406 [FIN, PSH, ACK] Seq=2888 Ack=519 Win=64239 Len=0
  196 15.517754976 192.168.49.139 → 104.16.249.249 TCP 54 43406 → 443 [ACK] Seq=519 Ack=2889 Win=62780 Len=0
  197 15.536945378 104.16.249.249 → 192.168.49.139 TCP 60 443 → 40232 [SYN, ACK] Seq=0 Ack=1 Win=64240 Len=0 MSS=1460
  198 15.537078055 192.168.49.139 → 104.16.249.249 TCP 54 40232 → 443 [ACK] Seq=1 Ack=1 Win=64240 Len=0
  199 15.537192700 104.16.249.249 → 192.168.49.139 TCP 60 443 → 40246 [SYN, ACK] Seq=0 Ack=1 Win=64240 Len=0 MSS=1460
  200 15.537213613 192.168.49.139 → 104.16.249.249 TCP 54 40246 → 443 [ACK] Seq=1 Ack=1 Win=64240 Len=0
  201 15.537279089 104.16.249.249 → 192.168.49.139 TCP 60 443 → 43402 [FIN, PSH, ACK] Seq=2889 Ack=519 Win=64239 Len=0
  202 15.537300145 192.168.49.139 → 104.16.249.249 TCP 54 43402 → 443 [ACK] Seq=519 Ack=2890 Win=63920 Len=0
  203 15.543703009 192.168.49.139 → 104.16.249.249 TLSv1 571 Client Hello
  204 15.544095039 104.16.249.249 → 192.168.49.139 TCP 60 443 → 40232 [ACK] Seq=1 Ack=518 Win=64240 Len=0
  205 15.550046613 192.168.49.139 → 104.16.249.249 TLSv1 571 Client Hello
  206 15.550756120 104.16.249.249 → 192.168.49.139 TCP 60 443 → 40246 [ACK] Seq=1 Ack=518 Win=64240 Len=0
  207 15.626473925 104.16.249.249 → 192.168.49.139 TLSv1.3 1514 Server Hello, Change Cipher Spec
  208 15.626517712 192.168.49.139 → 104.16.249.249 TCP 54 40232 → 443 [ACK] Seq=518 Ack=1461 Win=62780 Len=0
  209 15.626671407 104.16.249.249 → 192.168.49.139 TLSv1.3 1481 Application Data
  210 15.626705074 192.168.49.139 → 104.16.249.249 TCP 54 40232 → 443 [ACK] Seq=518 Ack=2888 Win=62780 Len=0
  211 15.660927015 104.16.249.249 → 192.168.49.139 TLSv1.3 1514 Server Hello, Change Cipher Spec
  212 15.660973106 192.168.49.139 → 104.16.249.249 TCP 54 40246 → 443 [ACK] Seq=518 Ack=1461 Win=62780 Len=0
  213 15.661196820 104.16.249.249 → 192.168.49.139 TLSv1.3 1480 Application Data
  214 15.661219237 192.168.49.139 → 104.16.249.249 TCP 54 40246 → 443 [ACK] Seq=518 Ack=2887 Win=62780 Len=0
  215 15.674495830 192.168.49.139 → 104.16.249.249 TCP 54 43410 → 443 [FIN, ACK] Seq=518 Ack=2889 Win=62780 Len=0
  216 15.675222631 192.168.49.139 → 104.16.249.249 TCP 54 43418 → 443 [FIN, ACK] Seq=518 Ack=2888 Win=62780 Len=0
  217 15.675345352 104.16.249.249 → 192.168.49.139 TCP 60 443 → 43410 [ACK] Seq=2889 Ack=519 Win=64239 Len=0
  218 15.676002635 104.16.249.249 → 192.168.49.139 TCP 60 443 → 43418 [ACK] Seq=2888 Ack=519 Win=64239 Len=0
  219 15.676936230 192.168.49.139 → 104.16.249.249 TCP 74 40262 → 443 [SYN] Seq=0 Win=64240 Len=0 MSS=1460 SACK_PERM=1 TSval=4103473052 TSecr=0 WS=128
  220 15.677291491 192.168.49.139 → 104.16.249.249 TCP 74 40264 → 443 [SYN] Seq=0 Win=64240 Len=0 MSS=1460 SACK_PERM=1 TSval=4103473052 TSecr=0 WS=128
  221 15.736323798 104.16.249.249 → 192.168.49.139 TCP 60 443 → 40262 [SYN, ACK] Seq=0 Ack=1 Win=64240 Len=0 MSS=1460
  222 15.736446539 192.168.49.139 → 104.16.249.249 TCP 54 40262 → 443 [ACK] Seq=1 Ack=1 Win=64240 Len=0
  223 15.744235416 192.168.49.139 → 104.16.249.249 TLSv1 571 Client Hello
  224 15.745097462 104.16.249.249 → 192.168.49.139 TCP 60 443 → 40262 [ACK] Seq=1 Ack=518 Win=64240 Len=0
  225 15.748541505 104.16.249.249 → 192.168.49.139 TCP 60 443 → 43410 [FIN, PSH, ACK] Seq=2889 Ack=519 Win=64239 Len=0
  226 15.748622300 192.168.49.139 → 104.16.249.249 TCP 54 43410 → 443 [ACK] Seq=519 Ack=2890 Win=62780 Len=0
  227 15.748840089 104.16.249.249 → 192.168.49.139 TCP 60 443 → 43418 [FIN, PSH, ACK] Seq=2888 Ack=519 Win=64239 Len=0
  228 15.748867362 192.168.49.139 → 104.16.249.249 TCP 54 43418 → 443 [ACK] Seq=519 Ack=2889 Win=62780 Len=0
  229 15.754855252 104.16.249.249 → 192.168.49.139 TCP 60 443 → 40264 [SYN, ACK] Seq=0 Ack=1 Win=64240 Len=0 MSS=1460
  230 15.754979587 192.168.49.139 → 104.16.249.249 TCP 54 40264 → 443 [ACK] Seq=1 Ack=1 Win=64240 Len=0
  231 15.765431321 192.168.49.139 → 104.16.249.249 TLSv1 571 Client Hello
  232 15.766172192 104.16.249.249 → 192.168.49.139 TCP 60 443 → 40264 [ACK] Seq=1 Ack=518 Win=64240 Len=0
  233 15.807792171 104.16.249.249 → 192.168.49.139 TLSv1.3 1414 Server Hello, Change Cipher Spec
  234 15.807868467 192.168.49.139 → 104.16.249.249 TCP 54 40262 → 443 [ACK] Seq=518 Ack=1361 Win=63920 Len=0
  235 15.825017149 104.16.249.249 → 192.168.49.139 TCP 1514 443 → 40262 [ACK] Seq=1361 Ack=518 Win=64240 Len=1460 [TCP segment of a reassembled PDU]
  236 15.825039025 192.168.49.139 → 104.16.249.249 TCP 54 40262 → 443 [ACK] Seq=518 Ack=2821 Win=63920 Len=0
  237 15.825075260 104.16.249.249 → 192.168.49.139 TLSv1.3 121 Application Data
  238 15.825079594 192.168.49.139 → 104.16.249.249 TCP 54 40262 → 443 [ACK] Seq=518 Ack=2888 Win=63920 Len=0
  239 15.835651138 104.16.249.249 → 192.168.49.139 TLSv1.3 1414 Server Hello, Change Cipher Spec
  240 15.835670219 192.168.49.139 → 104.16.249.249 TCP 54 40264 → 443 [ACK] Seq=518 Ack=1361 Win=63920 Len=0
  241 15.835708266 104.16.249.249 → 192.168.49.139 TCP 1514 443 → 40264 [ACK] Seq=1361 Ack=518 Win=64240 Len=1460 [TCP segment of a reassembled PDU]
  242 15.835713362 192.168.49.139 → 104.16.249.249 TCP 54 40264 → 443 [ACK] Seq=518 Ack=2821 Win=62780 Len=0
  243 15.835729182 104.16.249.249 → 192.168.49.139 TLSv1.3 120 Application Data
  244 15.835731942 192.168.49.139 → 104.16.249.249 TCP 54 40264 → 443 [ACK] Seq=518 Ack=2887 Win=62780 Len=0
  245 15.930409787 192.168.49.139 → 104.16.249.249 TCP 54 40262 → 443 [FIN, ACK] Seq=518 Ack=2888 Win=63920 Len=0
  246 15.930911923 192.168.49.139 → 104.16.249.249 TCP 54 40246 → 443 [FIN, ACK] Seq=518 Ack=2887 Win=62780 Len=0
  247 15.931477750 104.16.249.249 → 192.168.49.139 TCP 60 443 → 40262 [ACK] Seq=2888 Ack=519 Win=64239 Len=0
  248 15.931539181 104.16.249.249 → 192.168.49.139 TCP 60 443 → 40246 [ACK] Seq=2887 Ack=519 Win=64239 Len=0
  249 15.933314353 192.168.49.139 → 104.16.249.249 TCP 74 40272 → 443 [SYN] Seq=0 Win=64240 Len=0 MSS=1460 SACK_PERM=1 TSval=4103473308 TSecr=0 WS=128
  250 15.934074026 192.168.49.139 → 104.16.249.249 TCP 74 40276 → 443 [SYN] Seq=0 Win=64240 Len=0 MSS=1460 SACK_PERM=1 TSval=4103473309 TSecr=0 WS=128
  251 15.968919445 104.16.249.249 → 192.168.49.139 TCP 60 443 → 40276 [SYN, ACK] Seq=0 Ack=1 Win=64240 Len=0 MSS=1460
  252 15.968966398 192.168.49.139 → 104.16.249.249 TCP 54 40276 → 443 [ACK] Seq=1 Ack=1 Win=64240 Len=0
  253 15.968997233 104.16.249.249 → 192.168.49.139 TCP 60 443 → 40262 [FIN, PSH, ACK] Seq=2888 Ack=519 Win=64239 Len=0
  254 15.969016876 192.168.49.139 → 104.16.249.249 TCP 54 40262 → 443 [ACK] Seq=519 Ack=2889 Win=63920 Len=0
  255 15.969038320 104.16.249.249 → 192.168.49.139 TCP 60 443 → 40272 [SYN, ACK] Seq=0 Ack=1 Win=64240 Len=0 MSS=1460
  256 15.969048915 192.168.49.139 → 104.16.249.249 TCP 54 40272 → 443 [ACK] Seq=1 Ack=1 Win=64240 Len=0
  257 15.971102865 192.168.49.139 → 104.16.249.249 TLSv1 571 Client Hello
  258 15.971441974 104.16.249.249 → 192.168.49.139 TCP 60 443 → 40276 [ACK] Seq=1 Ack=518 Win=64240 Len=0
  259 15.973981985 192.168.49.139 → 104.16.249.249 TLSv1 571 Client Hello
  260 15.974328990 104.16.249.249 → 192.168.49.139 TCP 60 443 → 40272 [ACK] Seq=1 Ack=518 Win=64240 Len=0
  261 15.987385066 104.16.249.249 → 192.168.49.139 TCP 60 443 → 40246 [FIN, PSH, ACK] Seq=2887 Ack=519 Win=64239 Len=0
  262 15.987404936 192.168.49.139 → 104.16.249.249 TCP 54 40246 → 443 [ACK] Seq=519 Ack=2888 Win=62780 Len=0
  263 15.992365070 192.168.49.139 → 104.16.249.249 TCP 54 40272 → 443 [FIN, ACK] Seq=518 Ack=1 Win=64240 Len=0
  264 15.992504012 192.168.49.139 → 104.16.249.249 TCP 54 40264 → 443 [FIN, ACK] Seq=518 Ack=2887 Win=62780 Len=0
  265 15.992875404 104.16.249.249 → 192.168.49.139 TCP 60 443 → 40272 [ACK] Seq=1 Ack=519 Win=64239 Len=0
  266 15.992921619 104.16.249.249 → 192.168.49.139 TCP 60 443 → 40264 [ACK] Seq=2887 Ack=519 Win=64239 Len=0
  267 15.994497542 192.168.49.139 → 104.16.249.249 TCP 74 40282 → 443 [SYN] Seq=0 Win=64240 Len=0 MSS=1460 SACK_PERM=1 TSval=4103473369 TSecr=0 WS=128
  268 15.995117423 192.168.49.139 → 104.16.249.249 TCP 74 40290 → 443 [SYN] Seq=0 Win=64240 Len=0 MSS=1460 SACK_PERM=1 TSval=4103473370 TSecr=0 WS=128
  269 16.015301826 192.168.49.139 → 104.16.249.249 TCP 54 40276 → 443 [FIN, ACK] Seq=518 Ack=1 Win=64240 Len=0
  270 16.015649656 104.16.249.249 → 192.168.49.139 TCP 60 443 → 40276 [ACK] Seq=1 Ack=519 Win=64239 Len=0
  271 16.016394487 192.168.49.139 → 104.16.249.249 TCP 74 40306 → 443 [SYN] Seq=0 Win=64240 Len=0 MSS=1460 SACK_PERM=1 TSval=4103473391 TSecr=0 WS=128
  272 16.016539193 192.168.49.139 → 104.16.249.249 TCP 74 40318 → 443 [SYN] Seq=0 Win=64240 Len=0 MSS=1460 SACK_PERM=1 TSval=4103473391 TSecr=0 WS=128
  273 16.036607829 104.16.249.249 → 192.168.49.139 TCP 60 443 → 40282 [SYN, ACK] Seq=0 Ack=1 Win=64240 Len=0 MSS=1460
  274 16.036681370 192.168.49.139 → 104.16.249.249 TCP 54 40282 → 443 [RST] Seq=1 Win=0 Len=0
  275 16.049947335 104.16.249.249 → 192.168.49.139 TLSv1.3 1514 Server Hello, Change Cipher Spec
  276 16.049976232 192.168.49.139 → 104.16.249.249 TCP 54 40276 → 443 [RST] Seq=519 Win=0 Len=0
  277 16.050031544 104.16.249.249 → 192.168.49.139 TCP 1314 443 → 40276 [PSH, ACK] Seq=1461 Ack=519 Win=64239 Len=1260 [TCP segment of a reassembled PDU]
  278 16.050039344 192.168.49.139 → 104.16.249.249 TCP 54 40276 → 443 [RST] Seq=519 Win=0 Len=0
  279 16.050063356 104.16.249.249 → 192.168.49.139 TLSv1.3 221 Application Data
  280 16.050068335 192.168.49.139 → 104.16.249.249 TCP 54 40276 → 443 [RST] Seq=519 Win=0 Len=0
  281 16.050533022 104.16.249.249 → 192.168.49.139 TCP 60 443 → 40264 [FIN, PSH, ACK] Seq=2887 Ack=519 Win=64239 Len=0
  282 16.050545657 192.168.49.139 → 104.16.249.249 TCP 54 40264 → 443 [ACK] Seq=519 Ack=2888 Win=62780 Len=0
  283 16.055449282 104.16.249.249 → 192.168.49.139 TCP 60 443 → 40290 [SYN, ACK] Seq=0 Ack=1 Win=64240 Len=0 MSS=1460
  284 16.055507821 192.168.49.139 → 104.16.249.249 TCP 54 40290 → 443 [ACK] Seq=1 Ack=1 Win=64240 Len=0
  285 16.056926816 192.168.49.139 → 104.16.249.249 TLSv1.3 118 Change Cipher Spec, Application Data
  286 16.057235625 104.16.249.249 → 192.168.49.139 TCP 60 443 → 43398 [ACK] Seq=2888 Ack=582 Win=64240 Len=0
  287 16.057365971 192.168.49.139 → 104.16.249.249 TLSv1.3 118 Change Cipher Spec, Application Data
  288 16.057588284 104.16.249.249 → 192.168.49.139 TCP 60 443 → 43392 [ACK] Seq=2888 Ack=582 Win=64240 Len=0
  289 16.057674619 192.168.49.139 → 104.16.249.249 TLSv1.3 118 Change Cipher Spec, Application Data
  290 16.057802996 104.16.249.249 → 192.168.49.139 TCP 60 443 → 43370 [ACK] Seq=2888 Ack=582 Win=64240 Len=0
  291 16.058163559 192.168.49.139 → 104.16.249.249 TLSv1.3 224 Application Data
  292 16.058281019 192.168.49.139 → 104.16.249.249 TLSv1.3 205 Application Data
  293 16.058346180 104.16.249.249 → 192.168.49.139 TCP 60 443 → 43398 [ACK] Seq=2888 Ack=752 Win=64240 Len=0
  294 16.058350129 104.16.249.249 → 192.168.49.139 TCP 60 443 → 43398 [ACK] Seq=2888 Ack=903 Win=64240 Len=0
  295 16.058452035 192.168.49.139 → 104.16.249.249 TLSv1.3 213 Application Data
  296 16.058506337 104.16.249.249 → 192.168.49.139 TCP 60 443 → 43398 [ACK] Seq=2888 Ack=1062 Win=64240 Len=0
  297 16.058640719 192.168.49.139 → 104.16.249.249 TLSv1.3 241 Application Data
  298 16.058704302 104.16.249.249 → 192.168.49.139 TCP 60 443 → 43392 [ACK] Seq=2888 Ack=769 Win=64240 Len=0
  299 16.058807195 192.168.49.139 → 104.16.249.249 TLSv1.3 241 Application Data
  300 16.058873994 104.16.249.249 → 192.168.49.139 TCP 60 443 → 43370 [ACK] Seq=2888 Ack=769 Win=64240 Len=0
  301 16.059041708 192.168.49.139 → 104.16.249.249 TLSv1.3 110 Application Data
  302 16.059129943 192.168.49.139 → 104.16.249.249 TLSv1.3 213 Application Data
  303 16.059178466 104.16.249.249 → 192.168.49.139 TCP 60 443 → 43398 [ACK] Seq=2888 Ack=1118 Win=64240 Len=0
  304 16.059327671 104.16.249.249 → 192.168.49.139 TCP 60 443 → 43398 [ACK] Seq=2888 Ack=1277 Win=64240 Len=0
  305 16.059387910 192.168.49.139 → 104.16.249.249 TLSv1.3 110 Application Data
  306 16.059472926 192.168.49.139 → 104.16.249.249 TLSv1.3 213 Application Data
  307 16.059538830 104.16.249.249 → 192.168.49.139 TCP 60 443 → 43398 [ACK] Seq=2888 Ack=1333 Win=64240 Len=0
  308 16.059541676 104.16.249.249 → 192.168.49.139 TCP 60 443 → 43398 [ACK] Seq=2888 Ack=1492 Win=64240 Len=0
  309 16.061288349 192.168.49.139 → 192.168.49.2 DNS 106 Standard query 0x9abe A content-signature-2.cdn.mozilla.net OPT
  310 16.061416334 192.168.49.139 → 192.168.49.2 DNS 99 Standard query 0x1259 A contile.services.mozilla.com OPT
  311 16.061547367 192.168.49.139 → 192.168.49.2 DNS 99 Standard query 0x2aa2 AAAA contile.services.mozilla.com OPT
  312 16.061792163 192.168.49.139 → 192.168.49.2 DNS 106 Standard query 0xdebf AAAA content-signature-2.cdn.mozilla.net OPT
  313 16.062181626 192.168.49.139 → 192.168.49.2 DNS 108 Standard query 0x85cf A firefox.settings.services.mozilla.com OPT
  314 16.062396763 192.168.49.139 → 192.168.49.2 DNS 108 Standard query 0x78ab AAAA firefox.settings.services.mozilla.com OPT
  315 16.062546942 192.168.49.139 → 192.168.49.2 DNS 101 Standard query 0xd4d1 A incoming.telemetry.mozilla.org OPT
  316 16.062643567 192.168.49.139 → 192.168.49.2 DNS 101 Standard query 0xa0c9 AAAA incoming.telemetry.mozilla.org OPT
  317 16.063258543 192.168.49.139 → 192.168.49.2 DNS 88 Standard query 0x341f A ocsp.digicert.com OPT
  318 16.063269621 104.16.249.249 → 192.168.49.139 TLSv1.3 1514 Server Hello, Change Cipher Spec
  319 16.063289093 104.16.249.249 → 192.168.49.139 TLSv1.3 1481 Application Data
  320 16.063293965 192.168.49.139 → 104.16.249.249 TCP 54 40272 → 443 [RST] Seq=519 Win=0 Len=0
  321 16.063366777 192.168.49.139 → 104.16.249.249 TCP 54 40272 → 443 [RST] Seq=519 Win=0 Len=0
  322 16.063820966 192.168.49.139 → 104.16.249.249 TCP 54 40232 → 443 [FIN, ACK] Seq=518 Ack=2888 Win=62780 Len=0
  323 16.063896282 192.168.49.139 → 192.168.49.2 DNS 88 Standard query 0x282f AAAA ocsp.digicert.com OPT
  324 16.064054086 104.16.249.249 → 192.168.49.139 TCP 60 443 → 40232 [ACK] Seq=2888 Ack=519 Win=64239 Len=0
  325 16.064450195 192.168.49.139 → 104.16.249.249 TCP 54 40290 → 443 [FIN, ACK] Seq=1 Ack=1 Win=64240 Len=0
  326 16.064629448 104.16.249.249 → 192.168.49.139 TCP 60 443 → 40290 [ACK] Seq=1 Ack=2 Win=64239 Len=0
  327 16.064862901 192.168.49.139 → 104.16.249.249 TCP 54 43430 → 443 [FIN, ACK] Seq=518 Ack=2888 Win=62780 Len=0
  328 16.065087606 104.16.249.249 → 192.168.49.139 TCP 60 443 → 43430 [ACK] Seq=2888 Ack=519 Win=64239 Len=0
  329 16.065306410 192.168.49.139 → 104.16.249.249 TCP 54 43436 → 443 [FIN, ACK] Seq=518 Ack=2888 Win=62780 Len=0
  330 16.065532614 104.16.249.249 → 192.168.49.139 TCP 60 443 → 43436 [ACK] Seq=2888 Ack=519 Win=64239 Len=0
  331 16.065654350 192.168.49.139 → 34.107.221.82 TCP 54 37514 → 80 [FIN, ACK] Seq=304 Ack=217 Win=64024 Len=0
  332 16.065771631 192.168.49.139 → 34.107.221.82 TCP 54 37506 → 80 [FIN, ACK] Seq=302 Ack=298 Win=63943 Len=0
  333 16.065834532 34.107.221.82 → 192.168.49.139 TCP 60 80 → 37514 [ACK] Seq=217 Ack=305 Win=64239 Len=0
  334 16.065932147 34.107.221.82 → 192.168.49.139 TCP 60 80 → 37506 [ACK] Seq=298 Ack=303 Win=64239 Len=0
  335 16.076463705 192.168.49.139 → 104.16.249.249 TLSv1.3 118 Change Cipher Spec, Application Data
  336 16.076706019 104.16.249.249 → 192.168.49.139 TCP 60 443 → 43386 [ACK] Seq=2888 Ack=582 Win=64240 Len=0
  337 16.076996712 192.168.49.139 → 104.16.249.249 TLSv1.3 241 Application Data
  338 16.077057699 104.16.249.249 → 192.168.49.139 TCP 60 443 → 40306 [SYN, ACK] Seq=0 Ack=1 Win=64240 Len=0 MSS=1460
  339 16.077068656 192.168.49.139 → 104.16.249.249 TCP 54 40306 → 443 [RST] Seq=1 Win=0 Len=0
  340 16.077097705 104.16.249.249 → 192.168.49.139 TCP 60 443 → 43386 [ACK] Seq=2888 Ack=769 Win=64240 Len=0
  341 16.077287828 192.168.49.139 → 104.16.249.249 TLSv1.3 110 Application Data
  342 16.077350389 104.16.249.249 → 192.168.49.139 TCP 60 443 → 43398 [ACK] Seq=2888 Ack=1548 Win=64240 Len=0
  343 16.077452540 192.168.49.139 → 104.16.249.249 TLSv1.3 213 Application Data
  344 16.077511552 104.16.249.249 → 192.168.49.139 TCP 60 443 → 43398 [ACK] Seq=2888 Ack=1707 Win=64240 Len=0
  345 16.080407524 104.16.249.249 → 192.168.49.139 TCP 60 443 → 40318 [SYN, ACK] Seq=0 Ack=1 Win=64240 Len=0 MSS=1460
  346 16.080426428 192.168.49.139 → 104.16.249.249 TCP 54 40318 → 443 [RST] Seq=1 Win=0 Len=0
  347 16.123266219 104.16.249.249 → 192.168.49.139 TCP 60 443 → 43436 [FIN, PSH, ACK] Seq=2888 Ack=519 Win=64239 Len=0
  348 16.123291006 192.168.49.139 → 104.16.249.249 TCP 54 43436 → 443 [ACK] Seq=519 Ack=2889 Win=62780 Len=0
  349 16.127940238 104.16.249.249 → 192.168.49.139 TLSv1.3 582 Application Data, Application Data
  350 16.127983274 192.168.49.139 → 104.16.249.249 TCP 54 43386 → 443 [ACK] Seq=769 Ack=3416 Win=62780 Len=0
  351 16.128077493 104.16.249.249 → 192.168.49.139 TLSv1.3 582 Application Data, Application Data
  352 16.128087717 192.168.49.139 → 104.16.249.249 TCP 54 43370 → 443 [ACK] Seq=769 Ack=3416 Win=63920 Len=0
  353 16.128113204 104.16.249.249 → 192.168.49.139 TCP 60 443 → 43430 [FIN, PSH, ACK] Seq=2888 Ack=519 Win=64239 Len=0
  354 16.128149196 192.168.49.139 → 104.16.249.249 TCP 54 43430 → 443 [ACK] Seq=519 Ack=2889 Win=62780 Len=0
  355 16.128723925 192.168.49.139 → 104.16.249.249 TLSv1.3 78 Application Data
  356 16.128815170 104.16.249.249 → 192.168.49.139 TCP 60 443 → 43370 [ACK] Seq=3416 Ack=793 Win=64240 Len=0
  357 16.128955256 192.168.49.139 → 104.16.249.249 TCP 54 43370 → 443 [FIN, ACK] Seq=793 Ack=3416 Win=63920 Len=0
  358 16.129101698 192.168.49.139 → 104.16.249.249 TLSv1.3 78 Application Data
  359 16.129162169 104.16.249.249 → 192.168.49.139 TCP 60 443 → 43370 [ACK] Seq=3416 Ack=794 Win=64239 Len=0
  360 16.129175605 104.16.249.249 → 192.168.49.139 TCP 60 443 → 43386 [ACK] Seq=3416 Ack=793 Win=64240 Len=0
  361 16.129269268 192.168.49.139 → 104.16.249.249 TCP 54 43386 → 443 [FIN, ACK] Seq=793 Ack=3416 Win=62780 Len=0
  362 16.129401063 104.16.249.249 → 192.168.49.139 TCP 60 443 → 43386 [ACK] Seq=3416 Ack=794 Win=64239 Len=0
  363 16.134882902 192.168.49.2 → 192.168.49.139 DNS 272 Standard query response 0xdebf AAAA content-signature-2.cdn.mozilla.net CNAME content-signature-chains.prod.autograph.services.mozaws.net CNAME prod.content-signature-chains.prod.webservices.mozgcp.net AAAA 2600:1901:0:92a9:: OPT
  364 16.137684020 34.107.221.82 → 192.168.49.139 TCP 60 80 → 37506 [FIN, PSH, ACK] Seq=298 Ack=303 Win=64239 Len=0
  365 16.137726754 192.168.49.139 → 34.107.221.82 TCP 54 37506 → 80 [ACK] Seq=303 Ack=299 Win=63943 Len=0
  366 16.137766263 192.168.49.2 → 192.168.49.139 DNS 307 Standard query response 0xa0c9 AAAA incoming.telemetry.mozilla.org CNAME telemetry-incoming.r53-2.services.mozilla.com CNAME prod.ingestion-edge.prod.dataops.mozgcp.net SOA ns-cloud-b1.googledomains.com OPT
  367 16.137801628 192.168.49.2 → 192.168.49.139 DNS 115 Standard query response 0x1259 A contile.services.mozilla.com A 34.117.237.239 OPT
  368 16.137807147 34.107.221.82 → 192.168.49.139 TCP 60 80 → 37514 [FIN, PSH, ACK] Seq=217 Ack=305 Win=64239 Len=0
  369 16.137813460 192.168.49.139 → 34.107.221.82 TCP 54 37514 → 80 [ACK] Seq=305 Ack=218 Win=64024 Len=0
  370 16.138178466 192.168.49.139 → 192.168.49.2 DNS 114 Standard query 0x0b21 AAAA prod.ingestion-edge.prod.dataops.mozgcp.net OPT
  371 16.138652175 192.168.49.2 → 192.168.49.139 DNS 180 Standard query response 0x2aa2 AAAA contile.services.mozilla.com SOA ns-679.awsdns-20.net OPT
  372 16.138677272 192.168.49.2 → 192.168.49.139 DNS 260 Standard query response 0x9abe A content-signature-2.cdn.mozilla.net CNAME content-signature-chains.prod.autograph.services.mozaws.net CNAME prod.content-signature-chains.prod.webservices.mozgcp.net A 34.160.144.191 OPT
  373 16.138682162 192.168.49.2 → 192.168.49.139 DNS 136 Standard query response 0x341f A ocsp.digicert.com CNAME cs9.wac.phicdn.net A 93.184.220.29 OPT
  374 16.138685167 192.168.49.2 → 192.168.49.139 DNS 233 Standard query response 0xd4d1 A incoming.telemetry.mozilla.org CNAME telemetry-incoming.r53-2.services.mozilla.com CNAME prod.ingestion-edge.prod.dataops.mozgcp.net A 34.120.208.123 OPT
  375 16.138687384 192.168.49.2 → 192.168.49.139 DNS 124 Standard query response 0x85cf A firefox.settings.services.mozilla.com A 35.241.9.150 OPT
  376 16.138690205 192.168.49.2 → 192.168.49.139 DNS 192 Standard query response 0x78ab AAAA firefox.settings.services.mozilla.com SOA ns-1627.awsdns-11.co.uk OPT
  377 16.142954787 104.16.249.249 → 192.168.49.139 TCP 60 443 → 40232 [FIN, PSH, ACK] Seq=2888 Ack=519 Win=64239 Len=0
  378 16.143194776 192.168.49.139 → 104.16.249.249 TCP 54 40232 → 443 [ACK] Seq=519 Ack=2889 Win=62780 Len=0
  379 16.143325460 104.16.249.249 → 192.168.49.139 TCP 60 443 → 40290 [FIN, PSH, ACK] Seq=1 Ack=2 Win=64239 Len=0
  380 16.143356506 192.168.49.139 → 104.16.249.249 TCP 54 40290 → 443 [ACK] Seq=2 Ack=2 Win=64240 Len=0
  381 16.143420266 104.16.249.249 → 192.168.49.139 TLSv1.3 582 Application Data, Application Data
  382 16.143473010 192.168.49.139 → 104.16.249.249 TCP 54 43392 → 443 [ACK] Seq=769 Ack=3416 Win=63920 Len=0
  383 16.143640708 104.16.249.249 → 192.168.49.139 TLSv1.3 582 Application Data, Application Data
  384 16.143665476 192.168.49.139 → 104.16.249.249 TCP 54 43398 → 443 [ACK] Seq=1707 Ack=3416 Win=62780 Len=0
  385 16.144773097 192.168.49.139 → 104.16.249.249 TLSv1.3 85 Application Data
  386 16.144948509 104.16.249.249 → 192.168.49.139 TCP 60 443 → 43398 [ACK] Seq=3416 Ack=1738 Win=64240 Len=0
  387 16.145104853 192.168.49.139 → 104.16.249.249 TLSv1.3 78 Application Data
  388 16.145185701 192.168.49.139 → 104.16.249.249 TCP 54 43392 → 443 [FIN, ACK] Seq=793 Ack=3416 Win=63920 Len=0
  389 16.145199861 104.16.249.249 → 192.168.49.139 TCP 60 443 → 43392 [ACK] Seq=3416 Ack=793 Win=64240 Len=0
  390 16.145466058 104.16.249.249 → 192.168.49.139 TCP 60 443 → 43392 [ACK] Seq=3416 Ack=794 Win=64239 Len=0
  391 16.177664600 104.16.249.249 → 192.168.49.139 TLSv1.3 85 Application Data
  392 16.177696804 192.168.49.139 → 104.16.249.249 TCP 54 43386 → 443 [RST] Seq=794 Win=0 Len=0
  393 16.184682819 104.16.249.249 → 192.168.49.139 TLSv1.3 85 Application Data
  394 16.184705860 192.168.49.139 → 104.16.249.249 TCP 54 43370 → 443 [RST] Seq=794 Win=0 Len=0
  395 16.184752088 104.16.249.249 → 192.168.49.139 TCP 60 443 → 43370 [FIN, PSH, ACK] Seq=3447 Ack=794 Win=64239 Len=0
  396 16.184758540 192.168.49.139 → 104.16.249.249 TCP 54 43370 → 443 [RST] Seq=794 Win=0 Len=0
  397 16.198986330 192.168.49.2 → 192.168.49.139 DNS 207 Standard query response 0x0b21 AAAA prod.ingestion-edge.prod.dataops.mozgcp.net SOA ns-cloud-b1.googledomains.com OPT
  398 16.213074743 104.16.249.249 → 192.168.49.139 TLSv1.3 85 Application Data
  399 16.213099411 192.168.49.139 → 104.16.249.249 TCP 54 43392 → 443 [RST] Seq=794 Win=0 Len=0
  400 16.219391522 104.16.249.249 → 192.168.49.139 TLSv1.3 731 Application Data, Application Data
  401 16.219409797 192.168.49.139 → 104.16.249.249 TCP 54 43398 → 443 [ACK] Seq=1738 Ack=4093 Win=62780 Len=0
  402 16.219898200 104.16.249.249 → 192.168.49.139 TLSv1.3 585 Application Data
  403 16.219921813 192.168.49.139 → 104.16.249.249 TCP 54 43398 → 443 [ACK] Seq=1738 Ack=4624 Win=62780 Len=0
  404 16.220276137 104.16.249.249 → 192.168.49.139 TLSv1.3 586 Application Data
  405 16.220282625 192.168.49.139 → 104.16.249.249 TCP 54 43398 → 443 [ACK] Seq=1738 Ack=5156 Win=62780 Len=0
  406 16.220324861 104.16.249.249 → 192.168.49.139 TLSv1.3 586 Application Data
  407 16.220334472 192.168.49.139 → 104.16.249.249 TCP 54 43398 → 443 [ACK] Seq=1738 Ack=5688 Win=62780 Len=0
  408 16.372842581 192.168.49.2 → 192.168.49.139 DNS 185 Standard query response 0x282f AAAA ocsp.digicert.com CNAME cs9.wac.phicdn.net SOA ns1.edgecastcdn.net OPT
  409 16.373709446 192.168.49.139 → 192.168.49.2 DNS 89 Standard query 0xcc49 AAAA cs9.wac.phicdn.net OPT
  410 16.434740377 192.168.49.2 → 192.168.49.139 DNS 157 Standard query response 0xcc49 AAAA cs9.wac.phicdn.net SOA ns1.edgecastcdn.net OPT
  411 16.483000703 192.168.49.139 → 104.16.249.249 TLSv1.3 93 Application Data
  412 16.483149046 192.168.49.139 → 104.16.249.249 TLSv1.3 78 Application Data
  413 16.483190590 192.168.49.139 → 104.16.249.249 TCP 54 43398 → 443 [FIN, ACK] Seq=1801 Ack=5688 Win=62780 Len=0
  414 16.483218513 104.16.249.249 → 192.168.49.139 TCP 60 443 → 43398 [ACK] Seq=5688 Ack=1777 Win=64240 Len=0
  415 16.483235669 104.16.249.249 → 192.168.49.139 TCP 60 443 → 43398 [ACK] Seq=5688 Ack=1801 Win=64240 Len=0
  416 16.483319242 104.16.249.249 → 192.168.49.139 TCP 60 443 → 43398 [ACK] Seq=5688 Ack=1802 Win=64239 Len=0
  417 16.556050334 104.16.249.249 → 192.168.49.139 TCP 60 443 → 43398 [FIN, PSH, ACK] Seq=5688 Ack=1802 Win=64239 Len=0
  418 16.556090848 192.168.49.139 → 104.16.249.249 TCP 54 43398 → 443 [ACK] Seq=1802 Ack=5689 Win=62780 Len=0
