    1 0.000000000 192.168.49.1 → 239.255.255.250 SSDP 210 M-SEARCH * HTTP/1.1 
    2 1.008003306 192.168.49.1 → 239.255.255.250 SSDP 210 M-SEARCH * HTTP/1.1 
    3 2.019397527 192.168.49.1 → 239.255.255.250 SSDP 210 M-SEARCH * HTTP/1.1 
    4 5.182798284 192.168.49.136 → 192.168.49.2 DNS 97 Standard query 0x4c05 A mozilla.cloudflare-dns.com OPT
    5 5.183052445 192.168.49.136 → 192.168.49.2 DNS 97 Standard query 0xe244 AAAA mozilla.cloudflare-dns.com OPT
    6 5.308588676 Vmware_ee:2d:b6 → Broadcast    ARP 60 Who has 192.168.49.136? Tell 192.168.49.2
    7 5.308602159 Vmware_74:97:e4 → Vmware_ee:2d:b6 ARP 42 192.168.49.136 is at 00:0c:29:74:97:e4
    8 5.308709140 192.168.49.2 → 192.168.49.136 DNS 129 Standard query response 0x4c05 A mozilla.cloudflare-dns.com A 104.16.248.249 A 104.16.249.249 OPT
    9 5.355274411 192.168.49.2 → 192.168.49.136 DNS 153 Standard query response 0xe244 AAAA mozilla.cloudflare-dns.com AAAA 2606:4700::6810:f9f9 AAAA 2606:4700::6810:f8f9 OPT
   10 5.356282524 192.168.49.136 → 104.16.248.249 TCP 74 52954 → 443 [SYN] Seq=0 Win=64240 Len=0 MSS=1460 SACK_PERM=1 TSval=2743065353 TSecr=0 WS=128
   11 5.356402742 192.168.49.136 → 104.16.248.249 TCP 74 52970 → 443 [SYN] Seq=0 Win=64240 Len=0 MSS=1460 SACK_PERM=1 TSval=2743065353 TSecr=0 WS=128
   12 5.583885096 192.168.49.136 → 192.168.49.2 DNS 95 Standard query 0x7cdc A detectportal.firefox.com OPT
   13 5.584034268 192.168.49.136 → 192.168.49.2 DNS 95 Standard query 0xd8c4 AAAA detectportal.firefox.com OPT
   14 5.607033422 192.168.49.136 → 104.16.248.249 TCP 74 52980 → 443 [SYN] Seq=0 Win=64240 Len=0 MSS=1460 SACK_PERM=1 TSval=2743065603 TSecr=0 WS=128
   15 5.607279221 192.168.49.136 → 104.16.248.249 TCP 74 52982 → 443 [SYN] Seq=0 Win=64240 Len=0 MSS=1460 SACK_PERM=1 TSval=2743065604 TSecr=0 WS=128
   16 5.649097578 192.168.49.2 → 192.168.49.136 DNS 206 Standard query response 0x7cdc A detectportal.firefox.com CNAME detectportal.prod.mozaws.net CNAME prod.detectportal.prod.cloudops.mozgcp.net A 34.107.221.82 OPT
   17 5.683591856 192.168.49.2 → 192.168.49.136 DNS 218 Standard query response 0xd8c4 AAAA detectportal.firefox.com CNAME detectportal.prod.mozaws.net CNAME prod.detectportal.prod.cloudops.mozgcp.net AAAA 2600:1901:0:38d7:: OPT
   18 5.684552487 192.168.49.136 → 34.107.221.82 TCP 74 54990 → 80 [SYN] Seq=0 Win=64240 Len=0 MSS=1460 SACK_PERM=1 TSval=3282612476 TSecr=0 WS=128
   19 5.690693394 192.168.49.136 → 104.16.249.249 TCP 74 57530 → 443 [SYN] Seq=0 Win=64240 Len=0 MSS=1460 SACK_PERM=1 TSval=989647197 TSecr=0 WS=128
   20 5.690875734 192.168.49.136 → 104.16.249.249 TCP 74 57540 → 443 [SYN] Seq=0 Win=64240 Len=0 MSS=1460 SACK_PERM=1 TSval=989647197 TSecr=0 WS=128
   21 5.794246872 104.16.249.249 → 192.168.49.136 TCP 60 443 → 57530 [SYN, ACK] Seq=0 Ack=1 Win=64240 Len=0 MSS=1460
   22 5.794291894 192.168.49.136 → 104.16.249.249 TCP 54 57530 → 443 [ACK] Seq=1 Ack=1 Win=64240 Len=0
   23 5.799045165 192.168.49.136 → 104.16.249.249 TLSv1 571 Client Hello
   24 5.799369444 104.16.249.249 → 192.168.49.136 TCP 60 443 → 57530 [ACK] Seq=1 Ack=518 Win=64240 Len=0
   25 5.851073326 104.16.249.249 → 192.168.49.136 TLSv1.3 1514 Server Hello, Change Cipher Spec
   26 5.851090437 192.168.49.136 → 104.16.249.249 TCP 54 57530 → 443 [ACK] Seq=518 Ack=1461 Win=62780 Len=0
   27 5.851123895 104.16.249.249 → 192.168.49.136 TCP 1394 443 → 57530 [PSH, ACK] Seq=1461 Ack=518 Win=64240 Len=1340 [TCP segment of a reassembled PDU]
   28 5.851129854 192.168.49.136 → 104.16.249.249 TCP 54 57530 → 443 [ACK] Seq=518 Ack=2801 Win=62780 Len=0
   29 5.851148337 104.16.249.249 → 192.168.49.136 TLSv1.3 463 Application Data
   30 5.851151637 192.168.49.136 → 104.16.249.249 TCP 54 57530 → 443 [ACK] Seq=518 Ack=3210 Win=62371 Len=0
   31 5.851813362 104.16.249.249 → 192.168.49.136 TCP 60 443 → 57540 [SYN, ACK] Seq=0 Ack=1 Win=64240 Len=0 MSS=1460
   32 5.851829462 192.168.49.136 → 104.16.249.249 TCP 54 57540 → 443 [ACK] Seq=1 Ack=1 Win=64240 Len=0
   33 5.855281783 192.168.49.136 → 104.16.249.249 TLSv1 571 Client Hello
   34 5.855510303 104.16.249.249 → 192.168.49.136 TCP 60 443 → 57540 [ACK] Seq=1 Ack=518 Win=64240 Len=0
   35 5.855532615 192.168.49.136 → 104.16.249.249 TCP 74 57542 → 443 [SYN] Seq=0 Win=64240 Len=0 MSS=1460 SACK_PERM=1 TSval=989647362 TSecr=0 WS=128
   36 5.855948807 192.168.49.136 → 104.16.249.249 TCP 74 57558 → 443 [SYN] Seq=0 Win=64240 Len=0 MSS=1460 SACK_PERM=1 TSval=989647362 TSecr=0 WS=128
   37 5.867515413 192.168.49.136 → 104.16.249.249 TLSv1.3 118 Change Cipher Spec, Application Data
   38 5.867787816 104.16.249.249 → 192.168.49.136 TCP 60 443 → 57530 [ACK] Seq=3210 Ack=582 Win=64240 Len=0
   39 5.868336994 192.168.49.136 → 104.16.249.249 TLSv1.3 224 Application Data
   40 5.868418215 192.168.49.136 → 104.16.249.249 TLSv1.3 364 Application Data, Application Data
   41 5.868434766 104.16.249.249 → 192.168.49.136 TCP 60 443 → 57530 [ACK] Seq=3210 Ack=752 Win=64240 Len=0
   42 5.868535421 104.16.249.249 → 192.168.49.136 TCP 60 443 → 57530 [ACK] Seq=3210 Ack=1062 Win=64240 Len=0
   43 5.868556622 192.168.49.136 → 104.16.249.249 TLSv1.3 110 Application Data
   44 5.868603365 192.168.49.136 → 104.16.249.249 TLSv1.3 213 Application Data
   45 5.868767104 104.16.249.249 → 192.168.49.136 TCP 60 443 → 57530 [ACK] Seq=3210 Ack=1118 Win=64240 Len=0
   46 5.868776762 104.16.249.249 → 192.168.49.136 TCP 60 443 → 57530 [ACK] Seq=3210 Ack=1277 Win=64240 Len=0
   47 5.869007478 192.168.49.136 → 104.16.249.249 TLSv1.3 110 Application Data
   48 5.869106822 192.168.49.136 → 104.16.249.249 TLSv1.3 213 Application Data
   49 5.869293488 104.16.249.249 → 192.168.49.136 TCP 60 443 → 57530 [ACK] Seq=3210 Ack=1333 Win=64240 Len=0
   50 5.869303484 104.16.249.249 → 192.168.49.136 TCP 60 443 → 57530 [ACK] Seq=3210 Ack=1492 Win=64240 Len=0
   51 5.906536095 104.16.249.249 → 192.168.49.136 TLSv1.3 582 Application Data, Application Data
   52 5.906560864 192.168.49.136 → 104.16.249.249 TCP 54 57530 → 443 [ACK] Seq=1492 Ack=3738 Win=62780 Len=0
   53 5.907236624 192.168.49.136 → 104.16.249.249 TLSv1.3 85 Application Data
   54 5.907398646 104.16.249.249 → 192.168.49.136 TCP 60 443 → 57530 [ACK] Seq=3738 Ack=1523 Win=64240 Len=0
   55 5.926335180 104.16.249.249 → 192.168.49.136 TCP 60 443 → 57558 [SYN, ACK] Seq=0 Ack=1 Win=64240 Len=0 MSS=1460
   56 5.926369189 192.168.49.136 → 104.16.249.249 TCP 54 57558 → 443 [RST] Seq=1 Win=0 Len=0
   57 5.930340631 104.16.249.249 → 192.168.49.136 TLSv1.3 1514 Server Hello, Change Cipher Spec
   58 5.930371369 192.168.49.136 → 104.16.249.249 TCP 54 57540 → 443 [ACK] Seq=518 Ack=1461 Win=62780 Len=0
   59 5.930422849 104.16.249.249 → 192.168.49.136 TCP 1514 443 → 57540 [ACK] Seq=1461 Ack=518 Win=64240 Len=1460 [TCP segment of a reassembled PDU]
   60 5.930463430 192.168.49.136 → 104.16.249.249 TCP 54 57540 → 443 [ACK] Seq=518 Ack=2921 Win=62780 Len=0
   61 5.930490411 104.16.249.249 → 192.168.49.136 TLSv1.3 342 Application Data
   62 5.930496967 192.168.49.136 → 104.16.249.249 TCP 54 57540 → 443 [ACK] Seq=518 Ack=3209 Win=62492 Len=0
   63 5.940752575 192.168.49.136 → 34.107.221.82 TCP 74 54994 → 80 [SYN] Seq=0 Win=64240 Len=0 MSS=1460 SACK_PERM=1 TSval=3282612732 TSecr=0 WS=128
   64 5.947107832 192.168.49.136 → 104.16.249.249 TLSv1.3 118 Change Cipher Spec, Application Data
   65 5.947407285 104.16.249.249 → 192.168.49.136 TCP 60 443 → 57540 [ACK] Seq=3209 Ack=582 Win=64240 Len=0
   66 5.947876912 104.16.249.249 → 192.168.49.136 TLSv1.3 1249 Application Data, Application Data, Application Data
   67 5.947898695 192.168.49.136 → 104.16.249.249 TCP 54 57530 → 443 [ACK] Seq=1523 Ack=4933 Win=62780 Len=0
   68 5.947933951 104.16.249.249 → 192.168.49.136 TLSv1.3 586 Application Data
   69 5.947940504 192.168.49.136 → 104.16.249.249 TCP 54 57530 → 443 [ACK] Seq=1523 Ack=5465 Win=62780 Len=0
   70 5.952027206 192.168.49.136 → 104.16.249.249 TLSv1.3 110 Application Data
   71 5.952199168 104.16.249.249 → 192.168.49.136 TCP 60 443 → 57530 [ACK] Seq=5465 Ack=1579 Win=64240 Len=0
   72 5.952299613 192.168.49.136 → 104.16.249.249 TLSv1.3 213 Application Data
   73 5.952423375 104.16.249.249 → 192.168.49.136 TCP 60 443 → 57530 [ACK] Seq=5465 Ack=1738 Win=64240 Len=0
   74 5.952766051 192.168.49.136 → 104.16.249.249 TLSv1.3 241 Application Data
   75 5.952949599 104.16.249.249 → 192.168.49.136 TCP 60 443 → 57540 [ACK] Seq=3209 Ack=769 Win=64240 Len=0
   76 5.984059381 104.16.249.249 → 192.168.49.136 TLSv1.3 582 Application Data, Application Data
   77 5.984327125 192.168.49.136 → 104.16.249.249 TCP 54 57540 → 443 [ACK] Seq=769 Ack=3737 Win=62780 Len=0
   78 5.985324421 192.168.49.136 → 104.16.249.249 TLSv1.3 78 Application Data
   79 5.985591820 104.16.249.249 → 192.168.49.136 TCP 60 443 → 57540 [ACK] Seq=3737 Ack=793 Win=64240 Len=0
   80 5.985604303 104.16.249.249 → 192.168.49.136 TCP 60 443 → 57542 [SYN, ACK] Seq=0 Ack=1 Win=64240 Len=0 MSS=1460
   81 5.985634900 192.168.49.136 → 104.16.249.249 TCP 54 57542 → 443 [RST] Seq=1 Win=0 Len=0
   82 5.985902726 192.168.49.136 → 104.16.249.249 TCP 54 57540 → 443 [FIN, ACK] Seq=793 Ack=3737 Win=62780 Len=0
   83 5.986139344 104.16.249.249 → 192.168.49.136 TCP 60 443 → 57540 [ACK] Seq=3737 Ack=794 Win=64239 Len=0
   84 6.016108789 192.168.49.136 → 192.168.49.2 DNS 85 Standard query 0xfbfa A www.google.com OPT
   85 6.016358695 192.168.49.136 → 192.168.49.2 DNS 81 Standard query 0x47bf A google.com OPT
   86 6.016510802 192.168.49.136 → 192.168.49.2 DNS 97 Standard query 0xdd7a A forcesafesearch.google.com OPT
   87 6.016688421 192.168.49.136 → 192.168.49.2 DNS 86 Standard query 0x4828 A www.youtube.com OPT
   88 6.018276634 192.168.49.136 → 192.168.49.2 DNS 84 Standard query 0x372f A m.youtube.com OPT
   89 6.018784684 192.168.49.136 → 192.168.49.2 DNS 93 Standard query 0x356e A youtube.googleapis.com OPT
   90 6.019018280 192.168.49.136 → 192.168.49.2 DNS 95 Standard query 0xc5d1 A www.youtube-nocookie.com OPT
   91 6.020241513 192.168.49.136 → 192.168.49.2 DNS 94 Standard query 0x89cf A youtubei.googleapis.com OPT
   92 6.021900567 104.16.249.249 → 192.168.49.136 TLSv1.3 85 Application Data
   93 6.021931904 192.168.49.136 → 104.16.249.249 TCP 54 57540 → 443 [RST] Seq=794 Win=0 Len=0
   94 6.045338202 192.168.49.136 → 104.16.248.249 TCP 74 52996 → 443 [SYN] Seq=0 Win=64240 Len=0 MSS=1460 SACK_PERM=1 TSval=2743066042 TSecr=0 WS=128
   95 6.046346036 192.168.49.136 → 104.16.249.249 TCP 74 57560 → 443 [SYN] Seq=0 Win=64240 Len=0 MSS=1460 SACK_PERM=1 TSval=989647553 TSecr=0 WS=128
   96 6.053345796 192.168.49.136 → 104.16.248.249 TCP 74 53004 → 443 [SYN] Seq=0 Win=64240 Len=0 MSS=1460 SACK_PERM=1 TSval=2743066050 TSecr=0 WS=128
   97 6.065798346 34.107.221.82 → 192.168.49.136 TCP 60 80 → 54994 [SYN, ACK] Seq=0 Ack=1 Win=64240 Len=0 MSS=1460
   98 6.066292327 192.168.49.136 → 34.107.221.82 TCP 54 54994 → 80 [ACK] Seq=1 Ack=1 Win=64240 Len=0
   99 6.066487535 192.168.49.136 → 34.107.221.82 HTTP 355 GET /canonical.html HTTP/1.1 
  100 6.066795001 34.107.221.82 → 192.168.49.136 TCP 60 80 → 54994 [ACK] Seq=1 Ack=302 Win=64240 Len=0
  101 6.070751608 192.168.49.2 → 192.168.49.136 DNS 180 Standard query response 0x372f A m.youtube.com A 209.85.233.100 A 209.85.233.113 A 209.85.233.101 A 209.85.233.138 A 209.85.233.139 A 209.85.233.102 OPT
  102 6.071992906 192.168.49.136 → 192.168.49.2 DNS 91 Standard query 0xf22d A restrict.youtube.com OPT
  103 6.075777560 104.16.249.249 → 192.168.49.136 TLSv1.3 621 Application Data, Application Data
  104 6.076176001 192.168.49.136 → 104.16.249.249 TLSv1.3 93 Application Data
  105 6.076414920 192.168.49.136 → 104.16.249.249 TLSv1.3 78 Application Data
  106 6.076429337 104.16.249.249 → 192.168.49.136 TCP 60 443 → 57530 [ACK] Seq=6032 Ack=1777 Win=64240 Len=0
  107 6.076479851 192.168.49.136 → 104.16.249.249 TCP 54 57530 → 443 [FIN, ACK] Seq=1801 Ack=6032 Win=62780 Len=0
  108 6.076583854 104.16.249.249 → 192.168.49.136 TCP 60 443 → 57530 [ACK] Seq=6032 Ack=1801 Win=64240 Len=0
  109 6.076762716 104.16.249.249 → 192.168.49.136 TCP 60 443 → 57530 [ACK] Seq=6032 Ack=1802 Win=64239 Len=0
  110 6.080529606 192.168.49.136 → 34.117.237.239 TCP 74 56848 → 443 [SYN] Seq=0 Win=64240 Len=0 MSS=1460 SACK_PERM=1 TSval=2989986701 TSecr=0 WS=128
  111 6.094651239 192.168.49.2 → 192.168.49.136 DNS 181 Standard query response 0xfbfa A www.google.com A 64.233.162.104 A 64.233.162.105 A 64.233.162.106 A 64.233.162.147 A 64.233.162.103 A 64.233.162.99 OPT
  112 6.095421316 192.168.49.136 → 192.168.49.2 DNS 99 Standard query 0x4c7b A restrictmoderate.youtube.com OPT
  113 6.114139747 192.168.49.2 → 192.168.49.136 DNS 113 Standard query response 0xdd7a A forcesafesearch.google.com A 216.239.38.120 OPT
  114 6.115858079 192.168.49.136 → 192.168.49.2 DNS 93 Standard query 0x82a4 A sitereview.zscaler.com OPT
  115 6.119218662 192.168.49.2 → 192.168.49.136 DNS 163 Standard query response 0x4828 A www.youtube.com CNAME youtube-ui.l.google.com CNAME wide-youtube.l.google.com A 173.194.222.198 OPT
  116 6.119268380 192.168.49.2 → 192.168.49.136 DNS 172 Standard query response 0xc5d1 A www.youtube-nocookie.com CNAME youtube-ui.l.google.com CNAME wide-youtube.l.google.com A 173.194.222.198 OPT
  117 6.120288732 192.168.49.136 → 192.168.49.2 DNS 94 Standard query 0x2884 A use-application-dns.net OPT
  118 6.125705495 192.168.49.2 → 192.168.49.136 DNS 177 Standard query response 0x47bf A google.com A 64.233.162.138 A 64.233.162.101 A 64.233.162.100 A 64.233.162.113 A 64.233.162.102 A 64.233.162.139 OPT
  119 6.132503808 192.168.49.2 → 192.168.49.136 DNS 270 Standard query response 0x89cf A youtubei.googleapis.com A 64.233.161.95 A 173.194.222.95 A 173.194.73.95 A 142.251.1.95 A 209.85.233.95 A 108.177.14.95 A 74.125.131.95 A 74.125.205.95 A 64.233.165.95 A 64.233.162.95 A 64.233.163.95 OPT
  120 6.132533922 192.168.49.2 → 192.168.49.136 DNS 317 Standard query response 0x356e A youtube.googleapis.com A 74.125.205.95 A 64.233.164.95 A 64.233.165.95 A 64.233.162.95 A 64.233.163.95 A 173.194.220.95 A 64.233.161.95 A 173.194.222.95 A 142.250.150.95 A 173.194.73.95 A 142.251.1.95 A 209.85.233.95 A 108.177.14.95 A 74.125.131.95 OPT
  121 6.138345411 104.16.249.249 → 192.168.49.136 TCP 60 443 → 57530 [FIN, PSH, ACK] Seq=6032 Ack=1802 Win=64239 Len=0
  122 6.138443380 192.168.49.136 → 104.16.249.249 TCP 54 57530 → 443 [ACK] Seq=1802 Ack=6033 Win=62780 Len=0
  123 6.143375254 104.16.249.249 → 192.168.49.136 TCP 60 443 → 57560 [SYN, ACK] Seq=0 Ack=1 Win=64240 Len=0 MSS=1460
  124 6.143431522 192.168.49.136 → 104.16.249.249 TCP 54 57560 → 443 [ACK] Seq=1 Ack=1 Win=64240 Len=0
  125 6.146427615 192.168.49.136 → 104.16.249.249 TLSv1 682 Client Hello
  126 6.146697163 192.168.49.136 → 104.16.249.249 TLSv1.3 60 Change Cipher Spec
  127 6.146741353 104.16.249.249 → 192.168.49.136 TCP 60 443 → 57560 [ACK] Seq=1 Ack=629 Win=64240 Len=0
  128 6.146824639 192.168.49.136 → 104.16.249.249 TLSv1.3 224 Application Data
  129 6.146928683 104.16.249.249 → 192.168.49.136 TCP 60 443 → 57560 [ACK] Seq=1 Ack=635 Win=64240 Len=0
  130 6.147174814 104.16.249.249 → 192.168.49.136 TCP 60 443 → 57560 [ACK] Seq=1 Ack=805 Win=64240 Len=0
  131 6.155433976 34.117.237.239 → 192.168.49.136 TCP 60 443 → 56848 [SYN, ACK] Seq=0 Ack=1 Win=64240 Len=0 MSS=1460
  132 6.155577277 192.168.49.136 → 34.117.237.239 TCP 54 56848 → 443 [ACK] Seq=1 Ack=1 Win=64240 Len=0
  133 6.158116619 192.168.49.136 → 34.117.237.239 TLSv1 571 Client Hello
  134 6.158443665 34.117.237.239 → 192.168.49.136 TCP 60 443 → 56848 [ACK] Seq=1 Ack=518 Win=64240 Len=0
  135 6.169978111 192.168.49.2 → 192.168.49.136 DNS 115 Standard query response 0x4c7b A restrictmoderate.youtube.com A 216.239.38.119 OPT
  136 6.170027754 192.168.49.2 → 192.168.49.136 DNS 107 Standard query response 0xf22d A restrict.youtube.com A 216.239.38.120 OPT
  137 6.181897399 192.168.49.2 → 192.168.49.136 DNS 109 Standard query response 0x82a4 A sitereview.zscaler.com A 104.129.193.93 OPT
  138 6.188383464 34.107.221.82 → 192.168.49.136 HTTP 352 HTTP/1.1 200 OK  (text/html)
  139 6.188438957 192.168.49.136 → 34.107.221.82 TCP 54 54994 → 80 [ACK] Seq=302 Ack=299 Win=63942 Len=0
  140 6.189380666 104.16.249.249 → 192.168.49.136 TLSv1.3 798 Server Hello, Change Cipher Spec, Application Data, Application Data, Application Data
  141 6.189465800 192.168.49.136 → 104.16.249.249 TCP 54 57560 → 443 [ACK] Seq=805 Ack=745 Win=63984 Len=0
  142 6.191939811 192.168.49.136 → 104.16.249.249 TLSv1.3 138 Application Data, Application Data
  143 6.193164540 104.16.249.249 → 192.168.49.136 TCP 60 443 → 57560 [ACK] Seq=745 Ack=889 Win=64240 Len=0
  144 6.194519466 192.168.49.136 → 104.16.249.249 TLSv1.3 85 Application Data
  145 6.194722566 104.16.249.249 → 192.168.49.136 TCP 60 443 → 57560 [ACK] Seq=745 Ack=920 Win=64240 Len=0
  146 6.194989189 192.168.49.136 → 104.16.249.249 TLSv1.3 205 Application Data
  147 6.195146914 104.16.249.249 → 192.168.49.136 TCP 60 443 → 57560 [ACK] Seq=745 Ack=1071 Win=64240 Len=0
  148 6.195237214 192.168.49.136 → 104.16.249.249 TLSv1.3 213 Application Data
  149 6.195357616 104.16.249.249 → 192.168.49.136 TCP 60 443 → 57560 [ACK] Seq=745 Ack=1230 Win=64240 Len=0
  150 6.195604521 192.168.49.136 → 104.16.249.249 TLSv1.3 110 Application Data
  151 6.195723738 104.16.249.249 → 192.168.49.136 TCP 60 443 → 57560 [ACK] Seq=745 Ack=1286 Win=64240 Len=0
  152 6.195782777 192.168.49.136 → 104.16.249.249 TLSv1.3 213 Application Data
  153 6.195899008 104.16.249.249 → 192.168.49.136 TCP 60 443 → 57560 [ACK] Seq=745 Ack=1445 Win=64240 Len=0
  154 6.196212910 192.168.49.136 → 104.16.249.249 TLSv1.3 110 Application Data
  155 6.196299691 104.16.249.249 → 192.168.49.136 TCP 60 443 → 57560 [ACK] Seq=745 Ack=1501 Win=64240 Len=0
  156 6.196520525 192.168.49.136 → 104.16.249.249 TLSv1.3 213 Application Data
  157 6.196600458 104.16.249.249 → 192.168.49.136 TCP 60 443 → 57560 [ACK] Seq=745 Ack=1660 Win=64240 Len=0
  158 6.196831260 192.168.49.136 → 104.16.249.249 TLSv1.3 110 Application Data
  159 6.196900124 104.16.249.249 → 192.168.49.136 TCP 60 443 → 57560 [ACK] Seq=745 Ack=1716 Win=64240 Len=0
  160 6.197024506 192.168.49.136 → 104.16.249.249 TLSv1.3 213 Application Data
  161 6.197099112 104.16.249.249 → 192.168.49.136 TCP 60 443 → 57560 [ACK] Seq=745 Ack=1875 Win=64240 Len=0
  162 6.207837830 192.168.49.136 → 104.16.249.249 TLSv1.3 110 Application Data
  163 6.208123341 104.16.249.249 → 192.168.49.136 TCP 60 443 → 57560 [ACK] Seq=745 Ack=1931 Win=64240 Len=0
  164 6.208162424 192.168.49.136 → 104.16.249.249 TLSv1.3 213 Application Data
  165 6.208255534 104.16.249.249 → 192.168.49.136 TCP 60 443 → 57560 [ACK] Seq=745 Ack=2090 Win=64240 Len=0
  166 6.208420640 192.168.49.136 → 104.16.249.249 TLSv1.3 110 Application Data
  167 6.208512804 192.168.49.136 → 104.16.249.249 TLSv1.3 213 Application Data
  168 6.208527774 104.16.249.249 → 192.168.49.136 TCP 60 443 → 57560 [ACK] Seq=745 Ack=2146 Win=64240 Len=0
  169 6.209070817 104.16.249.249 → 192.168.49.136 TCP 60 443 → 57560 [ACK] Seq=745 Ack=2305 Win=64240 Len=0
  170 6.210571218 192.168.49.136 → 192.168.49.2 DNS 82 Standard query 0x4ca8 A example.org OPT
  171 6.210850373 192.168.49.136 → 192.168.49.2 DNS 84 Standard query 0x3ac9 A ipv4only.arpa OPT
  172 6.211075467 192.168.49.136 → 192.168.49.2 DNS 84 Standard query 0x084d AAAA ipv4only.arpa OPT
  173 6.211661475 192.168.49.136 → 192.168.49.2 DNS 82 Standard query 0x9645 AAAA example.org OPT
  174 6.213646616 34.117.237.239 → 192.168.49.136 TLSv1.3 1514 Server Hello, Change Cipher Spec
  175 6.213679022 192.168.49.136 → 34.117.237.239 TCP 54 56848 → 443 [ACK] Seq=518 Ack=1461 Win=62780 Len=0
  176 6.213752552 34.117.237.239 → 192.168.49.136 TCP 1394 443 → 56848 [PSH, ACK] Seq=1461 Ack=518 Win=64240 Len=1340 [TCP segment of a reassembled PDU]
  177 6.213765205 192.168.49.136 → 34.117.237.239 TCP 54 56848 → 443 [ACK] Seq=518 Ack=2801 Win=62780 Len=0
  178 6.216406171 192.168.49.136 → 34.107.221.82 TCP 74 55010 → 80 [SYN] Seq=0 Win=64240 Len=0 MSS=1460 SACK_PERM=1 TSval=3282613008 TSecr=0 WS=128
  179 6.227247004 34.117.237.239 → 192.168.49.136 TCP 1514 443 → 56848 [ACK] Seq=2801 Ack=518 Win=64240 Len=1460 [TCP segment of a reassembled PDU]
  180 6.227276047 192.168.49.136 → 34.117.237.239 TCP 54 56848 → 443 [ACK] Seq=518 Ack=4261 Win=62780 Len=0
  181 6.227314430 34.117.237.239 → 192.168.49.136 TLSv1.3 367 Application Data
  182 6.227319645 192.168.49.136 → 34.117.237.239 TCP 54 56848 → 443 [ACK] Seq=518 Ack=4574 Win=62780 Len=0
  183 6.229424284 192.168.49.136 → 104.16.249.249 TCP 74 57570 → 443 [SYN] Seq=0 Win=64240 Len=0 MSS=1460 SACK_PERM=1 TSval=989647736 TSecr=0 WS=128
  184 6.231683217 104.16.249.249 → 192.168.49.136 TLSv1.3 85 Application Data
  185 6.231709482 192.168.49.136 → 104.16.249.249 TCP 54 57560 → 443 [ACK] Seq=2305 Ack=776 Win=63984 Len=0
  186 6.249653612 104.16.249.249 → 192.168.49.136 TLSv1.3 154 Application Data
  187 6.249810194 192.168.49.136 → 104.16.249.249 TCP 54 57560 → 443 [ACK] Seq=2305 Ack=876 Win=63984 Len=0
  188 6.249937734 104.16.249.249 → 192.168.49.136 TLSv1.3 648 Application Data
  189 6.250039663 192.168.49.136 → 104.16.249.249 TCP 54 57560 → 443 [ACK] Seq=2305 Ack=1470 Win=63984 Len=0
  190 6.250864676 104.16.249.249 → 192.168.49.136 TLSv1.3 1514 Application Data, Application Data
  191 6.250889467 104.16.249.249 → 192.168.49.136 TLSv1.3 721 Application Data, Application Data
  192 6.251073224 192.168.49.136 → 104.16.249.249 TCP 54 57560 → 443 [ACK] Seq=2305 Ack=3597 Win=62780 Len=0
  193 6.262735714 104.16.249.249 → 192.168.49.136 TLSv1.3 586 Application Data
  194 6.263118198 192.168.49.136 → 104.16.249.249 TCP 54 57560 → 443 [ACK] Seq=2305 Ack=4129 Win=62780 Len=0
  195 6.264031200 192.168.49.136 → 104.16.249.249 TLSv1.3 93 Application Data
  196 6.264317546 104.16.249.249 → 192.168.49.136 TCP 60 443 → 57560 [ACK] Seq=4129 Ack=2344 Win=64240 Len=0
  197 6.264426344 192.168.49.136 → 104.16.249.249 TLSv1.3 78 Application Data
  198 6.264567414 104.16.249.249 → 192.168.49.136 TCP 60 443 → 57560 [ACK] Seq=4129 Ack=2368 Win=64240 Len=0
  199 6.264625955 192.168.49.136 → 104.16.249.249 TCP 54 57560 → 443 [FIN, ACK] Seq=2368 Ack=4129 Win=62780 Len=0
  200 6.265147583 104.16.249.249 → 192.168.49.136 TCP 60 443 → 57560 [ACK] Seq=4129 Ack=2369 Win=64239 Len=0
  201 6.267016219 192.168.49.136 → 34.120.208.123 TCP 74 52962 → 443 [SYN] Seq=0 Win=64240 Len=0 MSS=1460 SACK_PERM=1 TSval=164538066 TSecr=0 WS=128
  202 6.295815881 192.168.49.2 → 192.168.49.136 DNS 98 Standard query response 0x4ca8 A example.org A 93.184.216.34 OPT
  203 6.296612497 192.168.49.136 → 104.16.248.249 TCP 74 53018 → 443 [SYN] Seq=0 Win=64240 Len=0 MSS=1460 SACK_PERM=1 TSval=2743066293 TSecr=0 WS=128
  204 6.303321309 192.168.49.136 → 104.16.248.249 TCP 74 53020 → 443 [SYN] Seq=0 Win=64240 Len=0 MSS=1460 SACK_PERM=1 TSval=2743066300 TSecr=0 WS=128
  205 6.315143780 104.16.249.249 → 192.168.49.136 TCP 60 443 → 57560 [FIN, PSH, ACK] Seq=4129 Ack=2369 Win=64239 Len=0
  206 6.315206409 192.168.49.136 → 104.16.249.249 TCP 54 57560 → 443 [ACK] Seq=2369 Ack=4130 Win=62780 Len=0
  207 6.348576905 192.168.49.2 → 192.168.49.136 DNS 110 Standard query response 0x9645 AAAA example.org AAAA 2606:2800:220:1:248:1893:25c8:1946 OPT
  208 6.375796327 192.168.49.136 → 104.16.248.249 TCP 74 [TCP Retransmission] 52970 → 443 [SYN] Seq=0 Win=64240 Len=0 MSS=1460 SACK_PERM=1 TSval=2743066372 TSecr=0 WS=128
  209 6.375862669 192.168.49.136 → 104.16.248.249 TCP 74 [TCP Retransmission] 52954 → 443 [SYN] Seq=0 Win=64240 Len=0 MSS=1460 SACK_PERM=1 TSval=2743066372 TSecr=0 WS=128
  210 6.408662122 34.120.208.123 → 192.168.49.136 TCP 60 443 → 52962 [SYN, ACK] Seq=0 Ack=1 Win=64240 Len=0 MSS=1460
  211 6.408711026 192.168.49.136 → 34.120.208.123 TCP 54 52962 → 443 [ACK] Seq=1 Ack=1 Win=64240 Len=0
  212 6.408920041 192.168.49.136 → 34.120.208.123 TLSv1 265 Client Hello
  213 6.409217427 34.120.208.123 → 192.168.49.136 TCP 60 443 → 52962 [ACK] Seq=1 Ack=212 Win=64240 Len=0
  214 6.467138669 192.168.49.136 → 34.107.221.82 TCP 74 55014 → 80 [SYN] Seq=0 Win=64240 Len=0 MSS=1460 SACK_PERM=1 TSval=3282613258 TSecr=0 WS=128
  215 6.479994314 192.168.49.136 → 104.16.249.249 TCP 74 57578 → 443 [SYN] Seq=0 Win=64240 Len=0 MSS=1460 SACK_PERM=1 TSval=989647986 TSecr=0 WS=128
  216 6.534207911 34.120.208.123 → 192.168.49.136 TLSv1.2 1514 Server Hello
  217 6.534259096 192.168.49.136 → 34.120.208.123 TCP 54 52962 → 443 [ACK] Seq=212 Ack=1461 Win=62780 Len=0
  218 6.534325718 34.120.208.123 → 192.168.49.136 TCP 642 443 → 52962 [PSH, ACK] Seq=1461 Ack=212 Win=64240 Len=588 [TCP segment of a reassembled PDU]
  219 6.534351997 192.168.49.136 → 34.120.208.123 TCP 54 52962 → 443 [ACK] Seq=212 Ack=2049 Win=62780 Len=0
  220 6.539956462 34.120.208.123 → 192.168.49.136 TLSv1.2 1444 Certificate, Server Key Exchange, Server Hello Done
  221 6.539990101 192.168.49.136 → 34.120.208.123 TCP 54 52962 → 443 [ACK] Seq=212 Ack=3439 Win=62780 Len=0
  222 6.541191292 192.168.49.136 → 34.120.208.123 TLSv1.2 147 Client Key Exchange, Change Cipher Spec, Encrypted Handshake Message
  223 6.541397139 34.120.208.123 → 192.168.49.136 TCP 60 443 → 52962 [ACK] Seq=3439 Ack=305 Win=64240 Len=0
  224 6.605157173 104.16.249.249 → 192.168.49.136 TCP 60 443 → 57578 [SYN, ACK] Seq=0 Ack=1 Win=64240 Len=0 MSS=1460
  225 6.605247945 192.168.49.136 → 104.16.249.249 TCP 54 57578 → 443 [ACK] Seq=1 Ack=1 Win=64240 Len=0
  226 6.608292807 192.168.49.136 → 104.16.249.249 TLSv1 682 Client Hello
  227 6.608689956 104.16.249.249 → 192.168.49.136 TCP 60 443 → 57578 [ACK] Seq=1 Ack=629 Win=64240 Len=0
  228 6.608787081 192.168.49.136 → 104.16.249.249 TLSv1.3 60 Change Cipher Spec
  229 6.609048852 192.168.49.136 → 104.16.249.249 TLSv1.3 224 Application Data
  230 6.609069633 104.16.249.249 → 192.168.49.136 TCP 60 443 → 57578 [ACK] Seq=1 Ack=635 Win=64240 Len=0
  231 6.609192718 104.16.249.249 → 192.168.49.136 TCP 60 443 → 57578 [ACK] Seq=1 Ack=805 Win=64240 Len=0
  232 6.616282481 34.107.221.82 → 192.168.49.136 TCP 60 80 → 55010 [SYN, ACK] Seq=0 Ack=1 Win=64240 Len=0 MSS=1460
  233 6.616331908 192.168.49.136 → 34.107.221.82 TCP 54 55010 → 80 [ACK] Seq=1 Ack=1 Win=64240 Len=0
  234 6.616814275 192.168.49.136 → 34.107.221.82 HTTP 357 GET /success.txt?ipv4 HTTP/1.1 
  235 6.616986191 34.107.221.82 → 192.168.49.136 TCP 60 80 → 55010 [ACK] Seq=1 Ack=304 Win=64240 Len=0
  236 6.629462896 34.120.208.123 → 192.168.49.136 TLSv1.2 401 New Session Ticket, Change Cipher Spec, Encrypted Handshake Message, Application Data
  237 6.629597900 192.168.49.136 → 34.120.208.123 TCP 54 52962 → 443 [ACK] Seq=305 Ack=3786 Win=62780 Len=0
  238 6.635688619 192.168.49.136 → 104.16.248.249 TCP 74 [TCP Retransmission] 52982 → 443 [SYN] Seq=0 Win=64240 Len=0 MSS=1460 SACK_PERM=1 TSval=2743066632 TSecr=0 WS=128
  239 6.635776927 192.168.49.136 → 104.16.248.249 TCP 74 [TCP Retransmission] 52980 → 443 [SYN] Seq=0 Win=64240 Len=0 MSS=1460 SACK_PERM=1 TSval=2743066632 TSecr=0 WS=128
  240 6.654869170 104.16.249.249 → 192.168.49.136 TLSv1.3 798 Server Hello, Change Cipher Spec, Application Data, Application Data, Application Data
  241 6.654890813 192.168.49.136 → 104.16.249.249 TCP 54 57578 → 443 [ACK] Seq=805 Ack=745 Win=63984 Len=0
  242 6.660457766 192.168.49.136 → 104.16.249.249 TLSv1.3 138 Application Data, Application Data
  243 6.660579696 104.16.249.249 → 192.168.49.136 TCP 60 443 → 57578 [ACK] Seq=745 Ack=889 Win=64240 Len=0
  244 6.662655255 192.168.49.136 → 104.16.249.249 TLSv1.3 85 Application Data
  245 6.662762113 104.16.249.249 → 192.168.49.136 TCP 60 443 → 57578 [ACK] Seq=745 Ack=920 Win=64240 Len=0
  246 6.663374544 192.168.49.136 → 104.16.249.249 TLSv1.3 205 Application Data
  247 6.663443212 192.168.49.136 → 104.16.249.249 TLSv1.3 213 Application Data
  248 6.663457572 104.16.249.249 → 192.168.49.136 TCP 60 443 → 57578 [ACK] Seq=745 Ack=1071 Win=64240 Len=0
  249 6.663580069 104.16.249.249 → 192.168.49.136 TCP 60 443 → 57578 [ACK] Seq=745 Ack=1230 Win=64240 Len=0
  250 6.663741067 192.168.49.136 → 104.16.249.249 TLSv1.3 110 Application Data
  251 6.663781663 192.168.49.136 → 104.16.249.249 TLSv1.3 213 Application Data
  252 6.663813456 104.16.249.249 → 192.168.49.136 TCP 60 443 → 57578 [ACK] Seq=745 Ack=1286 Win=64240 Len=0
  253 6.663927133 104.16.249.249 → 192.168.49.136 TCP 60 443 → 57578 [ACK] Seq=745 Ack=1445 Win=64240 Len=0
  254 6.664037595 192.168.49.136 → 104.16.249.249 TLSv1.3 110 Application Data
  255 6.664083099 192.168.49.136 → 104.16.249.249 TLSv1.3 213 Application Data
  256 6.664151876 104.16.249.249 → 192.168.49.136 TCP 60 443 → 57578 [ACK] Seq=745 Ack=1501 Win=64240 Len=0
  257 6.664256382 104.16.249.249 → 192.168.49.136 TCP 60 443 → 57578 [ACK] Seq=745 Ack=1660 Win=64240 Len=0
  258 6.664579525 192.168.49.136 → 104.16.249.249 TLSv1.3 110 Application Data
  259 6.664666519 192.168.49.136 → 104.16.249.249 TLSv1.3 213 Application Data
  260 6.664679126 104.16.249.249 → 192.168.49.136 TCP 60 443 → 57578 [ACK] Seq=745 Ack=1716 Win=64240 Len=0
  261 6.664828082 104.16.249.249 → 192.168.49.136 TCP 60 443 → 57578 [ACK] Seq=745 Ack=1875 Win=64240 Len=0
  262 6.665322069 192.168.49.136 → 104.16.249.249 TLSv1.3 110 Application Data
  263 6.665379527 192.168.49.136 → 104.16.249.249 TLSv1.3 213 Application Data
  264 6.665402876 104.16.249.249 → 192.168.49.136 TCP 60 443 → 57578 [ACK] Seq=745 Ack=1931 Win=64240 Len=0
  265 6.665514591 104.16.249.249 → 192.168.49.136 TCP 60 443 → 57578 [ACK] Seq=745 Ack=2090 Win=64240 Len=0
  266 6.666354841 192.168.49.136 → 104.16.249.249 TLSv1.3 110 Application Data
  267 6.666419090 192.168.49.136 → 104.16.249.249 TLSv1.3 213 Application Data
  268 6.666456258 104.16.249.249 → 192.168.49.136 TCP 60 443 → 57578 [ACK] Seq=745 Ack=2146 Win=64240 Len=0
  269 6.666640283 104.16.249.249 → 192.168.49.136 TCP 60 443 → 57578 [ACK] Seq=745 Ack=2305 Win=64240 Len=0
  270 6.667475604 34.107.221.82 → 192.168.49.136 HTTP 270 HTTP/1.1 200 OK  (text/plain)
  271 6.667499307 192.168.49.136 → 34.107.221.82 TCP 54 55010 → 80 [ACK] Seq=304 Ack=217 Win=64024 Len=0
  272 6.668868889 192.168.49.136 → 104.16.249.249 TLSv1.3 110 Application Data
  273 6.668950766 192.168.49.136 → 104.16.249.249 TLSv1.3 213 Application Data
  274 6.668963623 104.16.249.249 → 192.168.49.136 TCP 60 443 → 57578 [ACK] Seq=745 Ack=2361 Win=64240 Len=0
  275 6.669073004 104.16.249.249 → 192.168.49.136 TCP 60 443 → 57578 [ACK] Seq=745 Ack=2520 Win=64240 Len=0
  276 6.669269066 192.168.49.136 → 104.16.249.249 TLSv1.3 110 Application Data
  277 6.669326273 192.168.49.136 → 104.16.249.249 TLSv1.3 213 Application Data
  278 6.669341331 104.16.249.249 → 192.168.49.136 TCP 60 443 → 57578 [ACK] Seq=745 Ack=2576 Win=64240 Len=0
  279 6.669456986 104.16.249.249 → 192.168.49.136 TCP 60 443 → 57578 [ACK] Seq=745 Ack=2735 Win=64240 Len=0
  280 6.669562483 192.168.49.136 → 104.16.249.249 TLSv1.3 110 Application Data
  281 6.669605768 192.168.49.136 → 104.16.249.249 TLSv1.3 213 Application Data
  282 6.669633217 104.16.249.249 → 192.168.49.136 TCP 60 443 → 57578 [ACK] Seq=745 Ack=2791 Win=64240 Len=0
  283 6.669734401 104.16.249.249 → 192.168.49.136 TCP 60 443 → 57578 [ACK] Seq=745 Ack=2950 Win=64240 Len=0
  284 6.670004955 192.168.49.136 → 104.16.249.249 TLSv1.3 110 Application Data
  285 6.670056400 192.168.49.136 → 104.16.249.249 TLSv1.3 213 Application Data
  286 6.670083703 104.16.249.249 → 192.168.49.136 TCP 60 443 → 57578 [ACK] Seq=745 Ack=3006 Win=64240 Len=0
  287 6.670224390 104.16.249.249 → 192.168.49.136 TCP 60 443 → 57578 [ACK] Seq=745 Ack=3165 Win=64240 Len=0
  288 6.670525506 192.168.49.136 → 104.16.249.249 TLSv1.3 110 Application Data
  289 6.670606511 104.16.249.249 → 192.168.49.136 TCP 60 443 → 57578 [ACK] Seq=745 Ack=3221 Win=64240 Len=0
  290 6.670610716 192.168.49.136 → 104.16.249.249 TLSv1.3 213 Application Data
  291 6.670706470 104.16.249.249 → 192.168.49.136 TCP 60 443 → 57578 [ACK] Seq=745 Ack=3380 Win=64240 Len=0
  292 6.687554631 104.16.249.249 → 192.168.49.136 TLSv1.3 85 Application Data
  293 6.687724948 192.168.49.136 → 104.16.249.249 TCP 54 57578 → 443 [ACK] Seq=3380 Ack=776 Win=63984 Len=0
  294 6.700058317 192.168.49.136 → 34.107.221.82 TCP 74 [TCP Retransmission] 54990 → 80 [SYN] Seq=0 Win=64240 Len=0 MSS=1460 SACK_PERM=1 TSval=3282613491 TSecr=0 WS=128
  295 6.714372455 104.16.249.249 → 192.168.49.136 TLSv1.3 748 Application Data, Application Data
  296 6.714409458 104.16.249.249 → 192.168.49.136 TLSv1.3 1514 Application Data, Application Data
  297 6.714419498 104.16.249.249 → 192.168.49.136 TLSv1.3 189 Application Data
  298 6.714421518 104.16.249.249 → 192.168.49.136 TLSv1.3 1118 Application Data, Application Data
  299 6.715303720 192.168.49.136 → 104.16.249.249 TCP 54 57578 → 443 [ACK] Seq=3380 Ack=4129 Win=61320 Len=0
  300 6.725475006 104.16.249.249 → 192.168.49.136 TLSv1.3 141 Application Data
  301 6.728667361 192.168.49.136 → 104.16.249.249 TCP 54 57578 → 443 [ACK] Seq=3380 Ack=4216 Win=62780 Len=0
  302 6.729119297 192.168.49.136 → 185.5.162.9  TCP 74 37298 → 80 [SYN] Seq=0 Win=64240 Len=0 MSS=1460 SACK_PERM=1 TSval=3148987729 TSecr=0 WS=128
  303 6.730085069 192.168.49.136 → 52.85.49.121 TCP 74 58312 → 443 [SYN] Seq=0 Win=64240 Len=0 MSS=1460 SACK_PERM=1 TSval=658435084 TSecr=0 WS=128
  304 6.730457339 192.168.49.136 → 52.85.49.121 TCP 74 58322 → 443 [SYN] Seq=0 Win=64240 Len=0 MSS=1460 SACK_PERM=1 TSval=658435085 TSecr=0 WS=128
  305 6.738794395 104.16.249.249 → 192.168.49.136 TLSv1.3 1118 Application Data, Application Data
  306 6.738833856 104.16.249.249 → 192.168.49.136 TLSv1.3 1514 Application Data, Application Data
  307 6.738849542 192.168.49.136 → 104.16.249.249 TCP 54 57578 → 443 [ACK] Seq=3380 Ack=6740 Win=62780 Len=0
  308 6.739101923 104.16.249.249 → 192.168.49.136 TLSv1.3 190 Application Data
  309 6.742127619 192.168.49.136 → 104.16.249.249 TCP 54 57578 → 443 [ACK] Seq=3380 Ack=6876 Win=62780 Len=0
  310 6.743764268 192.168.49.136 → 34.120.208.123 TCP 74 52970 → 443 [SYN] Seq=0 Win=64240 Len=0 MSS=1460 SACK_PERM=1 TSval=164538543 TSecr=0 WS=128
  311 6.744361711 192.168.49.136 → 93.184.220.29 TCP 74 59848 → 80 [SYN] Seq=0 Win=64240 Len=0 MSS=1460 SACK_PERM=1 TSval=1791450044 TSecr=0 WS=128
  312 6.752334049 192.168.49.136 → 104.16.249.249 TLSv1.3 110 Application Data
  313 6.752398466 192.168.49.136 → 104.16.249.249 TLSv1.3 213 Application Data
  314 6.752544140 104.16.249.249 → 192.168.49.136 TCP 60 443 → 57578 [ACK] Seq=6876 Ack=3436 Win=64240 Len=0
  315 6.752555891 104.16.249.249 → 192.168.49.136 TCP 60 443 → 57578 [ACK] Seq=6876 Ack=3595 Win=64240 Len=0
  316 6.752712176 192.168.49.136 → 104.16.249.249 TLSv1.3 110 Application Data
  317 6.752780899 104.16.249.249 → 192.168.49.136 TCP 60 443 → 57578 [ACK] Seq=6876 Ack=3651 Win=64240 Len=0
  318 6.752787522 192.168.49.136 → 104.16.249.249 TLSv1.3 213 Application Data
  319 6.752887837 104.16.249.249 → 192.168.49.136 TCP 60 443 → 57578 [ACK] Seq=6876 Ack=3810 Win=64240 Len=0
  320 6.783838087 104.16.249.249 → 192.168.49.136 TLSv1.3 89 Application Data
  321 6.783930432 192.168.49.136 → 104.16.249.249 TCP 54 57578 → 443 [ACK] Seq=3810 Ack=6911 Win=62780 Len=0
  322 6.802341704 93.184.220.29 → 192.168.49.136 TCP 60 80 → 59848 [SYN, ACK] Seq=0 Ack=1 Win=64240 Len=0 MSS=1460
  323 6.802438745 192.168.49.136 → 93.184.220.29 TCP 54 59848 → 80 [ACK] Seq=1 Ack=1 Win=64240 Len=0
  324 6.803037145 192.168.49.136 → 93.184.220.29 OCSP 478 Request
  325 6.803339605 93.184.220.29 → 192.168.49.136 TCP 60 80 → 59848 [ACK] Seq=1 Ack=425 Win=64240 Len=0
  326 6.815646861 34.107.221.82 → 192.168.49.136 TCP 60 80 → 55014 [SYN, ACK] Seq=0 Ack=1 Win=64240 Len=0 MSS=1460
  327 6.816271052 192.168.49.136 → 34.107.221.82 TCP 54 55014 → 80 [ACK] Seq=1 Ack=1 Win=64240 Len=0
  328 6.819083990 104.16.249.249 → 192.168.49.136 TLSv1.3 621 Application Data, Application Data
  329 6.819122292 104.16.249.249 → 192.168.49.136 TLSv1.3 586 Application Data
  330 6.819390364 192.168.49.136 → 104.16.249.249 TCP 54 57578 → 443 [ACK] Seq=3810 Ack=8010 Win=62780 Len=0
  331 6.820644129 192.168.49.136 → 52.10.73.188 TCP 74 47252 → 443 [SYN] Seq=0 Win=64240 Len=0 MSS=1460 SACK_PERM=1 TSval=3023622019 TSecr=0 WS=128
  332 6.834072679 52.85.49.121 → 192.168.49.136 TCP 60 443 → 58322 [SYN, ACK] Seq=0 Ack=1 Win=64240 Len=0 MSS=1460
  333 6.834169565 192.168.49.136 → 52.85.49.121 TCP 54 58322 → 443 [ACK] Seq=1 Ack=1 Win=64240 Len=0
  334 6.834830076 192.168.49.136 → 52.85.49.121 TLSv1 262 Client Hello
  335 6.835202593 52.85.49.121 → 192.168.49.136 TCP 60 443 → 58322 [ACK] Seq=1 Ack=209 Win=64240 Len=0
  336 6.853998140 52.85.49.121 → 192.168.49.136 TCP 60 443 → 58312 [SYN, ACK] Seq=0 Ack=1 Win=64240 Len=0 MSS=1460
  337 6.854354706 192.168.49.136 → 52.85.49.121 TCP 54 58312 → 443 [ACK] Seq=1 Ack=1 Win=64240 Len=0
  338 6.855396398 192.168.49.136 → 52.85.49.121 TLSv1 262 Client Hello
  339 6.856292971 52.85.49.121 → 192.168.49.136 TCP 60 443 → 58312 [ACK] Seq=1 Ack=209 Win=64240 Len=0
  340 6.862542598 93.184.220.29 → 192.168.49.136 OCSP 793 Response
  341 6.862564286 192.168.49.136 → 93.184.220.29 TCP 54 59848 → 80 [ACK] Seq=425 Ack=740 Win=63554 Len=0
  342 6.863295699 34.120.208.123 → 192.168.49.136 TCP 60 443 → 52970 [SYN, ACK] Seq=0 Ack=1 Win=64240 Len=0 MSS=1460
  343 6.863392461 192.168.49.136 → 34.120.208.123 TCP 54 52970 → 443 [ACK] Seq=1 Ack=1 Win=64240 Len=0
  344 6.868009200 192.168.49.136 → 34.120.208.123 TLSv1 571 Client Hello
  345 6.868292537 34.120.208.123 → 192.168.49.136 TCP 60 443 → 52970 [ACK] Seq=1 Ack=518 Win=64240 Len=0
  346 6.870299185 192.168.49.136 → 34.120.208.123 TLSv1.2 231 Application Data
  347 6.870480808 192.168.49.136 → 34.120.208.123 TLSv1.2 413 Application Data
  348 6.870559845 34.120.208.123 → 192.168.49.136 TCP 60 443 → 52962 [ACK] Seq=3786 Ack=482 Win=64240 Len=0
  349 6.870567145 34.120.208.123 → 192.168.49.136 TCP 60 443 → 52962 [ACK] Seq=3786 Ack=841 Win=64240 Len=0
  350 6.870692257 192.168.49.136 → 34.120.208.123 TLSv1.2 357 Application Data
  351 6.870757929 34.120.208.123 → 192.168.49.136 TCP 60 443 → 52962 [ACK] Seq=3786 Ack=1144 Win=64240 Len=0
  352 6.870982078 192.168.49.136 → 34.120.208.123 TLSv1.2 92 Application Data
  353 6.871052027 34.120.208.123 → 192.168.49.136 TCP 60 443 → 52962 [ACK] Seq=3786 Ack=1182 Win=64240 Len=0
  354 6.898410885  185.5.162.9 → 192.168.49.136 TCP 60 80 → 37298 [SYN, ACK] Seq=0 Ack=1 Win=64240 Len=0 MSS=1460
  355 6.898462386 192.168.49.136 → 185.5.162.9  TCP 54 37298 → 80 [ACK] Seq=1 Ack=1 Win=64240 Len=0
  356 6.898956963 192.168.49.136 → 185.5.162.9  OCSP 477 Request
  357 6.899133414  185.5.162.9 → 192.168.49.136 TCP 60 80 → 37298 [ACK] Seq=1 Ack=424 Win=64240 Len=0
  358 6.900351222 192.168.49.136 → 104.16.249.249 TLSv1.3 110 Application Data
  359 6.900409677 192.168.49.136 → 104.16.249.249 TLSv1.3 213 Application Data
  360 6.900564040 192.168.49.136 → 104.16.249.249 TLSv1.3 110 Application Data
  361 6.900563837 104.16.249.249 → 192.168.49.136 TCP 60 443 → 57578 [ACK] Seq=8010 Ack=3866 Win=64240 Len=0
  362 6.900569115 104.16.249.249 → 192.168.49.136 TCP 60 443 → 57578 [ACK] Seq=8010 Ack=4025 Win=64240 Len=0
  363 6.900616549 192.168.49.136 → 104.16.249.249 TLSv1.3 213 Application Data
  364 6.900684854 104.16.249.249 → 192.168.49.136 TCP 60 443 → 57578 [ACK] Seq=8010 Ack=4081 Win=64240 Len=0
  365 6.900688646 104.16.249.249 → 192.168.49.136 TCP 60 443 → 57578 [ACK] Seq=8010 Ack=4240 Win=64240 Len=0
  366 6.900710208 192.168.49.136 → 104.16.249.249 TLSv1.3 110 Application Data
  367 6.900770777 104.16.249.249 → 192.168.49.136 TCP 60 443 → 57578 [ACK] Seq=8010 Ack=4296 Win=64240 Len=0
  368 6.900776386 192.168.49.136 → 104.16.249.249 TLSv1.3 213 Application Data
  369 6.900868767 104.16.249.249 → 192.168.49.136 TCP 60 443 → 57578 [ACK] Seq=8010 Ack=4455 Win=64240 Len=0
  370 6.900874158 192.168.49.136 → 104.16.249.249 TLSv1.3 484 Application Data, Application Data, Application Data, Application Data
  371 6.900973231 192.168.49.136 → 104.16.249.249 TLSv1.3 484 Application Data, Application Data, Application Data, Application Data
