    1   0.000000 67.161.34.229 → 128.241.194.25 TCP 66 1643 → 110 [SYN] Seq=0 Win=65535 Len=0 MSS=1460 WS=4 SACK_PERM=1
    2   0.086899 128.241.194.25 → 67.161.34.229 TCP 66 110 → 1643 [SYN, ACK] Seq=0 Ack=1 Win=16384 Len=0 MSS=1460 WS=1 SACK_PERM=1
    3   0.086943 67.161.34.229 → 128.241.194.25 TCP 54 1643 → 110 [ACK] Seq=1 Ack=1 Win=256960 Len=0
    4   4.680620 128.241.194.25 → 67.161.34.229 POP 103 S: +OK POP3 [128.241.194.25] v2000.70 server ready
    5   4.681007 67.161.34.229 → 128.241.194.25 POP 70 C: USER rgantreyl
    6   4.770897 128.241.194.25 → 67.161.34.229 POP 95 S: +OK User name accepted, password please
    7   4.771077 67.161.34.229 → 128.241.194.25 POP 69 C: PASS abcdefgh
    8   4.886065 128.241.194.25 → 67.161.34.229 POP 84 S: +OK Mailbox open, 1 messages
    9   4.886357 67.161.34.229 → 128.241.194.25 POP 60 C: STAT
   10   4.978243 128.241.194.25 → 67.161.34.229 POP 67 S: +OK 1 11110
   11   4.978520 67.161.34.229 → 128.241.194.25 POP 60 C: UIDL
   12   5.071986 128.241.194.25 → 67.161.34.229 POP 108 S: +OK Unique-ID listing follows
   13   5.072202 67.161.34.229 → 128.241.194.25 POP 60 C: LIST
   14   5.166592 128.241.194.25 → 67.161.34.229 POP 100 S: +OK Mailbox scan listing follows
   15   5.168841 67.161.34.229 → 128.241.194.25 POP 62 C: RETR 1
   16   5.256687 128.241.194.25 → 67.161.34.229 POP 1514 S: +OK 11110 octets
   17   5.256983 128.241.194.25 → 67.161.34.229 POP 1514 S: DATA fragment, 1460 bytes
   18   5.257008 67.161.34.229 → 128.241.194.25 TCP 54 1643 → 110 [ACK] Seq=58 Ack=3154 Win=256960 Len=0
   19   5.257248 128.241.194.25 → 67.161.34.229 POP 1230 S: DATA fragment, 1176 bytes
   20   5.258325 128.241.194.25 → 67.161.34.229 POP 1514 S: DATA fragment, 1460 bytes
   21   5.258342 67.161.34.229 → 128.241.194.25 TCP 54 1643 → 110 [ACK] Seq=58 Ack=5790 Win=256960 Len=0
   22   5.258644 128.241.194.25 → 67.161.34.229 POP 1514 S: DATA fragment, 1460 bytes
   23   5.259575 128.241.194.25 → 67.161.34.229 POP 1514 S: DATA fragment, 1460 bytes
   24   5.259598 67.161.34.229 → 128.241.194.25 TCP 54 1643 → 110 [ACK] Seq=58 Ack=8710 Win=256960 Len=0
   25   5.343429 128.241.194.25 → 67.161.34.229 POP 338 S: DATA fragment, 284 bytes
   26   5.351204 128.241.194.25 → 67.161.34.229 POP 1514 S: DATA fragment, 1460 bytes
   27   5.351243 67.161.34.229 → 128.241.194.25 TCP 54 1643 → 110 [ACK] Seq=58 Ack=10454 Win=256960 Len=0
   28   5.437402 128.241.194.25 → 67.161.34.229 POP 966 S: DATA fragment, 912 bytes
   29   5.562633 67.161.34.229 → 128.241.194.25 TCP 54 1643 → 110 [ACK] Seq=58 Ack=11366 Win=256048 Len=0
   30   8.371691 67.161.34.229 → 128.241.194.25 POP 62 C: DELE 1
   31   8.460531 128.241.194.25 → 67.161.34.229 POP 75 S: +OK Message deleted
   32   8.460768 67.161.34.229 → 128.241.194.25 POP 60 C: QUIT
   33   8.586176 128.241.194.25 → 67.161.34.229 POP 68 S: +OK Sayonara
   34   8.586460 128.241.194.25 → 67.161.34.229 TCP 60 110 → 1643 [FIN, ACK] Seq=11401 Ack=72 Win=65464 Len=0
   35   8.586487 67.161.34.229 → 128.241.194.25 TCP 54 [TCP Previous segment not captured] 1643 → 110 [ACK] Seq=73 Ack=11402 Win=256012 Len=0
   36   8.586526 67.161.34.229 → 128.241.194.25 TCP 54 [TCP Out-Of-Order] 1643 → 110 [FIN, ACK] Seq=72 Ack=11401 Win=256012 Len=0
   37   8.680813 128.241.194.25 → 67.161.34.229 TCP 60 110 → 1643 [ACK] Seq=11402 Ack=73 Win=65464 Len=0
