    1 0.000000000 192.168.212.10 → 34.120.208.123 TLSv1.2 100 Application Data
    2 0.000540970 192.168.212.10 → 104.16.249.249 TLSv1.2 93 Application Data
    3 0.000860987 34.120.208.123 → 192.168.212.10 TCP 60 443 → 32960 [ACK] Seq=1 Ack=47 Win=64240 Len=0
    4 0.000880491 104.16.249.249 → 192.168.212.10 TCP 60 443 → 33424 [ACK] Seq=1 Ack=40 Win=64240 Len=0
    5 0.068444244 34.120.208.123 → 192.168.212.10 TLSv1.2 100 Application Data
    6 0.068478843 192.168.212.10 → 34.120.208.123 TCP 54 32960 → 443 [ACK] Seq=47 Ack=47 Win=64015 Len=0
    7 0.072685059 104.16.249.249 → 192.168.212.10 TLSv1.2 93 Application Data
    8 0.072704116 192.168.212.10 → 104.16.249.249 TCP 54 33424 → 443 [ACK] Seq=40 Ack=40 Win=65535 Len=0
    9 2.770951546 192.168.212.10 → 192.168.212.2 DNS 76 Standard query 0x2977 A ya.ri OPT
   10 2.771101331 192.168.212.10 → 192.168.212.2 DNS 76 Standard query 0x1778 AAAA ya.ri OPT
   11 2.802736677 192.168.212.2 → 192.168.212.10 DNS 151 Standard query response 0x1778 No such name AAAA ya.ri SOA a.root-servers.net OPT
   12 2.809424259 192.168.212.10 → 91.198.174.208 TLSv1.2 93 Application Data
   13 2.809983982 91.198.174.208 → 192.168.212.10 TCP 60 443 → 53198 [ACK] Seq=1 Ack=40 Win=64240 Len=0
   14 2.810377944 192.168.212.10 → 91.198.174.208 TLSv1.2 78 Application Data
   15 2.810720105 91.198.174.208 → 192.168.212.10 TCP 60 443 → 53198 [ACK] Seq=1 Ack=64 Win=64240 Len=0
   16 2.810832666 192.168.212.10 → 91.198.174.208 TCP 54 53198 → 443 [FIN, ACK] Seq=64 Ack=1 Win=63848 Len=0
   17 2.811191219 91.198.174.208 → 192.168.212.10 TCP 60 443 → 53198 [ACK] Seq=1 Ack=65 Win=64239 Len=0
   18 2.813194343 192.168.212.2 → 192.168.212.10 DNS 151 Standard query response 0x2977 No such name A ya.ri SOA a.root-servers.net OPT
   19 2.905174553 91.198.174.208 → 192.168.212.10 TLSv1.2 78 Application Data
   20 2.905218382 192.168.212.10 → 91.198.174.208 TCP 54 53198 → 443 [RST] Seq=65 Win=0 Len=0
   21 2.927605196 192.168.212.10 → 108.156.15.108 TCP 54 55794 → 80 [ACK] Seq=1 Ack=1 Win=63516 Len=0
   22 2.927997318 108.156.15.108 → 192.168.212.10 TCP 60 [TCP ACKed unseen segment] 80 → 55794 [ACK] Seq=1 Ack=2 Win=64240 Len=0
   23 3.002530500 192.168.212.10 → 52.45.214.17 TLSv1.2 100 Application Data
   24 3.003327357 52.45.214.17 → 192.168.212.10 TCP 60 443 → 48906 [ACK] Seq=1 Ack=47 Win=64240 Len=0
   25 3.183554223 192.168.212.10 → 162.247.243.29 TCP 54 35682 → 443 [ACK] Seq=1 Ack=1 Win=62780 Len=0
   26 3.183806484 192.168.212.10 → 162.247.243.29 TCP 54 55756 → 443 [ACK] Seq=1 Ack=1 Win=63848 Len=0
   27 3.183857259 192.168.212.10 → 162.247.243.29 TCP 54 55748 → 443 [ACK] Seq=1 Ack=1 Win=63797 Len=0
   28 3.183930661 162.247.243.29 → 192.168.212.10 TCP 60 [TCP ACKed unseen segment] 443 → 35682 [ACK] Seq=1 Ack=2 Win=64240 Len=0
   29 3.183940051 162.247.243.29 → 192.168.212.10 TCP 60 [TCP ACKed unseen segment] 443 → 55756 [ACK] Seq=1 Ack=2 Win=64240 Len=0
   30 3.183941458 162.247.243.29 → 192.168.212.10 TCP 60 [TCP ACKed unseen segment] 443 → 55748 [ACK] Seq=1 Ack=2 Win=64240 Len=0
   31 3.197013343 52.45.214.17 → 192.168.212.10 TLSv1.2 100 Application Data
   32 3.197038123 192.168.212.10 → 52.45.214.17 TCP 54 48906 → 443 [ACK] Seq=47 Ack=47 Win=62780 Len=0
   33 4.811295817 192.168.212.10 → 162.247.243.29 TLSv1.2 78 [TCP Previous segment not captured] , Application Data
   34 4.811677768 192.168.212.10 → 162.247.243.29 TCP 54 35682 → 443 [FIN, ACK] Seq=26 Ack=1 Win=62780 Len=0
   35 4.811934170 162.247.243.29 → 192.168.212.10 TCP 60 [TCP ACKed unseen segment] 443 → 35682 [ACK] Seq=1 Ack=26 Win=64240 Len=0
   36 4.811954421 162.247.243.29 → 192.168.212.10 TCP 60 443 → 35682 [ACK] Seq=1 Ack=27 Win=64239 Len=0
   37 4.812499571 192.168.212.10 → 108.156.15.108 TCP 54 [TCP Previous segment not captured] 55794 → 80 [FIN, ACK] Seq=2 Ack=1 Win=63516 Len=0
   38 4.812770235 192.168.212.10 → 162.247.243.29 TLSv1.2 78 [TCP Previous segment not captured] , Application Data
   39 4.812832235 192.168.212.10 → 162.247.243.29 TCP 54 55748 → 443 [FIN, ACK] Seq=26 Ack=1 Win=63797 Len=0
   40 4.812996397 108.156.15.108 → 192.168.212.10 TCP 60 [TCP ACKed unseen segment] 80 → 55794 [ACK] Seq=1 Ack=3 Win=64239 Len=0
   41 4.813298729 162.247.243.29 → 192.168.212.10 TCP 60 [TCP ACKed unseen segment] 443 → 55748 [ACK] Seq=1 Ack=26 Win=64240 Len=0
   42 4.813305984 162.247.243.29 → 192.168.212.10 TCP 60 443 → 55748 [ACK] Seq=1 Ack=27 Win=64239 Len=0
   43 4.813678120 192.168.212.10 → 162.247.243.29 TLSv1.2 78 [TCP Previous segment not captured] , Application Data
   44 4.814008971 162.247.243.29 → 192.168.212.10 TCP 60 [TCP ACKed unseen segment] 443 → 55756 [ACK] Seq=1 Ack=26 Win=64240 Len=0
   45 4.814113351 192.168.212.10 → 162.247.243.29 TCP 54 55756 → 443 [FIN, ACK] Seq=26 Ack=1 Win=63848 Len=0
   46 4.814444240 162.247.243.29 → 192.168.212.10 TCP 60 443 → 55756 [ACK] Seq=1 Ack=27 Win=64239 Len=0
   47 4.870047289 108.156.15.108 → 192.168.212.10 TCP 60 80 → 55794 [FIN, PSH, ACK] Seq=1 Ack=3 Win=64239 Len=0
   48 4.870091664 192.168.212.10 → 108.156.15.108 TCP 54 55794 → 80 [ACK] Seq=3 Ack=2 Win=63516 Len=0
   49 4.899365066 162.247.243.29 → 192.168.212.10 TLSv1.2 78 Application Data
   50 4.899409446 192.168.212.10 → 162.247.243.29 TCP 54 55748 → 443 [RST] Seq=27 Win=0 Len=0
   51 4.899493383 162.247.243.29 → 192.168.212.10 TLSv1.2 78 Application Data
   52 4.899499244 192.168.212.10 → 162.247.243.29 TCP 54 35682 → 443 [RST] Seq=27 Win=0 Len=0
   53 4.899600990 162.247.243.29 → 192.168.212.10 TCP 60 443 → 35682 [FIN, PSH, ACK] Seq=25 Ack=27 Win=64239 Len=0
   54 4.899608117 192.168.212.10 → 162.247.243.29 TCP 54 35682 → 443 [RST] Seq=27 Win=0 Len=0
   55 4.899652440 162.247.243.29 → 192.168.212.10 TLSv1.2 78 Application Data
   56 4.899657675 192.168.212.10 → 162.247.243.29 TCP 54 55756 → 443 [RST] Seq=27 Win=0 Len=0
   57 4.899701280 162.247.243.29 → 192.168.212.10 TCP 60 443 → 55756 [FIN, PSH, ACK] Seq=25 Ack=27 Win=64239 Len=0
   58 4.899706088 192.168.212.10 → 162.247.243.29 TCP 54 55756 → 443 [RST] Seq=27 Win=0 Len=0
   59 5.292615490 192.168.212.10 → 192.168.212.2 DNS 76 Standard query 0x668c A ya.ri OPT
   60 5.292737457 192.168.212.10 → 192.168.212.2 DNS 76 Standard query 0xf486 AAAA ya.ri OPT
   61 5.297544460 192.168.212.2 → 192.168.212.10 DNS 65 Standard query response 0x668c No such name A ya.ri
   62 5.298473044 192.168.212.2 → 192.168.212.10 DNS 65 Standard query response 0xf486 No such name AAAA ya.ri
   63 6.004636069 192.168.212.10 → 108.177.14.94 TLSv1.2 93 Application Data
   64 6.005369945 108.177.14.94 → 192.168.212.10 TCP 60 443 → 53800 [ACK] Seq=1 Ack=40 Win=64240 Len=0
   65 6.039826948 108.177.14.94 → 192.168.212.10 TLSv1.2 93 Application Data
   66 6.039863554 192.168.212.10 → 108.177.14.94 TCP 54 53800 → 443 [ACK] Seq=40 Ack=40 Win=63744 Len=0
   67 7.492028179 192.168.212.10 → 192.168.212.2 DNS 76 Standard query 0x5db6 A ya.ru OPT
   68 7.492147995 192.168.212.10 → 192.168.212.2 DNS 76 Standard query 0xc6bf AAAA ya.ru OPT
   69 7.517604678 192.168.212.2 → 192.168.212.10 DNS 107 Standard query response 0xc6bf AAAA ya.ru AAAA 2a02:6b8::2:242 OPT
   70 7.518621308 192.168.212.2 → 192.168.212.10 DNS 108 Standard query response 0x5db6 A ya.ru A 5.255.255.242 A 77.88.55.242 OPT
   71 7.520364714 192.168.212.10 → 5.255.255.242 ICMP 98 Echo (ping) request  id=0x000d, seq=1/256, ttl=66
   72 7.561786399 5.255.255.242 → 192.168.212.10 ICMP 98 Echo (ping) reply    id=0x000d, seq=1/256, ttl=128 (request in 71)
   73 7.562144970 192.168.212.10 → 192.168.212.2 DNS 97 Standard query 0x96ae PTR 242.255.255.5.in-addr.arpa OPT
   74 7.588807978 192.168.212.2 → 192.168.212.10 DNS 116 Standard query response 0x96ae PTR 242.255.255.5.in-addr.arpa PTR ya.ru OPT
   75 8.303567789 192.168.212.10 → 192.229.221.95 TCP 54 57998 → 80 [ACK] Seq=1 Ack=1 Win=63477 Len=0
   76 8.304079058 192.229.221.95 → 192.168.212.10 TCP 60 [TCP ACKed unseen segment] 80 → 57998 [ACK] Seq=1 Ack=2 Win=64240 Len=0
   77 8.522433800 192.168.212.10 → 5.255.255.242 ICMP 98 Echo (ping) request  id=0x000d, seq=2/512, ttl=66
   78 8.559417669 192.168.212.10 → 192.229.221.95 TCP 54 46004 → 80 [ACK] Seq=1 Ack=1 Win=63726 Len=0
   79 8.560013179 192.229.221.95 → 192.168.212.10 TCP 60 [TCP ACKed unseen segment] 80 → 46004 [ACK] Seq=1 Ack=2 Win=64240 Len=0
   80 8.567850743 5.255.255.242 → 192.168.212.10 ICMP 98 Echo (ping) reply    id=0x000d, seq=2/512, ttl=128 (request in 77)
   81 12.274420190 192.168.212.10 → 192.168.212.2 DNS 77 Standard query 0x0a07 A vk.com OPT
   82 12.274566408 192.168.212.10 → 192.168.212.2 DNS 77 Standard query 0x7b1e AAAA vk.com OPT
   83 12.296620107 192.168.212.2 → 192.168.212.10 DNS 133 Standard query response 0x7b1e AAAA vk.com SOA ns1.vkontakte.ru OPT
   84 12.299668848 192.168.212.2 → 192.168.212.10 DNS 173 Standard query response 0x0a07 A vk.com A 93.186.225.194 A 87.240.132.67 A 87.240.132.72 A 87.240.137.164 A 87.240.129.133 A 87.240.132.78 OPT
   85 12.300484445 192.168.212.10 → 93.186.225.194 ICMP 98 Echo (ping) request  id=0x000e, seq=1/256, ttl=66
   86 12.340069697 93.186.225.194 → 192.168.212.10 ICMP 98 Echo (ping) reply    id=0x000e, seq=1/256, ttl=128 (request in 85)
   87 12.340453300 192.168.212.10 → 192.168.212.2 DNS 98 Standard query 0xf2b3 PTR 194.225.186.93.in-addr.arpa OPT
   88 12.377815502 192.168.212.2 → 192.168.212.10 DNS 160 Standard query response 0xf2b3 No such name PTR 194.225.186.93.in-addr.arpa SOA ns1.vkontakte.ru OPT
   89 13.302469054 192.168.212.10 → 93.186.225.194 ICMP 98 Echo (ping) request  id=0x000e, seq=2/512, ttl=66
   90 13.329653587 93.186.225.194 → 192.168.212.10 ICMP 98 Echo (ping) reply    id=0x000e, seq=2/512, ttl=128 (request in 89)
   91 17.007034276 192.168.212.10 → 173.194.222.102 TLSv1.2 93 Application Data
   92 17.007682851 173.194.222.102 → 192.168.212.10 TCP 60 443 → 45388 [ACK] Seq=1 Ack=40 Win=64240 Len=0
   93 17.039794079 173.194.222.102 → 192.168.212.10 TLSv1.2 93 Application Data
   94 17.039836056 192.168.212.10 → 173.194.222.102 TCP 54 45388 → 443 [ACK] Seq=40 Ack=40 Win=63744 Len=0
   95 18.008765023 192.168.212.10 → 108.177.14.155 TLSv1.2 93 Application Data
   96 18.009022451 192.168.212.10 → 64.233.164.157 TLSv1.2 93 Application Data
   97 18.009233393 192.168.212.10 → 74.125.205.154 TLSv1.2 93 Application Data
   98 18.009592101 108.177.14.155 → 192.168.212.10 TCP 60 443 → 60792 [ACK] Seq=1 Ack=40 Win=64240 Len=0
   99 18.009615994 64.233.164.157 → 192.168.212.10 TCP 60 443 → 35522 [ACK] Seq=1 Ack=40 Win=64240 Len=0
  100 18.009619476 74.125.205.154 → 192.168.212.10 TCP 60 443 → 38260 [ACK] Seq=1 Ack=40 Win=64240 Len=0
  101 18.046810548 108.177.14.155 → 192.168.212.10 TLSv1.2 93 Application Data
  102 18.046847230 192.168.212.10 → 108.177.14.155 TCP 54 60792 → 443 [ACK] Seq=40 Ack=40 Win=63744 Len=0
  103 18.057310061 74.125.205.154 → 192.168.212.10 TLSv1.2 93 Application Data
  104 18.057347285 192.168.212.10 → 74.125.205.154 TCP 54 38260 → 443 [ACK] Seq=40 Ack=40 Win=62780 Len=0
  105 18.057509585 64.233.164.157 → 192.168.212.10 TLSv1.2 93 Application Data
  106 18.057520688 192.168.212.10 → 64.233.164.157 TCP 54 35522 → 443 [ACK] Seq=40 Ack=40 Win=63744 Len=0
  107 18.543644475 192.168.212.10 → 192.229.221.95 TCP 54 [TCP Dup ACK 75#1] 57998 → 80 [ACK] Seq=1 Ack=1 Win=63477 Len=0
  108 18.544288533 192.229.221.95 → 192.168.212.10 TCP 60 [TCP Dup ACK 76#1] [TCP ACKed unseen segment] 80 → 57998 [ACK] Seq=1 Ack=2 Win=64240 Len=0
  109 18.799693766 192.168.212.10 → 192.229.221.95 TCP 54 [TCP Dup ACK 78#1] 46004 → 80 [ACK] Seq=1 Ack=1 Win=63726 Len=0
  110 18.800089548 192.229.221.95 → 192.168.212.10 TCP 60 [TCP Dup ACK 79#1] [TCP ACKed unseen segment] 80 → 46004 [ACK] Seq=1 Ack=2 Win=64240 Len=0
  111 19.010196995 192.168.212.10 → 173.194.73.94 TLSv1.2 93 Application Data
  112 19.010625189 173.194.73.94 → 192.168.212.10 TCP 60 443 → 54954 [ACK] Seq=1 Ack=40 Win=64240 Len=0
  113 19.048469690 173.194.73.94 → 192.168.212.10 TLSv1.2 93 Application Data
  114 19.048507694 192.168.212.10 → 173.194.73.94 TCP 54 54954 → 443 [ACK] Seq=40 Ack=40 Win=65535 Len=0
  115 20.813173395 192.168.212.10 → 192.229.221.95 TCP 54 [TCP Previous segment not captured] 46004 → 80 [FIN, ACK] Seq=2 Ack=1 Win=63726 Len=0
  116 20.813512488 192.168.212.10 → 192.229.221.95 TCP 54 [TCP Previous segment not captured] 57998 → 80 [FIN, ACK] Seq=2 Ack=1 Win=63477 Len=0
  117 20.813747773 192.229.221.95 → 192.168.212.10 TCP 60 [TCP ACKed unseen segment] 80 → 46004 [ACK] Seq=1 Ack=3 Win=64239 Len=0
  118 20.813782435 192.229.221.95 → 192.168.212.10 TCP 60 [TCP ACKed unseen segment] 80 → 57998 [ACK] Seq=1 Ack=3 Win=64239 Len=0
  119 20.909446801 192.229.221.95 → 192.168.212.10 TCP 60 80 → 57998 [FIN, PSH, ACK] Seq=1 Ack=3 Win=64239 Len=0
  120 20.909541529 192.168.212.10 → 192.229.221.95 TCP 54 57998 → 80 [ACK] Seq=3 Ack=2 Win=63477 Len=0
  121 20.910498645 192.229.221.95 → 192.168.212.10 TCP 60 80 → 46004 [FIN, PSH, ACK] Seq=1 Ack=3 Win=64239 Len=0
  122 20.910525892 192.168.212.10 → 192.229.221.95 TCP 54 46004 → 80 [ACK] Seq=3 Ack=2 Win=63726 Len=0
  123 21.012026132 192.168.212.10 → 142.250.150.104 TLSv1.2 93 Application Data
  124 21.012676842 142.250.150.104 → 192.168.212.10 TCP 60 443 → 52272 [ACK] Seq=1 Ack=40 Win=64240 Len=0
  125 21.047238970 142.250.150.104 → 192.168.212.10 TLSv1.2 93 Application Data
  126 21.047278034 192.168.212.10 → 142.250.150.104 TCP 54 52272 → 443 [ACK] Seq=40 Ack=40 Win=65535 Len=0
  127 21.201013895 192.168.212.10 → 192.168.212.2 DNS 97 Standard query 0x13be A mozilla.cloudflare-dns.com OPT
  128 21.201159693 192.168.212.10 → 104.16.249.249 TLSv1.2 110 Application Data
  129 21.201211781 192.168.212.10 → 104.16.249.249 TLSv1.2 213 Application Data
  130 21.201267373 192.168.212.10 → 192.168.212.2 DNS 97 Standard query 0xa8b5 AAAA mozilla.cloudflare-dns.com OPT
  131 21.201777866 104.16.249.249 → 192.168.212.10 TCP 60 443 → 33424 [ACK] Seq=40 Ack=96 Win=64240 Len=0
  132 21.201809259 192.168.212.10 → 104.16.249.249 TLSv1.2 269 Application Data, Application Data
  133 21.201917225 104.16.249.249 → 192.168.212.10 TCP 60 443 → 33424 [ACK] Seq=40 Ack=255 Win=64240 Len=0
  134 21.202178770 104.16.249.249 → 192.168.212.10 TCP 60 443 → 33424 [ACK] Seq=40 Ack=470 Win=64240 Len=0
  135 21.211434928 192.168.212.2 → 192.168.212.10 DNS 142 Standard query response 0xa8b5 AAAA mozilla.cloudflare-dns.com AAAA 2606:4700::6810:f9f9 AAAA 2606:4700::6810:f8f9
  136 21.239566095 104.16.249.249 → 192.168.212.10 TLSv1.2 89 Application Data
  137 21.239598683 192.168.212.10 → 104.16.249.249 TCP 54 33424 → 443 [ACK] Seq=470 Ack=75 Win=65535 Len=0
  138 21.246786266 192.168.212.2 → 192.168.212.10 DNS 129 Standard query response 0x13be A mozilla.cloudflare-dns.com A 104.16.248.249 A 104.16.249.249 OPT
  139 21.274230120 104.16.249.249 → 192.168.212.10 TLSv1.2 89 Application Data
  140 21.274254893 192.168.212.10 → 104.16.249.249 TCP 54 33424 → 443 [ACK] Seq=470 Ack=110 Win=65535 Len=0
  141 21.274320708 104.16.249.249 → 192.168.212.10 TLSv1.2 609 Application Data
  142 21.274324449 192.168.212.10 → 104.16.249.249 TCP 54 33424 → 443 [ACK] Seq=470 Ack=665 Win=65535 Len=0
  143 21.287206089 104.16.249.249 → 192.168.212.10 TLSv1.2 586 Application Data
  144 21.287235926 192.168.212.10 → 104.16.249.249 TCP 54 33424 → 443 [ACK] Seq=470 Ack=1197 Win=65535 Len=0
  145 21.291748818 192.168.212.10 → 104.16.249.249 TLSv1.2 110 Application Data
  146 21.291861010 192.168.212.10 → 104.16.249.249 TLSv1.2 213 Application Data
  147 21.292183616 104.16.249.249 → 192.168.212.10 TCP 60 443 → 33424 [ACK] Seq=1197 Ack=526 Win=64240 Len=0
  148 21.292203229 192.168.212.10 → 104.16.249.249 TLSv1.2 269 Application Data, Application Data
  149 21.292269050 104.16.249.249 → 192.168.212.10 TCP 60 443 → 33424 [ACK] Seq=1197 Ack=685 Win=64240 Len=0
  150 21.292453290 104.16.249.249 → 192.168.212.10 TCP 60 443 → 33424 [ACK] Seq=1197 Ack=900 Win=64240 Len=0
  151 21.292462724 192.168.212.10 → 104.16.249.249 TLSv1.2 269 Application Data, Application Data
  152 21.292668446 104.16.249.249 → 192.168.212.10 TCP 60 443 → 33424 [ACK] Seq=1197 Ack=1115 Win=64240 Len=0
  153 21.326099143 104.16.249.249 → 192.168.212.10 TLSv1.2 89 Application Data
  154 21.326132449 192.168.212.10 → 104.16.249.249 TCP 54 33424 → 443 [ACK] Seq=1115 Ack=1232 Win=65535 Len=0
  155 21.366642947 104.16.249.249 → 192.168.212.10 TLSv1.2 634 Application Data, Application Data
  156 21.366683844 192.168.212.10 → 104.16.249.249 TCP 54 33424 → 443 [ACK] Seq=1115 Ack=1812 Win=65535 Len=0
  157 21.392906068 104.16.249.249 → 192.168.212.10 TLSv1.2 1118 Application Data, Application Data
  158 21.392944380 192.168.212.10 → 104.16.249.249 TCP 54 33424 → 443 [ACK] Seq=1115 Ack=2876 Win=65535 Len=0
  159 21.394816044 192.168.212.10 → 198.252.206.25 TCP 74 56894 → 443 [SYN] Seq=0 Win=64240 Len=0 MSS=1460 SACK_PERM=1 TSval=1516222301 TSecr=0 WS=128
  160 21.631806471 198.252.206.25 → 192.168.212.10 TCP 60 443 → 56894 [SYN, ACK] Seq=0 Ack=1 Win=64240 Len=0 MSS=1460
  161 21.631912286 192.168.212.10 → 198.252.206.25 TCP 54 56894 → 443 [ACK] Seq=1 Ack=1 Win=64240 Len=0
  162 21.634900228 192.168.212.10 → 198.252.206.25 TLSv1 571 Client Hello
  163 21.635255445 198.252.206.25 → 192.168.212.10 TCP 60 443 → 56894 [ACK] Seq=1 Ack=518 Win=64240 Len=0
  164 21.836839079 198.252.206.25 → 192.168.212.10 TLSv1.2 1514 Server Hello
  165 21.836875774 192.168.212.10 → 198.252.206.25 TCP 54 56894 → 443 [ACK] Seq=518 Ack=1461 Win=62780 Len=0
  166 21.837009126 198.252.206.25 → 192.168.212.10 TCP 1514 443 → 56894 [ACK] Seq=1461 Ack=518 Win=64240 Len=1460 [TCP segment of a reassembled PDU]
  167 21.837021231 192.168.212.10 → 198.252.206.25 TCP 54 56894 → 443 [ACK] Seq=518 Ack=2921 Win=62780 Len=0
  168 21.837085071 198.252.206.25 → 192.168.212.10 TCP 1298 443 → 56894 [PSH, ACK] Seq=2921 Ack=518 Win=64240 Len=1244 [TCP segment of a reassembled PDU]
  169 21.837092800 192.168.212.10 → 198.252.206.25 TCP 54 56894 → 443 [ACK] Seq=518 Ack=4165 Win=61536 Len=0
  170 21.837146987 198.252.206.25 → 192.168.212.10 TLSv1.2 941 Certificate, Certificate Status, Server Key Exchange, Server Hello Done
  171 21.837155118 192.168.212.10 → 198.252.206.25 TCP 54 56894 → 443 [ACK] Seq=518 Ack=5052 Win=61320 Len=0
  172 21.845580760 192.168.212.10 → 198.252.206.25 TLSv1.2 180 Client Key Exchange, Change Cipher Spec, Encrypted Handshake Message
  173 21.846067299 198.252.206.25 → 192.168.212.10 TCP 60 443 → 56894 [ACK] Seq=5052 Ack=644 Win=64240 Len=0
  174 22.040794504 198.252.206.25 → 192.168.212.10 TLSv1.2 105 Change Cipher Spec, Encrypted Handshake Message
  175 22.040810257 192.168.212.10 → 198.252.206.25 TCP 54 56894 → 443 [ACK] Seq=644 Ack=5103 Win=62780 Len=0
  176 22.041085069 192.168.212.10 → 198.252.206.25 TLSv1.2 645 Application Data
  177 22.041402865 198.252.206.25 → 192.168.212.10 TCP 60 443 → 56894 [ACK] Seq=5103 Ack=1235 Win=64240 Len=0
  178 22.246165750 198.252.206.25 → 192.168.212.10 TLSv1.2 249 Application Data
  179 22.246205619 192.168.212.10 → 198.252.206.25 TCP 54 56894 → 443 [ACK] Seq=1235 Ack=5298 Win=62780 Len=0
  180 22.252405088 192.168.212.10 → 198.252.206.25 TLSv1.2 140 Application Data
  181 22.252768677 198.252.206.25 → 192.168.212.10 TCP 60 443 → 56894 [ACK] Seq=5298 Ack=1321 Win=64240 Len=0
  182 22.252810579 192.168.212.10 → 198.252.206.25 TLSv1.2 108 Application Data
  183 22.253243934 198.252.206.25 → 192.168.212.10 TCP 60 443 → 56894 [ACK] Seq=5298 Ack=1375 Win=64240 Len=0
  184 23.013499702 192.168.212.10 → 104.17.210.204 TLSv1.2 93 Application Data
  185 23.013699236 192.168.212.10 → 188.114.98.229 TLSv1.2 93 Application Data
  186 23.014043481 192.168.212.10 → 104.17.115.176 TLSv1.2 93 Application Data
  187 23.014289970 104.17.210.204 → 192.168.212.10 TCP 60 443 → 35600 [ACK] Seq=1 Ack=40 Win=64240 Len=0
  188 23.014322685 188.114.98.229 → 192.168.212.10 TCP 60 443 → 55684 [ACK] Seq=1 Ack=40 Win=64240 Len=0
  189 23.014329196 104.17.115.176 → 192.168.212.10 TCP 60 443 → 35874 [ACK] Seq=1 Ack=40 Win=64240 Len=0
  190 23.068601245 104.17.210.204 → 192.168.212.10 TLSv1.2 93 Application Data
  191 23.068640441 192.168.212.10 → 104.17.210.204 TCP 54 35600 → 443 [ACK] Seq=40 Ack=40 Win=63848 Len=0
  192 23.080040535 188.114.98.229 → 192.168.212.10 TLSv1.2 93 Application Data
  193 23.080077418 192.168.212.10 → 188.114.98.229 TCP 54 55684 → 443 [ACK] Seq=40 Ack=40 Win=62780 Len=0
  194 23.080223828 104.17.115.176 → 192.168.212.10 TLSv1.2 93 Application Data
  195 23.080233329 192.168.212.10 → 104.17.115.176 TCP 54 35874 → 443 [ACK] Seq=40 Ack=40 Win=63848 Len=0
  196 24.014853315 192.168.212.10 → 104.19.154.83 TLSv1.2 93 Application Data
  197 24.015194899 192.168.212.10 → 104.17.202.204 TLSv1.2 93 Application Data
  198 24.015410147 104.19.154.83 → 192.168.212.10 TCP 60 443 → 49994 [ACK] Seq=1 Ack=40 Win=64240 Len=0
  199 24.015428774 104.17.202.204 → 192.168.212.10 TCP 60 443 → 44954 [ACK] Seq=1 Ack=40 Win=64240 Len=0
  200 24.015607430 192.168.212.10 → 104.17.68.176 TLSv1.2 93 Application Data
  201 24.015924838 104.17.68.176 → 192.168.212.10 TCP 60 443 → 42070 [ACK] Seq=1 Ack=40 Win=64240 Len=0
  202 24.056788064 104.19.154.83 → 192.168.212.10 TLSv1.2 93 Application Data
  203 24.056824318 192.168.212.10 → 104.19.154.83 TCP 54 49994 → 443 [ACK] Seq=40 Ack=40 Win=62780 Len=0
  204 24.068130833 104.17.68.176 → 192.168.212.10 TLSv1.2 93 Application Data
  205 24.068166859 192.168.212.10 → 104.17.68.176 TCP 54 42070 → 443 [ACK] Seq=40 Ack=40 Win=62780 Len=0
  206 24.068272304 104.17.202.204 → 192.168.212.10 TLSv1.2 93 Application Data
  207 24.068278725 192.168.212.10 → 104.17.202.204 TCP 54 44954 → 443 [ACK] Seq=40 Ack=40 Win=63848 Len=0
  208 25.016900939 192.168.212.10 → 74.125.205.157 TLSv1.2 93 Application Data
  209 25.017438626 74.125.205.157 → 192.168.212.10 TCP 60 443 → 49466 [ACK] Seq=1 Ack=40 Win=64240 Len=0
  210 25.017555790 192.168.212.10 → 108.177.14.97 TLSv1.2 93 Application Data
  211 25.017849469 192.168.212.10 → 173.194.222.154 TLSv1.2 93 Application Data
  212 25.018171870 108.177.14.97 → 192.168.212.10 TCP 60 443 → 50784 [ACK] Seq=1 Ack=40 Win=64240 Len=0
  213 25.018180883 173.194.222.154 → 192.168.212.10 TCP 60 443 → 55396 [ACK] Seq=1 Ack=40 Win=64240 Len=0
  214 25.050581698 74.125.205.157 → 192.168.212.10 TLSv1.2 93 Application Data
  215 25.050621313 192.168.212.10 → 74.125.205.157 TCP 54 49466 → 443 [ACK] Seq=40 Ack=40 Win=62780 Len=0
  216 25.069812804 108.177.14.97 → 192.168.212.10 TLSv1.2 93 Application Data
  217 25.069854360 192.168.212.10 → 108.177.14.97 TCP 54 50784 → 443 [ACK] Seq=40 Ack=40 Win=65535 Len=0
  218 25.081496788 173.194.222.154 → 192.168.212.10 TLSv1.2 93 Application Data
  219 25.081533646 192.168.212.10 → 173.194.222.154 TCP 54 55396 → 443 [ACK] Seq=40 Ack=40 Win=62780 Len=0
  220 26.019172947 192.168.212.10 → 108.156.22.92 TLSv1.2 93 Application Data
  221 26.019722135 108.156.22.92 → 192.168.212.10 TCP 60 443 → 55356 [ACK] Seq=1 Ack=40 Win=64240 Len=0
  222 26.019932403 192.168.212.10 → 64.233.161.94 TLSv1.2 93 Application Data
  223 26.020313351 64.233.161.94 → 192.168.212.10 TCP 60 443 → 57694 [ACK] Seq=1 Ack=40 Win=64240 Len=0
  224 26.020483627 192.168.212.10 → 142.250.150.103 TLSv1.2 93 Application Data
  225 26.020841680 142.250.150.103 → 192.168.212.10 TCP 60 443 → 47918 [ACK] Seq=1 Ack=40 Win=64240 Len=0
  226 26.040593655 64.233.161.94 → 192.168.212.10 TLSv1.2 93 Application Data
  227 26.040633931 192.168.212.10 → 64.233.161.94 TCP 54 57694 → 443 [ACK] Seq=40 Ack=40 Win=62780 Len=0
  228 26.065524808 142.250.150.103 → 192.168.212.10 TLSv1.2 93 Application Data
  229 26.065564330 192.168.212.10 → 142.250.150.103 TCP 54 47918 → 443 [ACK] Seq=40 Ack=40 Win=62780 Len=0
  230 26.081295815 108.156.22.92 → 192.168.212.10 TLSv1.2 93 Application Data
  231 26.081332391 192.168.212.10 → 108.156.22.92 TCP 54 55356 → 443 [ACK] Seq=40 Ack=40 Win=63848 Len=0
  232 26.223702253 192.168.212.10 → 152.199.19.160 TCP 54 43290 → 443 [ACK] Seq=1 Ack=1 Win=62780 Len=0
  233 26.223983846 152.199.19.160 → 192.168.212.10 TCP 60 [TCP ACKed unseen segment] 443 → 43290 [ACK] Seq=1 Ack=2 Win=64240 Len=0
  234 26.304844276 192.168.212.10 → 192.168.212.2 DNS 84 Standard query 0xffd1 A abbeyroad.com OPT
  235 26.305195576 192.168.212.10 → 192.168.212.2 DNS 84 Standard query 0xe7c8 AAAA abbeyroad.com OPT
  236 26.649925345 192.168.212.2 → 192.168.212.10 DNS 116 Standard query response 0xffd1 A abbeyroad.com A 149.126.77.141 A 149.126.72.141 OPT
  237 27.571644808 192.168.212.2 → 192.168.212.10 DNS 142 Standard query response 0xe7c8 AAAA abbeyroad.com SOA ns1.umusic.com OPT
  238 27.572484385 192.168.212.10 → 149.126.77.141 ICMP 98 Echo (ping) request  id=0x000f, seq=1/256, ttl=66
  239 27.672844879 149.126.77.141 → 192.168.212.10 ICMP 98 Echo (ping) reply    id=0x000f, seq=1/256, ttl=128 (request in 238)
  240 27.673009824 192.168.212.10 → 192.168.212.2 DNS 98 Standard query 0xece7 PTR 141.77.126.149.in-addr.arpa OPT
  241 27.815198861 192.168.212.10 → 64.233.165.94 TLSv1.2 93 Application Data
  242 27.815942627 64.233.165.94 → 192.168.212.10 TCP 60 443 → 36678 [ACK] Seq=1 Ack=40 Win=64240 Len=0
  243 27.816464468 192.168.212.10 → 64.233.165.94 TLSv1.2 78 Application Data
  244 27.816821070 64.233.165.94 → 192.168.212.10 TCP 60 443 → 36678 [ACK] Seq=1 Ack=64 Win=64240 Len=0
  245 27.816944985 192.168.212.10 → 64.233.165.94 TCP 54 36678 → 443 [FIN, ACK] Seq=64 Ack=1 Win=63910 Len=0
  246 27.817386521 64.233.165.94 → 192.168.212.10 TCP 60 443 → 36678 [ACK] Seq=1 Ack=65 Win=64239 Len=0
  247 27.870486408 64.233.165.94 → 192.168.212.10 TCP 60 443 → 36678 [FIN, PSH, ACK] Seq=1 Ack=65 Win=64239 Len=0
  248 27.870531596 192.168.212.10 → 64.233.165.94 TCP 54 36678 → 443 [ACK] Seq=65 Ack=2 Win=63910 Len=0
  249 27.971477773 192.168.212.2 → 192.168.212.10 DNS 142 Standard query response 0xece7 PTR 141.77.126.149.in-addr.arpa PTR 149.126.77.141.ip.incapdns.net OPT
  250 28.572818706 192.168.212.10 → 149.126.77.141 ICMP 98 Echo (ping) request  id=0x000f, seq=2/512, ttl=66
  251 28.641991770 149.126.77.141 → 192.168.212.10 ICMP 98 Echo (ping) reply    id=0x000f, seq=2/512, ttl=128 (request in 250)
  252 34.384119845 192.168.212.10 → 104.16.249.249 TLSv1.2 110 Application Data
  253 34.384199079 192.168.212.10 → 104.16.249.249 TLSv1.2 213 Application Data
  254 34.384327556 104.16.249.249 → 192.168.212.10 TCP 60 443 → 33424 [ACK] Seq=2876 Ack=1171 Win=64240 Len=0
  255 34.384339646 104.16.249.249 → 192.168.212.10 TCP 60 443 → 33424 [ACK] Seq=2876 Ack=1330 Win=64240 Len=0
  256 34.384347801 192.168.212.10 → 104.16.249.249 TLSv1.2 110 Application Data
  257 34.384402958 192.168.212.10 → 104.16.249.249 TLSv1.2 213 Application Data
  258 34.384440675 104.16.249.249 → 192.168.212.10 TCP 60 443 → 33424 [ACK] Seq=2876 Ack=1386 Win=64240 Len=0
  259 34.384537320 104.16.249.249 → 192.168.212.10 TCP 60 443 → 33424 [ACK] Seq=2876 Ack=1545 Win=64240 Len=0
  260 34.384741122 192.168.212.10 → 104.16.249.249 TLSv1.2 110 Application Data
  261 34.384779720 192.168.212.10 → 104.16.249.249 TLSv1.2 213 Application Data
  262 34.384821385 104.16.249.249 → 192.168.212.10 TCP 60 443 → 33424 [ACK] Seq=2876 Ack=1601 Win=64240 Len=0
  263 34.384916204 104.16.249.249 → 192.168.212.10 TCP 60 443 → 33424 [ACK] Seq=2876 Ack=1760 Win=64240 Len=0
  264 34.432230573 104.16.249.249 → 192.168.212.10 TLSv1.2 89 Application Data
  265 34.432264213 192.168.212.10 → 104.16.249.249 TCP 54 33424 → 443 [ACK] Seq=1760 Ack=2911 Win=65535 Len=0
  266 34.475972939 104.16.249.249 → 192.168.212.10 TLSv1.2 102 Application Data
  267 34.476009291 192.168.212.10 → 104.16.249.249 TCP 54 33424 → 443 [ACK] Seq=1760 Ack=2959 Win=65535 Len=0
  268 34.487796986 104.16.249.249 → 192.168.212.10 TLSv1.2 609 Application Data
  269 34.487839279 192.168.212.10 → 104.16.249.249 TCP 54 33424 → 443 [ACK] Seq=1760 Ack=3514 Win=65535 Len=0
  270 34.576121435 104.16.249.249 → 192.168.212.10 TLSv1.2 586 Application Data
  271 34.576161366 192.168.212.10 → 104.16.249.249 TCP 54 33424 → 443 [ACK] Seq=1760 Ack=4046 Win=65535 Len=0
  272 34.587990634 104.16.249.249 → 192.168.212.10 TLSv1.2 586 Application Data
  273 34.588029066 192.168.212.10 → 104.16.249.249 TCP 54 33424 → 443 [ACK] Seq=1760 Ack=4578 Win=65535 Len=0
  274 34.589310047 192.168.212.10 → 74.208.255.134 TCP 74 33172 → 443 [SYN] Seq=0 Win=64240 Len=0 MSS=1460 SACK_PERM=1 TSval=572580742 TSecr=0 WS=128
  275 34.841436842 192.168.212.10 → 104.16.249.249 TLSv1.2 110 Application Data
  276 34.841616588 192.168.212.10 → 104.16.249.249 TLSv1.2 213 Application Data
  277 34.841870110 104.16.249.249 → 192.168.212.10 TCP 60 443 → 33424 [ACK] Seq=4578 Ack=1816 Win=64240 Len=0
  278 34.841901169 104.16.249.249 → 192.168.212.10 TCP 60 443 → 33424 [ACK] Seq=4578 Ack=1975 Win=64240 Len=0
  279 34.842130830 74.208.255.134 → 192.168.212.10 TCP 60 443 → 33172 [SYN, ACK] Seq=0 Ack=1 Win=64240 Len=0 MSS=1460
  280 34.842173000 192.168.212.10 → 74.208.255.134 TCP 54 33172 → 443 [ACK] Seq=1 Ack=1 Win=64240 Len=0
  281 34.847359968 192.168.212.10 → 74.208.255.134 TLSv1 571 Client Hello
  282 34.847845777 74.208.255.134 → 192.168.212.10 TCP 60 443 → 33172 [ACK] Seq=1 Ack=518 Win=64240 Len=0
  283 34.878962164 104.16.249.249 → 192.168.212.10 TLSv1.2 89 Application Data
  284 34.878997201 192.168.212.10 → 104.16.249.249 TCP 54 33424 → 443 [ACK] Seq=1975 Ack=4613 Win=65535 Len=0
  285 34.928705034 104.16.249.249 → 192.168.212.10 TLSv1.2 609 Application Data
  286 34.928740483 192.168.212.10 → 104.16.249.249 TCP 54 33424 → 443 [ACK] Seq=1975 Ack=5168 Win=65535 Len=0
  287 35.012284903 74.208.255.134 → 192.168.212.10 TLSv1.2 1442 Server Hello
  288 35.012326402 192.168.212.10 → 74.208.255.134 TCP 54 33172 → 443 [ACK] Seq=518 Ack=1389 Win=63848 Len=0
  289 35.012441678 74.208.255.134 → 192.168.212.10 TCP 1442 443 → 33172 [PSH, ACK] Seq=1389 Ack=518 Win=64240 Len=1388 [TCP segment of a reassembled PDU]
  290 35.012452634 192.168.212.10 → 74.208.255.134 TCP 54 33172 → 443 [ACK] Seq=518 Ack=2777 Win=62460 Len=0
  291 35.024015491 74.208.255.134 → 192.168.212.10 TCP 1514 443 → 33172 [ACK] Seq=2777 Ack=518 Win=64240 Len=1460 [TCP segment of a reassembled PDU]
  292 35.024055469 192.168.212.10 → 74.208.255.134 TCP 54 33172 → 443 [ACK] Seq=518 Ack=4237 Win=62780 Len=0
  293 35.024166860 74.208.255.134 → 192.168.212.10 TLSv1.2 492 Certificate, Server Key Exchange, Server Hello Done
  294 35.024175429 192.168.212.10 → 74.208.255.134 TCP 54 33172 → 443 [ACK] Seq=518 Ack=4675 Win=62780 Len=0
  295 35.027627934 192.168.212.10 → 74.208.255.134 TLSv1.2 147 Client Key Exchange, Change Cipher Spec, Encrypted Handshake Message
  296 35.028260253 74.208.255.134 → 192.168.212.10 TCP 60 443 → 33172 [ACK] Seq=4675 Ack=611 Win=64240 Len=0
  297 35.252168186 74.208.255.134 → 192.168.212.10 TLSv1.2 328 New Session Ticket, Change Cipher Spec, Encrypted Handshake Message
  298 35.252198161 192.168.212.10 → 74.208.255.134 TCP 54 33172 → 443 [ACK] Seq=611 Ack=4949 Win=62780 Len=0
  299 35.252246166 74.208.255.134 → 192.168.212.10 TLSv1.2 123 Application Data
  300 35.252249035 192.168.212.10 → 74.208.255.134 TCP 54 33172 → 443 [ACK] Seq=611 Ack=5018 Win=62780 Len=0
  301 35.253425880 192.168.212.10 → 74.208.255.134 TLSv1.2 231 Application Data
  302 35.253574880 192.168.212.10 → 74.208.255.134 TLSv1.2 456 Application Data
  303 35.253645487 74.208.255.134 → 192.168.212.10 TCP 60 443 → 33172 [ACK] Seq=5018 Ack=788 Win=64240 Len=0
  304 35.253721679 74.208.255.134 → 192.168.212.10 TCP 60 443 → 33172 [ACK] Seq=5018 Ack=1190 Win=64240 Len=0
  305 35.254924937 192.168.212.10 → 74.208.255.134 TLSv1.2 92 Application Data
  306 35.255068183 74.208.255.134 → 192.168.212.10 TCP 60 443 → 33172 [ACK] Seq=5018 Ack=1228 Win=64240 Len=0
  307 35.456699346 74.208.255.134 → 192.168.212.10 TLSv1.2 92 Application Data
  308 35.456720389 192.168.212.10 → 74.208.255.134 TCP 54 33172 → 443 [ACK] Seq=1228 Ack=5056 Win=62780 Len=0
  309 36.173858282 74.208.255.134 → 192.168.212.10 TCP 1514 [TCP segment of a reassembled PDU]
  310 36.173883380 192.168.212.10 → 74.208.255.134 TCP 54 33172 → 443 [ACK] Seq=1228 Ack=6516 Win=62780 Len=0
  311 36.173920669 74.208.255.134 → 192.168.212.10 TCP 1514 443 → 33172 [ACK] Seq=6516 Ack=1228 Win=64240 Len=1460 [TCP segment of a reassembled PDU]
  312 36.173924093 192.168.212.10 → 74.208.255.134 TCP 54 33172 → 443 [ACK] Seq=1228 Ack=7976 Win=62780 Len=0
  313 36.173938380 74.208.255.134 → 192.168.212.10 TCP 1298 443 → 33172 [PSH, ACK] Seq=7976 Ack=1228 Win=64240 Len=1244 [TCP segment of a reassembled PDU]
  314 36.173940400 192.168.212.10 → 74.208.255.134 TCP 54 33172 → 443 [ACK] Seq=1228 Ack=9220 Win=61536 Len=0
  315 36.174131795 74.208.255.134 → 192.168.212.10 TCP 1514 443 → 33172 [ACK] Seq=9220 Ack=1228 Win=64240 Len=1460 [TCP segment of a reassembled PDU]
  316 36.174135702 192.168.212.10 → 74.208.255.134 TCP 54 33172 → 443 [ACK] Seq=1228 Ack=10680 Win=61320 Len=0
  317 36.174161438 74.208.255.134 → 192.168.212.10 TCP 1370 443 → 33172 [PSH, ACK] Seq=10680 Ack=1228 Win=64240 Len=1316 [TCP segment of a reassembled PDU]
  318 36.174163010 192.168.212.10 → 74.208.255.134 TCP 54 33172 → 443 [ACK] Seq=1228 Ack=11996 Win=60004 Len=0
  319 36.174377024 74.208.255.134 → 192.168.212.10 TCP 1442 443 → 33172 [PSH, ACK] Seq=11996 Ack=1228 Win=64240 Len=1388 [TCP segment of a reassembled PDU]
  320 36.174380164 192.168.212.10 → 74.208.255.134 TCP 54 33172 → 443 [ACK] Seq=1228 Ack=13384 Win=58616 Len=0
  321 36.174658669 74.208.255.134 → 192.168.212.10 TCP 1442 443 → 33172 [PSH, ACK] Seq=13384 Ack=1228 Win=64240 Len=1388 [TCP segment of a reassembled PDU]
  322 36.174662326 192.168.212.10 → 74.208.255.134 TCP 54 33172 → 443 [ACK] Seq=1228 Ack=14772 Win=63848 Len=0
  323 36.178826269 74.208.255.134 → 192.168.212.10 TCP 1442 443 → 33172 [PSH, ACK] Seq=14772 Ack=1228 Win=64240 Len=1388 [TCP segment of a reassembled PDU]
  324 36.178838084 192.168.212.10 → 74.208.255.134 TCP 54 33172 → 443 [ACK] Seq=1228 Ack=16160 Win=63848 Len=0
  325 36.191081467 74.208.255.134 → 192.168.212.10 TCP 1442 443 → 33172 [PSH, ACK] Seq=16160 Ack=1228 Win=64240 Len=1388 [TCP segment of a reassembled PDU]
  326 36.191128066 192.168.212.10 → 74.208.255.134 TCP 54 33172 → 443 [ACK] Seq=1228 Ack=17548 Win=63848 Len=0
  327 36.202735405 74.208.255.134 → 192.168.212.10 TCP 1442 443 → 33172 [PSH, ACK] Seq=17548 Ack=1228 Win=64240 Len=1388 [TCP segment of a reassembled PDU]
  328 36.202784397 192.168.212.10 → 74.208.255.134 TCP 54 33172 → 443 [ACK] Seq=1228 Ack=18936 Win=63848 Len=0
  329 36.208502518 74.208.255.134 → 192.168.212.10 TCP 1442 443 → 33172 [PSH, ACK] Seq=18936 Ack=1228 Win=64240 Len=1388 [TCP segment of a reassembled PDU]
  330 36.208528335 192.168.212.10 → 74.208.255.134 TCP 54 33172 → 443 [ACK] Seq=1228 Ack=20324 Win=63848 Len=0
  331 36.214300360 74.208.255.134 → 192.168.212.10 TLSv1.2 1442 Application Data [TCP segment of a reassembled PDU]
  332 36.214339442 192.168.212.10 → 74.208.255.134 TCP 54 33172 → 443 [ACK] Seq=1228 Ack=21712 Win=63848 Len=0
  333 36.229785370 74.208.255.134 → 192.168.212.10 TCP 1442 443 → 33172 [PSH, ACK] Seq=21712 Ack=1228 Win=64240 Len=1388 [TCP segment of a reassembled PDU]
  334 36.229816106 192.168.212.10 → 74.208.255.134 TCP 54 33172 → 443 [ACK] Seq=1228 Ack=23100 Win=63848 Len=0
  335 36.229920046 74.208.255.134 → 192.168.212.10 TCP 1442 443 → 33172 [PSH, ACK] Seq=23100 Ack=1228 Win=64240 Len=1388 [TCP segment of a reassembled PDU]
  336 36.229928754 192.168.212.10 → 74.208.255.134 TCP 54 33172 → 443 [ACK] Seq=1228 Ack=24488 Win=62460 Len=0
  337 36.238452029 74.208.255.134 → 192.168.212.10 TCP 1442 443 → 33172 [PSH, ACK] Seq=24488 Ack=1228 Win=64240 Len=1388 [TCP segment of a reassembled PDU]
  338 36.238471243 192.168.212.10 → 74.208.255.134 TCP 54 33172 → 443 [ACK] Seq=1228 Ack=25876 Win=63848 Len=0
  339 36.240385911 192.168.212.10 → 74.208.255.134 TLSv1.2 334 Application Data
  340 36.240539776 74.208.255.134 → 192.168.212.10 TCP 60 443 → 33172 [ACK] Seq=25876 Ack=1508 Win=64240 Len=0
  341 36.240736284 192.168.212.10 → 104.16.249.249 TLSv1.2 110 Application Data
  342 36.240795530 104.16.249.249 → 192.168.212.10 TCP 60 443 → 33424 [ACK] Seq=5168 Ack=2031 Win=64240 Len=0
  343 36.240915583 192.168.212.10 → 104.16.249.249 TLSv1.2 213 Application Data
  344 36.241025733 104.16.249.249 → 192.168.212.10 TCP 60 443 → 33424 [ACK] Seq=5168 Ack=2190 Win=64240 Len=0
  345 36.241140326 192.168.212.10 → 104.16.249.249 TLSv1.2 110 Application Data
  346 36.241202349 104.16.249.249 → 192.168.212.10 TCP 60 443 → 33424 [ACK] Seq=5168 Ack=2246 Win=64240 Len=0
  347 36.241299636 192.168.212.10 → 104.16.249.249 TLSv1.2 213 Application Data
  348 36.241347076 104.16.249.249 → 192.168.212.10 TCP 60 443 → 33424 [ACK] Seq=5168 Ack=2405 Win=64240 Len=0
  349 36.241519974 192.168.212.10 → 104.16.249.249 TLSv1.2 110 Application Data
  350 36.241573559 104.16.249.249 → 192.168.212.10 TCP 60 443 → 33424 [ACK] Seq=5168 Ack=2461 Win=64240 Len=0
  351 36.241671545 192.168.212.10 → 104.16.249.249 TLSv1.2 213 Application Data
  352 36.241718080 104.16.249.249 → 192.168.212.10 TCP 60 443 → 33424 [ACK] Seq=5168 Ack=2620 Win=64240 Len=0
  353 36.241969914 192.168.212.10 → 74.208.255.134 TLSv1.2 190 Application Data
  354 36.242082366 74.208.255.134 → 192.168.212.10 TCP 60 443 → 33172 [ACK] Seq=25876 Ack=1644 Win=64240 Len=0
  355 36.243155358 192.168.212.10 → 74.208.255.134 TLSv1.2 192 Application Data
  356 36.243269807 74.208.255.134 → 192.168.212.10 TCP 60 443 → 33172 [ACK] Seq=25876 Ack=1782 Win=64240 Len=0
  357 36.243581455 192.168.212.10 → 104.16.249.249 TLSv1.2 110 Application Data
  358 36.243626944 192.168.212.10 → 104.16.249.249 TLSv1.2 213 Application Data
  359 36.243660339 104.16.249.249 → 192.168.212.10 TCP 60 443 → 33424 [ACK] Seq=5168 Ack=2676 Win=64240 Len=0
  360 36.243768563 104.16.249.249 → 192.168.212.10 TCP 60 443 → 33424 [ACK] Seq=5168 Ack=2835 Win=64240 Len=0
  361 36.243925636 192.168.212.10 → 74.208.255.134 TLSv1.2 184 Application Data
  362 36.244045715 74.208.255.134 → 192.168.212.10 TCP 60 443 → 33172 [ACK] Seq=25876 Ack=1912 Win=64240 Len=0
  363 36.244138858 192.168.212.10 → 104.16.249.249 TLSv1.2 110 Application Data
  364 36.244182373 192.168.212.10 → 104.16.249.249 TLSv1.2 213 Application Data
  365 36.244257426 104.16.249.249 → 192.168.212.10 TCP 60 443 → 33424 [ACK] Seq=5168 Ack=2891 Win=64240 Len=0
  366 36.244263670 104.16.249.249 → 192.168.212.10 TCP 60 443 → 33424 [ACK] Seq=5168 Ack=3050 Win=64240 Len=0
  367 36.244333539 192.168.212.10 → 104.16.249.249 TLSv1.2 110 Application Data
  368 36.244368630 192.168.212.10 → 104.16.249.249 TLSv1.2 213 Application Data
  369 36.244400716 104.16.249.249 → 192.168.212.10 TCP 60 443 → 33424 [ACK] Seq=5168 Ack=3106 Win=64240 Len=0
  370 36.244490693 104.16.249.249 → 192.168.212.10 TCP 60 443 → 33424 [ACK] Seq=5168 Ack=3265 Win=64240 Len=0
  371 36.244668676 192.168.212.10 → 74.208.255.134 TLSv1.2 243 Application Data
  372 36.244739278 74.208.255.134 → 192.168.212.10 TCP 60 443 → 33172 [ACK] Seq=25876 Ack=2101 Win=64240 Len=0
  373 36.245198492 192.168.212.10 → 74.208.255.134 TLSv1.2 224 Application Data
  374 36.245290190 74.208.255.134 → 192.168.212.10 TCP 60 443 → 33172 [ACK] Seq=25876 Ack=2271 Win=64240 Len=0
  375 36.245634251 192.168.212.10 → 74.208.255.134 TLSv1.2 198 Application Data
  376 36.245724549 74.208.255.134 → 192.168.212.10 TCP 60 443 → 33172 [ACK] Seq=25876 Ack=2415 Win=64240 Len=0
  377 36.248656749 192.168.212.10 → 104.16.249.249 TLSv1.2 110 Application Data
  378 36.248703489 192.168.212.10 → 104.16.249.249 TLSv1.2 213 Application Data
  379 36.248746660 104.16.249.249 → 192.168.212.10 TCP 60 443 → 33424 [ACK] Seq=5168 Ack=3321 Win=64240 Len=0
  380 36.248842950 104.16.249.249 → 192.168.212.10 TCP 60 443 → 33424 [ACK] Seq=5168 Ack=3480 Win=64240 Len=0
  381 36.248914446 192.168.212.10 → 104.16.249.249 TLSv1.2 110 Application Data
  382 36.248948568 192.168.212.10 → 104.16.249.249 TLSv1.2 213 Application Data
  383 36.248974432 104.16.249.249 → 192.168.212.10 TCP 60 443 → 33424 [ACK] Seq=5168 Ack=3536 Win=64240 Len=0
