    1 0.000000000 192.168.138.100 → 192.168.241.222 TCP 74 54330 → 21 [SYN] Seq=0 Win=64240 Len=0 MSS=1460 SACK_PERM=1 TSval=2975978552 TSecr=0 WS=128
    2 0.001148289 192.168.241.222 → 192.168.138.100 TCP 60 21 → 54330 [SYN, ACK] Seq=0 Ack=1 Win=64240 Len=0 MSS=1460
    3 0.001189743 192.168.138.100 → 192.168.241.222 TCP 54 54330 → 21 [ACK] Seq=1 Ack=1 Win=64240 Len=0
    4 0.002942553 192.168.241.222 → 192.168.138.100 FTP 74 Response: 220 (vsFTPd 3.0.3)
    5 0.002954368 192.168.138.100 → 192.168.241.222 TCP 54 54330 → 21 [ACK] Seq=1 Ack=21 Win=64220 Len=0
    6 2.372840951 192.168.138.100 → 192.168.241.222 FTP 64 Request: USER fds
    7 2.380338649 192.168.241.222 → 192.168.138.100 TCP 60 21 → 54330 [ACK] Seq=21 Ack=11 Win=64240 Len=0
    8 2.380993362 192.168.241.222 → 192.168.138.100 FTP 88 Response: 331 Please specify the password.
    9 2.381009866 192.168.138.100 → 192.168.241.222 TCP 54 54330 → 21 [ACK] Seq=11 Ack=55 Win=64186 Len=0
   10 5.517265401 192.168.138.100 → 192.168.241.222 FTP 67 Request: PASS fdsfds
   11 5.518131696 192.168.241.222 → 192.168.138.100 TCP 60 21 → 54330 [ACK] Seq=55 Ack=24 Win=64240 Len=0
   12 8.382684281 192.168.241.222 → 192.168.138.100 FTP 76 Response: 530 Login incorrect.
   13 8.382742856 192.168.138.100 → 192.168.241.222 TCP 54 54330 → 21 [ACK] Seq=24 Ack=77 Win=64164 Len=0
   14 8.383003664 192.168.138.100 → 192.168.241.222 FTP 60 Request: SYST
   15 8.384442833 192.168.241.222 → 192.168.138.100 TCP 60 21 → 54330 [ACK] Seq=77 Ack=30 Win=64240 Len=0
   16 8.385940172 192.168.241.222 → 192.168.138.100 FTP 92 Response: 530 Please login with USER and PASS.
   17 8.385969431 192.168.138.100 → 192.168.241.222 TCP 54 54330 → 21 [ACK] Seq=30 Ack=115 Win=64126 Len=0
   18 11.355559987 192.168.138.100 → 198.16.66.100 TLSv1.2 330 Application Data
   19 11.356601707 198.16.66.100 → 192.168.138.100 TCP 60 436 → 40020 [ACK] Seq=1 Ack=277 Win=64240 Len=0
   20 11.589788036 198.16.66.100 → 192.168.138.100 TLSv1.2 352 Application Data
   21 11.589813303 192.168.138.100 → 198.16.66.100 TCP 54 40020 → 436 [ACK] Seq=277 Ack=299 Win=62780 Len=0
   22 12.212740060 192.168.138.100 → 192.168.241.222 FTP 59 Request: PWD
   23 12.213091925 192.168.241.222 → 192.168.138.100 TCP 60 21 → 54330 [ACK] Seq=115 Ack=35 Win=64240 Len=0
   24 12.213553315 192.168.241.222 → 192.168.138.100 FTP 92 Response: 530 Please login with USER and PASS.
   25 12.213561173 192.168.138.100 → 192.168.241.222 TCP 54 54330 → 21 [ACK] Seq=35 Ack=153 Win=64088 Len=0
   26 24.057927265 192.168.138.100 → 152.199.19.160 TCP 54 41472 → 443 [ACK] Seq=1 Ack=1 Win=62780 Len=0
   27 24.058209279 152.199.19.160 → 192.168.138.100 TCP 60 [TCP ACKed unseen segment] 443 → 41472 [ACK] Seq=1 Ack=2 Win=64240 Len=0
   28 38.286029159 192.168.138.100 → 192.168.241.222 FTP 65 Request: USER fdsf
   29 38.286441688 192.168.241.222 → 192.168.138.100 TCP 60 21 → 54330 [ACK] Seq=153 Ack=46 Win=64240 Len=0
   30 38.286932771 192.168.241.222 → 192.168.138.100 FTP 88 Response: 331 Please specify the password.
   31 38.286942665 192.168.138.100 → 192.168.241.222 TCP 54 54330 → 21 [ACK] Seq=46 Ack=187 Win=64054 Len=0
   32 39.876492703 192.168.138.100 → 198.16.66.100 TLSv1.2 200 Application Data
   33 39.876993269 198.16.66.100 → 192.168.138.100 TCP 60 436 → 40020 [ACK] Seq=299 Ack=423 Win=64240 Len=0
   34 40.954583486 198.16.66.100 → 192.168.138.100 TLSv1.2 121 Application Data
   35 40.954618053 192.168.138.100 → 198.16.66.100 TCP 54 40020 → 436 [ACK] Seq=423 Ack=366 Win=62780 Len=0
   36 41.187738345 192.168.138.100 → 192.168.241.222 FTP 68 Request: PASS fdsfdsf
   37 41.195352863 192.168.241.222 → 192.168.138.100 TCP 60 21 → 54330 [ACK] Seq=187 Ack=60 Win=64240 Len=0
   38 44.333546326 192.168.241.222 → 192.168.138.100 FTP 76 Response: 530 Login incorrect.
   39 44.333602345 192.168.138.100 → 192.168.241.222 TCP 54 54330 → 21 [ACK] Seq=60 Ack=209 Win=64054 Len=0
   40 45.268107718 192.168.138.100 → 192.168.241.222 FTP 83 Request: PORT 192,168,138,100,175,89
   41 45.268433661 192.168.241.222 → 192.168.138.100 TCP 60 21 → 54330 [ACK] Seq=209 Ack=89 Win=64211 Len=0
   42 45.268433816 192.168.241.222 → 192.168.138.100 FTP 119 Response: 500 Use PASV instead of PORT, incoming connections are disabled
   43 45.268449042 192.168.138.100 → 192.168.241.222 TCP 54 54330 → 21 [ACK] Seq=89 Ack=274 Win=64054 Len=0
   44 47.352438156 192.168.138.100 → 192.168.241.222 FTP 84 Request: PORT 192,168,138,100,225,109
   45 47.352805883 192.168.241.222 → 192.168.138.100 TCP 60 21 → 54330 [ACK] Seq=274 Ack=119 Win=64181 Len=0
   46 47.352805960 192.168.241.222 → 192.168.138.100 FTP 119 Response: 500 Use PASV instead of PORT, incoming connections are disabled
   47 47.352821361 192.168.138.100 → 192.168.241.222 TCP 54 54330 → 21 [ACK] Seq=119 Ack=339 Win=64054 Len=0
   48 48.586123082 192.168.138.100 → 192.168.241.222 FTP 84 Request: PORT 192,168,138,100,216,143
   49 48.586419290 192.168.241.222 → 192.168.138.100 TCP 60 21 → 54330 [ACK] Seq=339 Ack=149 Win=64151 Len=0
   50 48.586419386 192.168.241.222 → 192.168.138.100 FTP 119 Response: 500 Use PASV instead of PORT, incoming connections are disabled
   51 48.586434598 192.168.138.100 → 192.168.241.222 TCP 54 54330 → 21 [ACK] Seq=149 Ack=404 Win=64054 Len=0
   52 57.506415599 192.168.138.100 → 192.168.241.222 FTP 67 Request: USER fsdfds
   53 57.507300942 192.168.241.222 → 192.168.138.100 TCP 60 21 → 54330 [ACK] Seq=404 Ack=162 Win=64151 Len=0
   54 57.507782225 192.168.241.222 → 192.168.138.100 FTP 88 Response: 331 Please specify the password.
   55 57.507793239 192.168.138.100 → 192.168.241.222 TCP 54 54330 → 21 [ACK] Seq=162 Ack=438 Win=64054 Len=0
   56 58.374921802 192.168.138.100 → 239.255.255.250 SSDP 210 M-SEARCH * HTTP/1.1 
   57 58.453090605 192.168.138.100 → 192.168.241.222 FTP 67 Request: PASS gdsgds
   58 58.453355473 192.168.241.222 → 192.168.138.100 TCP 60 21 → 54330 [ACK] Seq=438 Ack=175 Win=64151 Len=0
   59 59.381437334 192.168.138.100 → 239.255.255.250 SSDP 210 M-SEARCH * HTTP/1.1 
   60 60.394134807 192.168.138.100 → 239.255.255.250 SSDP 210 M-SEARCH * HTTP/1.1 
   61 61.256173812 192.168.241.222 → 192.168.138.100 FTP 76 Response: 530 Login incorrect.
   62 61.297670579 192.168.138.100 → 192.168.241.222 TCP 54 54330 → 21 [ACK] Seq=175 Ack=461 Win=64054 Len=0
   63 61.402703418 192.168.138.100 → 239.255.255.250 SSDP 210 M-SEARCH * HTTP/1.1 
   64 63.450827638 192.168.138.100 → 192.168.241.222 FTP 66 Request: USER dsfsf
   65 63.451377327 192.168.138.100 → 192.168.241.222 TCP 54 54330 → 21 [FIN, ACK] Seq=187 Ack=461 Win=64054 Len=0
   66 63.451686665 192.168.241.222 → 192.168.138.100 TCP 60 21 → 54330 [ACK] Seq=461 Ack=187 Win=64151 Len=0
   67 63.451686732 192.168.241.222 → 192.168.138.100 TCP 60 21 → 54330 [ACK] Seq=461 Ack=188 Win=64150 Len=0
   68 69.116807839 192.168.138.100 → 152.199.19.160 TCP 54 [TCP Dup ACK 26#1] 41472 → 443 [ACK] Seq=1 Ack=1 Win=62780 Len=0
   69 69.117083156 152.199.19.160 → 192.168.138.100 TCP 60 [TCP Dup ACK 27#1] [TCP ACKed unseen segment] 443 → 41472 [ACK] Seq=1 Ack=2 Win=64240 Len=0
   70 69.741070924 192.168.138.100 → 185.125.190.57 NTP 90 NTP Version 4, client
   71 69.961540115 185.125.190.57 → 192.168.138.100 NTP 90 NTP Version 4, server
