    1 0.000000000 157.240.253.35 → 192.168.138.9 TCP 60 443 → 49882 [RST, ACK] Seq=1 Ack=1 Win=64240 Len=0
    2 0.002492769 192.168.138.9 → 157.240.253.35 TCP 74 41576 → 443 [SYN] Seq=0 Win=64240 Len=0 MSS=1460 SACK_PERM=1 TSval=2968001845 TSecr=0 WS=128
    3 0.140475855 157.240.253.35 → 192.168.138.9 TCP 60 443 → 41576 [SYN, ACK] Seq=0 Ack=1 Win=64240 Len=0 MSS=1460
    4 0.140513983 192.168.138.9 → 157.240.253.35 TCP 54 41576 → 443 [ACK] Seq=1 Ack=1 Win=64240 Len=0
    5 0.142199795 192.168.138.9 → 157.240.253.35 TLSv1 571 Client Hello
    6 0.142477359 157.240.253.35 → 192.168.138.9 TCP 60 443 → 41576 [ACK] Seq=1 Ack=518 Win=64240 Len=0
    7 0.426321077 192.168.138.9 → 199.232.192.134 TLSv1.2 78 Application Data
    8 0.426401237 192.168.138.9 → 199.232.192.134 TCP 54 56246 → 443 [FIN, ACK] Seq=25 Ack=1 Win=62780 Len=0
    9 0.426656873 199.232.192.134 → 192.168.138.9 TCP 60 443 → 56246 [ACK] Seq=1 Ack=25 Win=64240 Len=0
   10 0.426667394 199.232.192.134 → 192.168.138.9 TCP 60 443 → 56246 [ACK] Seq=1 Ack=26 Win=64239 Len=0
   11 0.492225003 199.232.192.134 → 192.168.138.9 TLSv1.2 78 Application Data
   12 0.492256062 192.168.138.9 → 199.232.192.134 TCP 54 56246 → 443 [RST] Seq=26 Win=0 Len=0
   13 1.242100480 192.168.138.9 → 151.101.192.134 TCP 54 51762 → 443 [ACK] Seq=1 Ack=1 Win=62780 Len=0
   14 1.243257062 151.101.192.134 → 192.168.138.9 TCP 60 [TCP ACKed unseen segment] 443 → 51762 [ACK] Seq=1 Ack=2 Win=64240 Len=0
   15 1.302498154 192.168.138.9 → 192.168.138.2 DNS 77 Standard query 0x2d87 A vk.com OPT
   16 1.302667477 192.168.138.9 → 192.168.138.2 DNS 77 Standard query 0x171f AAAA vk.com OPT
   17 1.377770758 192.168.138.2 → 192.168.138.9 DNS 133 Standard query response 0x171f AAAA vk.com SOA ns1.vkontakte.ru OPT
   18 1.397301597 192.168.138.2 → 192.168.138.9 DNS 173 Standard query response 0x2d87 A vk.com A 87.240.137.164 A 87.240.132.67 A 87.240.132.72 A 87.240.129.133 A 87.240.132.78 A 93.186.225.194 OPT
   19 1.398052336 192.168.138.9 → 87.240.137.164 ICMP 98 Echo (ping) request  id=0x4de9, seq=1/256, ttl=64
   20 1.463764632 87.240.137.164 → 192.168.138.9 ICMP 98 Echo (ping) reply    id=0x4de9, seq=1/256, ttl=128 (request in 19)
   21 1.464679295 192.168.138.9 → 192.168.138.2 DNS 98 Standard query 0x71f8 PTR 164.137.240.87.in-addr.arpa OPT
   22 1.498122821 192.168.138.9 → 151.101.192.134 TCP 54 51754 → 443 [ACK] Seq=1 Ack=1 Win=62897 Len=0
   23 1.498640898 151.101.192.134 → 192.168.138.9 TCP 60 [TCP ACKed unseen segment] 443 → 51754 [ACK] Seq=1 Ack=2 Win=64240 Len=0
   24 1.534565234 192.168.138.2 → 192.168.138.9 DNS 136 Standard query response 0x71f8 PTR 164.137.240.87.in-addr.arpa PTR srv164-137-240-87.vk.com OPT
   25 2.401366920 192.168.138.9 → 87.240.137.164 ICMP 98 Echo (ping) request  id=0x4de9, seq=2/512, ttl=64
   26 2.470221559 87.240.137.164 → 192.168.138.9 ICMP 98 Echo (ping) reply    id=0x4de9, seq=2/512, ttl=128 (request in 25)
   27 2.526719537 192.168.138.9 → 64.233.162.94 TCP 54 34918 → 80 [ACK] Seq=1 Ack=1 Win=63791 Len=0
   28 2.526909668 64.233.162.94 → 192.168.138.9 TCP 60 [TCP ACKed unseen segment] 80 → 34918 [ACK] Seq=1 Ack=2 Win=64240 Len=0
   29 3.004036447 192.168.138.9 → 93.189.63.147 TLSv1.2 93 Application Data
   30 3.004410966 93.189.63.147 → 192.168.138.9 TCP 60 443 → 57768 [ACK] Seq=1 Ack=40 Win=64240 Len=0
   31 3.079513571 93.189.63.147 → 192.168.138.9 TLSv1.2 93 Application Data
   32 3.079542440 192.168.138.9 → 93.189.63.147 TCP 54 57768 → 443 [ACK] Seq=40 Ack=40 Win=65535 Len=0
   33 3.429671553 192.168.138.9 → 151.101.192.134 TLSv1.2 78 [TCP Previous segment not captured] , Application Data
   34 3.429874989 192.168.138.9 → 151.101.192.134 TCP 54 51762 → 443 [FIN, ACK] Seq=26 Ack=1 Win=62780 Len=0
   35 3.430270377 151.101.192.134 → 192.168.138.9 TCP 60 [TCP ACKed unseen segment] 443 → 51762 [ACK] Seq=1 Ack=26 Win=64240 Len=0
   36 3.430292615 192.168.138.9 → 151.101.192.134 TLSv1.2 78 [TCP Previous segment not captured] , Application Data
   37 3.430298214 151.101.192.134 → 192.168.138.9 TCP 60 443 → 51762 [ACK] Seq=1 Ack=27 Win=64239 Len=0
   38 3.430397628 192.168.138.9 → 151.101.192.134 TCP 54 51754 → 443 [FIN, ACK] Seq=26 Ack=1 Win=62897 Len=0
   39 3.431169829 151.101.192.134 → 192.168.138.9 TCP 60 [TCP ACKed unseen segment] 443 → 51754 [ACK] Seq=1 Ack=26 Win=64240 Len=0
   40 3.431190222 151.101.192.134 → 192.168.138.9 TCP 60 443 → 51754 [ACK] Seq=1 Ack=27 Win=64239 Len=0
   41 3.511981395 151.101.192.134 → 192.168.138.9 TLSv1.2 78 Application Data
   42 3.512030809 192.168.138.9 → 151.101.192.134 TCP 54 51762 → 443 [RST] Seq=27 Win=0 Len=0
   43 3.514462648 151.101.192.134 → 192.168.138.9 TLSv1.2 78 Application Data
   44 3.514510053 192.168.138.9 → 151.101.192.134 TCP 54 51754 → 443 [RST] Seq=27 Win=0 Len=0
   45 3.515105663 151.101.192.134 → 192.168.138.9 TCP 60 443 → 51754 [FIN, PSH, ACK] Seq=25 Ack=27 Win=64239 Len=0
   46 3.515134443 192.168.138.9 → 151.101.192.134 TCP 54 51754 → 443 [RST] Seq=27 Win=0 Len=0
   47 4.005534596 192.168.138.9 → 87.250.251.119 TLSv1.2 93 Application Data
   48 4.005725212 192.168.138.9 → 64.233.165.95 TLSv1.2 93 Application Data
   49 4.005954637 192.168.138.9 → 104.16.249.249 TLSv1.2 93 Application Data
   50 4.006227471 87.250.251.119 → 192.168.138.9 TCP 60 443 → 37462 [ACK] Seq=1 Ack=40 Win=64240 Len=0
   51 4.006244499 64.233.165.95 → 192.168.138.9 TCP 60 443 → 41434 [ACK] Seq=1 Ack=40 Win=64240 Len=0
   52 4.006247335 104.16.249.249 → 192.168.138.9 TCP 60 443 → 58256 [ACK] Seq=1 Ack=40 Win=64240 Len=0
   53 4.036052687 104.16.249.249 → 192.168.138.9 TLSv1.2 93 Application Data
   54 4.036085936 192.168.138.9 → 104.16.249.249 TCP 54 58256 → 443 [ACK] Seq=40 Ack=40 Win=65535 Len=0
   55 4.042988242 64.233.165.95 → 192.168.138.9 TLSv1.2 93 Application Data
   56 4.043017034 192.168.138.9 → 64.233.165.95 TCP 54 41434 → 443 [ACK] Seq=40 Ack=40 Win=63000 Len=0
   57 4.048974055 87.250.251.119 → 192.168.138.9 TLSv1.2 110 Application Data
   58 4.049055056 192.168.138.9 → 87.250.251.119 TCP 54 37462 → 443 [ACK] Seq=40 Ack=57 Win=65535 Len=0
   59 4.049754249 192.168.138.9 → 87.250.251.119 TLSv1.2 93 Application Data
   60 4.050296087 87.250.251.119 → 192.168.138.9 TCP 60 443 → 37462 [ACK] Seq=57 Ack=79 Win=64240 Len=0
   61 4.431295754 192.168.138.9 → 64.233.162.94 TCP 54 [TCP Previous segment not captured] 34918 → 80 [FIN, ACK] Seq=2 Ack=1 Win=63791 Len=0
   62 4.431923371 64.233.162.94 → 192.168.138.9 TCP 60 [TCP ACKed unseen segment] 80 → 34918 [ACK] Seq=1 Ack=3 Win=64239 Len=0
   63 4.463834634 64.233.162.94 → 192.168.138.9 TCP 60 80 → 34918 [FIN, PSH, ACK] Seq=1 Ack=3 Win=64239 Len=0
   64 4.463887747 192.168.138.9 → 64.233.162.94 TCP 54 34918 → 80 [ACK] Seq=3 Ack=2 Win=63791 Len=0
   65 5.007524214 192.168.138.9 → 199.232.194.49 TLSv1.2 100 Application Data
   66 5.007917462 192.168.138.9 → 172.66.43.142 TLSv1.2 93 Application Data
   67 5.008138681 199.232.194.49 → 192.168.138.9 TCP 60 443 → 42402 [ACK] Seq=1 Ack=47 Win=64240 Len=0
   68 5.008339720 192.168.138.9 → 142.251.1.196 TLSv1.2 93 Application Data
   69 5.008694995 172.66.43.142 → 192.168.138.9 TCP 60 443 → 55196 [ACK] Seq=1 Ack=40 Win=64240 Len=0
   70 5.008711045 142.251.1.196 → 192.168.138.9 TCP 60 443 → 54100 [ACK] Seq=1 Ack=40 Win=64240 Len=0
   71 5.008750423 192.168.138.9 → 52.85.49.3   TLSv1.2 93 Application Data
   72 5.009672204   52.85.49.3 → 192.168.138.9 TCP 60 443 → 43142 [ACK] Seq=1 Ack=40 Win=64240 Len=0
   73 5.036928829 142.251.1.196 → 192.168.138.9 TLSv1.2 93 Application Data
   74 5.036976731 192.168.138.9 → 142.251.1.196 TCP 54 54100 → 443 [ACK] Seq=40 Ack=40 Win=63000 Len=0
   75 5.056877761 172.66.43.142 → 192.168.138.9 TLSv1.2 93 Application Data
   76 5.056924783 192.168.138.9 → 172.66.43.142 TCP 54 55196 → 443 [ACK] Seq=40 Ack=40 Win=65535 Len=0
   77 5.090233095   52.85.49.3 → 192.168.138.9 TLSv1.2 93 Application Data
   78 5.090280272 192.168.138.9 → 52.85.49.3   TCP 54 43142 → 443 [ACK] Seq=40 Ack=40 Win=65535 Len=0
   79 5.090621911 199.232.194.49 → 192.168.138.9 TLSv1.2 100 Application Data
   80 5.090645156 192.168.138.9 → 199.232.194.49 TCP 54 42402 → 443 [ACK] Seq=47 Ack=47 Win=62780 Len=0
   81 6.009803804 192.168.138.9 → 157.240.253.1 TLSv1.2 93 Application Data
   82 6.010235760 192.168.138.9 → 13.33.243.59 TLSv1.2 93 Application Data
   83 6.010517104 157.240.253.1 → 192.168.138.9 TCP 60 443 → 53954 [ACK] Seq=1 Ack=40 Win=64240 Len=0
   84 6.010619919 192.168.138.9 → 142.251.1.84 TLSv1.2 93 Application Data
   85 6.010865814 192.168.138.9 → 173.194.221.94 TLSv1.2 93 Application Data
   86 6.010998072 13.33.243.59 → 192.168.138.9 TCP 60 443 → 43490 [ACK] Seq=1 Ack=40 Win=64240 Len=0
   87 6.011014999 142.251.1.84 → 192.168.138.9 TCP 60 443 → 51768 [ACK] Seq=1 Ack=40 Win=64240 Len=0
   88 6.011390255 173.194.221.94 → 192.168.138.9 TCP 60 443 → 44488 [ACK] Seq=1 Ack=40 Win=64240 Len=0
   89 6.044321941 142.251.1.84 → 192.168.138.9 TLSv1.2 93 Application Data
   90 6.044367986 192.168.138.9 → 142.251.1.84 TCP 54 51768 → 443 [ACK] Seq=40 Ack=40 Win=63000 Len=0
   91 6.051275765 173.194.221.94 → 192.168.138.9 TLSv1.2 93 Application Data
   92 6.051322344 192.168.138.9 → 173.194.221.94 TCP 54 44488 → 443 [ACK] Seq=40 Ack=40 Win=62780 Len=0
   93 6.066886676 13.33.243.59 → 192.168.138.9 TLSv1.2 93 Application Data
   94 6.066932593 192.168.138.9 → 13.33.243.59 TCP 54 43490 → 443 [ACK] Seq=40 Ack=40 Win=65535 Len=0
   95 6.072928475 157.240.253.1 → 192.168.138.9 TLSv1.2 93 Application Data
   96 6.072975687 192.168.138.9 → 157.240.253.1 TCP 54 53954 → 443 [ACK] Seq=40 Ack=40 Win=62780 Len=0
   97 6.120733592 93.189.63.147 → 192.168.138.9 TLSv1.2 93 Application Data
   98 6.120856033 192.168.138.9 → 93.189.63.147 TCP 54 57768 → 443 [ACK] Seq=40 Ack=79 Win=65535 Len=0
   99 6.121245145 192.168.138.9 → 93.189.63.147 TLSv1.2 93 Application Data
  100 6.121827180 93.189.63.147 → 192.168.138.9 TCP 60 443 → 57768 [ACK] Seq=79 Ack=79 Win=64240 Len=0
  101 6.121898570 192.168.138.9 → 93.189.63.147 TLSv1.2 78 Application Data
  102 6.123154371 192.168.138.9 → 93.189.63.147 TCP 54 57768 → 443 [FIN, ACK] Seq=103 Ack=79 Win=65535 Len=0
  103 6.123201206 93.189.63.147 → 192.168.138.9 TCP 60 443 → 57768 [ACK] Seq=79 Ack=103 Win=64240 Len=0
  104 6.124054586 93.189.63.147 → 192.168.138.9 TCP 60 443 → 57768 [ACK] Seq=79 Ack=104 Win=64239 Len=0
  105 6.132181668 93.189.63.147 → 192.168.138.9 TLSv1.2 78 Application Data
  106 6.132234555 192.168.138.9 → 93.189.63.147 TCP 54 57768 → 443 [RST] Seq=104 Win=0 Len=0
  107 7.012001141 192.168.138.9 → 157.240.253.1 TLSv1.2 93 Application Data
  108 7.012666617 157.240.253.1 → 192.168.138.9 TCP 60 443 → 53962 [ACK] Seq=1 Ack=40 Win=64240 Len=0
  109 7.069220675 157.240.253.1 → 192.168.138.9 TLSv1.2 93 Application Data
  110 7.069272130 192.168.138.9 → 157.240.253.1 TCP 54 53962 → 443 [ACK] Seq=40 Ack=40 Win=65535 Len=0
  111 7.432593701 192.168.138.9 → 64.233.165.106 TLSv1.2 93 Application Data
  112 7.433196224 64.233.165.106 → 192.168.138.9 TCP 60 443 → 41842 [ACK] Seq=1 Ack=40 Win=64240 Len=0
  113 7.433897157 192.168.138.9 → 64.233.165.106 TLSv1.2 78 Application Data
  114 7.441612130 192.168.138.9 → 64.233.165.106 TCP 54 41842 → 443 [FIN, ACK] Seq=64 Ack=1 Win=63000 Len=0
  115 7.441691981 64.233.165.106 → 192.168.138.9 TCP 60 443 → 41842 [ACK] Seq=1 Ack=64 Win=64240 Len=0
  116 7.442091652 64.233.165.106 → 192.168.138.9 TCP 60 443 → 41842 [ACK] Seq=1 Ack=65 Win=64239 Len=0
  117 7.477651473 64.233.165.106 → 192.168.138.9 TCP 60 443 → 41842 [FIN, PSH, ACK] Seq=1 Ack=65 Win=64239 Len=0
  118 7.477692320 192.168.138.9 → 64.233.165.106 TCP 54 41842 → 443 [ACK] Seq=65 Ack=2 Win=63000 Len=0
  119 9.435165333 192.168.138.9 → 173.194.221.94 TLSv1.2 93 Application Data
  120 9.435908337 173.194.221.94 → 192.168.138.9 TCP 60 443 → 55166 [ACK] Seq=1 Ack=40 Win=64240 Len=0
  121 9.436461815 192.168.138.9 → 173.194.221.94 TLSv1.2 78 Application Data
  122 9.436719160 173.194.221.94 → 192.168.138.9 TCP 60 443 → 55166 [ACK] Seq=1 Ack=64 Win=64240 Len=0
  123 9.436812944 192.168.138.9 → 173.194.221.94 TCP 54 55166 → 443 [FIN, ACK] Seq=64 Ack=1 Win=62780 Len=0
  124 9.437194262 173.194.221.94 → 192.168.138.9 TCP 60 443 → 55166 [ACK] Seq=1 Ack=65 Win=64239 Len=0
  125 9.474047651 173.194.221.94 → 192.168.138.9 TCP 60 443 → 55166 [FIN, PSH, ACK] Seq=1 Ack=65 Win=64239 Len=0
  126 9.474075435 192.168.138.9 → 173.194.221.94 TCP 54 55166 → 443 [ACK] Seq=65 Ack=2 Win=62780 Len=0
  127 10.015349557 192.168.138.9 → 104.16.249.249 TLSv1.2 93 Application Data
  128 10.016198730 104.16.249.249 → 192.168.138.9 TCP 60 443 → 58256 [ACK] Seq=40 Ack=79 Win=64240 Len=0
  129 10.046728770 104.16.249.249 → 192.168.138.9 TLSv1.2 93 Application Data
  130 10.046775587 192.168.138.9 → 104.16.249.249 TCP 54 58256 → 443 [ACK] Seq=79 Ack=79 Win=65535 Len=0
  131 10.202606172 192.168.138.9 → 157.240.253.35 TCP 54 [TCP Keep-Alive] 41576 → 443 [ACK] Seq=517 Ack=1 Win=64240 Len=0
  132 11.225989859 192.168.138.9 → 157.240.253.35 TCP 54 [TCP Keep-Alive] 41576 → 443 [ACK] Seq=517 Ack=1 Win=64240 Len=0
  133 11.226495608 157.240.253.35 → 192.168.138.9 TCP 60 [TCP Keep-Alive ACK] 443 → 41576 [ACK] Seq=1 Ack=518 Win=64240 Len=0
  134 11.250885320 192.168.138.9 → 192.168.138.2 DNS 82 Standard query 0xdf07 A youtube.com OPT
  135 11.251052952 192.168.138.9 → 192.168.138.2 DNS 82 Standard query 0xe347 AAAA youtube.com OPT
  136 11.310596781 192.168.138.2 → 192.168.138.9 DNS 98 Standard query response 0xdf07 A youtube.com A 216.58.209.206 OPT
  137 11.320917010 192.168.138.2 → 192.168.138.9 DNS 110 Standard query response 0xe347 AAAA youtube.com AAAA 2a00:1450:4026:802::200e OPT
  138 11.329357300 192.168.138.9 → 216.58.209.206 ICMP 98 Echo (ping) request  id=0x4df4, seq=1/256, ttl=64
  139 11.359628022 216.58.209.206 → 192.168.138.9 ICMP 98 Echo (ping) reply    id=0x4df4, seq=1/256, ttl=128 (request in 138)
  140 11.360614415 192.168.138.9 → 192.168.138.2 DNS 98 Standard query 0xe746 PTR 206.209.58.216.in-addr.arpa OPT
  141 11.399806277 192.168.138.2 → 192.168.138.9 DNS 198 Standard query response 0xe746 PTR 206.209.58.216.in-addr.arpa PTR bud02s22-in-f206.1e100.net PTR hem09s03-in-f14.1e100.net PTR bud02s22-in-f14.1e100.net OPT
  142 12.324132125 192.168.138.9 → 216.58.209.206 ICMP 98 Echo (ping) request  id=0x4df4, seq=2/512, ttl=64
  143 12.360729822 216.58.209.206 → 192.168.138.9 ICMP 98 Echo (ping) reply    id=0x4df4, seq=2/512, ttl=128 (request in 142)
  144 15.019215328 192.168.138.9 → 64.233.161.198 TLSv1.2 93 Application Data
  145 15.019950829 64.233.161.198 → 192.168.138.9 TCP 60 443 → 44314 [ACK] Seq=1 Ack=40 Win=64240 Len=0
  146 15.066369999 64.233.161.198 → 192.168.138.9 TLSv1.2 93 Application Data
  147 15.066413180 192.168.138.9 → 64.233.161.198 TCP 54 44314 → 443 [ACK] Seq=40 Ack=40 Win=65535 Len=0
  148 16.020824218 192.168.138.9 → 104.16.249.249 TLSv1.2 93 Application Data
  149 16.021667220 104.16.249.249 → 192.168.138.9 TCP 60 443 → 58256 [ACK] Seq=79 Ack=118 Win=64240 Len=0
  150 16.047763999 104.16.249.249 → 192.168.138.9 TLSv1.2 93 Application Data
  151 16.047805067 192.168.138.9 → 104.16.249.249 TCP 54 58256 → 443 [ACK] Seq=118 Ack=118 Win=65535 Len=0
  152 17.990649307 192.168.138.9 → 104.16.249.249 TLSv1.2 110 Application Data
  153 17.990876884 192.168.138.9 → 104.16.249.249 TLSv1.2 213 Application Data
  154 17.991444730 104.16.249.249 → 192.168.138.9 TCP 60 443 → 58256 [ACK] Seq=118 Ack=174 Win=64240 Len=0
  155 17.991474226 104.16.249.249 → 192.168.138.9 TCP 60 443 → 58256 [ACK] Seq=118 Ack=333 Win=64240 Len=0
  156 17.991575255 192.168.138.9 → 104.16.249.249 TLSv1.2 110 Application Data
  157 17.991737260 192.168.138.9 → 104.16.249.249 TLSv1.2 213 Application Data
  158 17.992006927 104.16.249.249 → 192.168.138.9 TCP 60 443 → 58256 [ACK] Seq=118 Ack=389 Win=64240 Len=0
  159 17.992031257 104.16.249.249 → 192.168.138.9 TCP 60 443 → 58256 [ACK] Seq=118 Ack=548 Win=64240 Len=0
  160 18.023170475 192.168.138.9 → 52.85.49.3   TLSv1.2 93 Application Data
  161 18.023705090   52.85.49.3 → 192.168.138.9 TCP 60 443 → 43130 [ACK] Seq=1 Ack=40 Win=64240 Len=0
  162 18.024049784 192.168.138.9 → 64.233.162.94 TLSv1.2 93 Application Data
  163 18.024392525 64.233.162.94 → 192.168.138.9 TCP 60 443 → 43340 [ACK] Seq=1 Ack=40 Win=64240 Len=0
  164 18.024401700 104.16.249.249 → 192.168.138.9 TLSv1.2 89 Application Data
  165 18.024410186 192.168.138.9 → 104.16.249.249 TCP 54 58256 → 443 [ACK] Seq=548 Ack=153 Win=65535 Len=0
  166 18.053977113 64.233.162.94 → 192.168.138.9 TLSv1.2 93 Application Data
  167 18.054011162 192.168.138.9 → 64.233.162.94 TCP 54 43340 → 443 [ACK] Seq=40 Ack=40 Win=65535 Len=0
  168 18.066285682 104.16.249.249 → 192.168.138.9 TLSv1.2 89 Application Data
  169 18.066318753 192.168.138.9 → 104.16.249.249 TCP 54 58256 → 443 [ACK] Seq=548 Ack=188 Win=65535 Len=0
  170 18.067132601 104.16.249.249 → 192.168.138.9 TLSv1.2 609 Application Data
  171 18.067147148 192.168.138.9 → 104.16.249.249 TCP 54 58256 → 443 [ACK] Seq=548 Ack=743 Win=65535 Len=0
  172 18.067215481 104.16.249.249 → 192.168.138.9 TLSv1.2 586 Application Data
  173 18.067226380 192.168.138.9 → 104.16.249.249 TCP 54 58256 → 443 [ACK] Seq=548 Ack=1275 Win=65535 Len=0
  174 18.070562236 192.168.138.9 → 173.194.220.95 TCP 74 55014 → 443 [SYN] Seq=0 Win=64240 Len=0 MSS=1460 SACK_PERM=1 TSval=1176948774 TSecr=0 WS=128
  175 18.106734150   52.85.49.3 → 192.168.138.9 TLSv1.2 93 Application Data
  176 18.106781592 192.168.138.9 → 52.85.49.3   TCP 54 43130 → 443 [ACK] Seq=40 Ack=40 Win=63000 Len=0
  177 18.119720113 173.194.220.95 → 192.168.138.9 TCP 60 443 → 55014 [SYN, ACK] Seq=0 Ack=1 Win=64240 Len=0 MSS=1460
  178 18.119880481 192.168.138.9 → 173.194.220.95 TCP 54 55014 → 443 [ACK] Seq=1 Ack=1 Win=64240 Len=0
  179 18.128926773 192.168.138.9 → 173.194.220.95 TLSv1 726 Client Hello
  180 18.129479534 173.194.220.95 → 192.168.138.9 TCP 60 443 → 55014 [ACK] Seq=1 Ack=673 Win=64240 Len=0
  181 18.130561431 192.168.138.9 → 173.194.220.95 TLSv1.3 60 Change Cipher Spec
  182 18.130837810 192.168.138.9 → 173.194.220.95 TLSv1.3 817 Application Data
  183 18.130937399 173.194.220.95 → 192.168.138.9 TCP 60 443 → 55014 [ACK] Seq=1 Ack=679 Win=64240 Len=0
  184 18.131365045 173.194.220.95 → 192.168.138.9 TCP 60 443 → 55014 [ACK] Seq=1 Ack=1442 Win=64240 Len=0
  185 18.177954743 173.194.220.95 → 192.168.138.9 TLSv1.3 884 Server Hello, Change Cipher Spec, Application Data, Application Data, Application Data
  186 18.178004448 192.168.138.9 → 173.194.220.95 TCP 54 55014 → 443 [ACK] Seq=1442 Ack=831 Win=63910 Len=0
  187 18.180109757 192.168.138.9 → 173.194.220.95 TLSv1.3 138 Application Data, Application Data
  188 18.180553340 173.194.220.95 → 192.168.138.9 TCP 60 443 → 55014 [ACK] Seq=831 Ack=1526 Win=64240 Len=0
  189 18.182738985 192.168.138.9 → 173.194.220.95 TLSv1.3 85 Application Data
  190 18.183341050 173.194.220.95 → 192.168.138.9 TCP 60 443 → 55014 [ACK] Seq=831 Ack=1557 Win=64240 Len=0
  191 18.196944123 173.194.220.95 → 192.168.138.9 TLSv1.3 85 Application Data
  192 18.196971988 192.168.138.9 → 173.194.220.95 TCP 54 55014 → 443 [ACK] Seq=1557 Ack=862 Win=63910 Len=0
  193 18.206870095 173.194.220.95 → 192.168.138.9 TLSv1.3 1514 Application Data
  194 18.206901949 192.168.138.9 → 173.194.220.95 TCP 54 55014 → 443 [ACK] Seq=1557 Ack=2322 Win=63910 Len=0
  195 18.206996149 173.194.220.95 → 192.168.138.9 TLSv1.3 863 Application Data, Application Data, Application Data
  196 18.207011509 192.168.138.9 → 173.194.220.95 TCP 54 55014 → 443 [ACK] Seq=1557 Ack=3131 Win=63101 Len=0
  197 18.207545120 192.168.138.9 → 173.194.220.95 TLSv1.3 93 Application Data
  198 18.207771361 173.194.220.95 → 192.168.138.9 TCP 60 443 → 55014 [ACK] Seq=3131 Ack=1596 Win=64240 Len=0
  199 18.207785806 173.194.220.95 → 192.168.138.9 TLSv1.3 93 Application Data
  200 18.207793170 192.168.138.9 → 173.194.220.95 TCP 54 55014 → 443 [ACK] Seq=1596 Ack=3170 Win=63101 Len=0
  201 18.207908707 192.168.138.9 → 173.194.220.95 TLSv1.3 78 Application Data
  202 18.208047134 192.168.138.9 → 173.194.220.95 TCP 54 55014 → 443 [RST, ACK] Seq=1620 Ack=3170 Win=63101 Len=0
  203 18.208307425 173.194.220.95 → 192.168.138.9 TCP 60 443 → 55014 [ACK] Seq=3170 Ack=1620 Win=64240 Len=0
  204 18.208325343 192.168.138.9 → 173.194.220.95 TCP 54 55014 → 443 [RST] Seq=1620 Win=0 Len=0
  205 20.437228716 192.168.138.9 → 64.233.162.102 TLSv1.2 93 Application Data
  206 20.437677481 64.233.162.102 → 192.168.138.9 TCP 60 443 → 60594 [ACK] Seq=1 Ack=40 Win=64240 Len=0
  207 20.438272764 192.168.138.9 → 64.233.162.102 TLSv1.2 78 Application Data
  208 20.438379275 192.168.138.9 → 64.233.162.102 TCP 54 60594 → 443 [FIN, ACK] Seq=64 Ack=1 Win=62780 Len=0
  209 20.438557866 64.233.162.102 → 192.168.138.9 TCP 60 443 → 60594 [ACK] Seq=1 Ack=64 Win=64240 Len=0
  210 20.438757037 64.233.162.102 → 192.168.138.9 TCP 60 443 → 60594 [ACK] Seq=1 Ack=65 Win=64239 Len=0
  211 20.486456612 64.233.162.102 → 192.168.138.9 TCP 60 443 → 60594 [FIN, PSH, ACK] Seq=1 Ack=65 Win=64239 Len=0
  212 20.486509117 192.168.138.9 → 64.233.162.102 TCP 54 60594 → 443 [ACK] Seq=65 Ack=2 Win=62780 Len=0
  213 21.466593348 192.168.138.9 → 157.240.253.35 TCP 54 [TCP Keep-Alive] 41576 → 443 [ACK] Seq=517 Ack=1 Win=64240 Len=0
  214 21.467061758 157.240.253.35 → 192.168.138.9 TCP 60 [TCP Keep-Alive ACK] 443 → 41576 [ACK] Seq=1 Ack=518 Win=64240 Len=0
  215 22.346789950 172.67.68.36 → 192.168.138.9 TLSv1.2 79 Application Data
  216 22.349533612 192.168.138.9 → 172.67.68.36 TLSv1.2 83 Application Data
  217 22.350207640 172.67.68.36 → 192.168.138.9 TCP 60 443 → 44180 [ACK] Seq=26 Ack=30 Win=64240 Len=0
  218 22.982787548 192.168.138.9 → 192.168.138.2 DNS 78 Standard query 0x3061 A fta.com OPT
  219 22.982967822 192.168.138.9 → 192.168.138.2 DNS 78 Standard query 0x5ea4 AAAA fta.com OPT
  220 23.052143231 192.168.138.2 → 192.168.138.9 DNS 146 Standard query response 0x5ea4 AAAA fta.com SOA ns41.domaincontrol.com OPT
  221 23.096506682 192.168.138.2 → 192.168.138.9 DNS 110 Standard query response 0x3061 A fta.com A 15.197.142.173 A 3.33.152.147 OPT
  222 23.099197679 192.168.138.9 → 15.197.142.173 ICMP 98 Echo (ping) request  id=0x4df8, seq=1/256, ttl=64
  223 23.142172001 15.197.142.173 → 192.168.138.9 ICMP 98 Echo (ping) reply    id=0x4df8, seq=1/256, ttl=128 (request in 222)
  224 23.142581584 192.168.138.9 → 192.168.138.2 DNS 98 Standard query 0xc42c PTR 173.142.197.15.in-addr.arpa OPT
  225 23.205854478 192.168.138.2 → 192.168.138.9 DNS 154 Standard query response 0xc42c PTR 173.142.197.15.in-addr.arpa PTR a4ec4c6ea1c92e2e6.awsglobalaccelerator.com OPT
  226 24.026828844 192.168.138.9 → 104.16.249.249 TLSv1.2 93 Application Data
  227 24.027336682 104.16.249.249 → 192.168.138.9 TCP 60 443 → 58256 [ACK] Seq=1275 Ack=587 Win=64240 Len=0
  228 24.055977035 104.16.249.249 → 192.168.138.9 TLSv1.2 93 Application Data
  229 24.056013271 192.168.138.9 → 104.16.249.249 TCP 54 58256 → 443 [ACK] Seq=587 Ack=1314 Win=65535 Len=0
  230 24.100593561 192.168.138.9 → 15.197.142.173 ICMP 98 Echo (ping) request  id=0x4df8, seq=2/512, ttl=64
  231 24.165610032 15.197.142.173 → 192.168.138.9 ICMP 98 Echo (ping) reply    id=0x4df8, seq=2/512, ttl=128 (request in 230)
  232 25.790966222 157.240.253.35 → 192.168.138.9 TCP 60 443 → 41576 [RST, ACK] Seq=1 Ack=518 Win=64240 Len=0
  233 25.793290832 192.168.138.9 → 104.16.249.249 TLSv1.2 110 Application Data
  234 25.793444618 192.168.138.9 → 104.16.249.249 TLSv1.2 213 Application Data
  235 25.793968810 104.16.249.249 → 192.168.138.9 TCP 60 443 → 58256 [ACK] Seq=1314 Ack=643 Win=64240 Len=0
  236 25.793999540 192.168.138.9 → 104.16.249.249 TLSv1.2 269 Application Data, Application Data
  237 25.794072833 104.16.249.249 → 192.168.138.9 TCP 60 443 → 58256 [ACK] Seq=1314 Ack=802 Win=64240 Len=0
  238 25.794268499 104.16.249.249 → 192.168.138.9 TCP 60 443 → 58256 [ACK] Seq=1314 Ack=1017 Win=64240 Len=0
  239 25.818213120 104.16.249.249 → 192.168.138.9 TLSv1.2 89 Application Data
  240 25.818246029 192.168.138.9 → 104.16.249.249 TCP 54 58256 → 443 [ACK] Seq=1017 Ack=1349 Win=65535 Len=0
  241 25.856493254 104.16.249.249 → 192.168.138.9 TLSv1.2 89 Application Data
  242 25.856540325 192.168.138.9 → 104.16.249.249 TCP 54 58256 → 443 [ACK] Seq=1017 Ack=1384 Win=65535 Len=0
  243 25.868761572 104.16.249.249 → 192.168.138.9 TLSv1.2 1141 Application Data, Application Data
  244 25.868811344 192.168.138.9 → 104.16.249.249 TCP 54 58256 → 443 [ACK] Seq=1017 Ack=2471 Win=65535 Len=0
  245 25.874464505 192.168.138.9 → 157.240.253.35 TCP 74 49118 → 443 [SYN] Seq=0 Win=64240 Len=0 MSS=1460 SACK_PERM=1 TSval=2968027717 TSecr=0 WS=128
  246 25.950026218 157.240.253.35 → 192.168.138.9 TCP 60 443 → 49118 [SYN, ACK] Seq=0 Ack=1 Win=64240 Len=0 MSS=1460
  247 25.950150448 192.168.138.9 → 157.240.253.35 TCP 54 49118 → 443 [ACK] Seq=1 Ack=1 Win=64240 Len=0
  248 25.954209201 192.168.138.9 → 157.240.253.35 TLSv1 571 Client Hello
  249 25.954453530 157.240.253.35 → 192.168.138.9 TCP 60 443 → 49118 [ACK] Seq=1 Ack=518 Win=64240 Len=0
  250 26.440055618 192.168.138.9 → 64.233.165.147 TLSv1.2 93 Application Data
  251 26.440429409 192.168.138.9 → 64.233.165.147 TLSv1.2 78 Application Data
  252 26.440481278 64.233.165.147 → 192.168.138.9 TCP 60 443 → 54946 [ACK] Seq=1 Ack=40 Win=64240 Len=0
  253 26.440538201 192.168.138.9 → 64.233.165.147 TCP 54 54946 → 443 [FIN, ACK] Seq=64 Ack=1 Win=63744 Len=0
  254 26.440685195 64.233.165.147 → 192.168.138.9 TCP 60 443 → 54946 [ACK] Seq=1 Ack=64 Win=64240 Len=0
  255 26.440922069 64.233.165.147 → 192.168.138.9 TCP 60 443 → 54946 [ACK] Seq=1 Ack=65 Win=64239 Len=0
  256 26.492342455 64.233.165.147 → 192.168.138.9 TCP 60 443 → 54946 [FIN, PSH, ACK] Seq=1 Ack=65 Win=64239 Len=0
  257 26.492382709 192.168.138.9 → 64.233.165.147 TCP 54 54946 → 443 [ACK] Seq=65 Ack=2 Win=63744 Len=0
  258 27.875829955 192.168.138.9 → 34.120.208.123 TLSv1.2 93 Application Data
  259 27.876798509 34.120.208.123 → 192.168.138.9 TCP 60 443 → 51102 [ACK] Seq=1 Ack=40 Win=64240 Len=0
  260 27.919219479 34.120.208.123 → 192.168.138.9 TLSv1.2 93 Application Data
  261 27.919309903 192.168.138.9 → 34.120.208.123 TCP 54 51102 → 443 [ACK] Seq=40 Ack=40 Win=63000 Len=0
  262 30.442884670 192.168.138.9 → 64.233.165.147 TLSv1.2 93 Application Data
  263 30.443741382 64.233.165.147 → 192.168.138.9 TCP 60 443 → 54934 [ACK] Seq=1 Ack=40 Win=64240 Len=0
  264 30.444201760 192.168.138.9 → 64.233.165.147 TLSv1.2 78 Application Data
  265 30.444408465 192.168.138.9 → 64.233.165.147 TCP 54 54934 → 443 [FIN, ACK] Seq=64 Ack=1 Win=65535 Len=0
  266 30.444536734 64.233.165.147 → 192.168.138.9 TCP 60 443 → 54934 [ACK] Seq=1 Ack=64 Win=64240 Len=0
  267 30.445010535 64.233.165.147 → 192.168.138.9 TCP 60 443 → 54934 [ACK] Seq=1 Ack=65 Win=64239 Len=0
  268 30.524254567 64.233.165.147 → 192.168.138.9 TCP 60 443 → 54934 [FIN, PSH, ACK] Seq=1 Ack=65 Win=64239 Len=0
  269 30.524305004 192.168.138.9 → 64.233.165.147 TCP 54 54934 → 443 [ACK] Seq=65 Ack=2 Win=38664 Len=0
  270 30.879072334 192.168.138.9 → 104.16.249.249 TLSv1.2 93 Application Data
  271 30.880000185 104.16.249.249 → 192.168.138.9 TCP 60 443 → 58256 [ACK] Seq=2471 Ack=1056 Win=64240 Len=0
  272 30.906384640 104.16.249.249 → 192.168.138.9 TLSv1.2 93 Application Data
  273 30.906449316 192.168.138.9 → 104.16.249.249 TCP 54 58256 → 443 [ACK] Seq=1056 Ack=2510 Win=65535 Len=0
  274 31.443308320 192.168.138.9 → 172.67.68.36 TLSv1.2 93 Application Data
  275 31.443488603 192.168.138.9 → 104.16.85.20 TLSv1.2 93 Application Data
  276 31.443672671 192.168.138.9 → 104.16.57.101 TLSv1.2 93 Application Data
  277 31.443697394 172.67.68.36 → 192.168.138.9 TCP 60 443 → 37392 [ACK] Seq=1 Ack=40 Win=64240 Len=0
  278 31.443709954 104.16.85.20 → 192.168.138.9 TCP 60 443 → 50662 [ACK] Seq=1 Ack=40 Win=64240 Len=0
  279 31.443800321 192.168.138.9 → 64.233.165.104 TLSv1.2 93 Application Data
  280 31.443962721 104.16.57.101 → 192.168.138.9 TCP 60 443 → 59634 [ACK] Seq=1 Ack=40 Win=64240 Len=0
  281 31.443970329 64.233.165.104 → 192.168.138.9 TCP 60 443 → 56354 [ACK] Seq=1 Ack=40 Win=64240 Len=0
  282 31.444249314 192.168.138.9 → 64.233.165.104 TLSv1.2 78 Application Data
  283 31.444295820 192.168.138.9 → 64.233.165.104 TCP 54 56354 → 443 [FIN, ACK] Seq=64 Ack=1 Win=62780 Len=0
  284 31.444423776 64.233.165.104 → 192.168.138.9 TCP 60 443 → 56354 [ACK] Seq=1 Ack=64 Win=64240 Len=0
  285 31.444654603 192.168.138.9 → 104.16.85.20 TLSv1.2 78 Application Data
  286 31.444660368 64.233.165.104 → 192.168.138.9 TCP 60 443 → 56354 [ACK] Seq=1 Ack=65 Win=64239 Len=0
  287 31.444700235 192.168.138.9 → 104.16.85.20 TCP 54 50662 → 443 [FIN, ACK] Seq=64 Ack=1 Win=65535 Len=0
  288 31.444780506 104.16.85.20 → 192.168.138.9 TCP 60 443 → 50662 [ACK] Seq=1 Ack=64 Win=64240 Len=0
  289 31.444954661 104.16.85.20 → 192.168.138.9 TCP 60 443 → 50662 [ACK] Seq=1 Ack=65 Win=64239 Len=0
  290 31.445067735 192.168.138.9 → 172.67.68.36 TLSv1.2 78 Application Data
  291 31.445112412 192.168.138.9 → 172.67.68.36 TCP 54 37392 → 443 [FIN, ACK] Seq=64 Ack=1 Win=62780 Len=0
  292 31.445234949 172.67.68.36 → 192.168.138.9 TCP 60 443 → 37392 [ACK] Seq=1 Ack=64 Win=64240 Len=0
  293 31.445472486 172.67.68.36 → 192.168.138.9 TCP 60 443 → 37392 [ACK] Seq=1 Ack=65 Win=64239 Len=0
  294 31.445617797 192.168.138.9 → 104.16.57.101 TLSv1.2 78 Application Data
  295 31.445657579 192.168.138.9 → 104.16.57.101 TCP 54 59634 → 443 [FIN, ACK] Seq=64 Ack=1 Win=62780 Len=0
  296 31.445826436 104.16.57.101 → 192.168.138.9 TCP 60 443 → 59634 [ACK] Seq=1 Ack=64 Win=64240 Len=0
  297 31.445833607 104.16.57.101 → 192.168.138.9 TCP 60 443 → 59634 [ACK] Seq=1 Ack=65 Win=64239 Len=0
  298 31.544655968 64.233.165.104 → 192.168.138.9 TCP 60 443 → 56354 [FIN, PSH, ACK] Seq=1 Ack=65 Win=64239 Len=0
  299 31.544747290 192.168.138.9 → 64.233.165.104 TCP 54 56354 → 443 [ACK] Seq=65 Ack=2 Win=62780 Len=0
  300 31.544968245 172.67.68.36 → 192.168.138.9 TCP 60 443 → 37392 [FIN, PSH, ACK] Seq=1 Ack=65 Win=64239 Len=0
  301 31.544988690 192.168.138.9 → 172.67.68.36 TCP 54 37392 → 443 [ACK] Seq=65 Ack=2 Win=62780 Len=0
  302 31.545053472 104.16.85.20 → 192.168.138.9 TCP 60 443 → 50662 [FIN, PSH, ACK] Seq=1 Ack=65 Win=64239 Len=0
  303 31.545066541 192.168.138.9 → 104.16.85.20 TCP 54 50662 → 443 [ACK] Seq=65 Ack=2 Win=264 Len=0
  304 31.545207703 104.16.57.101 → 192.168.138.9 TCP 60 443 → 59634 [FIN, PSH, ACK] Seq=1 Ack=65 Win=64239 Len=0
  305 31.545222796 192.168.138.9 → 104.16.57.101 TCP 54 59634 → 443 [ACK] Seq=65 Ack=2 Win=62780 Len=0
  306 33.445962160 192.168.138.9 → 80.239.201.50 TLSv1.2 93 Application Data
  307 33.446544485 80.239.201.50 → 192.168.138.9 TCP 60 443 → 56276 [ACK] Seq=1 Ack=40 Win=64240 Len=0
  308 33.447175262 192.168.138.9 → 80.239.201.50 TLSv1.2 78 Application Data
  309 33.447341684 192.168.138.9 → 80.239.201.50 TCP 54 56276 → 443 [FIN, ACK] Seq=64 Ack=1 Win=62780 Len=0
  310 33.447564434 80.239.201.50 → 192.168.138.9 TCP 60 443 → 56276 [ACK] Seq=1 Ack=64 Win=64240 Len=0
  311 33.448223011 80.239.201.50 → 192.168.138.9 TCP 60 443 → 56276 [ACK] Seq=1 Ack=65 Win=64239 Len=0
  312 33.561613506 80.239.201.50 → 192.168.138.9 TLSv1.2 93 Application Data
  313 33.561668125 192.168.138.9 → 80.239.201.50 TCP 54 56276 → 443 [RST] Seq=65 Win=0 Len=0
  314 35.308757503 192.168.138.9 → 104.16.249.249 TLSv1.2 110 Application Data
  315 35.308820120 192.168.138.9 → 104.16.249.249 TLSv1.2 213 Application Data
  316 35.309013857 104.16.249.249 → 192.168.138.9 TCP 60 443 → 58256 [ACK] Seq=2510 Ack=1112 Win=64240 Len=0
  317 35.309024137 104.16.249.249 → 192.168.138.9 TCP 60 443 → 58256 [ACK] Seq=2510 Ack=1271 Win=64240 Len=0
  318 35.309094937 192.168.138.9 → 104.16.249.249 TLSv1.2 110 Application Data
  319 35.309134070 192.168.138.9 → 104.16.249.249 TLSv1.2 213 Application Data
  320 35.309255532 104.16.249.249 → 192.168.138.9 TCP 60 443 → 58256 [ACK] Seq=2510 Ack=1327 Win=64240 Len=0
  321 35.309259297 104.16.249.249 → 192.168.138.9 TCP 60 443 → 58256 [ACK] Seq=2510 Ack=1486 Win=64240 Len=0
  322 35.309429826 192.168.138.9 → 104.16.249.249 TLSv1.2 110 Application Data
  323 35.309473723 192.168.138.9 → 104.16.249.249 TLSv1.2 213 Application Data
  324 35.309577354 104.16.249.249 → 192.168.138.9 TCP 60 443 → 58256 [ACK] Seq=2510 Ack=1542 Win=64240 Len=0
  325 35.309669112 104.16.249.249 → 192.168.138.9 TCP 60 443 → 58256 [ACK] Seq=2510 Ack=1701 Win=64240 Len=0
  326 35.345242666 104.16.249.249 → 192.168.138.9 TLSv1.2 89 Application Data
  327 35.345266551 192.168.138.9 → 104.16.249.249 TCP 54 58256 → 443 [ACK] Seq=1701 Ack=2545 Win=65535 Len=0
  328 35.376475658 104.16.249.249 → 192.168.138.9 TLSv1.2 102 Application Data
  329 35.376522857 192.168.138.9 → 104.16.249.249 TCP 54 58256 → 443 [ACK] Seq=1701 Ack=2593 Win=65535 Len=0
  330 35.388828270 104.16.249.249 → 192.168.138.9 TLSv1.2 1141 Application Data, Application Data
  331 35.388848429 192.168.138.9 → 104.16.249.249 TCP 54 58256 → 443 [ACK] Seq=1701 Ack=3680 Win=65535 Len=0
  332 35.396842966 104.16.249.249 → 192.168.138.9 TLSv1.2 586 Application Data
  333 35.396866458 192.168.138.9 → 104.16.249.249 TCP 54 58256 → 443 [ACK] Seq=1701 Ack=4212 Win=65535 Len=0
  334 35.398052777 192.168.138.9 → 142.250.150.138 TCP 74 46006 → 443 [SYN] Seq=0 Win=64240 Len=0 MSS=1460 SACK_PERM=1 TSval=2530322471 TSecr=0 WS=128
  335 35.398168515 192.168.138.9 → 142.250.150.138 TCP 74 46010 → 443 [SYN] Seq=0 Win=64240 Len=0 MSS=1460 SACK_PERM=1 TSval=2530322472 TSecr=0 WS=128
  336 35.567939735 142.250.150.138 → 192.168.138.9 TCP 60 443 → 46006 [SYN, ACK] Seq=0 Ack=1 Win=64240 Len=0 MSS=1460
  337 35.568044642 192.168.138.9 → 142.250.150.138 TCP 54 46006 → 443 [ACK] Seq=1 Ack=1 Win=64240 Len=0
  338 35.572998147 192.168.138.9 → 142.250.150.138 TLSv1 571 Client Hello
  339 35.574328492 142.250.150.138 → 192.168.138.9 TCP 60 443 → 46006 [ACK] Seq=1 Ack=518 Win=64240 Len=0
  340 35.669736282 142.250.150.138 → 192.168.138.9 TCP 60 443 → 46006 [RST, ACK] Seq=1 Ack=518 Win=64240 Len=0
  341 35.671750142 192.168.138.9 → 142.250.150.139 TCP 74 52456 → 443 [SYN] Seq=0 Win=64240 Len=0 MSS=1460 SACK_PERM=1 TSval=2389920012 TSecr=0 WS=128
  342 35.737447596 142.250.150.139 → 192.168.138.9 TCP 60 443 → 52456 [SYN, ACK] Seq=0 Ack=1 Win=64240 Len=0 MSS=1460
  343 35.737552314 192.168.138.9 → 142.250.150.139 TCP 54 52456 → 443 [ACK] Seq=1 Ack=1 Win=64240 Len=0
  344 35.742377997 192.168.138.9 → 142.250.150.139 TLSv1 571 Client Hello
  345 35.742983994 142.250.150.139 → 192.168.138.9 TCP 60 443 → 52456 [ACK] Seq=1 Ack=518 Win=64240 Len=0
  346 35.784813940 142.250.150.139 → 192.168.138.9 TCP 60 443 → 52456 [RST, ACK] Seq=1 Ack=518 Win=64240 Len=0
  347 35.787524190 192.168.138.9 → 142.250.150.100 TCP 74 42600 → 443 [SYN] Seq=0 Win=64240 Len=0 MSS=1460 SACK_PERM=1 TSval=203827741 TSecr=0 WS=128
  348 35.922711571 142.250.150.100 → 192.168.138.9 TCP 60 443 → 42600 [SYN, ACK] Seq=0 Ack=1 Win=64240 Len=0 MSS=1460
  349 35.922853080 192.168.138.9 → 142.250.150.100 TCP 54 42600 → 443 [ACK] Seq=1 Ack=1 Win=64240 Len=0
  350 35.928054290 192.168.138.9 → 142.250.150.100 TLSv1 571 Client Hello
  351 35.928308254 142.250.150.100 → 192.168.138.9 TCP 60 443 → 42600 [ACK] Seq=1 Ack=518 Win=64240 Len=0
  352 35.939289831 142.250.150.138 → 192.168.138.9 TCP 60 443 → 46010 [SYN, ACK] Seq=0 Ack=1 Win=64240 Len=0 MSS=1460
  353 35.939335557 192.168.138.9 → 142.250.150.138 TCP 54 46010 → 443 [ACK] Seq=1 Ack=1 Win=64240 Len=0
  354 35.941154610 192.168.138.9 → 142.250.150.138 TLSv1 571 Client Hello
  355 35.941426269 142.250.150.138 → 192.168.138.9 TCP 60 443 → 46010 [ACK] Seq=1 Ack=518 Win=64240 Len=0
  356 36.051370499 142.250.150.100 → 192.168.138.9 TCP 60 443 → 42600 [RST, ACK] Seq=1 Ack=518 Win=64240 Len=0
  357 36.053447859 192.168.138.9 → 142.250.150.102 TCP 74 50890 → 443 [SYN] Seq=0 Win=64240 Len=0 MSS=1460 SACK_PERM=1 TSval=370536532 TSecr=0 WS=128
  358 36.058001692 192.168.138.9 → 157.240.253.35 TCP 54 [TCP Keep-Alive] 49118 → 443 [ACK] Seq=517 Ack=1 Win=64240 Len=0
  359 36.091579262 142.250.150.138 → 192.168.138.9 TCP 60 443 → 46010 [RST, ACK] Seq=1 Ack=518 Win=64240 Len=0
  360 36.304210897 192.168.138.9 → 142.250.150.102 TCP 74 50898 → 443 [SYN] Seq=0 Win=64240 Len=0 MSS=1460 SACK_PERM=1 TSval=370536783 TSecr=0 WS=128
  361 36.403518697 142.250.150.102 → 192.168.138.9 TCP 60 443 → 50898 [SYN, ACK] Seq=0 Ack=1 Win=64240 Len=0 MSS=1460
  362 36.403645403 192.168.138.9 → 142.250.150.102 TCP 54 50898 → 443 [ACK] Seq=1 Ack=1 Win=64240 Len=0
  363 36.410298726 192.168.138.9 → 142.250.150.102 TLSv1 571 Client Hello
  364 36.411199664 142.250.150.102 → 192.168.138.9 TCP 60 443 → 50898 [ACK] Seq=1 Ack=518 Win=64240 Len=0
  365 36.417328695 142.250.150.102 → 192.168.138.9 TCP 60 443 → 50890 [SYN, ACK] Seq=0 Ack=1 Win=64240 Len=0 MSS=1460
  366 36.417462415 192.168.138.9 → 142.250.150.102 TCP 54 50890 → 443 [ACK] Seq=1 Ack=1 Win=64240 Len=0
  367 36.424119088 192.168.138.9 → 142.250.150.102 TLSv1 571 Client Hello
  368 36.425031865 142.250.150.102 → 192.168.138.9 TCP 60 443 → 50890 [ACK] Seq=1 Ack=518 Win=64240 Len=0
  369 36.448744553 192.168.138.9 → 173.194.221.119 TLSv1.2 93 Application Data
  370 36.449025382 192.168.138.9 → 64.233.165.105 TLSv1.2 93 Application Data
  371 36.449592537 173.194.221.119 → 192.168.138.9 TCP 60 443 → 56230 [ACK] Seq=1 Ack=40 Win=64240 Len=0
  372 36.449623539 64.233.165.105 → 192.168.138.9 TCP 60 443 → 42038 [ACK] Seq=1 Ack=40 Win=64240 Len=0
  373 36.450453100 192.168.138.9 → 173.194.221.119 TLSv1.2 78 Application Data
  374 36.450639851 192.168.138.9 → 173.194.221.119 TCP 54 56230 → 443 [FIN, ACK] Seq=64 Ack=1 Win=62780 Len=0
  375 36.450904740 173.194.221.119 → 192.168.138.9 TCP 60 443 → 56230 [ACK] Seq=1 Ack=64 Win=64240 Len=0
  376 36.451446656 173.194.221.119 → 192.168.138.9 TCP 60 443 → 56230 [ACK] Seq=1 Ack=65 Win=64239 Len=0
  377 36.451584249 192.168.138.9 → 64.233.165.105 TLSv1.2 78 Application Data
  378 36.451751782 192.168.138.9 → 64.233.165.105 TCP 54 42038 → 443 [FIN, ACK] Seq=64 Ack=1 Win=62780 Len=0
  379 36.451972389 64.233.165.105 → 192.168.138.9 TCP 60 443 → 42038 [ACK] Seq=1 Ack=64 Win=64240 Len=0
  380 36.452580724 64.233.165.105 → 192.168.138.9 TCP 60 443 → 42038 [ACK] Seq=1 Ack=65 Win=64239 Len=0
  381 36.490733928 142.250.150.102 → 192.168.138.9 TCP 60 443 → 50890 [RST, ACK] Seq=1 Ack=518 Win=64240 Len=0
  382 36.496929174 64.233.165.105 → 192.168.138.9 TCP 60 443 → 42038 [FIN, PSH, ACK] Seq=1 Ack=65 Win=64239 Len=0
  383 36.496980823 192.168.138.9 → 64.233.165.105 TCP 54 42038 → 443 [ACK] Seq=65 Ack=2 Win=62780 Len=0
  384 36.501236706 173.194.221.119 → 192.168.138.9 TCP 60 443 → 56230 [FIN, PSH, ACK] Seq=1 Ack=65 Win=64239 Len=0
  385 36.501287846 192.168.138.9 → 173.194.221.119 TCP 54 56230 → 443 [ACK] Seq=65 Ack=2 Win=62780 Len=0
  386 36.520229828 142.250.150.102 → 192.168.138.9 TCP 60 443 → 50898 [RST, ACK] Seq=1 Ack=518 Win=64240 Len=0
  387 36.522822782 192.168.138.9 → 142.250.150.102 TCP 74 50914 → 443 [SYN] Seq=0 Win=64240 Len=0 MSS=1460 SACK_PERM=1 TSval=370537001 TSecr=0 WS=128
  388 36.671059845 142.250.150.102 → 192.168.138.9 TCP 60 443 → 50914 [SYN, ACK] Seq=0 Ack=1 Win=64240 Len=0 MSS=1460
  389 36.671150592 192.168.138.9 → 142.250.150.102 TCP 54 50914 → 443 [ACK] Seq=1 Ack=1 Win=64240 Len=0
  390 36.675838231 192.168.138.9 → 142.250.150.102 TLSv1 571 Client Hello
  391 36.676552214 142.250.150.102 → 192.168.138.9 TCP 60 443 → 50914 [ACK] Seq=1 Ack=518 Win=64240 Len=0
  392 36.814384477 142.250.150.102 → 192.168.138.9 TCP 60 443 → 50914 [RST, ACK] Seq=1 Ack=518 Win=64240 Len=0
  393 36.815624470 192.168.138.9 → 142.250.150.101 TCP 74 48612 → 443 [SYN] Seq=0 Win=64240 Len=0 MSS=1460 SACK_PERM=1 TSval=2976582824 TSecr=0 WS=128
  394 36.884144353 142.250.150.101 → 192.168.138.9 TCP 60 443 → 48612 [SYN, ACK] Seq=0 Ack=1 Win=64240 Len=0 MSS=1460
  395 36.884275043 192.168.138.9 → 142.250.150.101 TCP 54 48612 → 443 [ACK] Seq=1 Ack=1 Win=64240 Len=0
  396 36.891001359 192.168.138.9 → 142.250.150.101 TLSv1 571 Client Hello
  397 36.891647712 142.250.150.101 → 192.168.138.9 TCP 60 443 → 48612 [ACK] Seq=1 Ack=518 Win=64240 Len=0
  398 36.962643042 142.250.150.101 → 192.168.138.9 TCP 60 443 → 48612 [RST, ACK] Seq=1 Ack=518 Win=64240 Len=0
  399 36.964769104 192.168.138.9 → 142.250.150.113 TCP 74 37192 → 443 [SYN] Seq=0 Win=64240 Len=0 MSS=1460 SACK_PERM=1 TSval=1466808234 TSecr=0 WS=128
  400 37.033422747 142.250.150.113 → 192.168.138.9 TCP 60 443 → 37192 [SYN, ACK] Seq=0 Ack=1 Win=64240 Len=0 MSS=1460
  401 37.033527358 192.168.138.9 → 142.250.150.113 TCP 54 37192 → 443 [ACK] Seq=1 Ack=1 Win=64240 Len=0
  402 37.038532461 192.168.138.9 → 142.250.150.113 TLSv1 571 Client Hello
  403 37.039103907 142.250.150.113 → 192.168.138.9 TCP 60 443 → 37192 [ACK] Seq=1 Ack=518 Win=64240 Len=0
  404 37.082161926 192.168.138.9 → 157.240.253.35 TCP 54 [TCP Keep-Alive] 49118 → 443 [ACK] Seq=517 Ack=1 Win=64240 Len=0
  405 37.082429801 157.240.253.35 → 192.168.138.9 TCP 60 [TCP Keep-Alive ACK] 443 → 49118 [ACK] Seq=1 Ack=518 Win=64240 Len=0
  406 37.116065817 142.250.150.113 → 192.168.138.9 TCP 60 443 → 37192 [RST, ACK] Seq=1 Ack=518 Win=64240 Len=0
  407 37.119381625 192.168.138.9 → 142.250.150.138 TCP 74 46024 → 443 [SYN] Seq=0 Win=64240 Len=0 MSS=1460 SACK_PERM=1 TSval=2530324193 TSecr=0 WS=128
  408 37.192170204 142.250.150.138 → 192.168.138.9 TCP 60 443 → 46024 [SYN, ACK] Seq=0 Ack=1 Win=64240 Len=0 MSS=1460
  409 37.192312970 192.168.138.9 → 142.250.150.138 TCP 54 46024 → 443 [ACK] Seq=1 Ack=1 Win=64240 Len=0
  410 37.199390193 192.168.138.9 → 142.250.150.138 TLSv1 571 Client Hello
  411 37.199898468 142.250.150.138 → 192.168.138.9 TCP 60 443 → 46024 [ACK] Seq=1 Ack=518 Win=64240 Len=0
  412 37.266555938 142.250.150.138 → 192.168.138.9 TCP 60 443 → 46024 [RST, ACK] Seq=1 Ack=518 Win=64240 Len=0
  413 37.269332338 192.168.138.9 → 142.250.150.100 TCP 74 42614 → 443 [SYN] Seq=0 Win=64240 Len=0 MSS=1460 SACK_PERM=1 TSval=203829223 TSecr=0 WS=128
  414 37.364539198 142.250.150.100 → 192.168.138.9 TCP 60 443 → 42614 [SYN, ACK] Seq=0 Ack=1 Win=64240 Len=0 MSS=1460
  415 37.364609613 192.168.138.9 → 142.250.150.100 TCP 54 42614 → 443 [ACK] Seq=1 Ack=1 Win=64240 Len=0
  416 37.367566131 192.168.138.9 → 142.250.150.100 TLSv1 571 Client Hello
  417 37.367876973 142.250.150.100 → 192.168.138.9 TCP 60 443 → 42614 [ACK] Seq=1 Ack=518 Win=64240 Len=0
  418 37.423182272 192.168.138.9 → 192.168.138.2 DNS 81 Standard query 0xdf98 A binance.ae OPT
  419 37.423372844 192.168.138.9 → 192.168.138.2 DNS 81 Standard query 0xf08f AAAA binance.ae OPT
  420 37.449893948 192.168.138.9 → 108.177.14.95 TLSv1.2 93 Application Data
  421 37.450327527 108.177.14.95 → 192.168.138.9 TCP 60 443 → 49130 [ACK] Seq=1 Ack=40 Win=64240 Len=0
  422 37.450642694 192.168.138.9 → 108.177.14.95 TLSv1.2 78 Application Data
  423 37.450707163 192.168.138.9 → 108.177.14.95 TCP 54 49130 → 443 [FIN, ACK] Seq=64 Ack=1 Win=63000 Len=0
  424 37.450911212 108.177.14.95 → 192.168.138.9 TCP 60 443 → 49130 [ACK] Seq=1 Ack=64 Win=64240 Len=0
  425 37.451069299 108.177.14.95 → 192.168.138.9 TCP 60 443 → 49130 [ACK] Seq=1 Ack=65 Win=64239 Len=0
  426 37.475548501 142.250.150.100 → 192.168.138.9 TCP 60 443 → 42614 [RST, ACK] Seq=1 Ack=518 Win=64240 Len=0
  427 37.476844944 192.168.138.9 → 142.250.150.102 TCP 74 50918 → 443 [SYN] Seq=0 Win=64240 Len=0 MSS=1460 SACK_PERM=1 TSval=370537955 TSecr=0 WS=128
  428 37.488384499 108.177.14.95 → 192.168.138.9 TCP 60 443 → 49130 [FIN, PSH, ACK] Seq=1 Ack=65 Win=64239 Len=0
  429 37.488408679 192.168.138.9 → 108.177.14.95 TCP 54 49130 → 443 [ACK] Seq=65 Ack=2 Win=63000 Len=0
  430 37.505800649 192.168.138.2 → 192.168.138.9 DNS 97 Standard query response 0xdf98 A binance.ae A 64.190.63.111 OPT
  431 37.561986120 142.250.150.102 → 192.168.138.9 TCP 60 443 → 50918 [SYN, ACK] Seq=0 Ack=1 Win=64240 Len=0 MSS=1460
  432 37.562118512 192.168.138.9 → 142.250.150.102 TCP 54 50918 → 443 [ACK] Seq=1 Ack=1 Win=64240 Len=0
  433 37.568890161 192.168.138.9 → 142.250.150.102 TLSv1 571 Client Hello
  434 37.569357231 142.250.150.102 → 192.168.138.9 TCP 60 443 → 50918 [ACK] Seq=1 Ack=518 Win=64240 Len=0
  435 37.685840098 142.250.150.102 → 192.168.138.9 TCP 60 443 → 50918 [RST, ACK] Seq=1 Ack=518 Win=64240 Len=0
  436 38.382293045 192.168.138.9 → 192.168.138.2 DNS 81 Standard query 0xf08f AAAA binance.ae OPT
  437 38.451324957 192.168.138.9 → 172.67.68.36 TLSv1.2 93 Application Data
  438 38.451859753 192.168.138.9 → 77.88.21.90  TLSv1.2 93 Application Data
  439 38.452139577 172.67.68.36 → 192.168.138.9 TCP 60 443 → 36470 [ACK] Seq=1 Ack=40 Win=64240 Len=0
  440 38.452450192  77.88.21.90 → 192.168.138.9 TCP 60 443 → 40296 [ACK] Seq=1 Ack=40 Win=64240 Len=0
  441 38.452680384 192.168.138.9 → 213.180.204.158 TLSv1.2 93 Application Data
  442 38.453087073 192.168.138.9 → 77.88.21.90  TLSv1.2 93 Application Data
  443 38.453289376 213.180.204.158 → 192.168.138.9 TCP 60 443 → 37448 [ACK] Seq=1 Ack=40 Win=64240 Len=0
  444 38.453568063  77.88.21.90 → 192.168.138.9 TCP 60 443 → 40298 [ACK] Seq=1 Ack=40 Win=64240 Len=0
  445 38.454872652 192.168.138.9 → 213.180.204.158 TLSv1.2 78 Application Data
  446 38.455345605 213.180.204.158 → 192.168.138.9 TCP 60 443 → 37448 [ACK] Seq=1 Ack=64 Win=64240 Len=0
  447 38.455554020 192.168.138.9 → 213.180.204.158 TCP 54 37448 → 443 [FIN, ACK] Seq=64 Ack=1 Win=62780 Len=0
  448 38.456245755 213.180.204.158 → 192.168.138.9 TCP 60 443 → 37448 [ACK] Seq=1 Ack=65 Win=64239 Len=0
  449 38.456543120 192.168.138.9 → 172.67.68.36 TLSv1.2 78 Application Data
  450 38.456624582 192.168.138.9 → 172.67.68.36 TCP 54 36470 → 443 [FIN, ACK] Seq=64 Ack=1 Win=63000 Len=0
  451 38.456671936 172.67.68.36 → 192.168.138.9 TCP 60 443 → 36470 [ACK] Seq=1 Ack=64 Win=64240 Len=0
  452 38.456902862 172.67.68.36 → 192.168.138.9 TCP 60 443 → 36470 [ACK] Seq=1 Ack=65 Win=64239 Len=0
  453 38.457163231 192.168.138.9 → 77.88.21.90  TLSv1.2 78 Application Data
  454 38.457248754 192.168.138.9 → 77.88.21.90  TCP 54 40296 → 443 [FIN, ACK] Seq=64 Ack=1 Win=63000 Len=0
  455 38.457296037  77.88.21.90 → 192.168.138.9 TCP 60 443 → 40296 [ACK] Seq=1 Ack=64 Win=64240 Len=0
  456 38.457662286  77.88.21.90 → 192.168.138.9 TCP 60 443 → 40296 [ACK] Seq=1 Ack=65 Win=64239 Len=0
  457 38.457761476 192.168.138.9 → 77.88.21.90  TLSv1.2 78 Application Data
  458 38.457932783  77.88.21.90 → 192.168.138.9 TCP 60 443 → 40298 [ACK] Seq=1 Ack=64 Win=64240 Len=0
  459 38.457979037 192.168.138.9 → 77.88.21.90  TCP 54 40298 → 443 [FIN, ACK] Seq=64 Ack=1 Win=62780 Len=0
  460 38.458206253  77.88.21.90 → 192.168.138.9 TCP 60 443 → 40298 [ACK] Seq=1 Ack=65 Win=64239 Len=0
  461 38.472855059 192.168.138.2 → 192.168.138.9 DNS 154 Standard query response 0xf08f AAAA binance.ae SOA ns1.sedoparking.com OPT
  462 38.473327910 192.168.138.9 → 64.190.63.111 ICMP 98 Echo (ping) request  id=0x4dfb, seq=1/256, ttl=64
  463 38.501204720 172.67.68.36 → 192.168.138.9 TCP 60 443 → 36470 [FIN, PSH, ACK] Seq=1 Ack=65 Win=64239 Len=0
  464 38.501227669 192.168.138.9 → 172.67.68.36 TCP 54 36470 → 443 [ACK] Seq=65 Ack=2 Win=63000 Len=0
  465 38.512347438  77.88.21.90 → 192.168.138.9 TLSv1.2 117 Application Data, Application Data
  466 38.512461246 192.168.138.9 → 77.88.21.90  TCP 54 40298 → 443 [RST] Seq=65 Win=0 Len=0
  467 38.512557827  77.88.21.90 → 192.168.138.9 TLSv1.2 93 Application Data
  468 38.512571426 192.168.138.9 → 77.88.21.90  TCP 54 40296 → 443 [RST] Seq=65 Win=0 Len=0
  469 38.527884955 213.180.204.158 → 192.168.138.9 TCP 60 443 → 37448 [FIN, PSH, ACK] Seq=1 Ack=65 Win=64239 Len=0
  470 38.527914697 192.168.138.9 → 213.180.204.158 TCP 54 37448 → 443 [ACK] Seq=65 Ack=2 Win=62780 Len=0
  471 38.550874771 64.190.63.111 → 192.168.138.9 ICMP 98 Echo (ping) reply    id=0x4dfb, seq=1/256, ttl=128 (request in 462)
  472 38.551355143 192.168.138.9 → 192.168.138.2 DNS 97 Standard query 0xa9af PTR 111.63.190.64.in-addr.arpa OPT
  473 38.601506735 192.168.138.2 → 192.168.138.9 DNS 181 Standard query response 0xa9af No such name PTR 111.63.190.64.in-addr.arpa SOA ns-735.awsdns-27.net OPT
  474 38.602032487 192.168.138.9 → 192.168.138.2 DNS 86 Standard query 0xa9af PTR 111.63.190.64.in-addr.arpa
  475 38.681654944 192.168.138.2 → 192.168.138.9 DNS 170 Standard query response 0xa9af No such name PTR 111.63.190.64.in-addr.arpa SOA ns-735.awsdns-27.net
  476 39.474945748 192.168.138.9 → 64.190.63.111 ICMP 98 Echo (ping) request  id=0x4dfb, seq=2/512, ttl=64
  477 39.546227664 Vmware_ee:2d:b6 → Broadcast    ARP 60 Who has 192.168.138.9? Tell 192.168.138.2
  478 39.546257646 Vmware_74:97:e4 → Vmware_ee:2d:b6 ARP 42 192.168.138.9 is at 00:0c:29:74:97:e4
  479 39.546505163 64.190.63.111 → 192.168.138.9 ICMP 98 Echo (ping) reply    id=0x4dfb, seq=2/512, ttl=128 (request in 476)
  480 40.456245877 192.168.138.9 → 77.88.55.55  TLSv1.2 93 Application Data
  481 40.456500490 192.168.138.9 → 178.154.131.217 TLSv1.2 93 Application Data
  482 40.456637928  77.88.55.55 → 192.168.138.9 TCP 60 443 → 51480 [ACK] Seq=1 Ack=40 Win=64240 Len=0
  483 40.456736721 192.168.138.9 → 34.194.183.208 TLSv1.2 100 Application Data
  484 40.456852482 178.154.131.217 → 192.168.138.9 TCP 60 443 → 59288 [ACK] Seq=1 Ack=40 Win=64240 Len=0
  485 40.456946580 192.168.138.9 → 35.207.24.13 TLSv1.2 93 Application Data
  486 40.457034975 34.194.183.208 → 192.168.138.9 TCP 60 443 → 42754 [ACK] Seq=1 Ack=47 Win=64240 Len=0
  487 40.457208600 35.207.24.13 → 192.168.138.9 TCP 60 443 → 40552 [ACK] Seq=1 Ack=40 Win=64240 Len=0
  488 40.457405481 192.168.138.9 → 35.207.24.13 TLSv1.2 78 Application Data
  489 40.457532910 35.207.24.13 → 192.168.138.9 TCP 60 443 → 40552 [ACK] Seq=1 Ack=64 Win=64240 Len=0
  490 40.457581878 192.168.138.9 → 35.207.24.13 TCP 54 40552 → 443 [FIN, ACK] Seq=64 Ack=1 Win=63000 Len=0
  491 40.457845938 35.207.24.13 → 192.168.138.9 TCP 60 443 → 40552 [ACK] Seq=1 Ack=65 Win=64239 Len=0
  492 40.458017800 192.168.138.9 → 178.154.131.217 TLSv1.2 78 Application Data
  493 40.458081452 178.154.131.217 → 192.168.138.9 TCP 60 443 → 59288 [ACK] Seq=1 Ack=64 Win=64240 Len=0
  494 40.458190893 192.168.138.9 → 178.154.131.217 TCP 54 59288 → 443 [FIN, ACK] Seq=64 Ack=1 Win=65535 Len=0
  495 40.458374493 178.154.131.217 → 192.168.138.9 TCP 60 443 → 59288 [ACK] Seq=1 Ack=65 Win=64239 Len=0
  496 40.458575076 192.168.138.9 → 77.88.55.55  TLSv1.2 78 Application Data
  497 40.458630714  77.88.55.55 → 192.168.138.9 TCP 60 443 → 51480 [ACK] Seq=1 Ack=64 Win=64240 Len=0
  498 40.458724511 192.168.138.9 → 77.88.55.55  TCP 54 51480 → 443 [FIN, ACK] Seq=64 Ack=1 Win=65535 Len=0
  499 40.458932465  77.88.55.55 → 192.168.138.9 TCP 60 443 → 51480 [ACK] Seq=1 Ack=65 Win=64239 Len=0
  500 40.459248244 192.168.138.9 → 34.194.183.208 TLSv1.2 85 Encrypted Alert
  501 40.459353999 34.194.183.208 → 192.168.138.9 TCP 60 443 → 42754 [ACK] Seq=1 Ack=78 Win=64240 Len=0
  502 40.459391834 192.168.138.9 → 34.194.183.208 TCP 54 42754 → 443 [FIN, ACK] Seq=78 Ack=1 Win=62780 Len=0
  503 40.459561944 34.194.183.208 → 192.168.138.9 TCP 60 443 → 42754 [ACK] Seq=1 Ack=79 Win=64239 Len=0
  504 40.478037436 192.168.138.9 → 104.16.249.249 TLSv1.2 93 Application Data
  505 40.478402437 104.16.249.249 → 192.168.138.9 TCP 60 443 → 58256 [ACK] Seq=4212 Ack=1740 Win=64240 Len=0
  506 40.503000940 104.16.249.249 → 192.168.138.9 TLSv1.2 93 Application Data
  507 40.503029104 192.168.138.9 → 104.16.249.249 TCP 54 58256 → 443 [ACK] Seq=1740 Ack=4251 Win=65535 Len=0
  508 40.524191830 178.154.131.217 → 192.168.138.9 TCP 60 443 → 59288 [FIN, PSH, ACK] Seq=1 Ack=65 Win=64239 Len=0
  509 40.524247544 192.168.138.9 → 178.154.131.217 TCP 54 59288 → 443 [ACK] Seq=65 Ack=2 Win=27264 Len=0
  510 40.528993136  77.88.55.55 → 192.168.138.9 TLSv1.2 117 Application Data, Application Data
  511 40.529047398 192.168.138.9 → 77.88.55.55  TCP 54 51480 → 443 [RST] Seq=65 Win=0 Len=0
  512 40.624837075 34.194.183.208 → 192.168.138.9 TCP 60 443 → 42754 [FIN, PSH, ACK] Seq=1 Ack=79 Win=64239 Len=0
  513 40.624857449 192.168.138.9 → 34.194.183.208 TCP 54 42754 → 443 [ACK] Seq=79 Ack=2 Win=62780 Len=0
  514 40.631647969 35.207.24.13 → 192.168.138.9 TLSv1.2 78 Application Data
  515 40.631669068 192.168.138.9 → 35.207.24.13 TCP 54 40552 → 443 [RST] Seq=65 Win=0 Len=0
  516 41.458620083 192.168.138.9 → 172.67.68.36 TLSv1.2 93 Application Data
  517 41.459532580 172.67.68.36 → 192.168.138.9 TCP 60 443 → 44174 [ACK] Seq=1 Ack=40 Win=64240 Len=0
  518 41.460159777 192.168.138.9 → 172.67.68.36 TLSv1.2 78 Application Data
  519 41.460445836 172.67.68.36 → 192.168.138.9 TCP 60 443 → 44174 [ACK] Seq=1 Ack=64 Win=64240 Len=0
  520 41.460911984 192.168.138.9 → 172.67.68.36 TCP 54 44174 → 443 [FIN, ACK] Seq=64 Ack=1 Win=63558 Len=0
  521 41.461665552 172.67.68.36 → 192.168.138.9 TCP 60 443 → 44174 [ACK] Seq=1 Ack=65 Win=64239 Len=0
  522 41.500036670 192.168.138.2 → 192.168.138.9 DNS 154 Standard query response 0xf08f AAAA binance.ae SOA ns1.sedoparking.com OPT
  523 41.500097294 192.168.138.9 → 192.168.138.2 ICMP 182 Destination unreachable (Port unreachable)
  524 41.506703957 172.67.68.36 → 192.168.138.9 TCP 60 443 → 44174 [FIN, PSH, ACK] Seq=1 Ack=65 Win=64239 Len=0
  525 41.506758412 192.168.138.9 → 172.67.68.36 TCP 54 44174 → 443 [ACK] Seq=65 Ack=2 Win=63558 Len=0
  526 45.202188360 157.240.253.35 → 192.168.138.9 TCP 60 443 → 49118 [RST, ACK] Seq=1 Ack=518 Win=64240 Len=0
  527 45.202898833 192.168.138.9 → 157.240.253.35 TCP 74 59284 → 443 [SYN] Seq=0 Win=64240 Len=0 MSS=1460 SACK_PERM=1 TSval=2968047045 TSecr=0 WS=128
  528 45.316762294 157.240.253.35 → 192.168.138.9 TCP 60 443 → 59284 [SYN, ACK] Seq=0 Ack=1 Win=64240 Len=0 MSS=1460
  529 45.316809771 192.168.138.9 → 157.240.253.35 TCP 54 59284 → 443 [ACK] Seq=1 Ack=1 Win=64240 Len=0
  530 45.320036908 192.168.138.9 → 157.240.253.35 TLSv1 571 Client Hello
  531 45.320334111 157.240.253.35 → 192.168.138.9 TCP 60 443 → 59284 [ACK] Seq=1 Ack=518 Win=64240 Len=0
  532 46.204102583 192.168.138.9 → 104.16.249.249 TLSv1.2 93 Application Data
  533 46.205088764 104.16.249.249 → 192.168.138.9 TCP 60 443 → 58256 [ACK] Seq=4251 Ack=1779 Win=64240 Len=0
  534 46.230148500 104.16.249.249 → 192.168.138.9 TLSv1.2 93 Application Data
  535 46.230193027 192.168.138.9 → 104.16.249.249 TCP 54 58256 → 443 [ACK] Seq=1779 Ack=4290 Win=65535 Len=0
  536 47.512461139 172.67.68.36 → 192.168.138.9 TLSv1.2 79 Application Data
  537 47.514291049 192.168.138.9 → 172.67.68.36 TLSv1.2 83 Application Data
  538 47.514808115 172.67.68.36 → 192.168.138.9 TCP 60 443 → 44180 [ACK] Seq=51 Ack=59 Win=64240 Len=0
  539 52.206564981 192.168.138.9 → 104.16.249.249 TLSv1.2 93 Application Data
  540 52.207545480 104.16.249.249 → 192.168.138.9 TCP 60 443 → 58256 [ACK] Seq=4290 Ack=1818 Win=64240 Len=0
  541 52.237617972 104.16.249.249 → 192.168.138.9 TLSv1.2 93 Application Data
  542 52.237663789 192.168.138.9 → 104.16.249.249 TCP 54 58256 → 443 [ACK] Seq=1818 Ack=4329 Win=65535 Len=0
  543 55.513732819 192.168.138.9 → 157.240.253.35 TCP 54 [TCP Keep-Alive] 59284 → 443 [ACK] Seq=517 Ack=1 Win=64240 Len=0
  544 55.691781277 192.168.138.9 → 192.168.138.2 DNS 78 Standard query 0x7e03 A link.co OPT
  545 55.691978158 192.168.138.9 → 192.168.138.2 DNS 78 Standard query 0xdec9 AAAA link.co OPT
  546 55.824884347 192.168.138.2 → 192.168.138.9 DNS 159 Standard query response 0xdec9 AAAA link.co SOA ns-423.awsdns-52.com OPT
  547 55.837063708 192.168.138.2 → 192.168.138.9 DNS 126 Standard query response 0x7e03 A link.co A 52.49.17.168 A 18.202.131.124 A 52.30.58.64 OPT
  548 55.847421855 192.168.138.9 → 52.49.17.168 ICMP 98 Echo (ping) request  id=0x4e61, seq=1/256, ttl=64
  549 56.538904343 192.168.138.9 → 157.240.253.35 TCP 54 [TCP Keep-Alive] 59284 → 443 [ACK] Seq=517 Ack=1 Win=64240 Len=0
  550 56.539516830 157.240.253.35 → 192.168.138.9 TCP 60 [TCP Keep-Alive ACK] 443 → 59284 [ACK] Seq=1 Ack=518 Win=64240 Len=0
  551 56.858090347 192.168.138.9 → 52.49.17.168 ICMP 98 Echo (ping) request  id=0x4e61, seq=2/512, ttl=64
  552 57.460826870 192.168.138.9 → 87.250.251.119 TLSv1.2 93 Application Data
  553 57.461430041 192.168.138.9 → 64.233.165.95 TLSv1.2 93 Application Data
  554 57.461871224 87.250.251.119 → 192.168.138.9 TCP 60 443 → 37462 [ACK] Seq=57 Ack=118 Win=64240 Len=0
  555 57.461905647 64.233.165.95 → 192.168.138.9 TCP 60 443 → 41434 [ACK] Seq=40 Ack=79 Win=64240 Len=0
  556 57.462368932 192.168.138.9 → 64.233.165.95 TLSv1.2 78 Application Data
  557 57.462571353 192.168.138.9 → 64.233.165.95 TCP 54 41434 → 443 [FIN, ACK] Seq=103 Ack=40 Win=63000 Len=0
  558 57.462756611 64.233.165.95 → 192.168.138.9 TCP 60 443 → 41434 [ACK] Seq=40 Ack=103 Win=64240 Len=0
  559 57.463246416 64.233.165.95 → 192.168.138.9 TCP 60 443 → 41434 [ACK] Seq=40 Ack=104 Win=64239 Len=0
  560 57.463678429 192.168.138.9 → 87.250.251.119 TLSv1.2 78 Application Data
  561 57.472685912 192.168.138.9 → 87.250.251.119 TCP 54 37462 → 443 [FIN, ACK] Seq=142 Ack=57 Win=65535 Len=0
  562 57.472787735 87.250.251.119 → 192.168.138.9 TCP 60 443 → 37462 [ACK] Seq=57 Ack=142 Win=64240 Len=0
  563 57.473412688 87.250.251.119 → 192.168.138.9 TCP 60 443 → 37462 [ACK] Seq=57 Ack=143 Win=64239 Len=0
  564 57.570603335 64.233.165.95 → 192.168.138.9 TCP 60 443 → 41434 [FIN, PSH, ACK] Seq=40 Ack=104 Win=64239 Len=0
  565 57.570659352 192.168.138.9 → 64.233.165.95 TCP 54 41434 → 443 [ACK] Seq=104 Ack=41 Win=63000 Len=0
  566 57.575874912 87.250.251.119 → 192.168.138.9 TLSv1.2 93 Application Data
  567 57.575927309 192.168.138.9 → 87.250.251.119 TCP 54 37462 → 443 [RST] Seq=143 Win=0 Len=0
  568 57.882025992 192.168.138.9 → 52.49.17.168 ICMP 98 Echo (ping) request  id=0x4e61, seq=3/768, ttl=64
  569 58.209350399 192.168.138.9 → 104.16.249.249 TLSv1.2 93 Application Data
  570 58.210201635 104.16.249.249 → 192.168.138.9 TCP 60 443 → 58256 [ACK] Seq=4329 Ack=1857 Win=64240 Len=0
  571 58.236113083 104.16.249.249 → 192.168.138.9 TLSv1.2 93 Application Data
  572 58.236160178 192.168.138.9 → 104.16.249.249 TCP 54 58256 → 443 [ACK] Seq=1857 Ack=4368 Win=65535 Len=0
  573 58.462500173 192.168.138.9 → 199.232.194.49 TLSv1.2 100 Application Data
  574 58.462926645 192.168.138.9 → 172.66.43.142 TLSv1.2 93 Application Data
  575 58.463232497 192.168.138.9 → 142.251.1.196 TLSv1.2 93 Application Data
  576 58.463604878 199.232.194.49 → 192.168.138.9 TCP 60 443 → 42402 [ACK] Seq=47 Ack=93 Win=64240 Len=0
  577 58.463639717 172.66.43.142 → 192.168.138.9 TCP 60 443 → 55196 [ACK] Seq=40 Ack=79 Win=64240 Len=0
  578 58.463645462 142.251.1.196 → 192.168.138.9 TCP 60 443 → 54100 [ACK] Seq=40 Ack=79 Win=64240 Len=0
  579 58.463687745 192.168.138.9 → 52.85.49.3   TLSv1.2 93 Application Data
  580 58.464633442   52.85.49.3 → 192.168.138.9 TCP 60 443 → 43142 [ACK] Seq=40 Ack=79 Win=64240 Len=0
  581 58.464816622 192.168.138.9 → 172.66.43.142 TLSv1.2 78 Application Data
  582 58.464984587 192.168.138.9 → 172.66.43.142 TCP 54 55196 → 443 [FIN, ACK] Seq=103 Ack=40 Win=65535 Len=0
  583 58.465524448 172.66.43.142 → 192.168.138.9 TCP 60 443 → 55196 [ACK] Seq=40 Ack=103 Win=64240 Len=0
  584 58.465590118 172.66.43.142 → 192.168.138.9 TCP 60 443 → 55196 [ACK] Seq=40 Ack=104 Win=64239 Len=0
  585 58.466458508 192.168.138.9 → 52.85.49.3   TLSv1.2 78 Application Data
  586 58.466498182 192.168.138.9 → 52.85.49.3   TCP 54 43142 → 443 [FIN, ACK] Seq=103 Ack=40 Win=65535 Len=0
  587 58.466540782   52.85.49.3 → 192.168.138.9 TCP 60 443 → 43142 [ACK] Seq=40 Ack=103 Win=64240 Len=0
  588 58.466701051 192.168.138.9 → 142.251.1.196 TLSv1.2 78 Application Data
  589 58.466962501   52.85.49.3 → 192.168.138.9 TCP 60 443 → 43142 [ACK] Seq=40 Ack=104 Win=64239 Len=0
  590 58.466984762 192.168.138.9 → 142.251.1.196 TCP 54 54100 → 443 [FIN, ACK] Seq=103 Ack=40 Win=63000 Len=0
  591 58.467092153 142.251.1.196 → 192.168.138.9 TCP 60 443 → 54100 [ACK] Seq=40 Ack=103 Win=64240 Len=0
  592 58.467156740 142.251.1.196 → 192.168.138.9 TCP 60 443 → 54100 [ACK] Seq=40 Ack=104 Win=64239 Len=0
  593 58.467457219 192.168.138.9 → 199.232.194.49 TLSv1.2 85 Encrypted Alert
  594 58.467484742 192.168.138.9 → 199.232.194.49 TCP 54 42402 → 443 [FIN, ACK] Seq=124 Ack=47 Win=62780 Len=0
  595 58.467615353 199.232.194.49 → 192.168.138.9 TCP 60 443 → 42402 [ACK] Seq=47 Ack=124 Win=64240 Len=0
  596 58.467829164 199.232.194.49 → 192.168.138.9 TCP 60 443 → 42402 [ACK] Seq=47 Ack=125 Win=64239 Len=0
  597 58.551920324 142.251.1.196 → 192.168.138.9 TCP 60 443 → 54100 [FIN, PSH, ACK] Seq=40 Ack=104 Win=64239 Len=0
  598 58.551975973 192.168.138.9 → 142.251.1.196 TCP 54 54100 → 443 [ACK] Seq=104 Ack=41 Win=63000 Len=0
  599 58.552475465 172.66.43.142 → 192.168.138.9 TCP 60 443 → 55196 [FIN, PSH, ACK] Seq=40 Ack=104 Win=64239 Len=0
  600 58.552496220 192.168.138.9 → 172.66.43.142 TCP 54 55196 → 443 [ACK] Seq=104 Ack=41 Win=39748 Len=0
  601 58.627678069   52.85.49.3 → 192.168.138.9 TCP 60 443 → 43142 [FIN, PSH, ACK] Seq=40 Ack=104 Win=64239 Len=0
  602 58.627731239 192.168.138.9 → 52.85.49.3   TCP 54 43142 → 443 [ACK] Seq=104 Ack=41 Win=21604 Len=0
  603 58.675943926 199.232.194.49 → 192.168.138.9 TLSv1.2 85 Encrypted Alert
  604 58.675983210 192.168.138.9 → 199.232.194.49 TCP 54 42402 → 443 [RST] Seq=125 Win=0 Len=0
  605 58.906162636 192.168.138.9 → 52.49.17.168 ICMP 98 Echo (ping) request  id=0x4e61, seq=4/1024, ttl=64
  606 59.462806045 192.168.138.9 → 157.240.253.1 TLSv1.2 93 Application Data
  607 59.462992873 192.168.138.9 → 13.33.243.59 TLSv1.2 93 Application Data
  608 59.463115130 157.240.253.1 → 192.168.138.9 TCP 60 443 → 53954 [ACK] Seq=40 Ack=79 Win=64240 Len=0
  609 59.463128839 192.168.138.9 → 142.251.1.84 TLSv1.2 93 Application Data
  610 59.463229922 192.168.138.9 → 173.194.221.94 TLSv1.2 93 Application Data
  611 59.463314392 13.33.243.59 → 192.168.138.9 TCP 60 443 → 43490 [ACK] Seq=40 Ack=79 Win=64240 Len=0
  612 59.463336949 142.251.1.84 → 192.168.138.9 TCP 60 443 → 51768 [ACK] Seq=40 Ack=79 Win=64240 Len=0
  613 59.463558054 173.194.221.94 → 192.168.138.9 TCP 60 443 → 44488 [ACK] Seq=40 Ack=79 Win=64240 Len=0
  614 59.463758460 192.168.138.9 → 13.33.243.59 TLSv1.2 78 Application Data
  615 59.463802402 192.168.138.9 → 13.33.243.59 TCP 54 43490 → 443 [FIN, ACK] Seq=103 Ack=40 Win=65535 Len=0
  616 59.463920157 13.33.243.59 → 192.168.138.9 TCP 60 443 → 43490 [ACK] Seq=40 Ack=103 Win=64240 Len=0
  617 59.463985215 13.33.243.59 → 192.168.138.9 TCP 60 443 → 43490 [ACK] Seq=40 Ack=104 Win=64239 Len=0
  618 59.464021282 192.168.138.9 → 173.194.221.94 TLSv1.2 78 Application Data
  619 59.464061543 192.168.138.9 → 173.194.221.94 TCP 54 44488 → 443 [FIN, ACK] Seq=103 Ack=40 Win=62780 Len=0
  620 59.464174163 173.194.221.94 → 192.168.138.9 TCP 60 443 → 44488 [ACK] Seq=40 Ack=103 Win=64240 Len=0
  621 59.464178208 173.194.221.94 → 192.168.138.9 TCP 60 443 → 44488 [ACK] Seq=40 Ack=104 Win=64239 Len=0
  622 59.464353894 192.168.138.9 → 142.251.1.84 TLSv1.2 78 Application Data
  623 59.464391321 192.168.138.9 → 142.251.1.84 TCP 54 51768 → 443 [FIN, ACK] Seq=103 Ack=40 Win=63000 Len=0
  624 59.464520004 142.251.1.84 → 192.168.138.9 TCP 60 443 → 51768 [ACK] Seq=40 Ack=103 Win=64240 Len=0
  625 59.464586844 192.168.138.9 → 157.240.253.1 TLSv1.2 78 Application Data
  626 59.464613063 192.168.138.9 → 157.240.253.1 TCP 54 53954 → 443 [FIN, ACK] Seq=103 Ack=40 Win=62780 Len=0
  627 59.464664464 142.251.1.84 → 192.168.138.9 TCP 60 443 → 51768 [ACK] Seq=40 Ack=104 Win=64239 Len=0
  628 59.464671961 157.240.253.1 → 192.168.138.9 TCP 60 443 → 53954 [ACK] Seq=40 Ack=103 Win=64240 Len=0
  629 59.464742225 157.240.253.1 → 192.168.138.9 TCP 60 443 → 53954 [ACK] Seq=40 Ack=104 Win=64239 Len=0
  630 59.501566502 142.251.1.84 → 192.168.138.9 TCP 60 443 → 51768 [FIN, PSH, ACK] Seq=40 Ack=104 Win=64239 Len=0
  631 59.501591009 192.168.138.9 → 142.251.1.84 TCP 54 51768 → 443 [ACK] Seq=104 Ack=41 Win=63000 Len=0
  632 59.502299094 173.194.221.94 → 192.168.138.9 TCP 60 443 → 44488 [FIN, PSH, ACK] Seq=40 Ack=104 Win=64239 Len=0
  633 59.502318317 192.168.138.9 → 173.194.221.94 TCP 54 44488 → 443 [ACK] Seq=104 Ack=41 Win=62780 Len=0
  634 59.527680344 13.33.243.59 → 192.168.138.9 TCP 60 443 → 43490 [FIN, PSH, ACK] Seq=40 Ack=104 Win=64239 Len=0
  635 59.527722749 192.168.138.9 → 13.33.243.59 TCP 54 43490 → 443 [ACK] Seq=104 Ack=41 Win=48508 Len=0
  636 59.541996369 157.240.253.1 → 192.168.138.9 TLSv1.2 93 Application Data
  637 59.542056071 192.168.138.9 → 157.240.253.1 TCP 54 53954 → 443 [RST] Seq=104 Win=0 Len=0
  638 59.930115217 192.168.138.9 → 52.49.17.168 ICMP 98 Echo (ping) request  id=0x4e61, seq=5/1280, ttl=64
  639 60.464638783 192.168.138.9 → 157.240.253.1 TLSv1.2 93 Application Data
  640 60.465175368 157.240.253.1 → 192.168.138.9 TCP 60 443 → 53962 [ACK] Seq=40 Ack=79 Win=64240 Len=0
  641 60.465501616 192.168.138.9 → 157.240.253.1 TLSv1.2 78 Application Data
  642 60.465674279 192.168.138.9 → 157.240.253.1 TCP 54 53962 → 443 [FIN, ACK] Seq=103 Ack=40 Win=65535 Len=0
  643 60.466104139 157.240.253.1 → 192.168.138.9 TCP 60 443 → 53962 [ACK] Seq=40 Ack=103 Win=64240 Len=0
  644 60.466693110 157.240.253.1 → 192.168.138.9 TCP 60 443 → 53962 [ACK] Seq=40 Ack=104 Win=64239 Len=0
  645 60.519322124 157.240.253.1 → 192.168.138.9 TLSv1.2 93 Application Data
  646 60.519376260 192.168.138.9 → 157.240.253.1 TCP 54 53962 → 443 [RST] Seq=104 Win=0 Len=0
  647 60.954222133 192.168.138.9 → 52.49.17.168 ICMP 98 Echo (ping) request  id=0x4e61, seq=6/1536, ttl=64
  648 61.978246989 192.168.138.9 → 52.49.17.168 ICMP 98 Echo (ping) request  id=0x4e61, seq=7/1792, ttl=64
  649 63.001816337 192.168.138.9 → 52.49.17.168 ICMP 98 Echo (ping) request  id=0x4e61, seq=8/2048, ttl=64
  650 64.027039463 192.168.138.9 → 52.49.17.168 ICMP 98 Echo (ping) request  id=0x4e61, seq=9/2304, ttl=64
  651 64.212498420 192.168.138.9 → 104.16.249.249 TLSv1.2 93 Application Data
  652 64.213402914 104.16.249.249 → 192.168.138.9 TCP 60 443 → 58256 [ACK] Seq=4368 Ack=1896 Win=64240 Len=0
  653 64.236582127 104.16.249.249 → 192.168.138.9 TLSv1.2 93 Application Data
  654 64.236626854 192.168.138.9 → 104.16.249.249 TCP 54 58256 → 443 [ACK] Seq=1896 Ack=4407 Win=65535 Len=0
  655 66.575383000 157.240.253.35 → 192.168.138.9 TCP 60 443 → 59284 [RST, ACK] Seq=1 Ack=518 Win=64240 Len=0
  656 66.577946152 192.168.138.9 → 157.240.253.35 TCP 74 48164 → 443 [SYN] Seq=0 Win=64240 Len=0 MSS=1460 SACK_PERM=1 TSval=2968068420 TSecr=0 WS=128
  657 66.688109213 157.240.253.35 → 192.168.138.9 TCP 60 443 → 48164 [SYN, ACK] Seq=0 Ack=1 Win=64240 Len=0 MSS=1460
  658 66.688181189 192.168.138.9 → 157.240.253.35 TCP 54 48164 → 443 [ACK] Seq=1 Ack=1 Win=64240 Len=0
  659 66.692039643 192.168.138.9 → 157.240.253.35 TLSv1 571 Client Hello
  660 66.692395244 157.240.253.35 → 192.168.138.9 TCP 60 443 → 48164 [ACK] Seq=1 Ack=518 Win=64240 Len=0
  661 68.466443346 192.168.138.9 → 64.233.161.198 TLSv1.2 93 Application Data
  662 68.467224859 64.233.161.198 → 192.168.138.9 TCP 60 443 → 44314 [ACK] Seq=40 Ack=79 Win=64240 Len=0
  663 68.467434231 192.168.138.9 → 64.233.161.198 TLSv1.2 78 Application Data
  664 68.467804482 64.233.161.198 → 192.168.138.9 TCP 60 443 → 44314 [ACK] Seq=40 Ack=103 Win=64240 Len=0
  665 68.468184833 192.168.138.9 → 64.233.161.198 TCP 54 44314 → 443 [FIN, ACK] Seq=103 Ack=40 Win=65535 Len=0
  666 68.468753245 64.233.161.198 → 192.168.138.9 TCP 60 443 → 44314 [ACK] Seq=40 Ack=104 Win=64239 Len=0
  667 68.610777696 64.233.161.198 → 192.168.138.9 TCP 60 443 → 44314 [FIN, PSH, ACK] Seq=40 Ack=104 Win=64239 Len=0
  668 68.610827255 192.168.138.9 → 64.233.161.198 TCP 54 44314 → 443 [ACK] Seq=104 Ack=41 Win=21024 Len=0
  669 69.579412503 192.168.138.9 → 104.16.249.249 TLSv1.2 93 Application Data
  670 69.580213227 104.16.249.249 → 192.168.138.9 TCP 60 443 → 58256 [ACK] Seq=4407 Ack=1935 Win=64240 Len=0
  671 69.606291672 104.16.249.249 → 192.168.138.9 TLSv1.2 93 Application Data
  672 69.606335967 192.168.138.9 → 104.16.249.249 TCP 54 58256 → 443 [ACK] Seq=1935 Ack=4446 Win=65535 Len=0
  673 69.970804976 192.168.138.9 → 192.168.138.2 DNS 79 Standard query 0xb46a A ucoz.com OPT
  674 69.971030281 192.168.138.9 → 192.168.138.2 DNS 79 Standard query 0x76c9 AAAA ucoz.com OPT
  675 70.138398002 192.168.138.2 → 192.168.138.9 DNS 95 Standard query response 0xb46a A ucoz.com A 213.174.157.200 OPT
  676 70.882053239 192.168.138.9 → 192.168.138.2 DNS 79 Standard query 0x76c9 AAAA ucoz.com OPT
  677 70.933007415 192.168.138.2 → 192.168.138.9 DNS 136 Standard query response 0x76c9 AAAA ucoz.com SOA ns1.ucoz.net OPT
  678 70.934101917 192.168.138.9 → 213.174.157.200 ICMP 98 Echo (ping) request  id=0x4e77, seq=1/256, ttl=64
  679 71.072029378 213.174.157.200 → 192.168.138.9 ICMP 98 Echo (ping) reply    id=0x4e77, seq=1/256, ttl=128 (request in 678)
  680 71.072409657 192.168.138.9 → 192.168.138.2 DNS 99 Standard query 0xf26b PTR 200.157.174.213.in-addr.arpa OPT
  681 71.163042245 192.168.138.2 → 192.168.138.9 DNS 126 Standard query response 0xf26b PTR 200.157.174.213.in-addr.arpa PTR s100.ucoz.net OPT
  682 71.468468360 192.168.138.9 → 52.85.49.3   TLSv1.2 93 Application Data
  683 71.468988905 192.168.138.9 → 64.233.162.94 TLSv1.2 93 Application Data
  684 71.469314142   52.85.49.3 → 192.168.138.9 TCP 60 443 → 43130 [ACK] Seq=40 Ack=79 Win=64240 Len=0
  685 71.469752270 64.233.162.94 → 192.168.138.9 TCP 60 443 → 43340 [ACK] Seq=40 Ack=79 Win=64240 Len=0
  686 71.469867855 192.168.138.9 → 52.85.49.3   TLSv1.2 78 Application Data
  687 71.470053416 192.168.138.9 → 52.85.49.3   TCP 54 43130 → 443 [FIN, ACK] Seq=103 Ack=40 Win=63000 Len=0
  688 71.470573162   52.85.49.3 → 192.168.138.9 TCP 60 443 → 43130 [ACK] Seq=40 Ack=103 Win=64240 Len=0
  689 71.470871976   52.85.49.3 → 192.168.138.9 TCP 60 443 → 43130 [ACK] Seq=40 Ack=104 Win=64239 Len=0
  690 71.470927780 192.168.138.9 → 64.233.162.94 TLSv1.2 78 Application Data
  691 71.471171824 192.168.138.9 → 64.233.162.94 TCP 54 43340 → 443 [FIN, ACK] Seq=103 Ack=40 Win=65535 Len=0
  692 71.471692631 64.233.162.94 → 192.168.138.9 TCP 60 443 → 43340 [ACK] Seq=40 Ack=103 Win=64240 Len=0
  693 71.471973653 64.233.162.94 → 192.168.138.9 TCP 60 443 → 43340 [ACK] Seq=40 Ack=104 Win=64239 Len=0
  694 71.522743946 64.233.162.94 → 192.168.138.9 TCP 60 443 → 43340 [FIN, PSH, ACK] Seq=40 Ack=104 Win=64239 Len=0
  695 71.522768298 192.168.138.9 → 64.233.162.94 TCP 54 43340 → 443 [ACK] Seq=104 Ack=41 Win=57596 Len=0
  696 71.539475502   52.85.49.3 → 192.168.138.9 TCP 60 443 → 43130 [FIN, PSH, ACK] Seq=40 Ack=104 Win=64239 Len=0
  697 71.539499863 192.168.138.9 → 52.85.49.3   TCP 54 43130 → 443 [ACK] Seq=104 Ack=41 Win=63000 Len=0
  698 71.935969774 192.168.138.9 → 213.174.157.200 ICMP 98 Echo (ping) request  id=0x4e77, seq=2/512, ttl=64
  699 72.114774627 213.174.157.200 → 192.168.138.9 ICMP 98 Echo (ping) reply    id=0x4e77, seq=2/512, ttl=128 (request in 698)
  700 72.383585162 192.168.138.9 → 192.168.138.2 DNS 97 Standard query 0x0f05 A mozilla.cloudflare-dns.com OPT
  701 72.384281772 192.168.138.9 → 192.168.138.2 DNS 97 Standard query 0xb737 AAAA mozilla.cloudflare-dns.com OPT
  702 72.385082128 192.168.138.9 → 104.16.249.249 TLSv1.2 110 Application Data
  703 72.385250816 192.168.138.9 → 104.16.249.249 TLSv1.2 213 Application Data
  704 72.385644977 104.16.249.249 → 192.168.138.9 TCP 60 443 → 58256 [ACK] Seq=4446 Ack=1991 Win=64240 Len=0
  705 72.385667336 104.16.249.249 → 192.168.138.9 TCP 60 443 → 58256 [ACK] Seq=4446 Ack=2150 Win=64240 Len=0
  706 72.386245810 192.168.138.9 → 104.16.249.249 TLSv1.2 110 Application Data
  707 72.386387335 192.168.138.9 → 104.16.249.249 TLSv1.2 213 Application Data
  708 72.386464018 104.16.249.249 → 192.168.138.9 TCP 60 443 → 58256 [ACK] Seq=4446 Ack=2206 Win=64240 Len=0
  709 72.386759171 104.16.249.249 → 192.168.138.9 TCP 60 443 → 58256 [ACK] Seq=4446 Ack=2365 Win=64240 Len=0
  710 72.417864522 104.16.249.249 → 192.168.138.9 TLSv1.2 89 Application Data
  711 72.417933447 192.168.138.9 → 104.16.249.249 TCP 54 58256 → 443 [ACK] Seq=2365 Ack=4481 Win=65535 Len=0
  712 72.456035416 104.16.249.249 → 192.168.138.9 TLSv1.2 1176 Application Data, Application Data, Application Data
  713 72.456056393 192.168.138.9 → 104.16.249.249 TCP 54 58256 → 443 [ACK] Seq=2365 Ack=5603 Win=65535 Len=0
  714 72.456854289 192.168.138.9 → 34.117.237.239 TCP 74 55136 → 443 [SYN] Seq=0 Win=64240 Len=0 MSS=1460 SACK_PERM=1 TSval=596549224 TSecr=0 WS=128
  715 72.470767439 192.168.138.2 → 192.168.138.9 DNS 153 Standard query response 0xb737 AAAA mozilla.cloudflare-dns.com AAAA 2606:4700::6810:f8f9 AAAA 2606:4700::6810:f9f9 OPT
  716 72.511800043 34.117.237.239 → 192.168.138.9 TCP 60 443 → 55136 [SYN, ACK] Seq=0 Ack=1 Win=64240 Len=0 MSS=1460
  717 72.511838291 192.168.138.9 → 34.117.237.239 TCP 54 55136 → 443 [ACK] Seq=1 Ack=1 Win=64240 Len=0
  718 72.513318169 192.168.138.9 → 34.117.237.239 TLSv1 571 Client Hello
  719 72.513437829 34.117.237.239 → 192.168.138.9 TCP 60 443 → 55136 [ACK] Seq=1 Ack=518 Win=64240 Len=0
  720 72.561115450 34.117.237.239 → 192.168.138.9 TLSv1.3 1454 Server Hello, Change Cipher Spec
  721 72.561136701 192.168.138.9 → 34.117.237.239 TCP 54 55136 → 443 [ACK] Seq=518 Ack=1401 Win=63000 Len=0
  722 72.573670392 34.117.237.239 → 192.168.138.9 TCP 1454 443 → 55136 [PSH, ACK] Seq=1401 Ack=518 Win=64240 Len=1400 [TCP segment of a reassembled PDU]
  723 72.573689728 192.168.138.9 → 34.117.237.239 TCP 54 55136 → 443 [ACK] Seq=518 Ack=2801 Win=63000 Len=0
  724 72.574131933 34.117.237.239 → 192.168.138.9 TCP 1514 443 → 55136 [ACK] Seq=2801 Ack=518 Win=64240 Len=1460 [TCP segment of a reassembled PDU]
  725 72.574140180 192.168.138.9 → 34.117.237.239 TCP 54 55136 → 443 [ACK] Seq=518 Ack=4261 Win=63000 Len=0
  726 72.574220437 34.117.237.239 → 192.168.138.9 TLSv1.3 367 Application Data
  727 72.574228057 192.168.138.9 → 34.117.237.239 TCP 54 55136 → 443 [ACK] Seq=518 Ack=4574 Win=63000 Len=0
  728 72.577751983 192.168.138.9 → 34.117.237.239 TLSv1.3 118 Change Cipher Spec, Application Data
  729 72.578034402 34.117.237.239 → 192.168.138.9 TCP 60 443 → 55136 [ACK] Seq=4574 Ack=582 Win=64240 Len=0
  730 72.578376406 192.168.138.9 → 34.117.237.239 TLSv1.3 224 Application Data
  731 72.578524793 34.117.237.239 → 192.168.138.9 TCP 60 443 → 55136 [ACK] Seq=4574 Ack=752 Win=64240 Len=0
  732 72.578587180 192.168.138.9 → 34.117.237.239 TLSv1.3 294 Application Data
  733 72.578822923 34.117.237.239 → 192.168.138.9 TCP 60 443 → 55136 [ACK] Seq=4574 Ack=992 Win=64240 Len=0
  734 72.623112247 34.117.237.239 → 192.168.138.9 TLSv1.3 640 Application Data, Application Data
  735 72.623135158 192.168.138.9 → 34.117.237.239 TCP 54 55136 → 443 [ACK] Seq=992 Ack=5160 Win=63000 Len=0
  736 72.623780550 192.168.138.9 → 34.117.237.239 TLSv1.3 85 Application Data
  737 72.624094080 34.117.237.239 → 192.168.138.9 TCP 60 443 → 55136 [ACK] Seq=5160 Ack=1023 Win=64240 Len=0
  738 72.662210034 34.117.237.239 → 192.168.138.9 TLSv1.3 85 Application Data
  739 72.662241946 192.168.138.9 → 34.117.237.239 TCP 54 55136 → 443 [ACK] Seq=1023 Ack=5191 Win=63000 Len=0
  740 72.675669395 172.67.68.36 → 192.168.138.9 TLSv1.2 79 Application Data
  741 72.679814361 192.168.138.9 → 172.67.68.36 TLSv1.2 83 Application Data
  742 72.681337224 172.67.68.36 → 192.168.138.9 TCP 60 443 → 44180 [ACK] Seq=76 Ack=88 Win=64240 Len=0
  743 72.814001116 34.117.237.239 → 192.168.138.9 TLSv1.3 358 Application Data, Application Data, Application Data
  744 72.814019009 192.168.138.9 → 34.117.237.239 TCP 54 55136 → 443 [ACK] Seq=1023 Ack=5495 Win=63000 Len=0
  745 72.822071264 34.117.237.239 → 192.168.138.9 TLSv1.3 93 Application Data
  746 72.822084875 192.168.138.9 → 34.117.237.239 TCP 54 55136 → 443 [ACK] Seq=1023 Ack=5534 Win=63000 Len=0
  747 72.822563361 192.168.138.9 → 34.117.237.239 TLSv1.3 93 Application Data
  748 72.822876336 34.117.237.239 → 192.168.138.9 TCP 60 443 → 55136 [ACK] Seq=5534 Ack=1062 Win=64240 Len=0
  749 73.382304303 192.168.138.9 → 192.168.138.2 DNS 97 Standard query 0x0f05 A mozilla.cloudflare-dns.com OPT
  750 73.458022456 192.168.138.2 → 192.168.138.9 DNS 129 Standard query response 0x0f05 A mozilla.cloudflare-dns.com A 104.16.248.249 A 104.16.249.249 OPT
  751 74.025320533 192.168.138.2 → 192.168.138.9 DNS 136 Standard query response 0x76c9 AAAA ucoz.com SOA ns1.ucoz.net OPT
  752 74.025344251 192.168.138.9 → 192.168.138.2 ICMP 164 Destination unreachable (Port unreachable)
  753 76.557720151 192.168.138.2 → 192.168.138.9 DNS 129 Standard query response 0x0f05 A mozilla.cloudflare-dns.com A 104.16.248.249 A 104.16.249.249 OPT
  754 76.557783564 192.168.138.9 → 192.168.138.2 ICMP 157 Destination unreachable (Port unreachable)
  755 76.762347953 192.168.138.9 → 157.240.253.35 TCP 54 [TCP Keep-Alive] 48164 → 443 [ACK] Seq=517 Ack=1 Win=64240 Len=0
  756 77.459585460 192.168.138.9 → 104.16.249.249 TLSv1.2 93 Application Data
  757 77.460432446 104.16.249.249 → 192.168.138.9 TCP 60 443 → 58256 [ACK] Seq=5603 Ack=2404 Win=64240 Len=0
  758 77.488159280 104.16.249.249 → 192.168.138.9 TLSv1.2 93 Application Data
  759 77.488206507 192.168.138.9 → 104.16.249.249 TCP 54 58256 → 443 [ACK] Seq=2404 Ack=5642 Win=65535 Len=0
  760 77.789869325 192.168.138.9 → 157.240.253.35 TCP 54 [TCP Keep-Alive] 48164 → 443 [ACK] Seq=517 Ack=1 Win=64240 Len=0
  761 77.790212223 157.240.253.35 → 192.168.138.9 TCP 60 [TCP Keep-Alive ACK] 443 → 48164 [ACK] Seq=1 Ack=518 Win=64240 Len=0
  762 80.217659276 192.168.138.100 → 239.255.255.250 SSDP 210 M-SEARCH * HTTP/1.1 
  763 81.225522490 192.168.138.100 → 239.255.255.250 SSDP 210 M-SEARCH * HTTP/1.1 
  764 81.517699762 192.168.138.9 → 34.120.208.123 TLSv1.2 93 Application Data
  765 81.518779669 34.120.208.123 → 192.168.138.9 TCP 60 443 → 51102 [ACK] Seq=40 Ack=79 Win=64240 Len=0
  766 81.519234536 192.168.138.9 → 34.120.208.123 TLSv1.2 78 Application Data
  767 81.519792943 34.120.208.123 → 192.168.138.9 TCP 60 443 → 51102 [ACK] Seq=40 Ack=103 Win=64240 Len=0
  768 81.519988509 192.168.138.9 → 34.120.208.123 TCP 54 51102 → 443 [FIN, ACK] Seq=103 Ack=40 Win=63000 Len=0
  769 81.520975316 34.120.208.123 → 192.168.138.9 TCP 60 443 → 51102 [ACK] Seq=40 Ack=104 Win=64239 Len=0
  770 81.571730046 34.120.208.123 → 192.168.138.9 TCP 60 443 → 51102 [FIN, PSH, ACK] Seq=40 Ack=104 Win=64239 Len=0
  771 81.571782298 192.168.138.9 → 34.120.208.123 TCP 54 51102 → 443 [ACK] Seq=104 Ack=41 Win=63000 Len=0
  772 82.238185805 192.168.138.100 → 239.255.255.250 SSDP 210 M-SEARCH * HTTP/1.1 
  773 83.250684228 192.168.138.100 → 239.255.255.250 SSDP 210 M-SEARCH * HTTP/1.1 
  774 83.463744564 192.168.138.9 → 104.16.249.249 TLSv1.2 93 Application Data
  775 83.464819636 104.16.249.249 → 192.168.138.9 TCP 60 443 → 58256 [ACK] Seq=5642 Ack=2443 Win=64240 Len=0
  776 83.486999263 104.16.249.249 → 192.168.138.9 TLSv1.2 93 Application Data
  777 83.487042731 192.168.138.9 → 104.16.249.249 TCP 54 58256 → 443 [ACK] Seq=2443 Ack=5681 Win=65535 Len=0
  778 86.153678129 192.168.138.9 → 192.168.138.2 DNS 76 Standard query 0x0ec5 A it.kz OPT
  779 86.153880928 192.168.138.9 → 192.168.138.2 DNS 76 Standard query 0x1eb5 AAAA it.kz OPT
  780 86.293967971 192.168.138.2 → 192.168.138.9 DNS 131 Standard query response 0x1eb5 AAAA it.kz SOA ns1.hoster.kz OPT
  781 86.306520892 192.168.138.2 → 192.168.138.9 DNS 92 Standard query response 0x0ec5 A it.kz A 185.98.5.206 OPT
  782 86.308715689 192.168.138.9 → 185.98.5.206 ICMP 98 Echo (ping) request  id=0x4e7e, seq=1/256, ttl=64
  783 86.387011859 185.98.5.206 → 192.168.138.9 ICMP 98 Echo (ping) reply    id=0x4e7e, seq=1/256, ttl=128 (request in 782)
  784 86.387454114 192.168.138.9 → 192.168.138.2 DNS 96 Standard query 0xe7d9 PTR 206.5.98.185.in-addr.arpa OPT
  785 86.478622081 192.168.138.2 → 192.168.138.9 DNS 125 Standard query response 0xe7d9 PTR 206.5.98.185.in-addr.arpa PTR pkz54.hoster.kz OPT
  786 87.128396883 192.168.138.9 → 192.168.138.50 DHCP 342 DHCP Request  - Transaction ID 0xf31b8252
  787 87.130492478 192.168.138.50 → 192.168.138.9 DHCP 342 DHCP ACK      - Transaction ID 0xf31b8252
  788 87.171470006 157.240.253.35 → 192.168.138.9 TCP 60 443 → 48164 [RST, ACK] Seq=1 Ack=518 Win=64240 Len=0
  789 87.172947259 192.168.138.9 → 104.16.249.249 TLSv1.2 110 Application Data
  790 87.173027056 192.168.138.9 → 104.16.249.249 TLSv1.2 213 Application Data
  791 87.173181663 104.16.249.249 → 192.168.138.9 TCP 60 443 → 58256 [ACK] Seq=5681 Ack=2499 Win=64240 Len=0
  792 87.173190591 104.16.249.249 → 192.168.138.9 TCP 60 443 → 58256 [ACK] Seq=5681 Ack=2658 Win=64240 Len=0
  793 87.173222480 192.168.138.9 → 104.16.249.249 TLSv1.2 110 Application Data
  794 87.173279970 192.168.138.9 → 104.16.249.249 TLSv1.2 213 Application Data
  795 87.173590214 104.16.249.249 → 192.168.138.9 TCP 60 443 → 58256 [ACK] Seq=5681 Ack=2714 Win=64240 Len=0
  796 87.173593413 104.16.249.249 → 192.168.138.9 TCP 60 443 → 58256 [ACK] Seq=5681 Ack=2873 Win=64240 Len=0
  797 87.204906220 104.16.249.249 → 192.168.138.9 TLSv1.2 89 Application Data
  798 87.204923807 192.168.138.9 → 104.16.249.249 TCP 54 58256 → 443 [ACK] Seq=2873 Ack=5716 Win=65535 Len=0
  799 87.234819279 104.16.249.249 → 192.168.138.9 TLSv1.2 89 Application Data
  800 87.234836096 192.168.138.9 → 104.16.249.249 TCP 54 58256 → 443 [ACK] Seq=2873 Ack=5751 Win=65535 Len=0
  801 87.247403913 104.16.249.249 → 192.168.138.9 TLSv1.2 1141 Application Data, Application Data
  802 87.247424721 192.168.138.9 → 104.16.249.249 TCP 54 58256 → 443 [ACK] Seq=2873 Ack=6838 Win=65535 Len=0
  803 87.248281801 192.168.138.9 → 157.240.253.35 TCP 74 49620 → 443 [SYN] Seq=0 Win=64240 Len=0 MSS=1460 SACK_PERM=1 TSval=2968089091 TSecr=0 WS=128
  804 87.310576516 192.168.138.9 → 185.98.5.206 ICMP 98 Echo (ping) request  id=0x4e7e, seq=2/512, ttl=64
  805 87.327740072 157.240.253.35 → 192.168.138.9 TCP 60 443 → 49620 [SYN, ACK] Seq=0 Ack=1 Win=64240 Len=0 MSS=1460
  806 87.327814000 192.168.138.9 → 157.240.253.35 TCP 54 49620 → 443 [ACK] Seq=1 Ack=1 Win=64240 Len=0
  807 87.334959066 192.168.138.9 → 157.240.253.35 TLSv1 571 Client Hello
  808 87.335922029 157.240.253.35 → 192.168.138.9 TCP 60 443 → 49620 [ACK] Seq=1 Ack=518 Win=64240 Len=0
  809 87.382754431 185.98.5.206 → 192.168.138.9 ICMP 98 Echo (ping) reply    id=0x4e7e, seq=2/512, ttl=128 (request in 804)
