    1   0.000000   10.1.1.101 → 10.1.1.1     TCP 62 3177 → 80 [SYN] Seq=0 Win=0 Len=0 MSS=1460 SACK_PERM=1
    2   0.000651     10.1.1.1 → 10.1.1.101   TCP 62 80 → 3177 [SYN, ACK] Seq=0 Ack=1 Win=5840 Len=0 MSS=1460 SACK_PERM=1
    3   0.000697   10.1.1.101 → 10.1.1.1     TCP 54 3177 → 80 [ACK] Seq=1 Ack=1 Win=65535 Len=0
    4   0.013669   10.1.1.101 → 10.1.1.1     HTTP 530 GET / HTTP/1.1 
    5   0.014730     10.1.1.1 → 10.1.1.101   TCP 60 80 → 3177 [ACK] Seq=1 Ack=477 Win=6432 Len=0
    6   0.032289     10.1.1.1 → 10.1.1.101   HTTP 489 HTTP/1.1 200 OK  (text/html)
    7   0.032346     10.1.1.1 → 10.1.1.101   TCP 60 80 → 3177 [FIN, ACK] Seq=436 Ack=477 Win=6432 Len=0
    8   0.032407   10.1.1.101 → 10.1.1.1     TCP 54 3177 → 80 [ACK] Seq=477 Ack=437 Win=65100 Len=0
    9   0.121783   10.1.1.101 → 209.225.11.237 TCP 62 3179 → 80 [SYN] Seq=0 Win=0 Len=0 MSS=1460 SACK_PERM=1
   10   0.136302   10.1.1.101 → 10.1.1.1     TCP 54 3177 → 80 [FIN, ACK] Seq=477 Ack=437 Win=65100 Len=0
   11   0.136780     10.1.1.1 → 10.1.1.101   TCP 60 80 → 3177 [ACK] Seq=437 Ack=478 Win=6432 Len=0
   12   0.364255 209.225.11.237 → 10.1.1.101   TCP 62 80 → 3179 [SYN, ACK] Seq=0 Ack=1 Win=8760 Len=0 MSS=1460
   13   0.364322   10.1.1.101 → 209.225.11.237 TCP 54 3179 → 80 [ACK] Seq=1 Ack=1 Win=65535 Len=0
   14   0.364820   10.1.1.101 → 209.225.11.237 TCP 614 POST /scripts/cms/xcms.asp HTTP/1.1  [TCP segment of a reassembled PDU]
   15   0.649862 209.225.11.237 → 10.1.1.101   TCP 60 80 → 3179 [ACK] Seq=1 Ack=561 Win=6720 Len=0
   16   0.649949   10.1.1.101 → 209.225.11.237 HTTP 487 POST /scripts/cms/xcms.asp HTTP/1.1  (application/vnd.xacp)
   17   0.924215 209.225.11.237 → 10.1.1.101   TCP 60 80 → 3179 [ACK] Seq=1 Ack=994 Win=7840 Len=0
   18   0.953850 209.225.11.237 → 10.1.1.101   IPv4 770 Fragmented IP protocol (proto=TCP 6, off=744, ID=f6c5)
   19   0.954640 209.225.11.237 → 10.1.1.101   HTTP 60 [TCP Previous segment not captured] Continuation
   20   0.954679   10.1.1.101 → 209.225.11.237 TCP 54 [TCP ACKed unseen segment] 3179 → 80 [ACK] Seq=994 Ack=1461 Win=65535 Len=0
   21   0.978053 209.225.11.237 → 10.1.1.101   TCP 1273 [TCP Out-Of-Order] 80 → 3179 [PSH, ACK] Seq=1461 Ack=994 Win=7840 Len=1219
   22   0.978120   10.1.1.101 → 209.225.11.237 TCP 54 3179 → 80 [ACK] Seq=994 Ack=2686 Win=64311 Len=0
   23   1.198834   10.1.1.101 → 209.225.11.237 TCP 54 3179 → 80 [FIN, ACK] Seq=994 Ack=2686 Win=64311 Len=0
   24   1.199417   10.1.1.101 → 209.225.0.6  TCP 62 3183 → 80 [SYN] Seq=0 Win=0 Len=0 MSS=1460 SACK_PERM=1
   25   1.199758   10.1.1.101 → 209.225.0.6  TCP 62 3184 → 80 [SYN] Seq=0 Win=0 Len=0 MSS=1460 SACK_PERM=1
   26   1.225929   10.1.1.101 → 209.225.0.6  TCP 62 3185 → 80 [SYN] Seq=0 Win=0 Len=0 MSS=1460 SACK_PERM=1
   27   1.262302   10.1.1.101 → 209.225.0.6  TCP 62 3187 → 80 [SYN] Seq=0 Win=0 Len=0 MSS=1460 SACK_PERM=1
   28   1.275275   10.1.1.101 → 10.1.1.1     TCP 62 3188 → 80 [SYN] Seq=0 Win=0 Len=0 MSS=1460 SACK_PERM=1
   29   1.275756     10.1.1.1 → 10.1.1.101   TCP 62 80 → 3188 [SYN, ACK] Seq=0 Ack=1 Win=5840 Len=0 MSS=1460 SACK_PERM=1
   30   1.275803   10.1.1.101 → 10.1.1.1     TCP 54 3188 → 80 [ACK] Seq=1 Ack=1 Win=65535 Len=0
   31   1.283985   10.1.1.101 → 10.1.1.1     HTTP 628 GET /Websidan/index.html HTTP/1.1 
   32   1.285192     10.1.1.1 → 10.1.1.101   TCP 60 80 → 3188 [ACK] Seq=1 Ack=575 Win=6888 Len=0
   33   1.288407     10.1.1.1 → 10.1.1.101   TCP 1514 HTTP/1.1 200 OK  [TCP segment of a reassembled PDU]
   34   1.289663     10.1.1.1 → 10.1.1.101   TCP 1514 80 → 3188 [ACK] Seq=1461 Ack=575 Win=6888 Len=1460 [TCP segment of a reassembled PDU]
   35   1.289728   10.1.1.101 → 10.1.1.1     TCP 54 3188 → 80 [ACK] Seq=575 Ack=2921 Win=65535 Len=0
   36   1.292132     10.1.1.1 → 10.1.1.101   TCP 1514 80 → 3188 [ACK] Seq=2921 Ack=575 Win=6888 Len=1460 [TCP segment of a reassembled PDU]
   37   1.292259   10.1.1.101 → 10.1.1.1     TCP 54 3188 → 80 [ACK] Seq=575 Ack=4381 Win=65535 Len=0
   38   1.292367     10.1.1.1 → 10.1.1.101   HTTP 275 HTTP/1.1 200 OK  (text/html)
   39   1.292436   10.1.1.101 → 10.1.1.1     TCP 54 3188 → 80 [ACK] Seq=575 Ack=4603 Win=65314 Len=0
   40   1.379484   10.1.1.101 → 10.1.1.1     TCP 62 3189 → 80 [SYN] Seq=0 Win=0 Len=0 MSS=1460 SACK_PERM=1
   41   1.379927     10.1.1.1 → 10.1.1.101   TCP 62 80 → 3189 [SYN, ACK] Seq=0 Ack=1 Win=5840 Len=0 MSS=1460 SACK_PERM=1
   42   1.379970   10.1.1.101 → 10.1.1.1     TCP 54 3189 → 80 [ACK] Seq=1 Ack=1 Win=65535 Len=0
   43   1.381423   10.1.1.101 → 10.1.1.1     TCP 62 3190 → 80 [SYN] Seq=0 Win=0 Len=0 MSS=1460 SACK_PERM=1
   44   1.381865     10.1.1.1 → 10.1.1.101   TCP 62 80 → 3190 [SYN, ACK] Seq=0 Ack=1 Win=5840 Len=0 MSS=1460 SACK_PERM=1
   45   1.381910   10.1.1.101 → 10.1.1.1     TCP 54 3190 → 80 [ACK] Seq=1 Ack=1 Win=65535 Len=0
   46   1.402634   10.1.1.101 → 10.1.1.1     TCP 54 3188 → 80 [FIN, ACK] Seq=575 Ack=4603 Win=65314 Len=0
   47   1.403066     10.1.1.1 → 10.1.1.101   TCP 60 80 → 3188 [ACK] Seq=4603 Ack=576 Win=6888 Len=0
   48   1.403683   10.1.1.101 → 10.1.1.1     HTTP 651 GET /Websidan/images/bg2.jpg HTTP/1.1 
   49   1.404885     10.1.1.1 → 10.1.1.101   TCP 60 80 → 3189 [ACK] Seq=1 Ack=598 Win=6567 Len=0
   50   1.404938   10.1.1.101 → 10.1.1.1     HTTP 654 GET /Websidan/images/sydney.jpg HTTP/1.1 
   51   1.406166     10.1.1.1 → 10.1.1.101   TCP 60 80 → 3190 [ACK] Seq=1 Ack=601 Win=6600 Len=0
   52   1.408298     10.1.1.1 → 10.1.1.101   TCP 1514 HTTP/1.1 200 OK  [TCP segment of a reassembled PDU]
   53   1.409540     10.1.1.1 → 10.1.1.101   TCP 1514 80 → 3189 [ACK] Seq=1461 Ack=598 Win=6567 Len=1460 [TCP segment of a reassembled PDU]
   54   1.409607   10.1.1.101 → 10.1.1.1     TCP 54 3189 → 80 [ACK] Seq=598 Ack=2921 Win=65535 Len=0
   55   1.411460     10.1.1.1 → 10.1.1.101   TCP 1514 HTTP/1.1 200 OK  [TCP segment of a reassembled PDU]
   56   1.412710     10.1.1.1 → 10.1.1.101   TCP 1514 80 → 3189 [ACK] Seq=2921 Ack=598 Win=6567 Len=1460 [TCP segment of a reassembled PDU]
   57   1.412812   10.1.1.101 → 10.1.1.1     TCP 54 3189 → 80 [ACK] Seq=598 Ack=4381 Win=65535 Len=0
   58   1.413969     10.1.1.1 → 10.1.1.101   TCP 1514 80 → 3189 [ACK] Seq=4381 Ack=598 Win=6567 Len=1460 [TCP segment of a reassembled PDU]
   59   1.415274     10.1.1.1 → 10.1.1.101   TCP 1514 80 → 3189 [ACK] Seq=5841 Ack=598 Win=6567 Len=1460 [TCP segment of a reassembled PDU]
   60   1.415334   10.1.1.101 → 10.1.1.1     TCP 54 3189 → 80 [ACK] Seq=598 Ack=7301 Win=65535 Len=0
   61   1.416360     10.1.1.1 → 10.1.1.101   HTTP 1320 HTTP/1.1 200 OK  (JPEG JFIF image)
   62   1.416444   10.1.1.101 → 10.1.1.1     TCP 54 3189 → 80 [ACK] Seq=598 Ack=8568 Win=64269 Len=0
   63   1.417690     10.1.1.1 → 10.1.1.101   TCP 1514 80 → 3190 [ACK] Seq=1461 Ack=601 Win=6600 Len=1460 [TCP segment of a reassembled PDU]
   64   1.417781   10.1.1.101 → 10.1.1.1     TCP 54 3190 → 80 [ACK] Seq=601 Ack=2921 Win=65535 Len=0
   65   1.420185     10.1.1.1 → 10.1.1.101   TCP 1514 80 → 3190 [ACK] Seq=2921 Ack=601 Win=6600 Len=1460 [TCP segment of a reassembled PDU]
   66   1.420319   10.1.1.101 → 10.1.1.1     TCP 54 3190 → 80 [ACK] Seq=601 Ack=4381 Win=65535 Len=0
   67   1.421386     10.1.1.1 → 10.1.1.101   TCP 1514 80 → 3190 [ACK] Seq=4381 Ack=601 Win=6600 Len=1460 [TCP segment of a reassembled PDU]
   68   1.422680     10.1.1.1 → 10.1.1.101   TCP 1514 80 → 3190 [ACK] Seq=5841 Ack=601 Win=6600 Len=1460 [TCP segment of a reassembled PDU]
   69   1.422711   10.1.1.101 → 10.1.1.1     TCP 54 3190 → 80 [ACK] Seq=601 Ack=7301 Win=65535 Len=0
   70   1.423933     10.1.1.1 → 10.1.1.101   TCP 1514 80 → 3190 [ACK] Seq=7301 Ack=601 Win=6600 Len=1460 [TCP segment of a reassembled PDU]
   71   1.423994   10.1.1.101 → 10.1.1.1     TCP 54 3190 → 80 [ACK] Seq=601 Ack=8761 Win=65535 Len=0
   72   1.424518     10.1.1.1 → 10.1.1.101   HTTP 624 HTTP/1.1 200 OK  (JPEG JFIF image)
   73   1.424551   10.1.1.101 → 10.1.1.1     TCP 54 3190 → 80 [ACK] Seq=601 Ack=9332 Win=64965 Len=0
   74   1.449988 209.225.11.237 → 10.1.1.101   TCP 60 80 → 3179 [ACK] Seq=2686 Ack=995 Win=7840 Len=0
   75   1.462521  209.225.0.6 → 10.1.1.101   TCP 62 80 → 3183 [SYN, ACK] Seq=0 Ack=1 Win=5840 Len=0 MSS=1460 SACK_PERM=1
   76   1.462600   10.1.1.101 → 209.225.0.6  TCP 54 3183 → 80 [ACK] Seq=1 Ack=1 Win=65535 Len=0
   77   1.468937  209.225.0.6 → 10.1.1.101   TCP 62 80 → 3184 [SYN, ACK] Seq=0 Ack=1 Win=5840 Len=0 MSS=1460 SACK_PERM=1
   78   1.469034   10.1.1.101 → 209.225.0.6  TCP 54 3184 → 80 [ACK] Seq=1 Ack=1 Win=65535 Len=0
   79   1.475581  209.225.0.6 → 10.1.1.101   TCP 62 80 → 3185 [SYN, ACK] Seq=0 Ack=1 Win=5840 Len=0 MSS=1460 SACK_PERM=1
   80   1.475675   10.1.1.101 → 209.225.0.6  TCP 54 3185 → 80 [ACK] Seq=1 Ack=1 Win=65535 Len=0
   81   1.501725   10.1.1.101 → 209.225.0.6  TCP 1514 GET /site=126885/bnum=opera1/bins=1/opid=10030285/ver=711/dst=Win_700 HTTP/1.1  [TCP segment of a reassembled PDU]
   82   1.501785   10.1.1.101 → 209.225.0.6  HTTP 1211 GET /site=126885/bnum=opera1/bins=1/opid=10030285/ver=711/dst=Win_700 HTTP/1.1 
   83   1.502097   10.1.1.101 → 209.225.0.6  TCP 1514 GET /site=126885/bnum=opera2/bins=1/opid=10030867/ver=711/dst=Win_700 HTTP/1.1  [TCP segment of a reassembled PDU]
   84   1.502133   10.1.1.101 → 209.225.0.6  HTTP 1211 GET /site=126885/bnum=opera2/bins=1/opid=10030867/ver=711/dst=Win_700 HTTP/1.1 
   85   1.502384   10.1.1.101 → 209.225.0.6  TCP 1514 GET /site=126885/bnum=opera3/bins=1/opid=10032112/ver=711/dst=Win_700 HTTP/1.1  [TCP segment of a reassembled PDU]
   86   1.502407   10.1.1.101 → 209.225.0.6  HTTP 1211 GET /site=126885/bnum=opera3/bins=1/opid=10032112/ver=711/dst=Win_700 HTTP/1.1 
   87   1.508901  209.225.0.6 → 10.1.1.101   TCP 62 80 → 3187 [SYN, ACK] Seq=0 Ack=1 Win=5840 Len=0 MSS=1460 SACK_PERM=1
   88   1.508992   10.1.1.101 → 209.225.0.6  TCP 54 3187 → 80 [ACK] Seq=1 Ack=1 Win=65535 Len=0
   89   1.509918   10.1.1.101 → 209.225.0.6  TCP 1514 GET /site=126885/bnum=opera4/bins=1/opid=10003005/ver=711/dst=Win_700 HTTP/1.1  [TCP segment of a reassembled PDU]
   90   1.509970   10.1.1.101 → 209.225.0.6  HTTP 1211 GET /site=126885/bnum=opera4/bins=1/opid=10003005/ver=711/dst=Win_700 HTTP/1.1 
   91   1.543370   10.1.1.101 → 10.1.1.1     TCP 54 3189 → 80 [FIN, ACK] Seq=598 Ack=8568 Win=64269 Len=0
   92   1.543799     10.1.1.1 → 10.1.1.101   TCP 60 80 → 3189 [ACK] Seq=8568 Ack=599 Win=6567 Len=0
   93   1.711000   10.1.1.101 → 10.1.1.1     TCP 54 3190 → 80 [FIN, ACK] Seq=601 Ack=9332 Win=64965 Len=0
   94   1.711427     10.1.1.1 → 10.1.1.101   TCP 60 80 → 3190 [ACK] Seq=9332 Ack=602 Win=6600 Len=0
   95   1.850896  209.225.0.6 → 10.1.1.101   TCP 60 80 → 3183 [ACK] Seq=1 Ack=1461 Win=8760 Len=0
   96   1.937869  209.225.0.6 → 10.1.1.101   TCP 60 80 → 3183 [ACK] Seq=1 Ack=2618 Win=11680 Len=0
   97   1.942059  209.225.0.6 → 10.1.1.101   TCP 72 80 → 3183 [PSH, ACK] Seq=1 Ack=2618 Win=11680 Len=18 [TCP segment of a reassembled PDU]
   98   1.970667  209.225.0.6 → 10.1.1.101   IPv4 770 Fragmented IP protocol (proto=TCP 6, off=744, ID=87bd)
   99   1.970729   10.1.1.101 → 209.225.0.6  TCP 54 [TCP ACKed unseen segment] 3183 → 80 [ACK] Seq=2618 Ack=1479 Win=65535 Len=0
  100   1.994517  209.225.0.6 → 10.1.1.101   HTTP 1301 [TCP Previous segment not captured] Continuation
  101   1.994628   10.1.1.101 → 209.225.0.6  TCP 54 [TCP ACKed unseen segment] 3183 → 80 [ACK] Seq=2618 Ack=2727 Win=64288 Len=0
  102   1.996132   10.1.1.101 → 209.225.0.6  TCP 54 3183 → 80 [FIN, ACK] Seq=2618 Ack=2727 Win=64288 Len=0
  103   1.997232   10.1.1.101 → 209.225.0.6  TCP 62 3191 → 80 [SYN] Seq=0 Win=0 Len=0 MSS=1460 SACK_PERM=1
  104   2.044497  209.225.0.6 → 10.1.1.101   TCP 60 80 → 3184 [ACK] Seq=1 Ack=1461 Win=8760 Len=0
  105   2.130094  209.225.0.6 → 10.1.1.101   TCP 60 80 → 3184 [ACK] Seq=1 Ack=2618 Win=11680 Len=0
  106   2.137437  209.225.0.6 → 10.1.1.101   TCP 72 80 → 3184 [PSH, ACK] Seq=1 Ack=2618 Win=11680 Len=18 [TCP segment of a reassembled PDU]
  107   2.166067  209.225.0.6 → 10.1.1.101   IPv4 770 Fragmented IP protocol (proto=TCP 6, off=744, ID=798f)
  108   2.166127   10.1.1.101 → 209.225.0.6  TCP 54 [TCP ACKed unseen segment] 3184 → 80 [ACK] Seq=2618 Ack=1479 Win=65535 Len=0
  109   2.189730  209.225.0.6 → 10.1.1.101   HTTP 1301 [TCP Previous segment not captured] Continuation
  110   2.189845   10.1.1.101 → 209.225.0.6  TCP 54 [TCP ACKed unseen segment] 3184 → 80 [ACK] Seq=2618 Ack=2727 Win=64288 Len=0
  111   2.191371   10.1.1.101 → 209.225.0.6  TCP 54 3184 → 80 [FIN, ACK] Seq=2618 Ack=2727 Win=64288 Len=0
  112   2.192724   10.1.1.101 → 209.225.0.6  TCP 62 3192 → 80 [SYN] Seq=0 Win=0 Len=0 MSS=1460 SACK_PERM=1
  113   2.236049  209.225.0.6 → 10.1.1.101   TCP 60 80 → 3185 [ACK] Seq=1 Ack=1461 Win=8760 Len=0
  114   2.321252  209.225.0.6 → 10.1.1.101   TCP 60 80 → 3185 [ACK] Seq=1 Ack=2618 Win=11680 Len=0
  115   2.433860  209.225.0.6 → 10.1.1.101   TCP 60 80 → 3187 [ACK] Seq=1 Ack=1461 Win=8760 Len=0
  116   2.520115  209.225.0.6 → 10.1.1.101   TCP 60 80 → 3187 [ACK] Seq=1 Ack=2618 Win=11680 Len=0
  117   2.525019  209.225.0.6 → 10.1.1.101   TCP 72 80 → 3187 [PSH, ACK] Seq=1 Ack=2618 Win=11680 Len=18 [TCP segment of a reassembled PDU]
  118   2.553651  209.225.0.6 → 10.1.1.101   IPv4 770 Fragmented IP protocol (proto=TCP 6, off=744, ID=9f3e)
  119   2.553711   10.1.1.101 → 209.225.0.6  TCP 54 [TCP ACKed unseen segment] 3187 → 80 [ACK] Seq=2618 Ack=1479 Win=65535 Len=0
  120   2.577273  209.225.0.6 → 10.1.1.101   HTTP 1301 [TCP Previous segment not captured] Continuation
  121   2.577328   10.1.1.101 → 209.225.0.6  TCP 54 [TCP ACKed unseen segment] 3187 → 80 [ACK] Seq=2618 Ack=2727 Win=64288 Len=0
  122   2.578090  209.225.0.6 → 10.1.1.101   TCP 60 80 → 3183 [ACK] Seq=2727 Ack=2619 Win=11680 Len=0
  123   2.578775   10.1.1.101 → 209.225.0.6  TCP 54 3187 → 80 [FIN, ACK] Seq=2618 Ack=2727 Win=64288 Len=0
  124   2.579488  209.225.0.6 → 10.1.1.101   TCP 62 80 → 3191 [SYN, ACK] Seq=0 Ack=1 Win=5840 Len=0 MSS=1460 SACK_PERM=1
  125   2.579548   10.1.1.101 → 209.225.0.6  TCP 54 3191 → 80 [ACK] Seq=1 Ack=1 Win=65535 Len=0
  126   2.580113   10.1.1.101 → 209.225.0.6  TCP 62 3193 → 80 [SYN] Seq=0 Win=0 Len=0 MSS=1460 SACK_PERM=1
  127   2.580475   10.1.1.101 → 209.225.0.6  TCP 1514 GET /site=0000127709/mnum=0000162763/genr=1/logs=0/mdtm=1077726643/bins=1 HTTP/1.1  [TCP segment of a reassembled PDU]
  128   2.580536   10.1.1.101 → 209.225.0.6  HTTP 1267 GET /site=0000127709/mnum=0000162763/genr=1/logs=0/mdtm=1077726643/bins=1 HTTP/1.1 
  129   2.581836  209.225.0.6 → 10.1.1.101   TCP 60 80 → 3184 [ACK] Seq=2727 Ack=2619 Win=11680 Len=0
  130   2.583647  209.225.0.6 → 10.1.1.101   TCP 62 80 → 3192 [SYN, ACK] Seq=0 Ack=1 Win=5840 Len=0 MSS=1460 SACK_PERM=1
  131   2.583680   10.1.1.101 → 209.225.0.6  TCP 54 3192 → 80 [ACK] Seq=1 Ack=1 Win=65535 Len=0
  132   2.584108   10.1.1.101 → 209.225.0.6  TCP 1514 GET /site=0000127709/mnum=0000162763/genr=1/logs=0/mdtm=1077726643/bins=1 HTTP/1.1  [TCP segment of a reassembled PDU]
  133   2.584153   10.1.1.101 → 209.225.0.6  HTTP 1267 GET /site=0000127709/mnum=0000162763/genr=1/logs=0/mdtm=1077726643/bins=1 HTTP/1.1 
  134   2.750280  209.225.0.6 → 10.1.1.101   TCP 72 80 → 3185 [PSH, ACK] Seq=1 Ack=2618 Win=11680 Len=18 [TCP segment of a reassembled PDU]
  135   2.778893  209.225.0.6 → 10.1.1.101   IPv4 770 Fragmented IP protocol (proto=TCP 6, off=744, ID=109b)
  136   2.778957   10.1.1.101 → 209.225.0.6  TCP 54 [TCP ACKed unseen segment] 3185 → 80 [ACK] Seq=2618 Ack=1479 Win=65535 Len=0
  137   2.802516  209.225.0.6 → 10.1.1.101   HTTP 1301 [TCP Previous segment not captured] Continuation
  138   2.802576   10.1.1.101 → 209.225.0.6  TCP 54 [TCP ACKed unseen segment] 3185 → 80 [ACK] Seq=2618 Ack=2727 Win=64288 Len=0
  139   2.804015   10.1.1.101 → 209.225.0.6  TCP 54 3185 → 80 [FIN, ACK] Seq=2618 Ack=2727 Win=64288 Len=0
  140   2.805138   10.1.1.101 → 209.225.0.6  TCP 62 3194 → 80 [SYN] Seq=0 Win=0 Len=0 MSS=1460 SACK_PERM=1
  141   2.833092  209.225.0.6 → 10.1.1.101   TCP 60 80 → 3187 [ACK] Seq=2727 Ack=2619 Win=11680 Len=0
  142   2.844644  209.225.0.6 → 10.1.1.101   TCP 62 80 → 3193 [SYN, ACK] Seq=0 Ack=1 Win=5840 Len=0 MSS=1460 SACK_PERM=1
  143   2.844698   10.1.1.101 → 209.225.0.6  TCP 54 3193 → 80 [ACK] Seq=1 Ack=1 Win=65535 Len=0
  144   2.845194   10.1.1.101 → 209.225.0.6  TCP 1514 GET /site=0000127709/mnum=0000162766/genr=1/logs=0/mdtm=1077726645/bins=1 HTTP/1.1  [TCP segment of a reassembled PDU]
  145   2.845244   10.1.1.101 → 209.225.0.6  HTTP 1267 GET /site=0000127709/mnum=0000162766/genr=1/logs=0/mdtm=1077726645/bins=1 HTTP/1.1 
  146   2.950603  209.225.0.6 → 10.1.1.101   TCP 60 80 → 3191 [ACK] Seq=1 Ack=1461 Win=8760 Len=0
  147   3.041302  209.225.0.6 → 10.1.1.101   TCP 60 80 → 3191 [ACK] Seq=1 Ack=2674 Win=11680 Len=0
  148   3.055085  209.225.0.6 → 10.1.1.101   TCP 69 80 → 3191 [PSH, ACK] Seq=1 Ack=2674 Win=11680 Len=15 [TCP segment of a reassembled PDU]
  149   3.083719  209.225.0.6 → 10.1.1.101   IPv4 770 Fragmented IP protocol (proto=TCP 6, off=744, ID=41ae)
  150   3.083805   10.1.1.101 → 209.225.0.6  TCP 54 [TCP ACKed unseen segment] 3191 → 80 [ACK] Seq=2674 Ack=1476 Win=65535 Len=0
  151   3.153822  209.225.0.6 → 10.1.1.101   TCP 60 80 → 3192 [ACK] Seq=1 Ack=1461 Win=8760 Len=0
  152   3.242082  209.225.0.6 → 10.1.1.101   TCP 60 80 → 3192 [ACK] Seq=1 Ack=2674 Win=11680 Len=0
  153   3.244786  209.225.0.6 → 10.1.1.101   TCP 69 80 → 3192 [PSH, ACK] Seq=1 Ack=2674 Win=11680 Len=15 [TCP segment of a reassembled PDU]
  154   3.254168   10.1.1.101 → 10.1.1.1     TCP 62 3195 → 80 [SYN] Seq=0 Win=0 Len=0 MSS=1460 SACK_PERM=1
  155   3.254623     10.1.1.1 → 10.1.1.101   TCP 62 80 → 3195 [SYN, ACK] Seq=0 Ack=1 Win=5840 Len=0 MSS=1460 SACK_PERM=1
  156   3.254681   10.1.1.101 → 10.1.1.1     TCP 54 3195 → 80 [ACK] Seq=1 Ack=1 Win=65535 Len=0
  157   3.263072   10.1.1.101 → 10.1.1.1     HTTP 655 GET /Websidan/dagbok/dagbok.html HTTP/1.1 
  158   3.264289     10.1.1.1 → 10.1.1.101   TCP 60 80 → 3195 [ACK] Seq=1 Ack=602 Win=6611 Len=0
  159   3.266188     10.1.1.1 → 10.1.1.101   HTTP 746 HTTP/1.1 200 OK  (text/html)
  160   3.266235     10.1.1.1 → 10.1.1.101   TCP 60 80 → 3195 [FIN, ACK] Seq=693 Ack=602 Win=6611 Len=0
  161   3.266285   10.1.1.101 → 10.1.1.1     TCP 54 3195 → 80 [ACK] Seq=602 Ack=694 Win=64843 Len=0
  162   3.273447  209.225.0.6 → 10.1.1.101   IPv4 770 Fragmented IP protocol (proto=TCP 6, off=744, ID=c2fc)
  163   3.273545   10.1.1.101 → 209.225.0.6  TCP 54 [TCP ACKed unseen segment] 3192 → 80 [ACK] Seq=2674 Ack=1476 Win=65535 Len=0
  164   3.274604  209.225.0.6 → 10.1.1.101   TCP 60 80 → 3185 [ACK] Seq=2727 Ack=2619 Win=11680 Len=0
  165   3.276074  209.225.0.6 → 10.1.1.101   TCP 62 80 → 3194 [SYN, ACK] Seq=0 Ack=1 Win=5840 Len=0 MSS=1460 SACK_PERM=1
  166   3.276133   10.1.1.101 → 209.225.0.6  TCP 54 3194 → 80 [ACK] Seq=1 Ack=1 Win=65535 Len=0
  167   3.382311  209.225.0.6 → 10.1.1.101   TCP 60 80 → 3193 [ACK] Seq=1 Ack=1461 Win=8760 Len=0
  168   3.399697   10.1.1.101 → 209.225.0.6  TCP 1514 GET /site=0000127709/mnum=0000162763/genr=1/logs=0/mdtm=1077726643/bins=1 HTTP/1.1  [TCP segment of a reassembled PDU]
  169   3.399757   10.1.1.101 → 209.225.0.6  HTTP 1267 GET /site=0000127709/mnum=0000162763/genr=1/logs=0/mdtm=1077726643/bins=1 HTTP/1.1 
  170   3.471785  209.225.0.6 → 10.1.1.101   TCP 60 80 → 3193 [ACK] Seq=1 Ack=2674 Win=11680 Len=0
  171   3.473501  209.225.0.6 → 10.1.1.101   TCP 69 80 → 3193 [PSH, ACK] Seq=1 Ack=2674 Win=11680 Len=15 [TCP segment of a reassembled PDU]
  172   3.473728   10.1.1.101 → 10.1.1.1     TCP 54 3195 → 80 [FIN, ACK] Seq=602 Ack=694 Win=64843 Len=0
  173   3.474162     10.1.1.1 → 10.1.1.101   TCP 60 80 → 3195 [ACK] Seq=694 Ack=603 Win=6611 Len=0
  174   3.502125  209.225.0.6 → 10.1.1.101   IPv4 770 Fragmented IP protocol (proto=TCP 6, off=744, ID=9f47)
  175   3.502166   10.1.1.101 → 209.225.0.6  TCP 54 [TCP ACKed unseen segment] 3193 → 80 [ACK] Seq=2674 Ack=1476 Win=65535 Len=0
  176   3.530215  209.225.0.6 → 10.1.1.101   IPv4 770 Fragmented IP protocol (proto=TCP 6, off=744, ID=41af)
  177   3.558523  209.225.0.6 → 10.1.1.101   IPv4 770 Fragmented IP protocol (proto=TCP 6, off=744, ID=41b0)
  178   3.558574   10.1.1.101 → 209.225.0.6  TCP 54 [TCP ACKed unseen segment] 3191 → 80 [ACK] Seq=2674 Ack=4396 Win=65535 Len=0
  179   3.579368  209.225.0.6 → 10.1.1.101   HTTP 1187 [TCP Previous segment not captured] Continuation
  180   3.579433   10.1.1.101 → 209.225.0.6  TCP 54 [TCP ACKed unseen segment] 3191 → 80 [ACK] Seq=2674 Ack=5530 Win=64402 Len=0
  181   3.579695   10.1.1.101 → 209.225.0.6  TCP 54 3191 → 80 [FIN, ACK] Seq=2674 Ack=5530 Win=64402 Len=0
  182   3.607307  209.225.0.6 → 10.1.1.101   IPv4 770 Fragmented IP protocol (proto=TCP 6, off=744, ID=c2fd)
  183   3.635385  209.225.0.6 → 10.1.1.101   IPv4 770 Fragmented IP protocol (proto=TCP 6, off=744, ID=c2fe)
  184   3.635476   10.1.1.101 → 209.225.0.6  TCP 54 [TCP ACKed unseen segment] 3192 → 80 [ACK] Seq=2674 Ack=4396 Win=65535 Len=0
  185   3.656471  209.225.0.6 → 10.1.1.101   HTTP 1187 [TCP Previous segment not captured] Continuation
  186   3.656553   10.1.1.101 → 209.225.0.6  TCP 54 [TCP ACKed unseen segment] 3192 → 80 [ACK] Seq=2674 Ack=5530 Win=64402 Len=0
  187   3.656848   10.1.1.101 → 209.225.0.6  TCP 54 3192 → 80 [FIN, ACK] Seq=2674 Ack=5530 Win=64402 Len=0
  188   3.749938  209.225.0.6 → 10.1.1.101   TCP 60 80 → 3194 [ACK] Seq=1 Ack=1461 Win=8760 Len=0
  189   3.838383  209.225.0.6 → 10.1.1.101   TCP 60 80 → 3194 [ACK] Seq=1 Ack=2674 Win=11680 Len=0
  190   3.841091  209.225.0.6 → 10.1.1.101   TCP 69 80 → 3194 [PSH, ACK] Seq=1 Ack=2674 Win=11680 Len=15 [TCP segment of a reassembled PDU]
  191   3.869765  209.225.0.6 → 10.1.1.101   IPv4 770 Fragmented IP protocol (proto=TCP 6, off=744, ID=4c68)
  192   3.869883   10.1.1.101 → 209.225.0.6  TCP 54 [TCP ACKed unseen segment] 3194 → 80 [ACK] Seq=2674 Ack=1476 Win=65535 Len=0
  193   3.898063  209.225.0.6 → 10.1.1.101   IPv4 770 Fragmented IP protocol (proto=TCP 6, off=744, ID=9f48)
  194   3.926160  209.225.0.6 → 10.1.1.101   IPv4 770 Fragmented IP protocol (proto=TCP 6, off=744, ID=9f49)
  195   3.926227   10.1.1.101 → 209.225.0.6  TCP 54 [TCP ACKed unseen segment] 3193 → 80 [ACK] Seq=2674 Ack=4396 Win=65535 Len=0
  196   3.954380  209.225.0.6 → 10.1.1.101   IPv4 770 Fragmented IP protocol (proto=TCP 6, off=744, ID=9f4a)
  197   3.955418  209.225.0.6 → 10.1.1.101   TCP 60 80 → 3191 [ACK] Seq=5530 Ack=2675 Win=11680 Len=0
  198   3.956911  209.225.0.6 → 10.1.1.101   TCP 60 80 → 3192 [ACK] Seq=5530 Ack=2675 Win=11680 Len=0
  199   4.060357   10.1.1.101 → 209.225.0.6  TCP 54 [TCP ACKed unseen segment] 3193 → 80 [ACK] Seq=2674 Ack=5856 Win=65535 Len=0
  200   4.143750  209.225.0.6 → 10.1.1.101   IPv4 770 Fragmented IP protocol (proto=TCP 6, off=744, ID=4c69)
  201   4.172070  209.225.0.6 → 10.1.1.101   IPv4 770 Fragmented IP protocol (proto=TCP 6, off=744, ID=4c6a)
  202   4.172154   10.1.1.101 → 209.225.0.6  TCP 54 [TCP ACKed unseen segment] 3194 → 80 [ACK] Seq=2674 Ack=4396 Win=65535 Len=0
  203   4.193147  209.225.0.6 → 10.1.1.101   HTTP 1187 [TCP Previous segment not captured] Continuation
  204   4.193232   10.1.1.101 → 209.225.0.6  TCP 54 [TCP ACKed unseen segment] 3194 → 80 [ACK] Seq=2674 Ack=5530 Win=64402 Len=0
  205   4.193546   10.1.1.101 → 209.225.0.6  TCP 54 3194 → 80 [FIN, ACK] Seq=2674 Ack=5530 Win=64402 Len=0
  206   4.221106  209.225.0.6 → 10.1.1.101   IPv4 770 Fragmented IP protocol (proto=TCP 6, off=744, ID=9f4b)
  207   4.241944  209.225.0.6 → 10.1.1.101   HTTP 1190 [TCP Previous segment not captured] Continuation
  208   4.242030   10.1.1.101 → 209.225.0.6  TCP 54 [TCP ACKed unseen segment] 3193 → 80 [ACK] Seq=2674 Ack=8453 Win=65535 Len=0
  209   4.242520   10.1.1.101 → 209.225.0.6  TCP 54 3193 → 80 [FIN, ACK] Seq=2674 Ack=8453 Win=65535 Len=0
  210   4.447275  209.225.0.6 → 10.1.1.101   TCP 60 80 → 3194 [ACK] Seq=5530 Ack=2675 Win=11680 Len=0
  211   4.497036  209.225.0.6 → 10.1.1.101   TCP 60 80 → 3193 [ACK] Seq=8453 Ack=2675 Win=11680 Len=0
  212   4.913917   10.1.1.101 → 10.1.1.1     TCP 62 3196 → 80 [SYN] Seq=0 Win=0 Len=0 MSS=1460 SACK_PERM=1
  213   4.914374     10.1.1.1 → 10.1.1.101   TCP 62 80 → 3196 [SYN, ACK] Seq=0 Ack=1 Win=5840 Len=0 MSS=1460 SACK_PERM=1
  214   4.914420   10.1.1.101 → 10.1.1.1     TCP 54 3196 → 80 [ACK] Seq=1 Ack=1 Win=65535 Len=0
  215   4.922760   10.1.1.101 → 10.1.1.1     HTTP 668 GET /Websidan/dagbok/2004/dagbok.html HTTP/1.1 
  216   4.924004     10.1.1.1 → 10.1.1.101   TCP 60 80 → 3196 [ACK] Seq=1 Ack=615 Win=6754 Len=0
  217   4.926870     10.1.1.1 → 10.1.1.101   TCP 1514 HTTP/1.1 200 OK  [TCP segment of a reassembled PDU]
  218   4.926977     10.1.1.1 → 10.1.1.101   HTTP 134 HTTP/1.1 200 OK  (text/html)
  219   4.927086   10.1.1.101 → 10.1.1.1     TCP 54 3196 → 80 [ACK] Seq=615 Ack=1541 Win=65535 Len=0
  220   4.927109     10.1.1.1 → 10.1.1.101   TCP 60 80 → 3196 [FIN, ACK] Seq=1541 Ack=615 Win=6754 Len=0
  221   4.927139   10.1.1.101 → 10.1.1.1     TCP 54 3196 → 80 [ACK] Seq=615 Ack=1542 Win=65535 Len=0
  222   5.087884   10.1.1.101 → 10.1.1.1     TCP 54 3196 → 80 [FIN, ACK] Seq=615 Ack=1542 Win=65535 Len=0
  223   5.088321     10.1.1.1 → 10.1.1.101   TCP 60 80 → 3196 [ACK] Seq=1542 Ack=616 Win=6754 Len=0
  224   6.646468   10.1.1.101 → 10.1.1.1     TCP 62 3197 → 80 [SYN] Seq=0 Win=0 Len=0 MSS=1460 SACK_PERM=1
  225   6.646939     10.1.1.1 → 10.1.1.101   TCP 62 80 → 3197 [SYN, ACK] Seq=0 Ack=1 Win=5840 Len=0 MSS=1460 SACK_PERM=1
  226   6.646986   10.1.1.101 → 10.1.1.1     TCP 54 3197 → 80 [ACK] Seq=1 Ack=1 Win=65535 Len=0
  227   6.655170   10.1.1.101 → 10.1.1.1     HTTP 676 GET /Websidan/dagbok/2004/28/dagbok.html HTTP/1.1 
  228   6.656418     10.1.1.1 → 10.1.1.101   TCP 60 80 → 3197 [ACK] Seq=1 Ack=623 Win=6842 Len=0
  229   6.659352     10.1.1.1 → 10.1.1.101   TCP 1514 HTTP/1.1 200 OK  [TCP segment of a reassembled PDU]
  230   6.660260     10.1.1.1 → 10.1.1.101   HTTP 1103 HTTP/1.1 200 OK  (text/html)
  231   6.660346   10.1.1.101 → 10.1.1.1     TCP 54 3197 → 80 [ACK] Seq=623 Ack=2510 Win=65535 Len=0
  232   6.660368     10.1.1.1 → 10.1.1.101   TCP 60 80 → 3197 [FIN, ACK] Seq=2510 Ack=623 Win=6842 Len=0
  233   6.660398   10.1.1.101 → 10.1.1.1     TCP 54 3197 → 80 [ACK] Seq=623 Ack=2511 Win=65535 Len=0
  234   6.736387   10.1.1.101 → 10.1.1.1     TCP 62 3198 → 80 [SYN] Seq=0 Win=0 Len=0 MSS=1460 SACK_PERM=1
  235   6.736831     10.1.1.1 → 10.1.1.101   TCP 62 80 → 3198 [SYN, ACK] Seq=0 Ack=1 Win=5840 Len=0 MSS=1460 SACK_PERM=1
  236   6.736873   10.1.1.101 → 10.1.1.1     TCP 54 3198 → 80 [ACK] Seq=1 Ack=1 Win=65535 Len=0
  237   6.738548   10.1.1.101 → 10.1.1.1     TCP 62 3199 → 80 [SYN] Seq=0 Win=0 Len=0 MSS=1460 SACK_PERM=1
  238   6.738992     10.1.1.1 → 10.1.1.101   TCP 62 80 → 3199 [SYN, ACK] Seq=0 Ack=1 Win=5840 Len=0 MSS=1460 SACK_PERM=1
  239   6.739035   10.1.1.101 → 10.1.1.1     TCP 54 3199 → 80 [ACK] Seq=1 Ack=1 Win=65535 Len=0
  240   6.762743   10.1.1.101 → 10.1.1.1     HTTP 686 GET /Websidan/2004-07-SeaWorld/320/DSC07858.JPG HTTP/1.1 
  241   6.763698   10.1.1.101 → 10.1.1.1     HTTP 686 GET /Websidan/2004-07-SeaWorld/320/DSC07859.JPG HTTP/1.1 
  242   6.763884   10.1.1.101 → 10.1.1.1     TCP 54 3197 → 80 [FIN, ACK] Seq=623 Ack=2511 Win=65535 Len=0
  243   6.764522     10.1.1.1 → 10.1.1.101   TCP 60 80 → 3198 [ACK] Seq=1 Ack=633 Win=6952 Len=0
  244   6.765075     10.1.1.1 → 10.1.1.101   TCP 60 80 → 3199 [ACK] Seq=1 Ack=633 Win=6952 Len=0
  245   6.765205     10.1.1.1 → 10.1.1.101   TCP 60 80 → 3197 [ACK] Seq=2511 Ack=624 Win=6842 Len=0
  246   6.767765     10.1.1.1 → 10.1.1.101   TCP 1514 HTTP/1.1 200 OK  [TCP segment of a reassembled PDU]
  247   6.768985     10.1.1.1 → 10.1.1.101   TCP 1514 80 → 3198 [ACK] Seq=1461 Ack=633 Win=6952 Len=1460 [TCP segment of a reassembled PDU]
  248   6.769047   10.1.1.101 → 10.1.1.1     TCP 54 3198 → 80 [ACK] Seq=633 Ack=2921 Win=65535 Len=0
  249   6.770912     10.1.1.1 → 10.1.1.101   TCP 1514 HTTP/1.1 200 OK  [TCP segment of a reassembled PDU]
  250   6.772157     10.1.1.1 → 10.1.1.101   TCP 1514 80 → 3198 [ACK] Seq=2921 Ack=633 Win=6952 Len=1460 [TCP segment of a reassembled PDU]
  251   6.772230   10.1.1.101 → 10.1.1.1     TCP 54 3198 → 80 [ACK] Seq=633 Ack=4381 Win=65535 Len=0
  252   6.773438     10.1.1.1 → 10.1.1.101   TCP 1514 80 → 3198 [ACK] Seq=4381 Ack=633 Win=6952 Len=1460 [TCP segment of a reassembled PDU]
  253   6.774746     10.1.1.1 → 10.1.1.101   TCP 1514 80 → 3198 [ACK] Seq=5841 Ack=633 Win=6952 Len=1460 [TCP segment of a reassembled PDU]
  254   6.774808   10.1.1.101 → 10.1.1.1     TCP 54 3198 → 80 [ACK] Seq=633 Ack=7301 Win=65535 Len=0
  255   6.776006     10.1.1.1 → 10.1.1.101   TCP 1514 80 → 3199 [ACK] Seq=1461 Ack=633 Win=6952 Len=1460 [TCP segment of a reassembled PDU]
  256   6.776087   10.1.1.101 → 10.1.1.1     TCP 54 3199 → 80 [ACK] Seq=633 Ack=2921 Win=65535 Len=0
  257   6.777288     10.1.1.1 → 10.1.1.101   TCP 1514 80 → 3198 [ACK] Seq=7301 Ack=633 Win=6952 Len=1460 [TCP segment of a reassembled PDU]
  258   6.777374   10.1.1.101 → 10.1.1.1     TCP 54 3198 → 80 [ACK] Seq=633 Ack=8761 Win=65535 Len=0
  259   6.777805     10.1.1.1 → 10.1.1.101   HTTP 542 HTTP/1.1 200 OK  (JPEG JFIF image)
  260   6.777871   10.1.1.101 → 10.1.1.1     TCP 54 3198 → 80 [ACK] Seq=633 Ack=9250 Win=65047 Len=0
  261   6.779883     10.1.1.1 → 10.1.1.101   TCP 1514 80 → 3199 [ACK] Seq=2921 Ack=633 Win=6952 Len=1460 [TCP segment of a reassembled PDU]
  262   6.779941   10.1.1.101 → 10.1.1.1     TCP 54 3199 → 80 [ACK] Seq=633 Ack=4381 Win=65535 Len=0
  263   6.781133     10.1.1.1 → 10.1.1.101   TCP 1514 80 → 3199 [ACK] Seq=4381 Ack=633 Win=6952 Len=1460 [TCP segment of a reassembled PDU]
  264   6.782447     10.1.1.1 → 10.1.1.101   TCP 1514 80 → 3199 [ACK] Seq=5841 Ack=633 Win=6952 Len=1460 [TCP segment of a reassembled PDU]
  265   6.782500   10.1.1.101 → 10.1.1.1     TCP 54 3199 → 80 [ACK] Seq=633 Ack=7301 Win=65535 Len=0
  266   6.783706     10.1.1.1 → 10.1.1.101   TCP 1514 80 → 3199 [ACK] Seq=7301 Ack=633 Win=6952 Len=1460 [TCP segment of a reassembled PDU]
  267   6.783798   10.1.1.101 → 10.1.1.1     TCP 54 3199 → 80 [ACK] Seq=633 Ack=8761 Win=65535 Len=0
  268   6.785011     10.1.1.1 → 10.1.1.101   TCP 1514 80 → 3199 [ACK] Seq=8761 Ack=633 Win=6952 Len=1460 [TCP segment of a reassembled PDU]
  269   6.785744     10.1.1.1 → 10.1.1.101   HTTP 824 HTTP/1.1 200 OK  (JPEG JFIF image)
  270   6.785825   10.1.1.101 → 10.1.1.1     TCP 54 3199 → 80 [ACK] Seq=633 Ack=10992 Win=65535 Len=0
  271   6.884579   10.1.1.101 → 10.1.1.1     TCP 54 3198 → 80 [FIN, ACK] Seq=633 Ack=9250 Win=65047 Len=0
  272   6.885005     10.1.1.1 → 10.1.1.101   TCP 60 80 → 3198 [ACK] Seq=9250 Ack=634 Win=6952 Len=0
  273   6.903456   10.1.1.101 → 10.1.1.1     TCP 54 3199 → 80 [FIN, ACK] Seq=633 Ack=10992 Win=65535 Len=0
  274   6.903873     10.1.1.1 → 10.1.1.101   TCP 60 80 → 3199 [ACK] Seq=10992 Ack=634 Win=6952 Len=0
  275  10.827791   10.1.1.101 → 10.1.1.1     TCP 62 3200 → 80 [SYN] Seq=0 Win=0 Len=0 MSS=1460 SACK_PERM=1
  276  10.828277     10.1.1.1 → 10.1.1.101   TCP 62 80 → 3200 [SYN, ACK] Seq=0 Ack=1 Win=5840 Len=0 MSS=1460 SACK_PERM=1
  277  10.828321   10.1.1.101 → 10.1.1.1     TCP 54 3200 → 80 [ACK] Seq=1 Ack=1 Win=65535 Len=0
  278  10.836425   10.1.1.101 → 10.1.1.1     HTTP 691 GET /Websidan/2004-07-SeaWorld/fullsize/DSC07858.JPG HTTP/1.1 
  279  10.837691     10.1.1.1 → 10.1.1.101   TCP 60 80 → 3200 [ACK] Seq=1 Ack=638 Win=7007 Len=0
  280  10.840658     10.1.1.1 → 10.1.1.101   TCP 1514 HTTP/1.1 200 OK  [TCP segment of a reassembled PDU]
  281  10.841903     10.1.1.1 → 10.1.1.101   TCP 1514 80 → 3200 [ACK] Seq=1461 Ack=638 Win=7007 Len=1460 [TCP segment of a reassembled PDU]
  282  10.841956   10.1.1.101 → 10.1.1.1     TCP 54 3200 → 80 [ACK] Seq=638 Ack=2921 Win=65535 Len=0
  283  10.844315     10.1.1.1 → 10.1.1.101   TCP 1514 80 → 3200 [ACK] Seq=2921 Ack=638 Win=7007 Len=1460 [TCP segment of a reassembled PDU]
  284  10.844383   10.1.1.101 → 10.1.1.1     TCP 54 3200 → 80 [ACK] Seq=638 Ack=4381 Win=65535 Len=0
  285  10.845583     10.1.1.1 → 10.1.1.101   TCP 1514 80 → 3200 [ACK] Seq=4381 Ack=638 Win=7007 Len=1460 [TCP segment of a reassembled PDU]
  286  10.846912     10.1.1.1 → 10.1.1.101   TCP 1514 80 → 3200 [ACK] Seq=5841 Ack=638 Win=7007 Len=1460 [TCP segment of a reassembled PDU]
  287  10.846984   10.1.1.101 → 10.1.1.1     TCP 54 3200 → 80 [ACK] Seq=638 Ack=7301 Win=65535 Len=0
  288  10.848151     10.1.1.1 → 10.1.1.101   TCP 1514 80 → 3200 [ACK] Seq=7301 Ack=638 Win=7007 Len=1460 [TCP segment of a reassembled PDU]
  289  10.848258   10.1.1.101 → 10.1.1.1     TCP 54 3200 → 80 [ACK] Seq=638 Ack=8761 Win=65535 Len=0
  290  10.849432     10.1.1.1 → 10.1.1.101   TCP 1514 80 → 3200 [ACK] Seq=8761 Ack=638 Win=7007 Len=1460 [TCP segment of a reassembled PDU]
  291  10.850736     10.1.1.1 → 10.1.1.101   TCP 1514 80 → 3200 [ACK] Seq=10221 Ack=638 Win=7007 Len=1460 [TCP segment of a reassembled PDU]
  292  10.850773   10.1.1.101 → 10.1.1.1     TCP 54 3200 → 80 [ACK] Seq=638 Ack=11681 Win=65535 Len=0
  293  10.852001     10.1.1.1 → 10.1.1.101   TCP 1514 80 → 3200 [PSH, ACK] Seq=11681 Ack=638 Win=7007 Len=1460 [TCP segment of a reassembled PDU]
  294  10.852084   10.1.1.101 → 10.1.1.1     TCP 54 3200 → 80 [ACK] Seq=638 Ack=13141 Win=65535 Len=0
  295  10.853348     10.1.1.1 → 10.1.1.101   TCP 1514 80 → 3200 [ACK] Seq=13141 Ack=638 Win=7007 Len=1460 [TCP segment of a reassembled PDU]
  296  10.854595     10.1.1.1 → 10.1.1.101   TCP 1514 80 → 3200 [ACK] Seq=14601 Ack=638 Win=7007 Len=1460 [TCP segment of a reassembled PDU]
  297  10.854636   10.1.1.101 → 10.1.1.1     TCP 54 3200 → 80 [ACK] Seq=638 Ack=16061 Win=62615 Len=0
  298  10.855147     10.1.1.1 → 10.1.1.101   TCP 640 80 → 3200 [ACK] Seq=16061 Ack=638 Win=7007 Len=586 [TCP segment of a reassembled PDU]
  299  10.856935     10.1.1.1 → 10.1.1.101   TCP 1514 80 → 3200 [ACK] Seq=16647 Ack=638 Win=7007 Len=1460 [TCP segment of a reassembled PDU]
  300  10.856964   10.1.1.101 → 10.1.1.1     TCP 54 3200 → 80 [ACK] Seq=638 Ack=18107 Win=60569 Len=0
  301  10.858185     10.1.1.1 → 10.1.1.101   TCP 1514 80 → 3200 [ACK] Seq=18107 Ack=638 Win=7007 Len=1460 [TCP segment of a reassembled PDU]
  302  10.859482     10.1.1.1 → 10.1.1.101   TCP 1514 80 → 3200 [ACK] Seq=19567 Ack=638 Win=7007 Len=1460 [TCP segment of a reassembled PDU]
  303  10.859521   10.1.1.101 → 10.1.1.1     TCP 54 3200 → 80 [ACK] Seq=638 Ack=21027 Win=57649 Len=0
  304  10.860737     10.1.1.1 → 10.1.1.101   TCP 1514 80 → 3200 [PSH, ACK] Seq=21027 Ack=638 Win=7007 Len=1460 [TCP segment of a reassembled PDU]
  305  10.862044     10.1.1.1 → 10.1.1.101   TCP 1514 80 → 3200 [ACK] Seq=22487 Ack=638 Win=7007 Len=1460 [TCP segment of a reassembled PDU]
  306  10.862076   10.1.1.101 → 10.1.1.1     TCP 54 3200 → 80 [ACK] Seq=638 Ack=23947 Win=54729 Len=0
  307  10.863299     10.1.1.1 → 10.1.1.101   TCP 1514 80 → 3200 [ACK] Seq=23947 Ack=638 Win=7007 Len=1460 [TCP segment of a reassembled PDU]
  308  10.864599     10.1.1.1 → 10.1.1.101   TCP 1514 80 → 3200 [ACK] Seq=25407 Ack=638 Win=7007 Len=1460 [TCP segment of a reassembled PDU]
  309  10.864632   10.1.1.101 → 10.1.1.1     TCP 54 3200 → 80 [ACK] Seq=638 Ack=26867 Win=51809 Len=0
  310  10.865854     10.1.1.1 → 10.1.1.101   TCP 1514 80 → 3200 [ACK] Seq=26867 Ack=638 Win=7007 Len=1460 [TCP segment of a reassembled PDU]
  311  10.867155     10.1.1.1 → 10.1.1.101   TCP 1514 80 → 3200 [ACK] Seq=28327 Ack=638 Win=7007 Len=1460 [TCP segment of a reassembled PDU]
  312  10.867187   10.1.1.101 → 10.1.1.1     TCP 54 3200 → 80 [ACK] Seq=638 Ack=29787 Win=48889 Len=0
  313  10.868411     10.1.1.1 → 10.1.1.101   TCP 1514 80 → 3200 [ACK] Seq=29787 Ack=638 Win=7007 Len=1460 [TCP segment of a reassembled PDU]
  314  10.869714     10.1.1.1 → 10.1.1.101   TCP 1514 80 → 3200 [ACK] Seq=31247 Ack=638 Win=7007 Len=1460 [TCP segment of a reassembled PDU]
  315  10.869746   10.1.1.101 → 10.1.1.1     TCP 54 3200 → 80 [ACK] Seq=638 Ack=32707 Win=45969 Len=0
  316  10.870981     10.1.1.1 → 10.1.1.101   TCP 1514 80 → 3200 [ACK] Seq=32707 Ack=638 Win=7007 Len=1460 [TCP segment of a reassembled PDU]
  317  10.872274     10.1.1.1 → 10.1.1.101   TCP 1514 80 → 3200 [PSH, ACK] Seq=34167 Ack=638 Win=7007 Len=1460 [TCP segment of a reassembled PDU]
  318  10.872317   10.1.1.101 → 10.1.1.1     TCP 54 3200 → 80 [ACK] Seq=638 Ack=35627 Win=43049 Len=0
  319  10.873527     10.1.1.1 → 10.1.1.101   TCP 1514 80 → 3200 [ACK] Seq=35627 Ack=638 Win=7007 Len=1460 [TCP segment of a reassembled PDU]
  320  10.874832     10.1.1.1 → 10.1.1.101   TCP 1514 80 → 3200 [ACK] Seq=37087 Ack=638 Win=7007 Len=1460 [TCP segment of a reassembled PDU]
  321  10.874871   10.1.1.101 → 10.1.1.1     TCP 54 3200 → 80 [ACK] Seq=638 Ack=38547 Win=40129 Len=0
  322  10.876123     10.1.1.1 → 10.1.1.101   TCP 1514 80 → 3200 [ACK] Seq=38547 Ack=638 Win=7007 Len=1460 [TCP segment of a reassembled PDU]
  323  10.877409     10.1.1.1 → 10.1.1.101   TCP 1514 80 → 3200 [ACK] Seq=40007 Ack=638 Win=7007 Len=1460 [TCP segment of a reassembled PDU]
  324  10.877464   10.1.1.101 → 10.1.1.1     TCP 54 3200 → 80 [ACK] Seq=638 Ack=41467 Win=37209 Len=0
  325  10.878691     10.1.1.1 → 10.1.1.101   TCP 1514 80 → 3200 [ACK] Seq=41467 Ack=638 Win=7007 Len=1460 [TCP segment of a reassembled PDU]
  326  10.879973     10.1.1.1 → 10.1.1.101   TCP 1514 80 → 3200 [ACK] Seq=42927 Ack=638 Win=7007 Len=1460 [TCP segment of a reassembled PDU]
  327  10.880040   10.1.1.101 → 10.1.1.1     TCP 54 3200 → 80 [ACK] Seq=638 Ack=44387 Win=34289 Len=0
  328  10.881222     10.1.1.1 → 10.1.1.101   TCP 1514 80 → 3200 [ACK] Seq=44387 Ack=638 Win=7007 Len=1460 [TCP segment of a reassembled PDU]
  329  10.882537     10.1.1.1 → 10.1.1.101   TCP 1514 80 → 3200 [ACK] Seq=45847 Ack=638 Win=7007 Len=1460 [TCP segment of a reassembled PDU]
  330  10.882600   10.1.1.101 → 10.1.1.1     TCP 54 3200 → 80 [ACK] Seq=638 Ack=47307 Win=31369 Len=0
  331  10.883779     10.1.1.1 → 10.1.1.101   TCP 1514 80 → 3200 [ACK] Seq=47307 Ack=638 Win=7007 Len=1460 [TCP segment of a reassembled PDU]
  332  10.885106     10.1.1.1 → 10.1.1.101   TCP 1514 80 → 3200 [ACK] Seq=48767 Ack=638 Win=7007 Len=1460 [TCP segment of a reassembled PDU]
  333  10.885185   10.1.1.101 → 10.1.1.1     TCP 54 3200 → 80 [ACK] Seq=638 Ack=50227 Win=28449 Len=0
  334  10.886345     10.1.1.1 → 10.1.1.101   TCP 1514 80 → 3200 [ACK] Seq=50227 Ack=638 Win=7007 Len=1460 [TCP segment of a reassembled PDU]
  335  10.887642     10.1.1.1 → 10.1.1.101   TCP 1514 80 → 3200 [PSH, ACK] Seq=51687 Ack=638 Win=7007 Len=1460 [TCP segment of a reassembled PDU]
  336  10.887696   10.1.1.101 → 10.1.1.1     TCP 54 3200 → 80 [ACK] Seq=638 Ack=53147 Win=25529 Len=0
  337  10.888907     10.1.1.1 → 10.1.1.101   TCP 1514 80 → 3200 [ACK] Seq=53147 Ack=638 Win=7007 Len=1460 [TCP segment of a reassembled PDU]
  338  10.890203     10.1.1.1 → 10.1.1.101   TCP 1514 80 → 3200 [ACK] Seq=54607 Ack=638 Win=7007 Len=1460 [TCP segment of a reassembled PDU]
  339  10.890262   10.1.1.101 → 10.1.1.1     TCP 54 3200 → 80 [ACK] Seq=638 Ack=56067 Win=22609 Len=0
  340  10.891455     10.1.1.1 → 10.1.1.101   TCP 1514 80 → 3200 [ACK] Seq=56067 Ack=638 Win=7007 Len=1460 [TCP segment of a reassembled PDU]
  341  10.892757     10.1.1.1 → 10.1.1.101   TCP 1514 80 → 3200 [ACK] Seq=57527 Ack=638 Win=7007 Len=1460 [TCP segment of a reassembled PDU]
  342  10.892793   10.1.1.101 → 10.1.1.1     TCP 54 3200 → 80 [ACK] Seq=638 Ack=58987 Win=19689 Len=0
  343  10.894049     10.1.1.1 → 10.1.1.101   TCP 1514 80 → 3200 [ACK] Seq=58987 Ack=638 Win=7007 Len=1460 [TCP segment of a reassembled PDU]
  344  10.895324     10.1.1.1 → 10.1.1.101   TCP 1514 80 → 3200 [ACK] Seq=60447 Ack=638 Win=7007 Len=1460 [TCP segment of a reassembled PDU]
  345  10.895389   10.1.1.101 → 10.1.1.1     TCP 54 3200 → 80 [ACK] Seq=638 Ack=61907 Win=16769 Len=0
  346  10.896576     10.1.1.1 → 10.1.1.101   TCP 1514 80 → 3200 [ACK] Seq=61907 Ack=638 Win=7007 Len=1460 [TCP segment of a reassembled PDU]
  347  10.897893     10.1.1.1 → 10.1.1.101   TCP 1514 80 → 3200 [ACK] Seq=63367 Ack=638 Win=7007 Len=1460 [TCP segment of a reassembled PDU]
  348  10.897972   10.1.1.101 → 10.1.1.1     TCP 54 3200 → 80 [ACK] Seq=638 Ack=64827 Win=13849 Len=0
  349  10.899141     10.1.1.1 → 10.1.1.101   TCP 1514 80 → 3200 [ACK] Seq=64827 Ack=638 Win=7007 Len=1460 [TCP segment of a reassembled PDU]
  350  10.900448     10.1.1.1 → 10.1.1.101   TCP 1514 80 → 3200 [ACK] Seq=66287 Ack=638 Win=7007 Len=1460 [TCP segment of a reassembled PDU]
  351  10.900521   10.1.1.101 → 10.1.1.1     TCP 54 3200 → 80 [ACK] Seq=638 Ack=67747 Win=10929 Len=0
  352  10.901702     10.1.1.1 → 10.1.1.101   TCP 1514 80 → 3200 [ACK] Seq=67747 Ack=638 Win=7007 Len=1460 [TCP segment of a reassembled PDU]
  353  10.903001     10.1.1.1 → 10.1.1.101   TCP 1514 80 → 3200 [ACK] Seq=69207 Ack=638 Win=7007 Len=1460 [TCP segment of a reassembled PDU]
  354  10.903078   10.1.1.101 → 10.1.1.1     TCP 54 3200 → 80 [ACK] Seq=638 Ack=70667 Win=8009 Len=0
  355  10.904244     10.1.1.1 → 10.1.1.101   TCP 1514 80 → 3200 [ACK] Seq=70667 Ack=638 Win=7007 Len=1460 [TCP segment of a reassembled PDU]
  356  10.905545     10.1.1.1 → 10.1.1.101   TCP 1514 80 → 3200 [ACK] Seq=72127 Ack=638 Win=7007 Len=1460 [TCP segment of a reassembled PDU]
  357  10.905571   10.1.1.101 → 10.1.1.1     TCP 54 3200 → 80 [ACK] Seq=638 Ack=73587 Win=5089 Len=0
  358  10.906801     10.1.1.1 → 10.1.1.101   TCP 1514 80 → 3200 [ACK] Seq=73587 Ack=638 Win=7007 Len=1460 [TCP segment of a reassembled PDU]
  359  10.908119     10.1.1.1 → 10.1.1.101   TCP 1514 80 → 3200 [PSH, ACK] Seq=75047 Ack=638 Win=7007 Len=1460 [TCP segment of a reassembled PDU]
  360  10.908145   10.1.1.101 → 10.1.1.1     TCP 54 3200 → 80 [ACK] Seq=638 Ack=76507 Win=2169 Len=0
  361  10.909362     10.1.1.1 → 10.1.1.101   TCP 1514 80 → 3200 [ACK] Seq=76507 Ack=638 Win=7007 Len=1460 [TCP segment of a reassembled PDU]
  362  10.958682   10.1.1.101 → 10.1.1.1     TCP 54 3200 → 80 [ACK] Seq=638 Ack=77967 Win=65535 Len=0
  363  10.961082     10.1.1.1 → 10.1.1.101   TCP 1514 80 → 3200 [ACK] Seq=77967 Ack=638 Win=7007 Len=1460 [TCP segment of a reassembled PDU]
  364  10.962308     10.1.1.1 → 10.1.1.101   TCP 1514 80 → 3200 [ACK] Seq=79427 Ack=638 Win=7007 Len=1460 [TCP segment of a reassembled PDU]
  365  10.962361   10.1.1.101 → 10.1.1.1     TCP 54 3200 → 80 [ACK] Seq=638 Ack=80887 Win=62615 Len=0
  366  10.963561     10.1.1.1 → 10.1.1.101   TCP 1514 80 → 3200 [ACK] Seq=80887 Ack=638 Win=7007 Len=1460 [TCP segment of a reassembled PDU]
  367  10.964872     10.1.1.1 → 10.1.1.101   TCP 1514 80 → 3200 [ACK] Seq=82347 Ack=638 Win=7007 Len=1460 [TCP segment of a reassembled PDU]
  368  10.964923   10.1.1.101 → 10.1.1.1     TCP 54 3200 → 80 [ACK] Seq=638 Ack=83807 Win=59695 Len=0
  369  10.966132     10.1.1.1 → 10.1.1.101   TCP 1514 80 → 3200 [ACK] Seq=83807 Ack=638 Win=7007 Len=1460 [TCP segment of a reassembled PDU]
  370  10.967431     10.1.1.1 → 10.1.1.101   TCP 1514 80 → 3200 [ACK] Seq=85267 Ack=638 Win=7007 Len=1460 [TCP segment of a reassembled PDU]
  371  10.967476   10.1.1.101 → 10.1.1.1     TCP 54 3200 → 80 [ACK] Seq=638 Ack=86727 Win=56775 Len=0
  372  10.968677     10.1.1.1 → 10.1.1.101   TCP 1514 80 → 3200 [ACK] Seq=86727 Ack=638 Win=7007 Len=1460 [TCP segment of a reassembled PDU]
  373  10.970010     10.1.1.1 → 10.1.1.101   TCP 1514 80 → 3200 [ACK] Seq=88187 Ack=638 Win=7007 Len=1460 [TCP segment of a reassembled PDU]
  374  10.970042   10.1.1.101 → 10.1.1.1     TCP 54 3200 → 80 [ACK] Seq=638 Ack=89647 Win=53855 Len=0
  375  10.971239     10.1.1.1 → 10.1.1.101   TCP 1514 80 → 3200 [ACK] Seq=89647 Ack=638 Win=7007 Len=1460 [TCP segment of a reassembled PDU]
  376  10.972540     10.1.1.1 → 10.1.1.101   TCP 1514 80 → 3200 [ACK] Seq=91107 Ack=638 Win=7007 Len=1460 [TCP segment of a reassembled PDU]
  377  10.972572   10.1.1.101 → 10.1.1.1     TCP 54 3200 → 80 [ACK] Seq=638 Ack=92567 Win=50935 Len=0
  378  10.973797     10.1.1.1 → 10.1.1.101   TCP 1514 80 → 3200 [ACK] Seq=92567 Ack=638 Win=7007 Len=1460 [TCP segment of a reassembled PDU]
  379  10.975097     10.1.1.1 → 10.1.1.101   TCP 1514 80 → 3200 [ACK] Seq=94027 Ack=638 Win=7007 Len=1460 [TCP segment of a reassembled PDU]
  380  10.975130   10.1.1.101 → 10.1.1.1     TCP 54 3200 → 80 [ACK] Seq=638 Ack=95487 Win=48015 Len=0
  381  10.976356     10.1.1.1 → 10.1.1.101   TCP 1514 80 → 3200 [ACK] Seq=95487 Ack=638 Win=7007 Len=1460 [TCP segment of a reassembled PDU]
  382  10.977655     10.1.1.1 → 10.1.1.101   TCP 1514 80 → 3200 [ACK] Seq=96947 Ack=638 Win=7007 Len=1460 [TCP segment of a reassembled PDU]
  383  10.977691   10.1.1.101 → 10.1.1.1     TCP 54 3200 → 80 [ACK] Seq=638 Ack=98407 Win=45095 Len=0
  384  10.978911     10.1.1.1 → 10.1.1.101   TCP 1514 80 → 3200 [ACK] Seq=98407 Ack=638 Win=7007 Len=1460 [TCP segment of a reassembled PDU]
  385  10.980214     10.1.1.1 → 10.1.1.101   TCP 1514 80 → 3200 [ACK] Seq=99867 Ack=638 Win=7007 Len=1460 [TCP segment of a reassembled PDU]
  386  10.980245   10.1.1.101 → 10.1.1.1     TCP 54 3200 → 80 [ACK] Seq=638 Ack=101327 Win=42175 Len=0
  387  10.981473     10.1.1.1 → 10.1.1.101   TCP 1514 80 → 3200 [ACK] Seq=101327 Ack=638 Win=7007 Len=1460 [TCP segment of a reassembled PDU]
  388  10.982774     10.1.1.1 → 10.1.1.101   TCP 1514 80 → 3200 [ACK] Seq=102787 Ack=638 Win=7007 Len=1460 [TCP segment of a reassembled PDU]
  389  10.982807   10.1.1.101 → 10.1.1.1     TCP 54 3200 → 80 [ACK] Seq=638 Ack=104247 Win=39255 Len=0
  390  10.984028     10.1.1.1 → 10.1.1.101   TCP 1514 80 → 3200 [ACK] Seq=104247 Ack=638 Win=7007 Len=1460 [TCP segment of a reassembled PDU]
  391  10.985341     10.1.1.1 → 10.1.1.101   TCP 1514 80 → 3200 [ACK] Seq=105707 Ack=638 Win=7007 Len=1460 [TCP segment of a reassembled PDU]
  392  10.985375   10.1.1.101 → 10.1.1.1     TCP 54 3200 → 80 [ACK] Seq=638 Ack=107167 Win=36335 Len=0
  393  10.986626     10.1.1.1 → 10.1.1.101   TCP 1514 80 → 3200 [ACK] Seq=107167 Ack=638 Win=7007 Len=1460 [TCP segment of a reassembled PDU]
  394  10.987893     10.1.1.1 → 10.1.1.101   TCP 1514 80 → 3200 [PSH, ACK] Seq=108627 Ack=638 Win=7007 Len=1460 [TCP segment of a reassembled PDU]
  395  10.987947   10.1.1.101 → 10.1.1.1     TCP 54 3200 → 80 [ACK] Seq=638 Ack=110087 Win=33415 Len=0
  396  10.989144     10.1.1.1 → 10.1.1.101   TCP 1514 80 → 3200 [ACK] Seq=110087 Ack=638 Win=7007 Len=1460 [TCP segment of a reassembled PDU]
  397  10.990444     10.1.1.1 → 10.1.1.101   TCP 1514 80 → 3200 [ACK] Seq=111547 Ack=638 Win=7007 Len=1460 [TCP segment of a reassembled PDU]
  398  10.990479   10.1.1.101 → 10.1.1.1     TCP 54 3200 → 80 [ACK] Seq=638 Ack=113007 Win=30495 Len=0
  399  10.991700     10.1.1.1 → 10.1.1.101   TCP 1514 80 → 3200 [PSH, ACK] Seq=113007 Ack=638 Win=7007 Len=1460 [TCP segment of a reassembled PDU]
  400  10.993003     10.1.1.1 → 10.1.1.101   TCP 1514 80 → 3200 [ACK] Seq=114467 Ack=638 Win=7007 Len=1460 [TCP segment of a reassembled PDU]
  401  10.993038   10.1.1.101 → 10.1.1.1     TCP 54 3200 → 80 [ACK] Seq=638 Ack=115927 Win=27575 Len=0
  402  10.994258     10.1.1.1 → 10.1.1.101   TCP 1514 80 → 3200 [ACK] Seq=115927 Ack=638 Win=7007 Len=1460 [TCP segment of a reassembled PDU]
  403  10.995580     10.1.1.1 → 10.1.1.101   TCP 1514 80 → 3200 [ACK] Seq=117387 Ack=638 Win=7007 Len=1460 [TCP segment of a reassembled PDU]
  404  10.995656   10.1.1.101 → 10.1.1.1     TCP 54 3200 → 80 [ACK] Seq=638 Ack=118847 Win=24655 Len=0
  405  10.996823     10.1.1.1 → 10.1.1.101   TCP 1514 80 → 3200 [ACK] Seq=118847 Ack=638 Win=7007 Len=1460 [TCP segment of a reassembled PDU]
  406  10.998141     10.1.1.1 → 10.1.1.101   TCP 1514 80 → 3200 [ACK] Seq=120307 Ack=638 Win=7007 Len=1460 [TCP segment of a reassembled PDU]
  407  10.998215   10.1.1.101 → 10.1.1.1     TCP 54 3200 → 80 [ACK] Seq=638 Ack=121767 Win=21735 Len=0
  408  10.999388     10.1.1.1 → 10.1.1.101   TCP 1514 80 → 3200 [ACK] Seq=121767 Ack=638 Win=7007 Len=1460 [TCP segment of a reassembled PDU]
  409  11.000673     10.1.1.1 → 10.1.1.101   TCP 1514 80 → 3200 [ACK] Seq=123227 Ack=638 Win=7007 Len=1460 [TCP segment of a reassembled PDU]
  410  11.000711   10.1.1.101 → 10.1.1.1     TCP 54 3200 → 80 [ACK] Seq=638 Ack=124687 Win=18815 Len=0
  411  11.001930     10.1.1.1 → 10.1.1.101   TCP 1514 80 → 3200 [ACK] Seq=124687 Ack=638 Win=7007 Len=1460 [TCP segment of a reassembled PDU]
  412  11.003230     10.1.1.1 → 10.1.1.101   TCP 1514 80 → 3200 [ACK] Seq=126147 Ack=638 Win=7007 Len=1460 [TCP segment of a reassembled PDU]
  413  11.003288   10.1.1.101 → 10.1.1.1     TCP 54 3200 → 80 [ACK] Seq=638 Ack=127607 Win=15895 Len=0
  414  11.004486     10.1.1.1 → 10.1.1.101   TCP 1514 80 → 3200 [ACK] Seq=127607 Ack=638 Win=7007 Len=1460 [TCP segment of a reassembled PDU]
  415  11.005791     10.1.1.1 → 10.1.1.101   TCP 1514 80 → 3200 [ACK] Seq=129067 Ack=638 Win=7007 Len=1460 [TCP segment of a reassembled PDU]
  416  11.005842   10.1.1.101 → 10.1.1.1     TCP 54 3200 → 80 [ACK] Seq=638 Ack=130527 Win=12975 Len=0
  417  11.007046     10.1.1.1 → 10.1.1.101   TCP 1514 80 → 3200 [ACK] Seq=130527 Ack=638 Win=7007 Len=1460 [TCP segment of a reassembled PDU]
  418  11.008353     10.1.1.1 → 10.1.1.101   TCP 1514 80 → 3200 [ACK] Seq=131987 Ack=638 Win=7007 Len=1460 [TCP segment of a reassembled PDU]
  419  11.008412   10.1.1.101 → 10.1.1.1     TCP 54 3200 → 80 [ACK] Seq=638 Ack=133447 Win=10055 Len=0
  420  11.009614     10.1.1.1 → 10.1.1.101   TCP 1514 80 → 3200 [ACK] Seq=133447 Ack=638 Win=7007 Len=1460 [TCP segment of a reassembled PDU]
  421  11.010921     10.1.1.1 → 10.1.1.101   TCP 1514 80 → 3200 [ACK] Seq=134907 Ack=638 Win=7007 Len=1460 [TCP segment of a reassembled PDU]
  422  11.010989   10.1.1.101 → 10.1.1.1     TCP 54 3200 → 80 [ACK] Seq=638 Ack=136367 Win=7135 Len=0
  423  11.012159     10.1.1.1 → 10.1.1.101   TCP 1514 80 → 3200 [PSH, ACK] Seq=136367 Ack=638 Win=7007 Len=1460 [TCP segment of a reassembled PDU]
  424  11.013463     10.1.1.1 → 10.1.1.101   TCP 1514 80 → 3200 [ACK] Seq=137827 Ack=638 Win=7007 Len=1460 [TCP segment of a reassembled PDU]
  425  11.013500   10.1.1.101 → 10.1.1.1     TCP 54 3200 → 80 [ACK] Seq=638 Ack=139287 Win=4215 Len=0
  426  11.014738     10.1.1.1 → 10.1.1.101   TCP 1514 80 → 3200 [ACK] Seq=139287 Ack=638 Win=7007 Len=1460 [TCP segment of a reassembled PDU]
  427  11.016034     10.1.1.1 → 10.1.1.101   TCP 1514 80 → 3200 [ACK] Seq=140747 Ack=638 Win=7007 Len=1460 [TCP segment of a reassembled PDU]
  428  11.016074   10.1.1.101 → 10.1.1.1     TCP 54 3200 → 80 [ACK] Seq=638 Ack=142207 Win=1295 Len=0
  429  11.064832   10.1.1.101 → 10.1.1.1     TCP 54 [TCP Window Update] 3200 → 80 [ACK] Seq=638 Ack=142207 Win=65535 Len=0
  430  11.067208     10.1.1.1 → 10.1.1.101   TCP 1514 80 → 3200 [ACK] Seq=142207 Ack=638 Win=7007 Len=1460 [TCP segment of a reassembled PDU]
  431  11.068433     10.1.1.1 → 10.1.1.101   TCP 1514 80 → 3200 [ACK] Seq=143667 Ack=638 Win=7007 Len=1460 [TCP segment of a reassembled PDU]
  432  11.068484   10.1.1.101 → 10.1.1.1     TCP 54 3200 → 80 [ACK] Seq=638 Ack=145127 Win=62615 Len=0
  433  11.069689     10.1.1.1 → 10.1.1.101   TCP 1514 80 → 3200 [ACK] Seq=145127 Ack=638 Win=7007 Len=1460 [TCP segment of a reassembled PDU]
  434  11.070995     10.1.1.1 → 10.1.1.101   TCP 1514 80 → 3200 [ACK] Seq=146587 Ack=638 Win=7007 Len=1460 [TCP segment of a reassembled PDU]
  435  11.071030   10.1.1.101 → 10.1.1.1     TCP 54 3200 → 80 [ACK] Seq=638 Ack=148047 Win=59695 Len=0
  436  11.072334     10.1.1.1 → 10.1.1.101   TCP 1514 80 → 3200 [ACK] Seq=148047 Ack=638 Win=7007 Len=1460 [TCP segment of a reassembled PDU]
  437  11.073573     10.1.1.1 → 10.1.1.101   TCP 1514 80 → 3200 [ACK] Seq=149507 Ack=638 Win=7007 Len=1460 [TCP segment of a reassembled PDU]
  438  11.073658   10.1.1.101 → 10.1.1.1     TCP 54 3200 → 80 [ACK] Seq=638 Ack=150967 Win=56775 Len=0
  439  11.074812     10.1.1.1 → 10.1.1.101   TCP 1514 80 → 3200 [ACK] Seq=150967 Ack=638 Win=7007 Len=1460 [TCP segment of a reassembled PDU]
  440  11.076130     10.1.1.1 → 10.1.1.101   TCP 1514 80 → 3200 [ACK] Seq=152427 Ack=638 Win=7007 Len=1460 [TCP segment of a reassembled PDU]
  441  11.076202   10.1.1.101 → 10.1.1.1     TCP 54 3200 → 80 [ACK] Seq=638 Ack=153887 Win=53855 Len=0
  442  11.077387     10.1.1.1 → 10.1.1.101   TCP 1514 80 → 3200 [ACK] Seq=153887 Ack=638 Win=7007 Len=1460 [TCP segment of a reassembled PDU]
  443  11.078681     10.1.1.1 → 10.1.1.101   TCP 1514 80 → 3200 [ACK] Seq=155347 Ack=638 Win=7007 Len=1460 [TCP segment of a reassembled PDU]
  444  11.078750   10.1.1.101 → 10.1.1.1     TCP 54 3200 → 80 [ACK] Seq=638 Ack=156807 Win=50935 Len=0
  445  11.079944     10.1.1.1 → 10.1.1.101   TCP 1514 80 → 3200 [ACK] Seq=156807 Ack=638 Win=7007 Len=1460 [TCP segment of a reassembled PDU]
  446  11.081237     10.1.1.1 → 10.1.1.101   TCP 1514 80 → 3200 [ACK] Seq=158267 Ack=638 Win=7007 Len=1460 [TCP segment of a reassembled PDU]
  447  11.081304   10.1.1.101 → 10.1.1.1     TCP 54 3200 → 80 [ACK] Seq=638 Ack=159727 Win=48015 Len=0
  448  11.082492     10.1.1.1 → 10.1.1.101   TCP 1514 80 → 3200 [ACK] Seq=159727 Ack=638 Win=7007 Len=1460 [TCP segment of a reassembled PDU]
  449  11.083793     10.1.1.1 → 10.1.1.101   TCP 1514 80 → 3200 [ACK] Seq=161187 Ack=638 Win=7007 Len=1460 [TCP segment of a reassembled PDU]
  450  11.083855   10.1.1.101 → 10.1.1.1     TCP 54 3200 → 80 [ACK] Seq=638 Ack=162647 Win=45095 Len=0
  451  11.085047     10.1.1.1 → 10.1.1.101   TCP 1514 80 → 3200 [ACK] Seq=162647 Ack=638 Win=7007 Len=1460 [TCP segment of a reassembled PDU]
  452  11.086356     10.1.1.1 → 10.1.1.101   TCP 1514 80 → 3200 [ACK] Seq=164107 Ack=638 Win=7007 Len=1460 [TCP segment of a reassembled PDU]
  453  11.086391   10.1.1.101 → 10.1.1.1     TCP 54 3200 → 80 [ACK] Seq=638 Ack=165567 Win=42175 Len=0
  454  11.087602     10.1.1.1 → 10.1.1.101   TCP 1514 80 → 3200 [ACK] Seq=165567 Ack=638 Win=7007 Len=1460 [TCP segment of a reassembled PDU]
  455  11.088906     10.1.1.1 → 10.1.1.101   TCP 1514 80 → 3200 [ACK] Seq=167027 Ack=638 Win=7007 Len=1460 [TCP segment of a reassembled PDU]
  456  11.088938   10.1.1.101 → 10.1.1.1     TCP 54 3200 → 80 [ACK] Seq=638 Ack=168487 Win=39255 Len=0
  457  11.090162     10.1.1.1 → 10.1.1.101   TCP 1514 80 → 3200 [ACK] Seq=168487 Ack=638 Win=7007 Len=1460 [TCP segment of a reassembled PDU]
  458  11.091465     10.1.1.1 → 10.1.1.101   TCP 1514 80 → 3200 [PSH, ACK] Seq=169947 Ack=638 Win=7007 Len=1460 [TCP segment of a reassembled PDU]
  459  11.091496   10.1.1.101 → 10.1.1.1     TCP 54 3200 → 80 [ACK] Seq=638 Ack=171407 Win=36335 Len=0
  460  11.092718     10.1.1.1 → 10.1.1.101   TCP 1514 80 → 3200 [ACK] Seq=171407 Ack=638 Win=7007 Len=1460 [TCP segment of a reassembled PDU]
  461  11.094025     10.1.1.1 → 10.1.1.101   TCP 1514 80 → 3200 [ACK] Seq=172867 Ack=638 Win=7007 Len=1460 [TCP segment of a reassembled PDU]
  462  11.094062   10.1.1.101 → 10.1.1.1     TCP 54 3200 → 80 [ACK] Seq=638 Ack=174327 Win=33415 Len=0
  463  11.095275     10.1.1.1 → 10.1.1.101   TCP 1514 80 → 3200 [ACK] Seq=174327 Ack=638 Win=7007 Len=1460 [TCP segment of a reassembled PDU]
  464  11.096578     10.1.1.1 → 10.1.1.101   TCP 1514 80 → 3200 [ACK] Seq=175787 Ack=638 Win=7007 Len=1460 [TCP segment of a reassembled PDU]
  465  11.096609   10.1.1.101 → 10.1.1.1     TCP 54 3200 → 80 [ACK] Seq=638 Ack=177247 Win=30495 Len=0
  466  11.097835     10.1.1.1 → 10.1.1.101   TCP 1514 80 → 3200 [ACK] Seq=177247 Ack=638 Win=7007 Len=1460 [TCP segment of a reassembled PDU]
  467  11.099135     10.1.1.1 → 10.1.1.101   TCP 1514 80 → 3200 [ACK] Seq=178707 Ack=638 Win=7007 Len=1460 [TCP segment of a reassembled PDU]
  468  11.099165   10.1.1.101 → 10.1.1.1     TCP 54 3200 → 80 [ACK] Seq=638 Ack=180167 Win=27575 Len=0
  469  11.100394     10.1.1.1 → 10.1.1.101   TCP 1514 80 → 3200 [ACK] Seq=180167 Ack=638 Win=7007 Len=1460 [TCP segment of a reassembled PDU]
  470  11.101703     10.1.1.1 → 10.1.1.101   TCP 1514 80 → 3200 [PSH, ACK] Seq=181627 Ack=638 Win=7007 Len=1460 [TCP segment of a reassembled PDU]
  471  11.101734   10.1.1.101 → 10.1.1.1     TCP 54 3200 → 80 [ACK] Seq=638 Ack=183087 Win=24655 Len=0
  472  11.102949     10.1.1.1 → 10.1.1.101   TCP 1514 80 → 3200 [ACK] Seq=183087 Ack=638 Win=7007 Len=1460 [TCP segment of a reassembled PDU]
  473  11.104256     10.1.1.1 → 10.1.1.101   TCP 1514 80 → 3200 [ACK] Seq=184547 Ack=638 Win=7007 Len=1460 [TCP segment of a reassembled PDU]
  474  11.104294   10.1.1.101 → 10.1.1.1     TCP 54 3200 → 80 [ACK] Seq=638 Ack=186007 Win=21735 Len=0
  475  11.105506     10.1.1.1 → 10.1.1.101   TCP 1514 80 → 3200 [ACK] Seq=186007 Ack=638 Win=7007 Len=1460 [TCP segment of a reassembled PDU]
  476  11.106807     10.1.1.1 → 10.1.1.101   TCP 1514 80 → 3200 [ACK] Seq=187467 Ack=638 Win=7007 Len=1460 [TCP segment of a reassembled PDU]
  477  11.106839   10.1.1.101 → 10.1.1.1     TCP 54 3200 → 80 [ACK] Seq=638 Ack=188927 Win=18815 Len=0
  478  11.108072     10.1.1.1 → 10.1.1.101   TCP 1514 80 → 3200 [ACK] Seq=188927 Ack=638 Win=7007 Len=1460 [TCP segment of a reassembled PDU]
  479  11.109333     10.1.1.1 → 10.1.1.101   HTTP 1445 HTTP/1.1 200 OK  (JPEG JFIF image)
  480  11.109413   10.1.1.101 → 10.1.1.1     TCP 54 3200 → 80 [ACK] Seq=638 Ack=191779 Win=15964 Len=0
  481  11.144352   10.1.1.101 → 10.1.1.1     TCP 54 [TCP Window Update] 3200 → 80 [ACK] Seq=638 Ack=191779 Win=65535 Len=0
  482  11.382892   10.1.1.101 → 10.1.1.1     TCP 54 3200 → 80 [FIN, ACK] Seq=638 Ack=191779 Win=65535 Len=0
  483  11.383317     10.1.1.1 → 10.1.1.101   TCP 60 80 → 3200 [ACK] Seq=191779 Ack=639 Win=7007 Len=0
