    1 0.000000000 192.168.138.100 → 192.168.241.222 TCP 76 48102 → 21 [SYN] Seq=0 Win=64240 Len=0 MSS=1460 SACK_PERM=1 TSval=2948863619 TSecr=0 WS=128
    2 0.001076157 192.168.241.222 → 192.168.138.100 TCP 62 21 → 48102 [SYN, ACK] Seq=0 Ack=1 Win=64240 Len=0 MSS=1460
    3 0.001122092 192.168.138.100 → 192.168.241.222 TCP 56 48102 → 21 [ACK] Seq=1 Ack=1 Win=64240 Len=0
    4 0.004138591 192.168.241.222 → 192.168.138.100 FTP 76 Response: 220 (vsFTPd 3.0.3)
    5 0.004157767 192.168.138.100 → 192.168.241.222 TCP 56 48102 → 21 [ACK] Seq=1 Ack=21 Win=64220 Len=0
    6 0.941995440 192.168.138.100 → 152.199.19.160 TCP 56 52462 → 443 [ACK] Seq=1 Ack=1 Win=62780 Len=0
    7 0.942269655 152.199.19.160 → 192.168.138.100 TCP 62 [TCP ACKed unseen segment] 443 → 52462 [ACK] Seq=1 Ack=2 Win=64240 Len=0
    8 2.479039609 192.168.138.100 → 78.47.62.131 TCP 56 47428 → 443 [ACK] Seq=1 Ack=1 Win=64240 Len=0
    9 3.502978888 192.168.138.100 → 78.47.62.131 TCP 56 [TCP Dup ACK 8#1] 47428 → 443 [ACK] Seq=1 Ack=1 Win=64240 Len=0
   10 3.503716292 78.47.62.131 → 192.168.138.100 TCP 62 [TCP ACKed unseen segment] 443 → 47428 [ACK] Seq=1 Ack=2 Win=64240 Len=0
   11 3.879150933 192.168.138.100 → 192.168.241.222 FTP 67 Request: USER kali
   12 3.879587684 192.168.241.222 → 192.168.138.100 TCP 62 21 → 48102 [ACK] Seq=21 Ack=12 Win=64240 Len=0
   13 3.880095444 192.168.241.222 → 192.168.138.100 FTP 90 Response: 331 Please specify the password.
   14 3.880104157 192.168.138.100 → 192.168.241.222 TCP 56 48102 → 21 [ACK] Seq=12 Ack=55 Win=64186 Len=0
   15 5.885646997 192.168.138.100 → 192.168.241.222 FTP 70 Request: PASS rusanow
   16 5.886118121 192.168.241.222 → 192.168.138.100 TCP 62 21 → 48102 [ACK] Seq=55 Ack=26 Win=64240 Len=0
   17 5.927116821 192.168.241.222 → 192.168.138.100 FTP 79 Response: 230 Login successful.
   18 5.927135609 192.168.138.100 → 192.168.241.222 TCP 56 48102 → 21 [ACK] Seq=26 Ack=78 Win=64163 Len=0
   19 5.927238317 192.168.138.100 → 192.168.241.222 FTP 62 Request: SYST
   20 5.927474964 192.168.241.222 → 192.168.138.100 TCP 62 21 → 48102 [ACK] Seq=78 Ack=32 Win=64240 Len=0
   21 5.928108138 192.168.241.222 → 192.168.138.100 FTP 75 Response: 215 UNIX Type: L8
   22 5.928113334 192.168.138.100 → 192.168.241.222 TCP 56 48102 → 21 [ACK] Seq=32 Ack=97 Win=64144 Len=0
   23 8.333450647 192.168.138.100 → 192.168.241.222 FTP 61 Request: PWD
   24 8.333901629 192.168.241.222 → 192.168.138.100 TCP 62 21 → 48102 [ACK] Seq=97 Ack=37 Win=64240 Len=0
   25 8.334561302 192.168.241.222 → 192.168.138.100 FTP 99 Response: 257 "/home/kali" is the current directory
   26 8.334570307 192.168.138.100 → 192.168.241.222 TCP 56 48102 → 21 [ACK] Seq=37 Ack=140 Win=64101 Len=0
   27 11.066920445 192.168.138.100 → 192.168.241.222 FTP 62 Request: QUIT
   28 11.067220517 192.168.241.222 → 192.168.138.100 TCP 62 21 → 48102 [ACK] Seq=140 Ack=43 Win=64240 Len=0
   29 11.067804427 192.168.241.222 → 192.168.138.100 FTP 70 Response: 221 Goodbye.
   30 11.068111525 192.168.138.100 → 192.168.241.222 TCP 56 48102 → 21 [FIN, ACK] Seq=43 Ack=155 Win=64086 Len=0
   31 11.068294214 192.168.241.222 → 192.168.138.100 TCP 62 21 → 48102 [ACK] Seq=155 Ack=44 Win=64239 Len=0
