    1 0.000000000 185.172.90.252 → 192.168.49.139 TLSv1.2 462 Application Data
    2 0.000019650 192.168.49.139 → 185.172.90.252 TCP 56 45852 → 443 [ACK] Seq=1 Ack=407 Win=63982 Len=0
    3 0.000139345 54.38.64.100 → 192.168.49.139 TLSv1.2 356 Application Data
    4 0.000143838 192.168.49.139 → 54.38.64.100 TCP 56 42862 → 443 [ACK] Seq=1 Ack=301 Win=63000 Len=0
    5 0.003582900 51.38.120.206 → 192.168.49.139 TLSv1.2 104 Application Data
    6 0.003630549 192.168.49.139 → 51.38.120.206 TCP 56 32768 → 443 [ACK] Seq=1 Ack=49 Win=63000 Len=0
    7 0.003695214 51.38.120.206 → 192.168.49.139 TLSv1.2 585 Application Data
    8 0.003706135 192.168.49.139 → 51.38.120.206 TCP 56 32768 → 443 [ACK] Seq=1 Ack=578 Win=63000 Len=0
    9 0.003728566 147.75.85.234 → 192.168.49.139 TLSv1.2 119 Application Data
   10 0.003735798 192.168.49.139 → 147.75.85.234 TCP 56 52178 → 443 [ACK] Seq=1 Ack=64 Win=62780 Len=0
   11 0.008929203 194.55.244.178 → 192.168.49.139 TLSv1.2 388 Application Data
   12 0.008995279 192.168.49.139 → 194.55.244.178 TCP 56 50594 → 443 [ACK] Seq=1 Ack=333 Win=65535 Len=0
   13 0.020905653 70.42.32.159 → 192.168.49.139 TLSv1.2 211 Application Data
   14 0.020922878 192.168.49.139 → 70.42.32.159 TCP 56 59338 → 443 [ACK] Seq=1 Ack=156 Win=63000 Len=0
   15 0.021939765 194.55.244.178 → 192.168.49.139 TLSv1.2 388 Application Data
   16 0.021952800 192.168.49.139 → 194.55.244.178 TCP 56 50594 → 443 [ACK] Seq=1 Ack=665 Win=65535 Len=0
   17 0.023476595 192.168.49.139 → 151.101.194.133 TCP 56 33830 → 80 [ACK] Seq=1 Ack=1 Win=62780 Len=0
   18 0.023588990 192.168.49.139 → 151.101.194.133 TCP 56 33842 → 80 [ACK] Seq=1 Ack=1 Win=62780 Len=0
   19 0.023641755 192.168.49.139 → 151.101.194.133 TCP 56 33864 → 80 [ACK] Seq=1 Ack=1 Win=62780 Len=0
   20 0.023672941 192.168.49.139 → 151.101.194.133 TCP 56 33852 → 80 [ACK] Seq=1 Ack=1 Win=62780 Len=0
   21 0.023794316 151.101.194.133 → 192.168.49.139 TCP 62 [TCP ACKed unseen segment] 80 → 33830 [ACK] Seq=1 Ack=2 Win=64240 Len=0
   22 0.023804769 151.101.194.133 → 192.168.49.139 TCP 62 [TCP ACKed unseen segment] 80 → 33842 [ACK] Seq=1 Ack=2 Win=64240 Len=0
   23 0.023807166 151.101.194.133 → 192.168.49.139 TCP 62 [TCP ACKed unseen segment] 80 → 33864 [ACK] Seq=1 Ack=2 Win=64240 Len=0
   24 0.023808599 151.101.194.133 → 192.168.49.139 TCP 62 [TCP ACKed unseen segment] 80 → 33852 [ACK] Seq=1 Ack=2 Win=64240 Len=0
   25 0.044734559 188.42.191.196 → 192.168.49.139 TLSv1.2 104 Application Data
   26 0.044768970 192.168.49.139 → 188.42.191.196 TCP 56 39762 → 443 [ACK] Seq=1 Ack=49 Win=65535 Len=0
   27 0.054912231 157.90.3.144 → 192.168.49.139 TLSv1.2 451 Application Data
   28 0.055051043 192.168.49.139 → 157.90.3.144 TCP 56 46852 → 443 [ACK] Seq=1 Ack=396 Win=62780 Len=0
   29 0.079220731 192.168.49.139 → 188.42.191.196 TLSv1.2 958 Application Data
   30 0.081169849 188.42.191.196 → 192.168.49.139 TCP 62 443 → 39762 [ACK] Seq=49 Ack=903 Win=64240 Len=0
   31 0.091426511 52.59.131.18 → 192.168.49.139 TLSv1.2 640 Application Data, Application Data
   32 0.091452400 192.168.49.139 → 52.59.131.18 TCP 56 57292 → 443 [ACK] Seq=1 Ack=585 Win=63656 Len=0
   33 0.116539578 192.168.49.139 → 188.42.191.196 TLSv1.2 157 Application Data
   34 0.116711041 188.42.191.196 → 192.168.49.139 TCP 62 443 → 39762 [ACK] Seq=49 Ack=1004 Win=64240 Len=0
   35 0.133326295 188.42.191.196 → 192.168.49.139 TLSv1.2 780 Application Data
   36 0.168164790 188.42.191.196 → 192.168.49.139 TLSv1.2 616 Application Data
   37 0.168210401 192.168.49.139 → 188.42.191.196 TCP 56 39762 → 443 [ACK] Seq=1004 Ack=1333 Win=65535 Len=0
   38 0.211168082 188.42.191.196 → 192.168.49.139 TLSv1.2 582 Application Data
   39 0.221728671    127.0.0.1 → 127.0.0.53   DNS 85 Standard query 0xa1ba A ib.adnxs.com OPT
   40 0.221756723    127.0.0.1 → 127.0.0.53   DNS 85 Standard query 0x8fc1 AAAA ib.adnxs.com OPT
   41 0.221950662   127.0.0.53 → 127.0.0.1    DNS 278 Standard query response 0xa1ba A ib.adnxs.com CNAME g.geogslb.com CNAME ib.anycast.adnxs.com A 37.252.172.123 A 37.252.171.52 A 37.252.171.84 A 37.252.171.21 A 37.252.173.215 A 37.252.171.53 A 37.252.171.22 A 37.252.171.149 A 37.252.171.85 OPT
   42 0.222074812   127.0.0.53 → 127.0.0.1    DNS 134 Standard query response 0x8fc1 AAAA ib.adnxs.com CNAME g.geogslb.com CNAME ib.anycast.adnxs.com OPT
   43 0.224895314 192.168.49.139 → 37.252.171.22 TLSv1.2 1468 Application Data
   44 0.225293240 37.252.171.22 → 192.168.49.139 TCP 62 443 → 54162 [ACK] Seq=1 Ack=1413 Win=64240 Len=0
   45 0.236395996    127.0.0.1 → 127.0.0.53   DNS 93 Standard query 0x85e6 A shb.richaudience.com OPT
   46 0.236419251    127.0.0.1 → 127.0.0.53   DNS 93 Standard query 0xbdee AAAA shb.richaudience.com OPT
   47 0.236543973   127.0.0.53 → 127.0.0.1    DNS 109 Standard query response 0x85e6 A shb.richaudience.com A 157.90.0.13 OPT
   48 0.236615263   127.0.0.53 → 127.0.0.1    DNS 93 Standard query response 0xbdee AAAA shb.richaudience.com OPT
   49 0.237059110 192.168.49.139 → 157.90.3.144 TLSv1.2 132 Application Data
   50 0.237118598 192.168.49.139 → 157.90.3.144 TLSv1.2 1038 Application Data
   51 0.237244134 157.90.3.144 → 192.168.49.139 TCP 62 443 → 46852 [ACK] Seq=396 Ack=77 Win=64240 Len=0
   52 0.237251844 157.90.3.144 → 192.168.49.139 TCP 62 443 → 46852 [ACK] Seq=396 Ack=1059 Win=64240 Len=0
   53 0.237568051    127.0.0.1 → 127.0.0.53   DNS 95 Standard query 0xcd31 A ads.betweendigital.com OPT
   54 0.237587534    127.0.0.1 → 127.0.0.53   DNS 95 Standard query 0x5338 AAAA ads.betweendigital.com OPT
   55 0.237706576   127.0.0.53 → 127.0.0.1    DNS 177 Standard query response 0xcd31 A ads.betweendigital.com CNAME ssp.ads.betweendigital.com A 188.42.34.65 A 188.42.34.64 A 188.42.191.196 A 188.42.196.115 OPT
   56 0.237804075   127.0.0.53 → 127.0.0.1    DNS 113 Standard query response 0x5338 AAAA ads.betweendigital.com CNAME ssp.ads.betweendigital.com OPT
   57 0.238251243 192.168.49.139 → 188.42.191.196 TLSv1.2 134 Application Data
   58 0.238306659 192.168.49.139 → 188.42.191.196 TLSv1.2 977 Application Data
   59 0.238440169 188.42.191.196 → 192.168.49.139 TCP 62 443 → 39762 [ACK] Seq=1859 Ack=1082 Win=64240 Len=0
   60 0.238446434 188.42.191.196 → 192.168.49.139 TCP 62 443 → 39762 [ACK] Seq=1859 Ack=2003 Win=64240 Len=0
   61 0.238813079 192.168.49.139 → 185.172.90.252 TLSv1.2 541 Application Data
   62 0.238974430 185.172.90.252 → 192.168.49.139 TCP 62 443 → 45852 [ACK] Seq=407 Ack=486 Win=64240 Len=0
   63 0.239869028    127.0.0.1 → 127.0.0.53   DNS 95 Standard query 0x979c A prebid.smilewanted.com OPT
   64 0.239897746    127.0.0.1 → 127.0.0.53   DNS 95 Standard query 0xbfa5 AAAA prebid.smilewanted.com OPT
   65 0.240056801   127.0.0.53 → 127.0.0.1    DNS 127 Standard query response 0x979c A prebid.smilewanted.com A 188.114.98.234 A 188.114.99.234 OPT
   66 0.240133332   127.0.0.53 → 127.0.0.1    DNS 95 Standard query response 0xbfa5 AAAA prebid.smilewanted.com OPT
   67 0.240283171 192.168.49.139 → 188.114.98.234 TLSv1.2 124 Application Data
   68 0.240365197 192.168.49.139 → 188.114.98.234 TLSv1.2 441 Application Data
   69 0.240621931 188.114.98.234 → 192.168.49.139 TCP 62 443 → 34638 [ACK] Seq=1 Ack=69 Win=64240 Len=0
   70 0.240634023 188.114.98.234 → 192.168.49.139 TCP 62 443 → 34638 [ACK] Seq=1 Ack=454 Win=64240 Len=0
   71 0.260004179 192.168.49.139 → 194.55.244.178 TLSv1.2 324 Application Data
   72 0.260281740 194.55.244.178 → 192.168.49.139 TCP 62 443 → 50594 [ACK] Seq=665 Ack=269 Win=64240 Len=0
   73 0.262029666 192.168.49.139 → 194.55.244.178 TLSv1.2 324 Application Data
   74 0.262194629 194.55.244.178 → 192.168.49.139 TCP 62 443 → 50594 [ACK] Seq=665 Ack=537 Win=64240 Len=0
   75 0.262547185    127.0.0.1 → 127.0.0.53   DNS 83 Standard query 0x0565 A mp.4dex.io OPT
   76 0.262578476    127.0.0.1 → 127.0.0.53   DNS 83 Standard query 0x8f72 AAAA mp.4dex.io OPT
   77 0.262724335   127.0.0.53 → 127.0.0.1    DNS 115 Standard query response 0x0565 A mp.4dex.io A 188.114.98.234 A 188.114.99.234 OPT
   78 0.262809749   127.0.0.53 → 127.0.0.1    DNS 139 Standard query response 0x8f72 AAAA mp.4dex.io AAAA 2a06:98c1:3122:e000::a AAAA 2a06:98c1:3123:e000::a OPT
   79 0.263040357 192.168.49.139 → 188.114.98.234 TLSv1.2 132 Application Data
   80 0.263148666 192.168.49.139 → 188.114.98.234 TCP 1516 [TCP segment of a reassembled PDU]
   81 0.263202107 192.168.49.139 → 188.114.98.234 TLSv1.2 235 Application Data
   82 0.263263891 188.114.98.234 → 192.168.49.139 TCP 62 443 → 34698 [ACK] Seq=1 Ack=77 Win=64240 Len=0
   83 0.263367296 188.114.98.234 → 192.168.49.139 TCP 62 443 → 34698 [ACK] Seq=1 Ack=1537 Win=64240 Len=0
   84 0.263384715 188.114.98.234 → 192.168.49.139 TCP 62 443 → 34698 [ACK] Seq=1 Ack=1716 Win=64240 Len=0
   85 0.263443736 192.168.49.139 → 188.114.98.234 TLSv1.2 1410 Application Data
   86 0.263586686 188.114.98.234 → 192.168.49.139 TCP 62 443 → 34698 [ACK] Seq=1 Ack=3070 Win=64240 Len=0
   87 0.264352237    127.0.0.1 → 127.0.0.53   DNS 88 Standard query 0x0b4c A b1h.zemanta.com OPT
   88 0.264416087    127.0.0.1 → 127.0.0.53   DNS 88 Standard query 0xbf64 AAAA b1h.zemanta.com OPT
   89 0.264839918   127.0.0.53 → 127.0.0.1    DNS 187 Standard query response 0x0b4c A b1h.zemanta.com CNAME b1-use1.zemanta.com CNAME zemanta-nychi2.outbrain.org CNAME nydc1.outbrain.org A 70.42.32.159 OPT
   90 0.265045894   127.0.0.53 → 127.0.0.1    DNS 171 Standard query response 0xbf64 AAAA b1h.zemanta.com CNAME b1-use1.zemanta.com CNAME zemanta-nychi2.outbrain.org CNAME nydc1.outbrain.org OPT
   91 0.265147594 192.168.49.139 → 70.42.32.159 TLSv1.2 1480 Application Data
   92 0.265285211 70.42.32.159 → 192.168.49.139 TCP 62 443 → 59338 [ACK] Seq=156 Ack=1425 Win=64240 Len=0
   93 0.266097088    127.0.0.1 → 127.0.0.53   DNS 86 Standard query 0xbe51 A tlx.3lift.com OPT
   94 0.266131237    127.0.0.1 → 127.0.0.53   DNS 86 Standard query 0x5a5f AAAA tlx.3lift.com OPT
   95 0.266485189   127.0.0.53 → 127.0.0.1    DNS 235 Standard query response 0xbe51 A tlx.3lift.com CNAME eu-tlx.3lift.com A 52.57.32.9 A 3.124.245.248 A 18.158.192.160 A 18.197.98.179 A 35.158.173.74 A 52.28.253.130 A 3.73.229.242 A 3.126.86.175 OPT
   96 0.266883095   127.0.0.53 → 127.0.0.1    DNS 107 Standard query response 0x5a5f AAAA tlx.3lift.com CNAME eu-tlx.3lift.com OPT
   97 0.267968422 192.168.49.139 → 52.59.131.18 TLSv1.2 221 Application Data
   98 0.268327461 192.168.49.139 → 52.59.131.18 TLSv1.2 1047 Application Data
   99 0.269022891 52.59.131.18 → 192.168.49.139 TCP 62 443 → 57292 [ACK] Seq=585 Ack=166 Win=64240 Len=0
  100 0.269083592 52.59.131.18 → 192.168.49.139 TCP 62 443 → 57292 [ACK] Seq=585 Ack=1157 Win=64240 Len=0
  101 0.270048820 192.168.49.139 → 213.19.162.21 TLSv1.2 771 Application Data
  102 0.270259062 213.19.162.21 → 192.168.49.139 TCP 62 443 → 45580 [ACK] Seq=1 Ack=716 Win=64240 Len=0
  103 0.270615531    127.0.0.1 → 127.0.0.53   DNS 88 Standard query 0x7339 A prebid.a-mo.net OPT
  104 0.270640132    127.0.0.1 → 127.0.0.53   DNS 88 Standard query 0x5340 AAAA prebid.a-mo.net OPT
  105 0.270746645   127.0.0.53 → 127.0.0.1    DNS 104 Standard query response 0x7339 A prebid.a-mo.net A 147.75.85.234 OPT
  106 0.270820859   127.0.0.53 → 127.0.0.1    DNS 88 Standard query response 0x5340 AAAA prebid.a-mo.net OPT
  107 0.270945976 192.168.49.139 → 147.75.85.234 TLSv1.2 125 Application Data
  108 0.271005885 192.168.49.139 → 147.75.85.234 TLSv1.2 1411 Application Data
  109 0.271143455 147.75.85.234 → 192.168.49.139 TCP 62 443 → 52178 [ACK] Seq=64 Ack=70 Win=64240 Len=0
  110 0.271149445 147.75.85.234 → 192.168.49.139 TCP 62 443 → 52178 [ACK] Seq=64 Ack=1425 Win=64240 Len=0
  111 0.271949477    127.0.0.1 → 127.0.0.53   DNS 87 Standard query 0xbd36 A onetag-sys.com OPT
  112 0.272037475   127.0.0.53 → 127.0.0.1    DNS 183 Standard query response 0xbd36 A onetag-sys.com A 51.75.86.98 A 51.38.120.206 A 51.89.9.254 A 51.89.9.252 A 51.89.9.251 A 51.89.9.253 OPT
  113 0.272055547    127.0.0.1 → 127.0.0.53   DNS 87 Standard query 0xed3c AAAA onetag-sys.com OPT
  114 0.272109500   127.0.0.53 → 127.0.0.1    DNS 87 Standard query response 0xed3c AAAA onetag-sys.com OPT
  115 0.272359845 192.168.49.139 → 51.38.120.206 TLSv1.2 134 Application Data
  116 0.272427621 192.168.49.139 → 51.38.120.206 TCP 1516 [TCP segment of a reassembled PDU]
  117 0.272469925 192.168.49.139 → 51.38.120.206 TLSv1.2 98 Application Data
  118 0.272566403 51.38.120.206 → 192.168.49.139 TCP 62 443 → 32768 [ACK] Seq=578 Ack=79 Win=64240 Len=0
  119 0.272573849 51.38.120.206 → 192.168.49.139 TCP 62 443 → 32768 [ACK] Seq=578 Ack=1539 Win=64240 Len=0
  120 0.272575055 51.38.120.206 → 192.168.49.139 TCP 62 443 → 32768 [ACK] Seq=578 Ack=1581 Win=64240 Len=0
  121 0.273307493 192.168.49.139 → 185.76.9.24  TLSv1.2 171 Application Data
  122 0.273420712 192.168.49.139 → 185.76.9.24  TLSv1.2 91 Application Data
  123 0.274610937  185.76.9.24 → 192.168.49.139 TCP 62 443 → 53924 [ACK] Seq=1 Ack=116 Win=64240 Len=0
  124 0.274619410  185.76.9.24 → 192.168.49.139 TCP 62 443 → 53924 [ACK] Seq=1 Ack=151 Win=64240 Len=0
  125 0.275594446    127.0.0.1 → 127.0.0.53   DNS 97 Standard query 0x2643 A ww1097.smartadserver.com OPT
  126 0.275623629    127.0.0.1 → 127.0.0.53   DNS 97 Standard query 0xf64b AAAA ww1097.smartadserver.com OPT
  127 0.275812463   127.0.0.53 → 127.0.0.1    DNS 303 Standard query response 0x2643 A ww1097.smartadserver.com CNAME geo-eu-us-secure.delivery-prod-sas.akadns.net CNAME euw1.smartadserver.com A 81.17.55.161 A 81.17.55.112 A 81.17.55.160 A 81.17.55.113 A 81.17.55.99 A 81.17.55.98 A 89.149.192.65 A 89.149.192.64 OPT
  128 0.275931640   127.0.0.53 → 127.0.0.1    DNS 175 Standard query response 0xf64b AAAA ww1097.smartadserver.com CNAME geo-eu-us-secure.delivery-prod-sas.akadns.net CNAME euw1.smartadserver.com OPT
  129 0.276087950 192.168.49.139 → 81.17.55.98  TLSv1.2 1504 Application Data
  130 0.276339560  81.17.55.98 → 192.168.49.139 TCP 62 443 → 40860 [ACK] Seq=1 Ack=1449 Win=64240 Len=0
  131 0.279864824 192.168.49.139 → 54.38.64.100 TLSv1.2 492 Application Data
  132 0.280252264 54.38.64.100 → 192.168.49.139 TCP 62 443 → 42862 [ACK] Seq=301 Ack=437 Win=64240 Len=0
  133 0.283929633 192.168.49.139 → 188.42.191.196 TLSv1.2 162 Application Data
  134 0.284152190 188.42.191.196 → 192.168.49.139 TCP 62 443 → 39762 [ACK] Seq=1859 Ack=2109 Win=64240 Len=0
  135 0.294468425 188.114.98.234 → 192.168.49.139 TCP 1516 [TCP segment of a reassembled PDU]
  136 0.294493434 192.168.49.139 → 188.114.98.234 TCP 56 34638 → 443 [ACK] Seq=454 Ack=1461 Win=62780 Len=0
  137 0.294535010 188.114.98.234 → 192.168.49.139 TLSv1.2 874 Application Data, Application Data
  138 0.294541474 192.168.49.139 → 188.114.98.234 TCP 56 34638 → 443 [ACK] Seq=454 Ack=2279 Win=62780 Len=0
  139 0.294708036 188.114.98.234 → 192.168.49.139 TLSv1.2 91 Application Data
  140 0.294712334 192.168.49.139 → 188.114.98.234 TCP 56 34638 → 443 [ACK] Seq=454 Ack=2314 Win=62780 Len=0
  141 0.301003959 157.90.3.144 → 192.168.49.139 TLSv1.2 98 Application Data
  142 0.301021080 192.168.49.139 → 157.90.3.144 TCP 56 46852 → 443 [ACK] Seq=1059 Ack=438 Win=62780 Len=0
  143 0.352513799  185.76.9.24 → 192.168.49.139 TLSv1.2 642 Application Data
  144 0.352546756 192.168.49.139 → 185.76.9.24  TCP 56 53924 → 443 [ACK] Seq=151 Ack=587 Win=62780 Len=0
  145 0.357996194 185.172.90.252 → 192.168.49.139 TLSv1.2 462 Application Data
  146 0.358028253 192.168.49.139 → 185.172.90.252 TCP 56 45852 → 443 [ACK] Seq=486 Ack=813 Win=63982 Len=0
  147 0.366252583 192.168.49.139 → 193.232.150.75 TCP 76 40710 → 443 [SYN] Seq=0 Win=64240 Len=0 MSS=1460 SACK_PERM=1 TSval=1067599574 TSecr=0 WS=128
  148 0.366431306 213.19.162.21 → 192.168.49.139 TLSv1.2 627 Application Data, Application Data
  149 0.366453827 54.38.64.100 → 192.168.49.139 TLSv1.2 356 Application Data
  150 0.366462904 192.168.49.139 → 54.38.64.100 TCP 56 42862 → 443 [ACK] Seq=437 Ack=601 Win=63000 Len=0
  151 0.369935742  81.17.55.98 → 192.168.49.139 TCP 1516 [TCP segment of a reassembled PDU]
  152 0.369966203 192.168.49.139 → 81.17.55.98  TCP 56 40860 → 443 [ACK] Seq=1449 Ack=1461 Win=63588 Len=0
  153 0.370007830  81.17.55.98 → 192.168.49.139 TLSv1.2 228 Application Data
  154 0.370016050 192.168.49.139 → 81.17.55.98  TCP 56 40860 → 443 [ACK] Seq=1449 Ack=1633 Win=63416 Len=0
  155 0.388256807 188.114.98.234 → 192.168.49.139 TLSv1.2 119 Application Data
  156 0.388275249 192.168.49.139 → 188.114.98.234 TCP 56 34698 → 443 [ACK] Seq=3070 Ack=64 Win=62780 Len=0
  157 0.394470526 157.90.3.144 → 192.168.49.139 TLSv1.2 354 Application Data
  158 0.394500635 192.168.49.139 → 157.90.3.144 TCP 56 46852 → 443 [ACK] Seq=1059 Ack=736 Win=62780 Len=0
  159 0.394547539 188.42.191.196 → 192.168.49.139 TLSv1.2 583 Application Data, Application Data
  160 0.400234318 37.252.171.22 → 192.168.49.139 TLSv1.2 930 Application Data
  161 0.400266877 192.168.49.139 → 37.252.171.22 TCP 56 54162 → 443 [ACK] Seq=1413 Ack=875 Win=63802 Len=0
  162 0.400325798 51.38.120.206 → 192.168.49.139 TLSv1.2 633 Application Data, Application Data
  163 0.400332918 192.168.49.139 → 51.38.120.206 TCP 56 32768 → 443 [ACK] Seq=1581 Ack=1155 Win=63000 Len=0
  164 0.411976700 192.168.49.139 → 213.19.162.21 TCP 56 45580 → 443 [ACK] Seq=716 Ack=572 Win=62780 Len=0
  165 0.413929101 194.55.244.178 → 192.168.49.139 TCP 1516 [TCP segment of a reassembled PDU]
  166 0.413979454 192.168.49.139 → 194.55.244.178 TCP 56 50594 → 443 [ACK] Seq=537 Ack=2125 Win=65535 Len=0
  167 0.414057107 194.55.244.178 → 192.168.49.139 TCP 1396 443 → 50594 [PSH, ACK] Seq=2125 Ack=537 Win=64240 Len=1340 [TCP segment of a reassembled PDU]
  168 0.414077080 192.168.49.139 → 194.55.244.178 TCP 56 50594 → 443 [ACK] Seq=537 Ack=3465 Win=65535 Len=0
  169 0.421666705 194.55.244.178 → 192.168.49.139 TCP 1516 443 → 50594 [ACK] Seq=3465 Ack=537 Win=64240 Len=1460 [TCP segment of a reassembled PDU]
  170 0.421706429 192.168.49.139 → 194.55.244.178 TCP 56 50594 → 443 [ACK] Seq=537 Ack=4925 Win=65535 Len=0
  171 0.421758574 194.55.244.178 → 192.168.49.139 TCP 1396 443 → 50594 [PSH, ACK] Seq=4925 Ack=537 Win=64240 Len=1340 [TCP segment of a reassembled PDU]
  172 0.421767436 192.168.49.139 → 194.55.244.178 TCP 56 50594 → 443 [ACK] Seq=537 Ack=6265 Win=65535 Len=0
  173 0.421792449 194.55.244.178 → 192.168.49.139 TLSv1.2 603 Application Data, Application Data
  174 0.421797209 192.168.49.139 → 194.55.244.178 TCP 56 50594 → 443 [ACK] Seq=537 Ack=6812 Win=65535 Len=0
  175 0.421821067 193.232.150.75 → 192.168.49.139 TCP 62 443 → 40710 [SYN, ACK] Seq=0 Ack=1 Win=64240 Len=0 MSS=1460
  176 0.421850844 192.168.49.139 → 193.232.150.75 TCP 56 40710 → 443 [ACK] Seq=1 Ack=1 Win=64240 Len=0
  177 0.428386787 192.168.49.139 → 193.232.150.75 TLSv1 573 Client Hello
  178 0.428881027 193.232.150.75 → 192.168.49.139 TCP 62 443 → 40710 [ACK] Seq=1 Ack=518 Win=64240 Len=0
  179 0.436055765 192.168.49.139 → 188.42.191.196 TCP 56 39762 → 443 [ACK] Seq=2109 Ack=2386 Win=65535 Len=0
  180 0.466822506 147.75.85.234 → 192.168.49.139 TLSv1.2 96 Application Data
  181 0.466845975 192.168.49.139 → 147.75.85.234 TCP 56 52178 → 443 [ACK] Seq=1425 Ack=104 Win=62780 Len=0
  182 0.473449844 52.59.131.18 → 192.168.49.139 TLSv1.2 640 Application Data, Application Data
  183 0.473470923 192.168.49.139 → 52.59.131.18 TCP 56 57292 → 443 [ACK] Seq=1157 Ack=1169 Win=63656 Len=0
  184 0.473509853 70.42.32.159 → 192.168.49.139 TLSv1.2 211 Application Data
  185 0.473515710 192.168.49.139 → 70.42.32.159 TCP 56 59338 → 443 [ACK] Seq=1425 Ack=311 Win=63000 Len=0
  186 0.485991425 193.232.150.75 → 192.168.49.139 TLSv1.2 1516 Server Hello
  187 0.486097239 192.168.49.139 → 193.232.150.75 TCP 56 40710 → 443 [ACK] Seq=518 Ack=1461 Win=62780 Len=0
  188 0.486187745 193.232.150.75 → 192.168.49.139 TCP 1396 443 → 40710 [PSH, ACK] Seq=1461 Ack=518 Win=64240 Len=1340 [TCP segment of a reassembled PDU]
  189 0.486200807 192.168.49.139 → 193.232.150.75 TCP 56 40710 → 443 [ACK] Seq=518 Ack=2801 Win=62780 Len=0
  190 0.490336027 192.168.49.139 → 188.42.191.196 TLSv1.2 1024 Application Data
  191 0.490547686 192.168.49.139 → 194.226.130.226 TLSv1.2 166 Application Data
  192 0.490677128 188.42.191.196 → 192.168.49.139 TCP 62 443 → 39762 [ACK] Seq=2386 Ack=3077 Win=64240 Len=0
  193 0.490807554 194.226.130.226 → 192.168.49.139 TCP 62 443 → 39378 [ACK] Seq=1 Ack=111 Win=64240 Len=0
  194 0.491037117 192.168.49.139 → 188.42.191.196 TLSv1.2 821 Application Data
  195 0.491157432 188.42.191.196 → 192.168.49.139 TCP 62 443 → 39762 [ACK] Seq=2386 Ack=3842 Win=64240 Len=0
  196 0.491961519 194.55.244.178 → 192.168.49.139 TLSv1.2 388 Application Data
  197 0.491984994 192.168.49.139 → 194.55.244.178 TCP 56 50594 → 443 [ACK] Seq=537 Ack=7144 Win=65535 Len=0
  198 0.492158614 193.232.150.75 → 192.168.49.139 TLSv1.2 1516 Certificate [TCP segment of a reassembled PDU]
  199 0.492167554 192.168.49.139 → 193.232.150.75 TCP 56 40710 → 443 [ACK] Seq=518 Ack=4261 Win=62780 Len=0
  200 0.492210002 193.232.150.75 → 192.168.49.139 TLSv1.2 465 Server Key Exchange, Server Hello Done
  201 0.492216525 192.168.49.139 → 193.232.150.75 TCP 56 40710 → 443 [ACK] Seq=518 Ack=4670 Win=62780 Len=0
  202 0.503305457 188.42.191.196 → 192.168.49.139 TLSv1.2 1061 Application Data
  203 0.503345991 192.168.49.139 → 188.42.191.196 TCP 56 39762 → 443 [ACK] Seq=3842 Ack=3391 Win=65535 Len=0
  204 0.504076050 188.42.191.196 → 192.168.49.139 TCP 1456 [TCP segment of a reassembled PDU]
  205 0.504097329 192.168.49.139 → 188.42.191.196 TCP 56 39762 → 443 [ACK] Seq=3842 Ack=4791 Win=65535 Len=0
  206 0.504567581 192.168.49.139 → 193.232.150.75 TLSv1.2 182 Client Key Exchange, Change Cipher Spec, Encrypted Handshake Message
  207 0.504899622 193.232.150.75 → 192.168.49.139 TCP 62 443 → 40710 [ACK] Seq=4670 Ack=644 Win=64240 Len=0
  208 0.508404859 192.168.49.139 → 104.16.120.195 TLSv1.2 293 Application Data
  209 0.508763266 104.16.120.195 → 192.168.49.139 TCP 62 443 → 46110 [ACK] Seq=1 Ack=238 Win=64240 Len=0
  210 0.508934981 188.42.191.196 → 192.168.49.139 TCP 1456 443 → 39762 [PSH, ACK] Seq=4791 Ack=3842 Win=64240 Len=1400 [TCP segment of a reassembled PDU]
  211 0.508945403 192.168.49.139 → 188.42.191.196 TCP 56 39762 → 443 [ACK] Seq=3842 Ack=6191 Win=65535 Len=0
  212 0.516275849 188.42.191.196 → 192.168.49.139 TLSv1.2 1101 Application Data
  213 0.516305820 192.168.49.139 → 188.42.191.196 TCP 56 39762 → 443 [ACK] Seq=3842 Ack=7236 Win=65535 Len=0
  214 0.516780680 188.42.191.196 → 192.168.49.139 TCP 1456 [TCP segment of a reassembled PDU]
  215 0.516788278 192.168.49.139 → 188.42.191.196 TCP 56 39762 → 443 [ACK] Seq=3842 Ack=8636 Win=65535 Len=0
  216 0.516915298 188.42.191.196 → 192.168.49.139 TCP 1456 443 → 39762 [PSH, ACK] Seq=8636 Ack=3842 Win=64240 Len=1400 [TCP segment of a reassembled PDU]
  217 0.516920416 192.168.49.139 → 188.42.191.196 TCP 56 39762 → 443 [ACK] Seq=3842 Ack=10036 Win=65535 Len=0
  218 0.521367248 188.42.191.196 → 192.168.49.139 TCP 1456 443 → 39762 [PSH, ACK] Seq=10036 Ack=3842 Win=64240 Len=1400 [TCP segment of a reassembled PDU]
  219 0.521385027 192.168.49.139 → 188.42.191.196 TCP 56 39762 → 443 [ACK] Seq=3842 Ack=11436 Win=65535 Len=0
  220 0.536403073 188.42.191.196 → 192.168.49.139 TCP 1516 443 → 39762 [ACK] Seq=11436 Ack=3842 Win=64240 Len=1460 [TCP segment of a reassembled PDU]
  221 0.536488652 192.168.49.139 → 188.42.191.196 TCP 56 39762 → 443 [ACK] Seq=3842 Ack=12896 Win=65535 Len=0
  222 0.536533719 188.42.191.196 → 192.168.49.139 TLSv1.2 478 Application Data
  223 0.536538885 192.168.49.139 → 188.42.191.196 TCP 56 39762 → 443 [ACK] Seq=3842 Ack=13318 Win=65535 Len=0
  224 0.543418405    127.0.0.1 → 127.0.0.53   DNS 88 Standard query 0xa6d8 A prebid.a-mo.net OPT
  225 0.543457021    127.0.0.1 → 127.0.0.53   DNS 88 Standard query 0xcedf AAAA prebid.a-mo.net OPT
  226 0.543631929   127.0.0.53 → 127.0.0.1    DNS 104 Standard query response 0xa6d8 A prebid.a-mo.net A 147.75.85.234 OPT
  227 0.543705777   127.0.0.53 → 127.0.0.1    DNS 88 Standard query response 0xcedf AAAA prebid.a-mo.net OPT
  228 0.544474350 192.168.49.139 → 147.75.85.234 TLSv1.2 125 Application Data
  229 0.544545438 192.168.49.139 → 147.75.85.234 TLSv1.2 1509 Application Data
  230 0.544895960 147.75.85.234 → 192.168.49.139 TCP 62 443 → 52178 [ACK] Seq=104 Ack=1494 Win=64240 Len=0
  231 0.544910081 147.75.85.234 → 192.168.49.139 TCP 62 443 → 52178 [ACK] Seq=104 Ack=2947 Win=64240 Len=0
  232 0.545458009    127.0.0.1 → 127.0.0.53   DNS 95 Standard query 0xbcf5 A ads.betweendigital.com OPT
  233 0.545491662    127.0.0.1 → 127.0.0.53   DNS 95 Standard query 0xc200 AAAA ads.betweendigital.com OPT
  234 0.545726888   127.0.0.53 → 127.0.0.1    DNS 177 Standard query response 0xbcf5 A ads.betweendigital.com CNAME ssp.ads.betweendigital.com A 188.42.34.65 A 188.42.34.64 A 188.42.191.196 A 188.42.196.115 OPT
  235 0.545907838   127.0.0.53 → 127.0.0.1    DNS 113 Standard query response 0xc200 AAAA ads.betweendigital.com CNAME ssp.ads.betweendigital.com OPT
  236 0.546986600 192.168.49.139 → 188.42.191.196 TLSv1.2 139 Application Data
  237 0.547078200 192.168.49.139 → 188.42.191.196 TLSv1.2 1025 Application Data
  238 0.547107882 188.42.191.196 → 192.168.49.139 TCP 62 443 → 39762 [ACK] Seq=13318 Ack=3925 Win=64240 Len=0
  239 0.547230548 188.42.191.196 → 192.168.49.139 TCP 62 443 → 39762 [ACK] Seq=13318 Ack=4894 Win=64240 Len=0
  240 0.548902011 194.226.130.226 → 192.168.49.139 TLSv1.2 488 Application Data
  241 0.549002646 192.168.49.139 → 194.226.130.226 TCP 56 39378 → 443 [ACK] Seq=111 Ack=433 Win=62780 Len=0
  242 0.550669605    127.0.0.1 → 127.0.0.53   DNS 95 Standard query 0x6381 A prebid.smilewanted.com OPT
  243 0.550839985   127.0.0.53 → 127.0.0.1    DNS 127 Standard query response 0x6381 A prebid.smilewanted.com A 188.114.98.234 A 188.114.99.234 OPT
  244 0.550869782    127.0.0.1 → 127.0.0.53   DNS 95 Standard query 0x2b89 AAAA prebid.smilewanted.com OPT
  245 0.550955329   127.0.0.53 → 127.0.0.1    DNS 95 Standard query response 0x2b89 AAAA prebid.smilewanted.com OPT
  246 0.551459043 192.168.49.139 → 188.114.98.234 TLSv1.2 129 Application Data
  247 0.551512972 192.168.49.139 → 188.114.98.234 TLSv1.2 531 Application Data
  248 0.551649675 188.114.98.234 → 192.168.49.139 TCP 62 443 → 34638 [ACK] Seq=2314 Ack=527 Win=64240 Len=0
  249 0.551658154 188.114.98.234 → 192.168.49.139 TCP 62 443 → 34638 [ACK] Seq=2314 Ack=1002 Win=64240 Len=0
  250 0.554017155    127.0.0.1 → 127.0.0.53   DNS 93 Standard query 0x894f A shb.richaudience.com OPT
  251 0.554041042    127.0.0.1 → 127.0.0.53   DNS 93 Standard query 0x835a AAAA shb.richaudience.com OPT
  252 0.554176452   127.0.0.53 → 127.0.0.1    DNS 109 Standard query response 0x894f A shb.richaudience.com A 157.90.0.13 OPT
  253 0.554255221   127.0.0.53 → 127.0.0.1    DNS 93 Standard query response 0x835a AAAA shb.richaudience.com OPT
  254 0.555051350 192.168.49.139 → 157.90.3.144 TLSv1.2 137 Application Data
  255 0.555113074 192.168.49.139 → 157.90.3.144 TLSv1.2 1129 Application Data
  256 0.555299745 157.90.3.144 → 192.168.49.139 TCP 62 443 → 46852 [ACK] Seq=736 Ack=1140 Win=64240 Len=0
  257 0.555309336 157.90.3.144 → 192.168.49.139 TCP 62 443 → 46852 [ACK] Seq=736 Ack=2213 Win=64240 Len=0
  258 0.566843995 193.232.150.75 → 192.168.49.139 TLSv1.2 383 New Session Ticket, Change Cipher Spec, Encrypted Handshake Message, Application Data
  259 0.566973196 192.168.49.139 → 193.232.150.75 TCP 56 40710 → 443 [ACK] Seq=644 Ack=4997 Win=62780 Len=0
  260 0.568878760    127.0.0.1 → 127.0.0.53   DNS 83 Standard query 0x379a A mp.4dex.io OPT
  261 0.568898266    127.0.0.1 → 127.0.0.53   DNS 83 Standard query 0x61ac AAAA mp.4dex.io OPT
  262 0.569068228   127.0.0.53 → 127.0.0.1    DNS 115 Standard query response 0x379a A mp.4dex.io A 188.114.98.234 A 188.114.99.234 OPT
  263 0.569201727   127.0.0.53 → 127.0.0.1    DNS 139 Standard query response 0x61ac AAAA mp.4dex.io AAAA 2a06:98c1:3122:e000::a AAAA 2a06:98c1:3123:e000::a OPT
  264 0.570084720 104.16.120.195 → 192.168.49.139 TLSv1.2 202 Application Data
  265 0.570116785 192.168.49.139 → 104.16.120.195 TCP 56 46110 → 443 [ACK] Seq=238 Ack=147 Win=62780 Len=0
  266 0.570388874 104.16.120.195 → 192.168.49.139 TLSv1.2 87 Application Data
  267 0.570400376 192.168.49.139 → 104.16.120.195 TCP 56 46110 → 443 [ACK] Seq=238 Ack=178 Win=62780 Len=0
  268 0.572311049 192.168.49.139 → 188.114.98.234 TLSv1.2 127 Application Data
  269 0.572498341 192.168.49.139 → 188.114.98.234 TCP 1516 [TCP segment of a reassembled PDU]
  270 0.572555861 192.168.49.139 → 188.114.98.234 TLSv1.2 235 Application Data
  271 0.572641652 188.114.98.234 → 192.168.49.139 TCP 62 443 → 34698 [ACK] Seq=64 Ack=3141 Win=64240 Len=0
  272 0.572651654 188.114.98.234 → 192.168.49.139 TCP 62 443 → 34698 [ACK] Seq=64 Ack=4601 Win=64240 Len=0
  273 0.572826422 188.114.98.234 → 192.168.49.139 TCP 62 443 → 34698 [ACK] Seq=64 Ack=4780 Win=64240 Len=0
  274 0.573256431 192.168.49.139 → 188.114.98.234 TLSv1.2 1505 Application Data
  275 0.573500655 188.114.98.234 → 192.168.49.139 TCP 62 443 → 34698 [ACK] Seq=64 Ack=6229 Win=64240 Len=0
  276 0.573586482 192.168.49.139 → 193.232.150.75 TLSv1.2 233 Application Data
  277 0.573639500 192.168.49.139 → 193.232.150.75 TLSv1.2 310 Application Data
  278 0.573803354 193.232.150.75 → 192.168.49.139 TCP 62 443 → 40710 [ACK] Seq=4997 Ack=821 Win=64240 Len=0
  279 0.573809880 193.232.150.75 → 192.168.49.139 TCP 62 443 → 40710 [ACK] Seq=4997 Ack=1075 Win=64240 Len=0
  280 0.578843159 188.42.191.196 → 192.168.49.139 TLSv1.2 616 Application Data
  281 0.578874320 192.168.49.139 → 188.42.191.196 TCP 56 39762 → 443 [ACK] Seq=4894 Ack=13878 Win=65535 Len=0
  282 0.582756956 192.168.49.139 → 193.232.150.75 TLSv1.2 94 Application Data
  283 0.583086695 193.232.150.75 → 192.168.49.139 TCP 62 443 → 40710 [ACK] Seq=4997 Ack=1113 Win=64240 Len=0
  284 0.588247853 188.42.191.196 → 192.168.49.139 TLSv1.2 616 Application Data
  285 0.588361813 192.168.49.139 → 188.42.191.196 TCP 56 39762 → 443 [ACK] Seq=4894 Ack=14438 Win=65535 Len=0
  286 0.589928898    127.0.0.1 → 127.0.0.53   DNS 87 Standard query 0x73d4 A onetag-sys.com OPT
  287 0.590117010   127.0.0.53 → 127.0.0.1    DNS 183 Standard query response 0x73d4 A onetag-sys.com A 51.75.86.98 A 51.38.120.206 A 51.89.9.254 A 51.89.9.252 A 51.89.9.251 A 51.89.9.253 OPT
  288 0.590291277    127.0.0.1 → 127.0.0.53   DNS 87 Standard query 0xdbdd AAAA onetag-sys.com OPT
  289 0.590396127   127.0.0.53 → 127.0.0.1    DNS 87 Standard query response 0xdbdd AAAA onetag-sys.com OPT
  290 0.591145532 192.168.49.139 → 51.38.120.206 TLSv1.2 139 Application Data
  291 0.591231457 192.168.49.139 → 51.38.120.206 TCP 1516 [TCP segment of a reassembled PDU]
  292 0.591315456 192.168.49.139 → 51.38.120.206 TLSv1.2 166 Application Data
  293 0.591434092 51.38.120.206 → 192.168.49.139 TCP 62 443 → 32768 [ACK] Seq=1155 Ack=1664 Win=64240 Len=0
  294 0.591449205 51.38.120.206 → 192.168.49.139 TCP 62 443 → 32768 [ACK] Seq=1155 Ack=3124 Win=64240 Len=0
  295 0.591539629 51.38.120.206 → 192.168.49.139 TCP 62 443 → 32768 [ACK] Seq=1155 Ack=3234 Win=64240 Len=0
  296 0.591659615 192.168.49.139 → 51.38.120.206 TLSv1.2 200 Application Data
  297 0.591782122 51.38.120.206 → 192.168.49.139 TCP 62 443 → 32768 [ACK] Seq=1155 Ack=3378 Win=64240 Len=0
  298 0.592852098    127.0.0.1 → 127.0.0.53   DNS 88 Standard query 0x0901 A b1h.zemanta.com OPT
  299 0.593183927   127.0.0.53 → 127.0.0.1    DNS 187 Standard query response 0x0901 A b1h.zemanta.com CNAME b1-use1.zemanta.com CNAME zemanta-nychi2.outbrain.org CNAME nydc1.outbrain.org A 70.42.32.159 OPT
  300 0.593215947    127.0.0.1 → 127.0.0.53   DNS 88 Standard query 0x390d AAAA b1h.zemanta.com OPT
  301 0.593467856   127.0.0.53 → 127.0.0.1    DNS 171 Standard query response 0x390d AAAA b1h.zemanta.com CNAME b1-use1.zemanta.com CNAME zemanta-nychi2.outbrain.org CNAME nydc1.outbrain.org OPT
  302 0.593678689 192.168.49.139 → 70.42.32.159 TCP 1516 [TCP segment of a reassembled PDU]
  303 0.593751101 192.168.49.139 → 70.42.32.159 TLSv1.2 111 Application Data
  304 0.593992284 70.42.32.159 → 192.168.49.139 TCP 62 443 → 59338 [ACK] Seq=311 Ack=2885 Win=64240 Len=0
  305 0.594003660 70.42.32.159 → 192.168.49.139 TCP 62 443 → 59338 [ACK] Seq=311 Ack=2940 Win=64240 Len=0
  306 0.600591613 192.168.49.139 → 194.55.244.178 TLSv1.2 325 Application Data
  307 0.600902259 194.55.244.178 → 192.168.49.139 TCP 62 443 → 50594 [ACK] Seq=7144 Ack=806 Win=64240 Len=0
  308 0.605852757 188.114.98.234 → 192.168.49.139 TCP 1516 [TCP segment of a reassembled PDU]
  309 0.605886433 192.168.49.139 → 188.114.98.234 TCP 56 34638 → 443 [ACK] Seq=1002 Ack=3774 Win=62780 Len=0
  310 0.605951541 188.114.98.234 → 192.168.49.139 TLSv1.2 865 Application Data
  311 0.605964515 192.168.49.139 → 188.114.98.234 TCP 56 34638 → 443 [ACK] Seq=1002 Ack=4583 Win=62780 Len=0
  312 0.605988434 188.114.98.234 → 192.168.49.139 TLSv1.2 87 Application Data
  313 0.605993340 192.168.49.139 → 188.114.98.234 TCP 56 34638 → 443 [ACK] Seq=1002 Ack=4614 Win=62780 Len=0
  314 0.606302688 188.114.98.234 → 192.168.49.139 TLSv1.2 91 Application Data
  315 0.606309855 192.168.49.139 → 188.114.98.234 TCP 56 34638 → 443 [ACK] Seq=1002 Ack=4649 Win=62780 Len=0
  316 0.607264274 192.168.49.139 → 194.55.244.178 TLSv1.2 325 Application Data
  317 0.607473072 194.55.244.178 → 192.168.49.139 TCP 62 443 → 50594 [ACK] Seq=7144 Ack=1075 Win=64240 Len=0
  318 0.609013273 192.168.49.139 → 194.55.244.178 TLSv1.2 325 Application Data
  319 0.609198407 194.55.244.178 → 192.168.49.139 TCP 62 443 → 50594 [ACK] Seq=7144 Ack=1344 Win=64240 Len=0
  320 0.610348986 192.168.49.139 → 194.55.244.178 TLSv1.2 325 Application Data
  321 0.610507844 194.55.244.178 → 192.168.49.139 TCP 62 443 → 50594 [ACK] Seq=7144 Ack=1613 Win=64240 Len=0
  322 0.611717498 192.168.49.139 → 194.55.244.178 TLSv1.2 325 Application Data
  323 0.611939219 194.55.244.178 → 192.168.49.139 TCP 62 443 → 50594 [ACK] Seq=7144 Ack=1882 Win=64240 Len=0
  324 0.614653377 192.168.49.139 → 194.55.244.178 TLSv1.2 325 Application Data
  325 0.614889263 194.55.244.178 → 192.168.49.139 TCP 62 443 → 50594 [ACK] Seq=7144 Ack=2151 Win=64240 Len=0
  326 0.616200988 192.168.49.139 → 194.55.244.178 TLSv1.2 324 Application Data
  327 0.616563809 194.55.244.178 → 192.168.49.139 TCP 62 443 → 50594 [ACK] Seq=7144 Ack=2419 Win=64240 Len=0
  328 0.620165301    127.0.0.1 → 127.0.0.53   DNS 85 Standard query 0x89f4 A ib.adnxs.com OPT
  329 0.620195948    127.0.0.1 → 127.0.0.53   DNS 85 Standard query 0x4702 AAAA ib.adnxs.com OPT
  330 0.620411349   127.0.0.53 → 127.0.0.1    DNS 278 Standard query response 0x89f4 A ib.adnxs.com CNAME g.geogslb.com CNAME ib.anycast.adnxs.com A 37.252.172.123 A 37.252.171.52 A 37.252.171.84 A 37.252.171.21 A 37.252.173.215 A 37.252.171.53 A 37.252.171.22 A 37.252.171.149 A 37.252.171.85 OPT
  331 0.620594751   127.0.0.53 → 127.0.0.1    DNS 134 Standard query response 0x4702 AAAA ib.adnxs.com CNAME g.geogslb.com CNAME ib.anycast.adnxs.com OPT
  332 0.621016356 192.168.49.139 → 37.252.171.22 TCP 1516 [TCP segment of a reassembled PDU]
  333 0.621074749 192.168.49.139 → 37.252.171.22 TLSv1.2 143 Application Data
  334 0.621311447 37.252.171.22 → 192.168.49.139 TCP 62 443 → 54162 [ACK] Seq=875 Ack=2873 Win=64240 Len=0
  335 0.621319693 37.252.171.22 → 192.168.49.139 TCP 62 443 → 54162 [ACK] Seq=875 Ack=2960 Win=64240 Len=0
  336 0.623306024 157.90.3.144 → 192.168.49.139 TLSv1.2 98 Application Data
  337 0.623329687 192.168.49.139 → 157.90.3.144 TCP 56 46852 → 443 [ACK] Seq=2213 Ack=778 Win=62780 Len=0
  338 0.623420919    127.0.0.1 → 127.0.0.53   DNS 86 Standard query 0xa27e A tlx.3lift.com OPT
  339 0.623469508    127.0.0.1 → 127.0.0.53   DNS 86 Standard query 0xda8d AAAA tlx.3lift.com OPT
  340 0.623714147   127.0.0.53 → 127.0.0.1    DNS 235 Standard query response 0xa27e A tlx.3lift.com CNAME eu-tlx.3lift.com A 52.57.32.9 A 3.124.245.248 A 18.158.192.160 A 18.197.98.179 A 35.158.173.74 A 52.28.253.130 A 3.73.229.242 A 3.126.86.175 OPT
  341 0.623948473   127.0.0.53 → 127.0.0.1    DNS 107 Standard query response 0xda8d AAAA tlx.3lift.com CNAME eu-tlx.3lift.com OPT
  342 0.624375441 193.232.150.75 → 192.168.49.139 TLSv1.2 94 Application Data
  343 0.624392477 192.168.49.139 → 193.232.150.75 TCP 56 40710 → 443 [ACK] Seq=1113 Ack=5035 Win=62780 Len=0
  344 0.625216532 192.168.49.139 → 52.59.131.18 TLSv1.2 221 Application Data
  345 0.625378570 192.168.49.139 → 52.59.131.18 TLSv1.2 1135 Application Data
  346 0.625549391 52.59.131.18 → 192.168.49.139 TCP 62 443 → 57292 [ACK] Seq=1169 Ack=1322 Win=64240 Len=0
  347 0.625565441 52.59.131.18 → 192.168.49.139 TCP 62 443 → 57292 [ACK] Seq=1169 Ack=2401 Win=64240 Len=0
  348 0.625958084 147.75.85.234 → 192.168.49.139 TLSv1.2 96 Application Data
  349 0.625972637 192.168.49.139 → 147.75.85.234 TCP 56 52178 → 443 [ACK] Seq=2947 Ack=144 Win=62780 Len=0
  350 0.633671195 192.168.49.139 → 213.19.162.21 TLSv1.2 780 Application Data
  351 0.633921211 213.19.162.21 → 192.168.49.139 TCP 62 443 → 45580 [ACK] Seq=572 Ack=1440 Win=64240 Len=0
  352 0.636255566 192.168.49.139 → 185.172.90.252 TLSv1.2 577 Application Data
  353 0.636516302 185.172.90.252 → 192.168.49.139 TCP 62 443 → 45852 [ACK] Seq=813 Ack=1007 Win=64240 Len=0
  354 0.637427911    127.0.0.1 → 127.0.0.53   DNS 97 Standard query 0x48c5 A ww1097.smartadserver.com OPT
  355 0.637453613    127.0.0.1 → 127.0.0.53   DNS 97 Standard query 0x34cd AAAA ww1097.smartadserver.com OPT
  356 0.637669707   127.0.0.53 → 127.0.0.1    DNS 303 Standard query response 0x48c5 A ww1097.smartadserver.com CNAME geo-eu-us-secure.delivery-prod-sas.akadns.net CNAME euw1.smartadserver.com A 81.17.55.161 A 81.17.55.112 A 81.17.55.160 A 81.17.55.113 A 81.17.55.99 A 81.17.55.98 A 89.149.192.65 A 89.149.192.64 OPT
  357 0.637886626   127.0.0.53 → 127.0.0.1    DNS 175 Standard query response 0x34cd AAAA ww1097.smartadserver.com CNAME geo-eu-us-secure.delivery-prod-sas.akadns.net CNAME euw1.smartadserver.com OPT
  358 0.638263978 192.168.49.139 → 81.17.55.98  TLSv1.2 1508 Application Data
  359 0.638661824  81.17.55.98 → 192.168.49.139 TCP 62 443 → 40860 [ACK] Seq=1633 Ack=2901 Win=64240 Len=0
  360 0.642004291 192.168.49.139 → 194.226.130.226 TLSv1.2 166 Application Data
  361 0.642269700 194.226.130.226 → 192.168.49.139 TCP 62 443 → 39378 [ACK] Seq=433 Ack=221 Win=64240 Len=0
  362 0.643012292 192.168.49.139 → 54.38.64.100 TLSv1.2 491 Application Data
  363 0.643214000 54.38.64.100 → 192.168.49.139 TCP 62 443 → 42862 [ACK] Seq=601 Ack=872 Win=64240 Len=0
  364 0.662882420 188.42.191.196 → 192.168.49.139 TLSv1.2 104 Application Data
  365 0.662912927 192.168.49.139 → 188.42.191.196 TCP 56 39762 → 443 [ACK] Seq=4894 Ack=14486 Win=65535 Len=0
  366 0.679659155 193.232.150.75 → 192.168.49.139 TCP 1516 [TCP segment of a reassembled PDU]
  367 0.679678385 192.168.49.139 → 193.232.150.75 TCP 56 40710 → 443 [ACK] Seq=1113 Ack=6495 Win=62780 Len=0
  368 0.679743720 193.232.150.75 → 192.168.49.139 TCP 1396 443 → 40710 [PSH, ACK] Seq=6495 Ack=1113 Win=64240 Len=1340 [TCP segment of a reassembled PDU]
  369 0.679751912 192.168.49.139 → 193.232.150.75 TCP 56 40710 → 443 [ACK] Seq=1113 Ack=7835 Win=62780 Len=0
  370 0.679874076 193.232.150.75 → 192.168.49.139 TCP 1516 443 → 40710 [ACK] Seq=7835 Ack=1113 Win=64240 Len=1460 [TCP segment of a reassembled PDU]
  371 0.679881061 192.168.49.139 → 193.232.150.75 TCP 56 40710 → 443 [ACK] Seq=1113 Ack=9295 Win=61320 Len=0
  372 0.679909360 193.232.150.75 → 192.168.49.139 TCP 1396 443 → 40710 [PSH, ACK] Seq=9295 Ack=1113 Win=64240 Len=1340 [TCP segment of a reassembled PDU]
  373 0.679917281 192.168.49.139 → 193.232.150.75 TCP 56 40710 → 443 [ACK] Seq=1113 Ack=10635 Win=61320 Len=0
  374 0.680197359 193.232.150.75 → 192.168.49.139 TCP 1516 443 → 40710 [ACK] Seq=10635 Ack=1113 Win=64240 Len=1460 [TCP segment of a reassembled PDU]
  375 0.680202808 192.168.49.139 → 193.232.150.75 TCP 56 40710 → 443 [ACK] Seq=1113 Ack=12095 Win=62780 Len=0
  376 0.680239609 193.232.150.75 → 192.168.49.139 TLSv1.2 423 Application Data
  377 0.680243343 192.168.49.139 → 193.232.150.75 TCP 56 40710 → 443 [ACK] Seq=1113 Ack=12462 Win=62780 Len=0
  378 0.681502581 188.114.98.234 → 192.168.49.139 TLSv1.2 142 Application Data
  379 0.681542346 192.168.49.139 → 188.114.98.234 TCP 56 34698 → 443 [ACK] Seq=6229 Ack=150 Win=62780 Len=0
  380 0.691762675 194.226.130.226 → 192.168.49.139 TLSv1.2 375 Application Data
  381 0.691790546 192.168.49.139 → 194.226.130.226 TCP 56 39378 → 443 [ACK] Seq=221 Ack=752 Win=62780 Len=0
  382 0.699689701    127.0.0.1 → 127.0.0.53   DNS 89 Standard query 0xa796 A f3-ru.adhigh.net OPT
  383 0.699720620    127.0.0.1 → 127.0.0.53   DNS 89 Standard query 0x839f AAAA f3-ru.adhigh.net OPT
  384 0.699845033 192.168.49.139 → 192.168.49.2 DNS 89 Standard query 0x9900 A f3-ru.adhigh.net OPT
  385 0.699960706 192.168.49.139 → 192.168.49.2 DNS 89 Standard query 0x42ae AAAA f3-ru.adhigh.net OPT
  386 0.702189164 192.168.49.139 → 158.160.20.142 TCP 76 36768 → 443 [SYN] Seq=0 Win=64240 Len=0 MSS=1460 SACK_PERM=1 TSval=1646242073 TSecr=0 WS=128
  387 0.702896294 194.55.244.178 → 192.168.49.139 TLSv1.2 388 Application Data
  388 0.702911054 192.168.49.139 → 194.55.244.178 TCP 56 50594 → 443 [ACK] Seq=2419 Ack=7476 Win=65535 Len=0
  389 0.708931796 157.90.3.144 → 192.168.49.139 TLSv1.2 354 Application Data
  390 0.708950190 192.168.49.139 → 157.90.3.144 TCP 56 46852 → 443 [ACK] Seq=2213 Ack=1076 Win=62780 Len=0
  391 0.709639695 194.55.244.178 → 192.168.49.139 TLSv1.2 388 Application Data
  392 0.709648187 192.168.49.139 → 194.55.244.178 TCP 56 50594 → 443 [ACK] Seq=2419 Ack=7808 Win=65535 Len=0
  393 0.726990521 213.19.162.21 → 192.168.49.139 TLSv1.2 215 Application Data
  394 0.727007846 192.168.49.139 → 213.19.162.21 TCP 56 45580 → 443 [ACK] Seq=1440 Ack=731 Win=62780 Len=0
  395 0.727255022 213.19.162.21 → 192.168.49.139 TLSv1.2 495 Application Data
  396 0.727262863 192.168.49.139 → 213.19.162.21 TCP 56 45580 → 443 [ACK] Seq=1440 Ack=1170 Win=62780 Len=0
  397 0.732640789 51.38.120.206 → 192.168.49.139 TLSv1.2 104 Application Data
  398 0.732656552 192.168.49.139 → 51.38.120.206 TCP 56 32768 → 443 [ACK] Seq=3378 Ack=1203 Win=63000 Len=0
  399 0.733590188 192.168.49.2 → 192.168.49.139 DNS 105 Standard query response 0x9900 A f3-ru.adhigh.net A 193.232.148.142 OPT
  400 0.733718407   127.0.0.53 → 127.0.0.1    DNS 105 Standard query response 0xa796 A f3-ru.adhigh.net A 193.232.148.142 OPT
  401 0.734436323 194.55.244.178 → 192.168.49.139 TLSv1.2 388 Application Data
  402 0.734442000 192.168.49.139 → 194.55.244.178 TCP 56 50594 → 443 [ACK] Seq=2419 Ack=8140 Win=65535 Len=0
  403 0.735984667 51.38.120.206 → 192.168.49.139 TLSv1.2 585 Application Data
  404 0.735998877 192.168.49.139 → 51.38.120.206 TCP 56 32768 → 443 [ACK] Seq=3378 Ack=1732 Win=63000 Len=0
  405 0.736037271 188.42.191.196 → 192.168.49.139 TLSv1.2 780 Application Data
  406 0.736041121 192.168.49.139 → 188.42.191.196 TCP 56 39762 → 443 [ACK] Seq=4894 Ack=15210 Win=65535 Len=0
  407 0.751961086 192.168.49.2 → 192.168.49.139 DNS 146 Standard query response 0x42ae AAAA f3-ru.adhigh.net SOA ns1.getintent.com OPT
  408 0.752399732   127.0.0.53 → 127.0.0.1    DNS 89 Standard query response 0x839f AAAA f3-ru.adhigh.net OPT
  409 0.752775711 194.55.244.178 → 192.168.49.139 TLSv1.2 720 Application Data, Application Data
  410 0.752867608 192.168.49.139 → 194.55.244.178 TCP 56 50594 → 443 [ACK] Seq=2419 Ack=8804 Win=65535 Len=0
  411 0.754781364 192.168.49.139 → 193.232.148.142 TCP 76 58966 → 443 [SYN] Seq=0 Win=64240 Len=0 MSS=1460 SACK_PERM=1 TSval=984975125 TSecr=0 WS=128
  412 0.758373756 194.55.244.178 → 192.168.49.139 TLSv1.2 388 Application Data
  413 0.758408455 192.168.49.139 → 194.55.244.178 TCP 56 50594 → 443 [ACK] Seq=2419 Ack=9136 Win=65535 Len=0
  414 0.768067605  81.17.55.98 → 192.168.49.139 TCP 1516 [TCP segment of a reassembled PDU]
  415 0.768106602 192.168.49.139 → 81.17.55.98  TCP 56 40860 → 443 [ACK] Seq=2901 Ack=3093 Win=63416 Len=0
  416 0.768240126  81.17.55.98 → 192.168.49.139 TLSv1.2 233 Application Data
  417 0.768268661 192.168.49.139 → 81.17.55.98  TCP 56 40860 → 443 [ACK] Seq=2901 Ack=3270 Win=63416 Len=0
  418 0.768647031 185.172.90.252 → 192.168.49.139 TLSv1.2 462 Application Data
  419 0.768662514 192.168.49.139 → 185.172.90.252 TCP 56 45852 → 443 [ACK] Seq=1007 Ack=1219 Win=63982 Len=0
  420 0.775894814 37.252.171.22 → 192.168.49.139 TLSv1.2 930 Application Data
  421 0.775936125 192.168.49.139 → 37.252.171.22 TCP 56 54162 → 443 [ACK] Seq=2960 Ack=1749 Win=63802 Len=0
  422 0.777014238 194.55.244.178 → 192.168.49.139 TLSv1.2 388 Application Data
  423 0.777041962 192.168.49.139 → 194.55.244.178 TCP 56 50594 → 443 [ACK] Seq=2419 Ack=9468 Win=65535 Len=0
  424 0.793173879 54.38.64.100 → 192.168.49.139 TLSv1.2 356 Application Data
  425 0.793201273 192.168.49.139 → 54.38.64.100 TCP 56 42862 → 443 [ACK] Seq=872 Ack=901 Win=63000 Len=0
  426 0.793299655 158.160.20.142 → 192.168.49.139 TCP 62 443 → 36768 [SYN, ACK] Seq=0 Ack=1 Win=64240 Len=0 MSS=1460
  427 0.793321222 192.168.49.139 → 158.160.20.142 TCP 56 36768 → 443 [ACK] Seq=1 Ack=1 Win=64240 Len=0
  428 0.795827729 192.168.49.139 → 151.101.194.133 TCP 56 33828 → 80 [ACK] Seq=1 Ack=1 Win=62780 Len=0
  429 0.796001502 151.101.194.133 → 192.168.49.139 TCP 62 [TCP ACKed unseen segment] 80 → 33828 [ACK] Seq=1 Ack=2 Win=64240 Len=0
  430 0.796317083 192.168.49.139 → 158.160.20.142 TLSv1 573 Client Hello
  431 0.796659907 158.160.20.142 → 192.168.49.139 TCP 62 443 → 36768 [ACK] Seq=1 Ack=518 Win=64240 Len=0
  432 0.800057209 193.232.148.142 → 192.168.49.139 TCP 62 443 → 58966 [SYN, ACK] Seq=0 Ack=1 Win=64240 Len=0 MSS=1460
  433 0.800121316 192.168.49.139 → 193.232.148.142 TCP 56 58966 → 443 [ACK] Seq=1 Ack=1 Win=64240 Len=0
  434 0.806973823 192.168.49.139 → 193.232.148.142 TLSv1 573 Client Hello
  435 0.807265774 193.232.148.142 → 192.168.49.139 TCP 62 443 → 58966 [ACK] Seq=1 Ack=518 Win=64240 Len=0
  436 0.830326681 52.59.131.18 → 192.168.49.139 TLSv1.2 640 Application Data, Application Data
  437 0.830346485 192.168.49.139 → 52.59.131.18 TCP 56 57292 → 443 [ACK] Seq=2401 Ack=1753 Win=63656 Len=0
  438 0.839195901 192.168.49.139 → 188.42.191.196 TLSv1.2 965 Application Data
  439 0.839513343 188.42.191.196 → 192.168.49.139 TCP 62 443 → 39762 [ACK] Seq=15210 Ack=5803 Win=64240 Len=0
  440 0.855567819 192.168.49.139 → 188.42.191.196 TLSv1.2 157 Application Data
  441 0.855760740 188.42.191.196 → 192.168.49.139 TCP 62 443 → 39762 [ACK] Seq=15210 Ack=5904 Win=64240 Len=0
  442 0.867105220 158.160.20.142 → 192.168.49.139 TLSv1.2 1516 Server Hello
  443 0.867134349 192.168.49.139 → 158.160.20.142 TCP 56 36768 → 443 [ACK] Seq=518 Ack=1461 Win=62780 Len=0
  444 0.867183415 158.160.20.142 → 192.168.49.139 TCP 1396 443 → 36768 [PSH, ACK] Seq=1461 Ack=518 Win=64240 Len=1340 [TCP segment of a reassembled PDU]
  445 0.867191496 192.168.49.139 → 158.160.20.142 TCP 56 36768 → 443 [ACK] Seq=518 Ack=2801 Win=62780 Len=0
  446 0.871131659 158.160.20.142 → 192.168.49.139 TLSv1.2 1516 Certificate [TCP segment of a reassembled PDU]
  447 0.871185342 192.168.49.139 → 158.160.20.142 TCP 56 36768 → 443 [ACK] Seq=518 Ack=4261 Win=62780 Len=0
  448 0.871228057 158.160.20.142 → 192.168.49.139 TLSv1.2 441 Server Key Exchange, Server Hello Done
  449 0.871231953 192.168.49.139 → 158.160.20.142 TCP 56 36768 → 443 [ACK] Seq=518 Ack=4646 Win=62780 Len=0
  450 0.872308407 193.232.148.142 → 192.168.49.139 TLSv1.2 1516 Server Hello
  451 0.872321082 192.168.49.139 → 193.232.148.142 TCP 56 58966 → 443 [ACK] Seq=518 Ack=1461 Win=62780 Len=0
  452 0.872346501 193.232.148.142 → 192.168.49.139 TCP 1396 443 → 58966 [PSH, ACK] Seq=1461 Ack=518 Win=64240 Len=1340 [TCP segment of a reassembled PDU]
  453 0.872350725 192.168.49.139 → 193.232.148.142 TCP 56 58966 → 443 [ACK] Seq=518 Ack=2801 Win=62780 Len=0
  454 0.872612198 193.232.148.142 → 192.168.49.139 TLSv1.2 1516 Certificate [TCP segment of a reassembled PDU]
  455 0.872618343 192.168.49.139 → 193.232.148.142 TCP 56 58966 → 443 [ACK] Seq=518 Ack=4261 Win=61320 Len=0
  456 0.872646903 193.232.148.142 → 192.168.49.139 TLSv1.2 465 Server Key Exchange, Server Hello Done
  457 0.872650839 192.168.49.139 → 193.232.148.142 TCP 56 58966 → 443 [ACK] Seq=518 Ack=4670 Win=61320 Len=0
  458 0.875039316 192.168.49.139 → 158.160.20.142 TLSv1.2 182 Client Key Exchange, Change Cipher Spec, Encrypted Handshake Message
  459 0.875407583 158.160.20.142 → 192.168.49.139 TCP 62 443 → 36768 [ACK] Seq=4646 Ack=644 Win=64240 Len=0
  460 0.882039458 192.168.49.139 → 193.232.148.142 TLSv1.2 182 Client Key Exchange, Change Cipher Spec, Encrypted Handshake Message
  461 0.882467382 193.232.148.142 → 192.168.49.139 TCP 62 443 → 58966 [ACK] Seq=4670 Ack=644 Win=64240 Len=0
  462 0.909368467    127.0.0.1 → 127.0.0.53   DNS 94 Standard query 0x68f5 A exchange.buzzoola.com OPT
  463 0.909409842    127.0.0.1 → 127.0.0.53   DNS 94 Standard query 0xc6fe AAAA exchange.buzzoola.com OPT
  464 0.909632016 192.168.49.139 → 192.168.49.2 DNS 94 Standard query 0x177d A exchange.buzzoola.com OPT
  465 0.909823697 192.168.49.139 → 192.168.49.2 DNS 94 Standard query 0x24ad AAAA exchange.buzzoola.com OPT
  466 0.914611331 70.42.32.159 → 192.168.49.139 TLSv1.2 211 Application Data
  467 0.914636863 192.168.49.139 → 70.42.32.159 TCP 56 59338 → 443 [ACK] Seq=2940 Ack=466 Win=63000 Len=0
  468 0.916977203 192.168.49.139 → 167.235.33.113 TLSv1.2 263 Application Data
  469 0.917233690 167.235.33.113 → 192.168.49.139 TCP 62 443 → 58996 [ACK] Seq=1 Ack=208 Win=64240 Len=0
  470 0.918660810 188.42.191.196 → 192.168.49.139 TLSv1.2 616 Application Data
  471 0.918680947 192.168.49.139 → 188.42.191.196 TCP 56 39762 → 443 [ACK] Seq=5904 Ack=15770 Win=65535 Len=0
  472 0.943157112 158.160.20.142 → 192.168.49.139 TLSv1.2 314 New Session Ticket, Change Cipher Spec, Encrypted Handshake Message
  473 0.943188511 192.168.49.139 → 158.160.20.142 TCP 56 36768 → 443 [ACK] Seq=644 Ack=4904 Win=62780 Len=0
  474 0.944198242 192.168.49.139 → 158.160.20.142 TLSv1.2 519 Application Data
  475 0.944615834 158.160.20.142 → 192.168.49.139 TCP 62 443 → 36768 [ACK] Seq=4904 Ack=1107 Win=64240 Len=0
  476 0.944637151 193.232.148.142 → 192.168.49.139 TLSv1.2 314 New Session Ticket, Change Cipher Spec, Encrypted Handshake Message
  477 0.944653387 192.168.49.139 → 193.232.148.142 TCP 56 58966 → 443 [ACK] Seq=644 Ack=4928 Win=62780 Len=0
  478 0.944704066 193.232.148.142 → 192.168.49.139 TLSv1.2 125 Application Data
  479 0.944711473 192.168.49.139 → 193.232.148.142 TCP 56 58966 → 443 [ACK] Seq=644 Ack=4997 Win=62780 Len=0
  480 0.946520439 192.168.49.139 → 193.232.148.142 TLSv1.2 233 Application Data
  481 0.946609291 192.168.49.139 → 193.232.148.142 TLSv1.2 1100 Application Data
  482 0.946799711 193.232.148.142 → 192.168.49.139 TCP 62 443 → 58966 [ACK] Seq=4997 Ack=821 Win=64240 Len=0
  483 0.946817723 193.232.148.142 → 192.168.49.139 TCP 62 443 → 58966 [ACK] Seq=4997 Ack=1865 Win=64240 Len=0
  484 0.948577235 192.168.49.139 → 193.232.148.142 TLSv1.2 94 Application Data
  485 0.948743133 193.232.148.142 → 192.168.49.139 TCP 62 443 → 58966 [ACK] Seq=4997 Ack=1903 Win=64240 Len=0
  486 0.954975310 192.168.49.2 → 192.168.49.139 DNS 176 Standard query response 0x24ad AAAA exchange.buzzoola.com SOA ns-1031.awsdns-00.org OPT
  487 0.955607221   127.0.0.53 → 127.0.0.1    DNS 94 Standard query response 0xc6fe AAAA exchange.buzzoola.com OPT
  488 0.969487090 192.168.49.2 → 192.168.49.139 DNS 478 Standard query response 0x177d A exchange.buzzoola.com A 144.76.118.200 A 167.235.33.115 A 159.69.142.212 A 176.9.79.218 A 167.235.33.113 A 94.130.13.220 A 167.235.33.114 A 148.251.40.140 A 138.201.160.249 A 168.119.88.34 A 176.9.158.88 A 138.201.34.239 A 168.119.9.59 A 116.202.236.171 A 144.76.118.233 A 88.198.31.232 A 168.119.8.212 A 159.69.141.123 A 148.251.156.238 A 138.201.34.238 A 116.202.236.172 A 176.9.81.69 A 144.76.119.17 A 49.12.83.94 OPT
  489 0.969801377   127.0.0.53 → 127.0.0.1    DNS 478 Standard query response 0x68f5 A exchange.buzzoola.com A 144.76.118.200 A 167.235.33.115 A 159.69.142.212 A 176.9.79.218 A 167.235.33.113 A 94.130.13.220 A 167.235.33.114 A 148.251.40.140 A 138.201.160.249 A 168.119.88.34 A 176.9.158.88 A 138.201.34.239 A 168.119.9.59 A 116.202.236.171 A 144.76.118.233 A 88.198.31.232 A 168.119.8.212 A 159.69.141.123 A 148.251.156.238 A 138.201.34.238 A 116.202.236.172 A 176.9.81.69 A 144.76.119.17 A 49.12.83.94 OPT
  490 0.991494415 167.235.33.113 → 192.168.49.139 TLSv1.2 370 Application Data
  491 0.991550213 192.168.49.139 → 167.235.33.113 TCP 56 58996 → 443 [ACK] Seq=208 Ack=315 Win=62780 Len=0
  492 0.995209416 192.168.49.139 → 167.235.33.113 TLSv1.2 265 Application Data
  493 0.995598097 192.168.49.139 → 167.235.33.113 TLSv1.2 283 Application Data
  494 0.995633958 167.235.33.113 → 192.168.49.139 TCP 62 443 → 58992 [ACK] Seq=1 Ack=210 Win=64240 Len=0
  495 0.995730038 167.235.33.113 → 192.168.49.139 TCP 62 443 → 58992 [ACK] Seq=1 Ack=437 Win=64240 Len=0
  496 1.003185584 188.42.191.196 → 192.168.49.139 TLSv1.2 582 Application Data
  497 1.003223677 192.168.49.139 → 188.42.191.196 TCP 56 39762 → 443 [ACK] Seq=5904 Ack=16296 Win=65535 Len=0
  498 1.004597267    127.0.0.1 → 127.0.0.53   DNS 97 Standard query 0xe519 A ww1097.smartadserver.com OPT
  499 1.004631346    127.0.0.1 → 127.0.0.53   DNS 97 Standard query 0xd127 AAAA ww1097.smartadserver.com OPT
  500 1.004955267   127.0.0.53 → 127.0.0.1    DNS 303 Standard query response 0xe519 A ww1097.smartadserver.com CNAME geo-eu-us-secure.delivery-prod-sas.akadns.net CNAME euw1.smartadserver.com A 81.17.55.161 A 81.17.55.112 A 81.17.55.160 A 81.17.55.113 A 81.17.55.99 A 81.17.55.98 A 89.149.192.65 A 89.149.192.64 OPT
  501 1.005176219   127.0.0.53 → 127.0.0.1    DNS 175 Standard query response 0xd127 AAAA ww1097.smartadserver.com CNAME geo-eu-us-secure.delivery-prod-sas.akadns.net CNAME euw1.smartadserver.com OPT
  502 1.006334112 192.168.49.139 → 81.17.55.98  TLSv1.2 1504 Application Data
  503 1.006604357  81.17.55.98 → 192.168.49.139 TCP 62 443 → 40860 [ACK] Seq=3270 Ack=4349 Win=64240 Len=0
  504 1.022341779 193.232.148.142 → 192.168.49.139 TLSv1.2 94 Application Data
  505 1.022384807 192.168.49.139 → 193.232.148.142 TCP 56 58966 → 443 [ACK] Seq=1903 Ack=5035 Win=62780 Len=0
  506 1.029244461 192.168.49.139 → 54.38.64.100 TLSv1.2 492 Application Data
  507 1.029665806 54.38.64.100 → 192.168.49.139 TCP 62 443 → 42862 [ACK] Seq=901 Ack=1308 Win=64240 Len=0
  508 1.039223309 192.168.49.139 → 188.42.191.196 TLSv1.2 162 Application Data
  509 1.039608704 188.42.191.196 → 192.168.49.139 TCP 62 443 → 39762 [ACK] Seq=16296 Ack=6010 Win=64240 Len=0
  510 1.088934149 158.160.20.142 → 192.168.49.139 TLSv1.2 755 Application Data
  511 1.088955857 192.168.49.139 → 158.160.20.142 TCP 56 36768 → 443 [ACK] Seq=1107 Ack=5603 Win=62780 Len=0
  512 1.090956989 193.232.148.142 → 192.168.49.139 TLSv1.2 1290 Application Data
  513 1.090974038 192.168.49.139 → 193.232.148.142 TCP 56 58966 → 443 [ACK] Seq=1903 Ack=6269 Win=62780 Len=0
  514 1.107997427 192.168.49.139 → 158.160.20.142 TLSv1.2 539 Application Data
  515 1.108344634 158.160.20.142 → 192.168.49.139 TCP 62 443 → 36768 [ACK] Seq=5603 Ack=1590 Win=64240 Len=0
  516 1.108943925 192.168.49.139 → 193.232.148.142 TLSv1.2 942 Application Data
  517 1.109217700 193.232.148.142 → 192.168.49.139 TCP 62 443 → 58966 [ACK] Seq=6269 Ack=2789 Win=64240 Len=0
  518 1.129586206 188.42.191.196 → 192.168.49.139 TLSv1.2 535 Application Data
  519 1.129660194 192.168.49.139 → 188.42.191.196 TCP 56 39762 → 443 [ACK] Seq=6010 Ack=16775 Win=65535 Len=0
  520 1.134516105  81.17.55.98 → 192.168.49.139 TCP 1516 [TCP segment of a reassembled PDU]
  521 1.134534914 192.168.49.139 → 81.17.55.98  TCP 56 40860 → 443 [ACK] Seq=4349 Ack=4730 Win=63416 Len=0
  522 1.134565000  81.17.55.98 → 192.168.49.139 TLSv1.2 227 Application Data
  523 1.134569566 192.168.49.139 → 81.17.55.98  TCP 56 40860 → 443 [ACK] Seq=4349 Ack=4901 Win=63416 Len=0
  524 1.134584112 54.38.64.100 → 192.168.49.139 TLSv1.2 356 Application Data
  525 1.134586656 192.168.49.139 → 54.38.64.100 TCP 56 42862 → 443 [ACK] Seq=1308 Ack=1201 Win=63000 Len=0
  526 1.146698845 192.168.49.139 → 193.232.150.75 TLSv1.2 147 Application Data
  527 1.147385506 193.232.150.75 → 192.168.49.139 TCP 62 443 → 40710 [ACK] Seq=12462 Ack=1204 Win=64240 Len=0
  528 1.165366094 193.232.148.142 → 192.168.49.139 TLSv1.2 355 Application Data
  529 1.169858118 158.160.20.142 → 192.168.49.139 TLSv1.2 568 Application Data
  530 1.198561372 167.235.33.113 → 192.168.49.139 TLSv1.2 104 Application Data
  531 1.198591138 192.168.49.139 → 167.235.33.113 TCP 56 58992 → 443 [ACK] Seq=437 Ack=49 Win=62780 Len=0
  532 1.200809791 192.168.49.139 → 188.42.191.196 TLSv1.2 1045 Application Data
  533 1.201115915 192.168.49.139 → 194.226.130.226 TLSv1.2 166 Application Data
  534 1.201173573 188.42.191.196 → 192.168.49.139 TCP 62 443 → 39762 [ACK] Seq=16775 Ack=6999 Win=64240 Len=0
  535 1.201339310 194.226.130.226 → 192.168.49.139 TCP 62 443 → 39378 [ACK] Seq=752 Ack=331 Win=64240 Len=0
  536 1.201864128 192.168.49.139 → 188.42.191.196 TLSv1.2 830 Application Data
  537 1.201974295 188.42.191.196 → 192.168.49.139 TCP 62 443 → 39762 [ACK] Seq=16775 Ack=7773 Win=64240 Len=0
  538 1.203880877 167.235.33.113 → 192.168.49.139 TLSv1.2 374 Application Data
  539 1.203896500 192.168.49.139 → 167.235.33.113 TCP 56 58992 → 443 [ACK] Seq=437 Ack=367 Win=62780 Len=0
  540 1.204528086 192.168.49.139 → 104.16.120.195 TLSv1.2 293 Application Data
  541 1.204716857 104.16.120.195 → 192.168.49.139 TCP 62 443 → 46110 [ACK] Seq=178 Ack=475 Win=64240 Len=0
  542 1.210088679 193.232.150.75 → 192.168.49.139 TCP 1516 [TCP segment of a reassembled PDU]
  543 1.210110093 192.168.49.139 → 193.232.150.75 TCP 56 40710 → 443 [ACK] Seq=1204 Ack=13922 Win=62780 Len=0
  544 1.210164427 193.232.150.75 → 192.168.49.139 TCP 1396 443 → 40710 [PSH, ACK] Seq=13922 Ack=1204 Win=64240 Len=1340 [TCP segment of a reassembled PDU]
  545 1.210171558 192.168.49.139 → 193.232.150.75 TCP 56 40710 → 443 [ACK] Seq=1204 Ack=15262 Win=62780 Len=0
  546 1.210188112 193.232.150.75 → 192.168.49.139 TCP 1516 443 → 40710 [ACK] Seq=15262 Ack=1204 Win=64240 Len=1460 [TCP segment of a reassembled PDU]
  547 1.210191564 192.168.49.139 → 193.232.150.75 TCP 56 40710 → 443 [ACK] Seq=1204 Ack=16722 Win=61320 Len=0
  548 1.210210815 193.232.150.75 → 192.168.49.139 TCP 1396 443 → 40710 [PSH, ACK] Seq=16722 Ack=1204 Win=64240 Len=1340 [TCP segment of a reassembled PDU]
  549 1.210215527 192.168.49.139 → 193.232.150.75 TCP 56 40710 → 443 [ACK] Seq=1204 Ack=18062 Win=61320 Len=0
  550 1.211676635 192.168.49.139 → 193.232.148.142 TCP 56 58966 → 443 [ACK] Seq=2789 Ack=6568 Win=62780 Len=0
  551 1.211722767 192.168.49.139 → 158.160.20.142 TCP 56 36768 → 443 [ACK] Seq=1590 Ack=6115 Win=62780 Len=0
  552 1.218188739 193.232.150.75 → 192.168.49.139 TCP 1516 443 → 40710 [ACK] Seq=18062 Ack=1204 Win=64240 Len=1460 [TCP segment of a reassembled PDU]
  553 1.218207086 192.168.49.139 → 193.232.150.75 TCP 56 40710 → 443 [ACK] Seq=1204 Ack=19522 Win=62780 Len=0
  554 1.218248733 193.232.150.75 → 192.168.49.139 TLSv1.2 422 Application Data
  555 1.218253527 192.168.49.139 → 193.232.150.75 TCP 56 40710 → 443 [ACK] Seq=1204 Ack=19888 Win=62780 Len=0
  556 1.251210503    127.0.0.1 → 127.0.0.53   DNS 90 Standard query 0xefa1 A f16-ru.adhigh.net OPT
  557 1.251265563    127.0.0.1 → 127.0.0.53   DNS 90 Standard query 0x0dcb AAAA f16-ru.adhigh.net OPT
  558 1.251471290 192.168.49.139 → 192.168.49.2 DNS 90 Standard query 0x1189 A f16-ru.adhigh.net OPT
  559 1.251665326 192.168.49.139 → 192.168.49.2 DNS 90 Standard query 0x17ad AAAA f16-ru.adhigh.net OPT
  560 1.260079481 104.16.120.195 → 192.168.49.139 TLSv1.2 152 Application Data
  561 1.260113915 192.168.49.139 → 104.16.120.195 TCP 56 46110 → 443 [ACK] Seq=475 Ack=274 Win=62780 Len=0
  562 1.262371191 192.168.49.139 → 158.160.20.142 TLSv1.2 519 Application Data
  563 1.262837754 158.160.20.142 → 192.168.49.139 TCP 62 443 → 36768 [ACK] Seq=6115 Ack=2053 Win=64240 Len=0
  564 1.276110995 104.16.120.195 → 192.168.49.139 TLSv1.2 87 Application Data
  565 1.276145849 192.168.49.139 → 104.16.120.195 TCP 56 46110 → 443 [ACK] Seq=475 Ack=305 Win=62780 Len=0
  566 1.284028042 194.226.130.226 → 192.168.49.139 TLSv1.2 488 Application Data
  567 1.284066716 192.168.49.139 → 194.226.130.226 TCP 56 39378 → 443 [ACK] Seq=331 Ack=1184 Win=62780 Len=0
  568 1.289682864 188.42.191.196 → 192.168.49.139 TLSv1.2 616 Application Data
  569 1.289706997 192.168.49.139 → 188.42.191.196 TCP 56 39762 → 443 [ACK] Seq=7773 Ack=17335 Win=65535 Len=0
  570 1.295885723 192.168.49.139 → 194.226.130.226 TLSv1.2 166 Application Data
  571 1.296426888 194.226.130.226 → 192.168.49.139 TCP 62 443 → 39378 [ACK] Seq=1184 Ack=441 Win=64240 Len=0
  572 1.297699984 192.168.49.2 → 192.168.49.139 DNS 106 Standard query response 0x1189 A f16-ru.adhigh.net A 193.232.150.149 OPT
  573 1.298002450   127.0.0.53 → 127.0.0.1    DNS 106 Standard query response 0xefa1 A f16-ru.adhigh.net A 193.232.150.149 OPT
  574 1.303975232 192.168.49.139 → 93.184.220.29 TCP 56 47318 → 80 [ACK] Seq=1 Ack=1 Win=63635 Len=0
  575 1.304119332 192.168.49.139 → 99.81.36.249 TCP 56 35274 → 443 [ACK] Seq=1 Ack=1 Win=62780 Len=0
  576 1.304441851 93.184.220.29 → 192.168.49.139 TCP 62 [TCP ACKed unseen segment] 80 → 47318 [ACK] Seq=1 Ack=2 Win=64240 Len=0
  577 1.304481197 99.81.36.249 → 192.168.49.139 TCP 62 [TCP ACKed unseen segment] 443 → 35274 [ACK] Seq=1 Ack=2 Win=64240 Len=0
  578 1.307743284 192.168.49.139 → 93.184.220.29 TCP 56 47332 → 80 [ACK] Seq=1 Ack=1 Win=63599 Len=0
  579 1.307928271 93.184.220.29 → 192.168.49.139 TCP 62 [TCP ACKed unseen segment] 80 → 47332 [ACK] Seq=1 Ack=2 Win=64240 Len=0
  580 1.309373323 192.168.49.2 → 192.168.49.139 DNS 147 Standard query response 0x17ad AAAA f16-ru.adhigh.net SOA ns1.getintent.com OPT
  581 1.310103272   127.0.0.53 → 127.0.0.1    DNS 90 Standard query response 0x0dcb AAAA f16-ru.adhigh.net OPT
  582 1.312601319 192.168.49.139 → 193.232.150.149 TCP 76 44700 → 443 [SYN] Seq=0 Win=64240 Len=0 MSS=1460 SACK_PERM=1 TSval=481451476 TSecr=0 WS=128
  583 1.328536531 158.160.20.142 → 192.168.49.139 TLSv1.2 784 Application Data, Application Data
  584 1.328588871 192.168.49.139 → 158.160.20.142 TCP 56 36768 → 443 [ACK] Seq=2053 Ack=6843 Win=62780 Len=0
  585 1.338638336 192.168.49.139 → 158.160.20.142 TLSv1.2 539 Application Data
  586 1.338941657 158.160.20.142 → 192.168.49.139 TCP 62 443 → 36768 [ACK] Seq=6843 Ack=2536 Win=64240 Len=0
  587 1.369308181 188.42.191.196 → 192.168.49.139 TLSv1.2 616 Application Data
  588 1.369333493 192.168.49.139 → 188.42.191.196 TCP 56 39762 → 443 [ACK] Seq=7773 Ack=17895 Win=65535 Len=0
  589 1.372205803 194.226.130.226 → 192.168.49.139 TLSv1.2 375 Application Data
  590 1.372300612 192.168.49.139 → 194.226.130.226 TCP 56 39378 → 443 [ACK] Seq=441 Ack=1503 Win=62780 Len=0
  591 1.384708280 193.232.150.149 → 192.168.49.139 TCP 62 443 → 44700 [SYN, ACK] Seq=0 Ack=1 Win=64240 Len=0 MSS=1460
  592 1.384828046 192.168.49.139 → 193.232.150.149 TCP 56 44700 → 443 [ACK] Seq=1 Ack=1 Win=64240 Len=0
  593 1.388073103 192.168.49.139 → 193.232.150.149 TLSv1 573 Client Hello
  594 1.388433594 193.232.150.149 → 192.168.49.139 TCP 62 443 → 44700 [ACK] Seq=1 Ack=518 Win=64240 Len=0
  595 1.397798103 158.160.20.142 → 192.168.49.139 TLSv1.2 597 Application Data, Application Data
  596 1.397823226 192.168.49.139 → 158.160.20.142 TCP 56 36768 → 443 [ACK] Seq=2536 Ack=7384 Win=62780 Len=0
  597 1.480165719 193.232.150.149 → 192.168.49.139 TLSv1.2 1456 Server Hello
  598 1.480202036 192.168.49.139 → 193.232.150.149 TCP 56 44700 → 443 [ACK] Seq=518 Ack=1401 Win=63000 Len=0
  599 1.564994907 193.232.150.149 → 192.168.49.139 TCP 1516 443 → 44700 [ACK] Seq=1401 Ack=518 Win=64240 Len=1460 [TCP segment of a reassembled PDU]
  600 1.565031924 192.168.49.139 → 193.232.150.149 TCP 56 44700 → 443 [ACK] Seq=518 Ack=2861 Win=63000 Len=0
  601 1.565076352 193.232.150.149 → 192.168.49.139 TLSv1.2 1396 Certificate [TCP segment of a reassembled PDU]
  602 1.565084630 192.168.49.139 → 193.232.150.149 TCP 56 44700 → 443 [ACK] Seq=518 Ack=4201 Win=63000 Len=0
  603 1.613266541 193.232.150.149 → 192.168.49.139 TLSv1.2 525 Server Key Exchange, Server Hello Done
  604 1.613285804 192.168.49.139 → 193.232.150.149 TCP 56 44700 → 443 [ACK] Seq=518 Ack=4670 Win=63000 Len=0
  605 1.615984208 192.168.49.139 → 193.232.150.149 TLSv1.2 182 Client Key Exchange, Change Cipher Spec, Encrypted Handshake Message
  606 1.616344608 193.232.150.149 → 192.168.49.139 TCP 62 443 → 44700 [ACK] Seq=4670 Ack=644 Win=64240 Len=0
  607 1.685847924    127.0.0.1 → 127.0.0.53   DNS 94 Standard query 0x512c A exchange.buzzoola.com OPT
  608 1.686024414   127.0.0.53 → 127.0.0.1    DNS 478 Standard query response 0x512c A exchange.buzzoola.com A 49.12.83.94 A 144.76.119.17 A 176.9.81.69 A 116.202.236.172 A 138.201.34.238 A 148.251.156.238 A 159.69.141.123 A 168.119.8.212 A 88.198.31.232 A 144.76.118.233 A 116.202.236.171 A 168.119.9.59 A 138.201.34.239 A 176.9.158.88 A 168.119.88.34 A 138.201.160.249 A 148.251.40.140 A 167.235.33.114 A 94.130.13.220 A 167.235.33.113 A 176.9.79.218 A 159.69.142.212 A 167.235.33.115 A 144.76.118.200 OPT
  609 1.686045647    127.0.0.1 → 127.0.0.53   DNS 94 Standard query 0x8533 AAAA exchange.buzzoola.com OPT
  610 1.686102060   127.0.0.53 → 127.0.0.1    DNS 94 Standard query response 0x8533 AAAA exchange.buzzoola.com OPT
  611 1.686874825    127.0.0.1 → 127.0.0.53   DNS 94 Standard query 0x993c A exchange.buzzoola.com OPT
  612 1.686980313   127.0.0.53 → 127.0.0.1    DNS 478 Standard query response 0x993c A exchange.buzzoola.com A 49.12.83.94 A 144.76.119.17 A 176.9.81.69 A 116.202.236.172 A 138.201.34.238 A 148.251.156.238 A 159.69.141.123 A 168.119.8.212 A 88.198.31.232 A 144.76.118.233 A 116.202.236.171 A 168.119.9.59 A 138.201.34.239 A 176.9.158.88 A 168.119.88.34 A 138.201.160.249 A 148.251.40.140 A 167.235.33.114 A 94.130.13.220 A 167.235.33.113 A 176.9.79.218 A 159.69.142.212 A 167.235.33.115 A 144.76.118.200 OPT
  613 1.686999174    127.0.0.1 → 127.0.0.53   DNS 94 Standard query 0xeb40 AAAA exchange.buzzoola.com OPT
  614 1.687049207 192.168.49.139 → 167.235.33.113 TLSv1.2 262 Application Data
  615 1.687054425   127.0.0.53 → 127.0.0.1    DNS 94 Standard query response 0xeb40 AAAA exchange.buzzoola.com OPT
  616 1.687783316 167.235.33.113 → 192.168.49.139 TCP 62 443 → 58996 [ACK] Seq=315 Ack=414 Win=64240 Len=0
  617 1.704807574 193.232.150.149 → 192.168.49.139 TLSv1.2 314 New Session Ticket, Change Cipher Spec, Encrypted Handshake Message
  618 1.704830480 192.168.49.139 → 193.232.150.149 TCP 56 44700 → 443 [ACK] Seq=644 Ack=4928 Win=63000 Len=0
  619 1.705778227 192.168.49.139 → 193.232.150.149 TLSv1.2 233 Application Data
  620 1.705844393 192.168.49.139 → 193.232.150.149 TLSv1.2 1095 Application Data
  621 1.706520320 193.232.150.149 → 192.168.49.139 TCP 62 443 → 44700 [ACK] Seq=4928 Ack=821 Win=64240 Len=0
  622 1.706568796 193.232.150.149 → 192.168.49.139 TCP 62 443 → 44700 [ACK] Seq=4928 Ack=1860 Win=64240 Len=0
  623 1.757848839 167.235.33.113 → 192.168.49.139 TLSv1.2 370 Application Data
  624 1.757880585 192.168.49.139 → 167.235.33.113 TCP 56 58996 → 443 [ACK] Seq=414 Ack=629 Win=62780 Len=0
  625 1.760736689 192.168.49.139 → 167.235.33.113 TLSv1.2 264 Application Data
  626 1.760832149 192.168.49.139 → 167.235.33.113 TLSv1.2 284 Application Data
  627 1.761045079 167.235.33.113 → 192.168.49.139 TCP 62 443 → 58992 [ACK] Seq=367 Ack=645 Win=64240 Len=0
  628 1.761057199 167.235.33.113 → 192.168.49.139 TCP 62 443 → 58992 [ACK] Seq=367 Ack=873 Win=64240 Len=0
  629 1.956218381 167.235.33.113 → 192.168.49.139 TLSv1.2 422 Application Data, Application Data
  630 1.956239520 192.168.49.139 → 167.235.33.113 TCP 56 58992 → 443 [ACK] Seq=873 Ack=733 Win=62780 Len=0
  631 2.005896929 193.232.150.149 → 192.168.49.139 TLSv1.2 1392 Application Data, Application Data, Application Data
  632 2.005927398 192.168.49.139 → 193.232.150.149 TCP 56 44700 → 443 [ACK] Seq=1860 Ack=6264 Win=63000 Len=0
  633 2.006222912 192.168.49.139 → 193.232.150.149 TLSv1.2 94 Application Data
  634 2.006456410 193.232.150.149 → 192.168.49.139 TCP 62 443 → 44700 [ACK] Seq=6264 Ack=1898 Win=64240 Len=0
  635 2.013013949 192.168.49.139 → 193.232.150.149 TLSv1.2 936 Application Data
  636 2.013343374 193.232.150.149 → 192.168.49.139 TCP 62 443 → 44700 [ACK] Seq=6264 Ack=2778 Win=64240 Len=0
  637 2.150953319 193.232.150.149 → 192.168.49.139 TLSv1.2 356 Application Data
  638 2.191689575 192.168.49.139 → 193.232.150.149 TCP 56 44700 → 443 [ACK] Seq=2778 Ack=6564 Win=63000 Len=0
  639 2.378374072 192.168.49.2 → 192.168.49.139 DNS 271 Standard query response 0xc8ac A ww1097.smartadserver.com CNAME geo-eu-us-secure.delivery-prod-sas.akadns.net CNAME itx4.smartadserver.com A 185.86.139.96 A 185.86.139.95 A 185.86.139.116 A 185.86.139.85 A 185.86.139.59 A 185.86.139.58 OPT
  640 2.378437497 192.168.49.139 → 192.168.49.2 ICMP 299 Destination unreachable (Port unreachable)
  641 2.583424156 192.168.49.139 → 104.18.32.68 TCP 56 36052 → 80 [ACK] Seq=1 Ack=1 Win=63756 Len=0
  642 2.583676791 104.18.32.68 → 192.168.49.139 TCP 62 [TCP ACKed unseen segment] 80 → 36052 [ACK] Seq=1 Ack=2 Win=64240 Len=0
  643 2.614223870 192.168.49.139 → 51.15.145.116 TLSv1.2 87 Encrypted Alert
  644 2.614337354 192.168.49.139 → 51.15.145.116 TCP 56 50256 → 443 [FIN, ACK] Seq=32 Ack=1 Win=62780 Len=0
  645 2.614611673 51.15.145.116 → 192.168.49.139 TCP 62 443 → 50256 [ACK] Seq=1 Ack=32 Win=64240 Len=0
  646 2.614621923 51.15.145.116 → 192.168.49.139 TCP 62 443 → 50256 [ACK] Seq=1 Ack=33 Win=64239 Len=0
  647 2.614815580 192.168.49.139 → 51.15.145.116 TLSv1.2 87 Encrypted Alert
  648 2.614906370 192.168.49.139 → 51.15.145.116 TCP 56 50244 → 443 [FIN, ACK] Seq=32 Ack=1 Win=64084 Len=0
  649 2.614961051 51.15.145.116 → 192.168.49.139 TCP 62 443 → 50244 [ACK] Seq=1 Ack=32 Win=64240 Len=0
  650 2.615028551 51.15.145.116 → 192.168.49.139 TCP 62 443 → 50244 [ACK] Seq=1 Ack=33 Win=64239 Len=0
  651 2.615122937 192.168.49.139 → 51.15.145.116 TLSv1.2 87 Encrypted Alert
  652 2.615212687 192.168.49.139 → 51.15.145.116 TCP 56 50230 → 443 [FIN, ACK] Seq=32 Ack=1 Win=64084 Len=0
  653 2.615264665 51.15.145.116 → 192.168.49.139 TCP 62 443 → 50230 [ACK] Seq=1 Ack=32 Win=64240 Len=0
  654 2.615341762 51.15.145.116 → 192.168.49.139 TCP 62 443 → 50230 [ACK] Seq=1 Ack=33 Win=64239 Len=0
  655 2.705373348 51.15.145.116 → 192.168.49.139 TCP 62 443 → 50230 [FIN, PSH, ACK] Seq=1 Ack=33 Win=64239 Len=0
  656 2.705404245 192.168.49.139 → 51.15.145.116 TCP 56 50230 → 443 [ACK] Seq=33 Ack=2 Win=64084 Len=0
  657 2.705481159 51.15.145.116 → 192.168.49.139 TCP 62 443 → 50256 [FIN, PSH, ACK] Seq=1 Ack=33 Win=64239 Len=0
  658 2.705491659 192.168.49.139 → 51.15.145.116 TCP 56 50256 → 443 [ACK] Seq=33 Ack=2 Win=62780 Len=0
  659 2.723998102 51.15.145.116 → 192.168.49.139 TCP 62 443 → 50244 [FIN, PSH, ACK] Seq=1 Ack=33 Win=64239 Len=0
  660 2.724030848 192.168.49.139 → 51.15.145.116 TCP 56 50244 → 443 [ACK] Seq=33 Ack=2 Win=64084 Len=0
  661 2.839682829 192.168.49.139 → 104.18.32.68 TCP 56 36068 → 80 [ACK] Seq=1 Ack=1 Win=63690 Len=0
  662 2.839730260 192.168.49.139 → 104.18.32.68 TCP 56 36082 → 80 [ACK] Seq=1 Ack=1 Win=63690 Len=0
  663 2.839782320 104.18.32.68 → 192.168.49.139 TCP 62 [TCP ACKed unseen segment] 80 → 36068 [ACK] Seq=1 Ack=2 Win=64240 Len=0
  664 2.839790987 104.18.32.68 → 192.168.49.139 TCP 62 [TCP ACKed unseen segment] 80 → 36082 [ACK] Seq=1 Ack=2 Win=64240 Len=0
  665 3.095906459 192.168.49.139 → 151.101.194.133 TCP 56 33818 → 80 [ACK] Seq=1 Ack=1 Win=63000 Len=0
  666 3.096115454 151.101.194.133 → 192.168.49.139 TCP 62 [TCP ACKed unseen segment] 80 → 33818 [ACK] Seq=1 Ack=2 Win=64240 Len=0
  667 3.355385698 192.168.49.139 → 104.18.32.68 TCP 56 36032 → 80 [ACK] Seq=1 Ack=1 Win=63690 Len=0
  668 3.355659876 104.18.32.68 → 192.168.49.139 TCP 62 [TCP ACKed unseen segment] 80 → 36032 [ACK] Seq=1 Ack=2 Win=64240 Len=0
  669 3.380357513 192.168.49.139 → 34.117.237.239 TLSv1.2 95 Application Data
  670 3.380704146 34.117.237.239 → 192.168.49.139 TCP 62 443 → 39092 [ACK] Seq=1 Ack=40 Win=64240 Len=0
  671 3.417680661 34.117.237.239 → 192.168.49.139 TLSv1.2 95 Application Data
  672 3.417697824 192.168.49.139 → 34.117.237.239 TCP 56 39092 → 443 [ACK] Seq=40 Ack=40 Win=64028 Len=0
  673 3.608005192 192.168.49.139 → 104.18.32.68 TCP 56 36044 → 80 [ACK] Seq=1 Ack=1 Win=63690 Len=0
  674 3.608500050 104.18.32.68 → 192.168.49.139 TCP 62 [TCP ACKed unseen segment] 80 → 36044 [ACK] Seq=1 Ack=2 Win=64240 Len=0
  675 4.198192021    127.0.0.1 → 127.0.0.53   DNS 99 Standard query 0x9aa9 A mozilla.cloudflare-dns.com OPT
  676 4.198221615    127.0.0.1 → 127.0.0.53   DNS 99 Standard query 0x28b3 AAAA mozilla.cloudflare-dns.com OPT
  677 4.198353404 192.168.49.139 → 104.16.248.249 TCP 76 53906 → 443 [SYN] Seq=0 Win=64240 Len=0 MSS=1460 SACK_PERM=1 TSval=3343572324 TSecr=0 WS=128
  678 4.198429127 192.168.49.139 → 192.168.49.2 DNS 99 Standard query 0x1f93 A mozilla.cloudflare-dns.com OPT
  679 4.198461665 192.168.49.139 → 192.168.49.2 DNS 99 Standard query 0xae95 AAAA mozilla.cloudflare-dns.com OPT
  680 4.198728175    127.0.0.1 → 127.0.0.53   DNS 99 Standard query 0xf1d4 A mozilla.cloudflare-dns.com OPT
  681 4.198752180    127.0.0.1 → 127.0.0.53   DNS 99 Standard query 0x2ddb AAAA mozilla.cloudflare-dns.com OPT
  682 4.198838511 192.168.49.139 → 104.16.248.249 TCP 76 53908 → 443 [SYN] Seq=0 Win=64240 Len=0 MSS=1460 SACK_PERM=1 TSval=3343572325 TSecr=0 WS=128
  683 4.224991194 192.168.49.2 → 192.168.49.139 DNS 131 Standard query response 0x1f93 A mozilla.cloudflare-dns.com A 104.16.249.249 A 104.16.248.249 OPT
  684 4.225152168   127.0.0.53 → 127.0.0.1    DNS 131 Standard query response 0x9aa9 A mozilla.cloudflare-dns.com A 104.16.249.249 A 104.16.248.249 OPT
  685 4.225189081   127.0.0.53 → 127.0.0.1    DNS 131 Standard query response 0xf1d4 A mozilla.cloudflare-dns.com A 104.16.249.249 A 104.16.248.249 OPT
  686 4.241991371 192.168.49.2 → 192.168.49.139 DNS 155 Standard query response 0xae95 AAAA mozilla.cloudflare-dns.com AAAA 2606:4700::6810:f9f9 AAAA 2606:4700::6810:f8f9 OPT
  687 4.242169157   127.0.0.53 → 127.0.0.1    DNS 155 Standard query response 0x28b3 AAAA mozilla.cloudflare-dns.com AAAA 2606:4700::6810:f9f9 AAAA 2606:4700::6810:f8f9 OPT
  688 4.242205083   127.0.0.53 → 127.0.0.1    DNS 155 Standard query response 0x2ddb AAAA mozilla.cloudflare-dns.com AAAA 2606:4700::6810:f9f9 AAAA 2606:4700::6810:f8f9 OPT
  689 4.375322425 192.168.49.139 → 69.173.144.138 TCP 56 42010 → 443 [ACK] Seq=1 Ack=1 Win=64038 Len=0
  690 4.375467836 69.173.144.138 → 192.168.49.139 TCP 62 [TCP ACKed unseen segment] 443 → 42010 [ACK] Seq=1 Ack=2 Win=64240 Len=0
  691 4.448919020 192.168.49.139 → 104.16.248.249 TCP 76 53910 → 443 [SYN] Seq=0 Win=64240 Len=0 MSS=1460 SACK_PERM=1 TSval=3343572575 TSecr=0 WS=128
  692 4.449389107    127.0.0.1 → 127.0.0.53   DNS 99 Standard query 0xbdd3 A mozilla.cloudflare-dns.com OPT
  693 4.449401401    127.0.0.1 → 127.0.0.53   DNS 99 Standard query 0x9e9b A mozilla.cloudflare-dns.com OPT
  694 4.449806759   127.0.0.53 → 127.0.0.1    DNS 131 Standard query response 0xbdd3 A mozilla.cloudflare-dns.com A 104.16.248.249 A 104.16.249.249 OPT
  695 4.449884402 192.168.49.139 → 104.16.248.249 TCP 76 53922 → 443 [SYN] Seq=0 Win=64240 Len=0 MSS=1460 SACK_PERM=1 TSval=3343572576 TSecr=0 WS=128
  696 4.449914384   127.0.0.53 → 127.0.0.1    DNS 131 Standard query response 0x9e9b A mozilla.cloudflare-dns.com A 104.16.248.249 A 104.16.249.249 OPT
  697 4.542581990 188.114.99.234 → 192.168.49.139 TLSv1.2 80 Application Data
  698 4.542614506 192.168.49.139 → 188.114.99.234 TCP 56 56230 → 443 [ACK] Seq=1 Ack=25 Win=63000 Len=0
  699 4.542801560 192.168.49.139 → 188.114.99.234 TLSv1.2 80 Application Data
  700 4.542851718 192.168.49.139 → 188.114.99.234 TCP 56 56230 → 443 [FIN, ACK] Seq=25 Ack=25 Win=63000 Len=0
  701 4.542989047 188.114.99.234 → 192.168.49.139 TCP 62 443 → 56230 [ACK] Seq=25 Ack=25 Win=64240 Len=0
  702 4.543085533 188.114.99.234 → 192.168.49.139 TCP 62 443 → 56230 [ACK] Seq=25 Ack=26 Win=64239 Len=0
  703 4.543539188 188.114.99.234 → 192.168.49.139 TCP 62 443 → 56230 [FIN, PSH, ACK] Seq=25 Ack=26 Win=64239 Len=0
  704 4.543551700 192.168.49.139 → 188.114.99.234 TCP 56 56230 → 443 [ACK] Seq=26 Ack=26 Win=63000 Len=0
  705 4.938908484 188.114.99.234 → 192.168.49.139 TLSv1.2 80 Application Data
  706 4.939150128 192.168.49.139 → 188.114.99.234 TLSv1.2 80 Application Data
  707 4.939191483 192.168.49.139 → 188.114.99.234 TCP 56 56238 → 443 [FIN, ACK] Seq=25 Ack=26 Win=63000 Len=0
  708 4.939330300 188.114.99.234 → 192.168.49.139 TCP 62 443 → 56238 [ACK] Seq=26 Ack=25 Win=64240 Len=0
  709 4.939337698 188.114.99.234 → 192.168.49.139 TCP 62 443 → 56238 [ACK] Seq=26 Ack=26 Win=64239 Len=0
  710 5.207824962 192.168.49.139 → 104.16.248.249 TCP 76 [TCP Retransmission] 53906 → 443 [SYN] Seq=0 Win=64240 Len=0 MSS=1460 SACK_PERM=1 TSval=3343573334 TSecr=0 WS=128
  711 5.207983534 192.168.49.139 → 104.16.248.249 TCP 76 [TCP Retransmission] 53908 → 443 [SYN] Seq=0 Win=64240 Len=0 MSS=1460 SACK_PERM=1 TSval=3343573334 TSecr=0 WS=128
