    1 0.000000000 192.168.212.132 → 192.168.212.2 DNS 86 Standard query 0x7172 A mozilla.cloudflare-dns.com
    2 0.000162547 192.168.212.132 → 192.168.212.2 DNS 86 Standard query 0xd628 AAAA mozilla.cloudflare-dns.com
    3 0.123009696 192.168.212.132 → 185.199.110.133 TCP 54 53798 → 443 [ACK] Seq=1 Ack=1 Win=65535 Len=0
    4 0.123133892 185.199.110.133 → 192.168.212.132 TCP 60 [TCP ACKed unseen segment] 443 → 53798 [ACK] Seq=1 Ack=2 Win=64240 Len=0
    5 0.160749533 192.168.212.2 → 192.168.212.132 DNS 118 Standard query response 0x7172 A mozilla.cloudflare-dns.com A 104.16.248.249 A 104.16.249.249
    6 0.160770460 192.168.212.2 → 192.168.212.132 DNS 142 Standard query response 0xd628 AAAA mozilla.cloudflare-dns.com AAAA 2606:4700::6810:f9f9 AAAA 2606:4700::6810:f8f9
    7 0.162159115 192.168.212.132 → 104.16.248.249 TCP 74 34866 → 443 [SYN] Seq=0 Win=64240 Len=0 MSS=1460 SACK_PERM=1 TSval=2107525563 TSecr=0 WS=128
    8 0.162270534 192.168.212.132 → 104.16.248.249 TCP 74 34868 → 443 [SYN] Seq=0 Win=64240 Len=0 MSS=1460 SACK_PERM=1 TSval=2107525563 TSecr=0 WS=128
    9 0.361351213 192.168.212.132 → 192.168.212.2 DNS 84 Standard query 0x220b A detectportal.firefox.com
   10 0.361449546 192.168.212.132 → 192.168.212.2 DNS 84 Standard query 0xb28f AAAA detectportal.firefox.com
   11 0.365732714 104.16.248.249 → 192.168.212.132 TCP 60 443 → 34868 [RST, ACK] Seq=1 Ack=1 Win=64240 Len=0
   12 0.393149504 192.168.212.2 → 192.168.212.132 DNS 195 Standard query response 0x220b A detectportal.firefox.com CNAME detectportal.prod.mozaws.net CNAME prod.detectportal.prod.cloudops.mozgcp.net A 34.107.221.82
   13 0.394102774 192.168.212.2 → 192.168.212.132 DNS 207 Standard query response 0xb28f AAAA detectportal.firefox.com CNAME detectportal.prod.mozaws.net CNAME prod.detectportal.prod.cloudops.mozgcp.net AAAA 2600:1901:0:38d7::
   14 0.412342763 192.168.212.132 → 104.16.249.249 TCP 74 40464 → 443 [SYN] Seq=0 Win=64240 Len=0 MSS=1460 SACK_PERM=1 TSval=3336495632 TSecr=0 WS=128
   15 0.470135746 192.168.212.132 → 104.16.249.249 TCP 74 40466 → 443 [SYN] Seq=0 Win=64240 Len=0 MSS=1460 SACK_PERM=1 TSval=3336495690 TSecr=0 WS=128
   16 0.470298826 192.168.212.132 → 104.16.249.249 TCP 74 40468 → 443 [SYN] Seq=0 Win=64240 Len=0 MSS=1460 SACK_PERM=1 TSval=3336495690 TSecr=0 WS=128
   17 0.471866332 104.16.249.249 → 192.168.212.132 TCP 60 443 → 40464 [SYN, ACK] Seq=0 Ack=1 Win=64240 Len=0 MSS=1460
   18 0.471919377 192.168.212.132 → 104.16.249.249 TCP 54 40464 → 443 [ACK] Seq=1 Ack=1 Win=64240 Len=0
   19 0.474596188 192.168.212.132 → 104.16.249.249 TLSv1 571 Client Hello
   20 0.474759668 104.16.249.249 → 192.168.212.132 TCP 60 443 → 40464 [ACK] Seq=1 Ack=518 Win=64240 Len=0
   21 0.477156956 192.168.212.132 → 34.107.221.82 TCP 74 37884 → 80 [SYN] Seq=0 Win=64240 Len=0 MSS=1460 SACK_PERM=1 TSval=3836530487 TSecr=0 WS=128
   22 0.510173992 104.16.249.249 → 192.168.212.132 TCP 60 443 → 40466 [SYN, ACK] Seq=0 Ack=1 Win=64240 Len=0 MSS=1460
   23 0.510277276 192.168.212.132 → 104.16.249.249 TCP 54 40466 → 443 [ACK] Seq=1 Ack=1 Win=64240 Len=0
   24 0.515180056 192.168.212.132 → 104.16.249.249 TLSv1 571 Client Hello
   25 0.515334422 104.16.249.249 → 192.168.212.132 TCP 60 443 → 40466 [ACK] Seq=1 Ack=518 Win=64240 Len=0
   26 0.515635247 192.168.212.132 → 104.16.249.249 TCP 74 40472 → 443 [SYN] Seq=0 Win=64240 Len=0 MSS=1460 SACK_PERM=1 TSval=3336495736 TSecr=0 WS=128
   27 0.517540590 192.168.212.132 → 104.16.249.249 TCP 74 40474 → 443 [SYN] Seq=0 Win=64240 Len=0 MSS=1460 SACK_PERM=1 TSval=3336495738 TSecr=0 WS=128
   28 0.517617393 192.168.212.132 → 104.16.249.249 TCP 74 40476 → 443 [SYN] Seq=0 Win=64240 Len=0 MSS=1460 SACK_PERM=1 TSval=3336495738 TSecr=0 WS=128
   29 0.536764006 104.16.249.249 → 192.168.212.132 TCP 60 443 → 40468 [SYN, ACK] Seq=0 Ack=1 Win=64240 Len=0 MSS=1460
   30 0.536813909 192.168.212.132 → 104.16.249.249 TCP 54 40468 → 443 [ACK] Seq=1 Ack=1 Win=64240 Len=0
   31 0.538676072 192.168.212.132 → 104.16.249.249 TLSv1 571 Client Hello
   32 0.538812517 104.16.249.249 → 192.168.212.132 TCP 60 443 → 40468 [ACK] Seq=1 Ack=518 Win=64240 Len=0
   33 0.552139829 104.16.249.249 → 192.168.212.132 TLSv1.3 1442 Server Hello, Change Cipher Spec
   34 0.552161245 192.168.212.132 → 104.16.249.249 TCP 54 40464 → 443 [ACK] Seq=518 Ack=1389 Win=63848 Len=0
   35 0.552203052 104.16.249.249 → 192.168.212.132 TCP 1442 443 → 40464 [PSH, ACK] Seq=1389 Ack=518 Win=64240 Len=1388 [TCP segment of a reassembled PDU]
   36 0.552207182 192.168.212.132 → 104.16.249.249 TCP 54 40464 → 443 [ACK] Seq=518 Ack=2777 Win=62460 Len=0
   37 0.552333574 104.16.249.249 → 192.168.212.132 TLSv1.3 164 Application Data
   38 0.552337715 192.168.212.132 → 104.16.249.249 TCP 54 40464 → 443 [ACK] Seq=518 Ack=2887 Win=62460 Len=0
   39 0.557846016 104.16.249.249 → 192.168.212.132 TCP 60 443 → 40476 [SYN, ACK] Seq=0 Ack=1 Win=64240 Len=0 MSS=1460
   40 0.557896729 192.168.212.132 → 104.16.249.249 TCP 54 40476 → 443 [ACK] Seq=1 Ack=1 Win=64240 Len=0
   41 0.564335707 34.107.221.82 → 192.168.212.132 TCP 60 80 → 37884 [SYN, ACK] Seq=0 Ack=1 Win=64240 Len=0 MSS=1460
   42 0.564377511 192.168.212.132 → 34.107.221.82 TCP 54 37884 → 80 [ACK] Seq=1 Ack=1 Win=64240 Len=0
   43 0.569676206 104.16.249.249 → 192.168.212.132 TCP 60 443 → 40472 [SYN, ACK] Seq=0 Ack=1 Win=64240 Len=0 MSS=1460
   44 0.569741394 192.168.212.132 → 104.16.249.249 TCP 54 40472 → 443 [ACK] Seq=1 Ack=1 Win=64240 Len=0
   45 0.569785170 192.168.212.132 → 34.107.221.82 HTTP 355 GET /canonical.html HTTP/1.1 
   46 0.569876285 34.107.221.82 → 192.168.212.132 TCP 60 80 → 37884 [ACK] Seq=1 Ack=302 Win=64240 Len=0
   47 0.573023998 192.168.212.132 → 104.16.249.249 TLSv1 571 Client Hello
   48 0.573285427 104.16.249.249 → 192.168.212.132 TCP 60 443 → 40476 [ACK] Seq=1 Ack=518 Win=64240 Len=0
   49 0.578716418 192.168.212.132 → 104.16.249.249 TLSv1 571 Client Hello
   50 0.579005057 104.16.249.249 → 192.168.212.132 TCP 60 443 → 40472 [ACK] Seq=1 Ack=518 Win=64240 Len=0
   51 0.582078139 104.16.249.249 → 192.168.212.132 TLSv1.3 1442 Server Hello, Change Cipher Spec
   52 0.582095812 192.168.212.132 → 104.16.249.249 TCP 54 40466 → 443 [ACK] Seq=518 Ack=1389 Win=63848 Len=0
   53 0.582292204 104.16.249.249 → 192.168.212.132 TCP 1442 443 → 40466 [PSH, ACK] Seq=1389 Ack=518 Win=64240 Len=1388 [TCP segment of a reassembled PDU]
   54 0.582299229 192.168.212.132 → 104.16.249.249 TCP 54 40466 → 443 [ACK] Seq=518 Ack=2777 Win=62460 Len=0
   55 0.582324564 104.16.249.249 → 192.168.212.132 TLSv1.3 165 Application Data
   56 0.582327760 192.168.212.132 → 104.16.249.249 TCP 54 40466 → 443 [ACK] Seq=518 Ack=2888 Win=62460 Len=0
   57 0.595019050 104.16.249.249 → 192.168.212.132 TLSv1.3 1442 Server Hello, Change Cipher Spec
   58 0.595082929 192.168.212.132 → 104.16.249.249 TCP 54 40468 → 443 [ACK] Seq=518 Ack=1389 Win=63848 Len=0
   59 0.595127546 104.16.249.249 → 192.168.212.132 TCP 1442 443 → 40468 [PSH, ACK] Seq=1389 Ack=518 Win=64240 Len=1388 [TCP segment of a reassembled PDU]
   60 0.595133959 192.168.212.132 → 104.16.249.249 TCP 54 40468 → 443 [ACK] Seq=518 Ack=2777 Win=62460 Len=0
   61 0.606868769 104.16.249.249 → 192.168.212.132 TLSv1.3 164 Application Data
   62 0.606901588 192.168.212.132 → 104.16.249.249 TCP 54 40468 → 443 [ACK] Seq=518 Ack=2887 Win=63848 Len=0
   63 0.607930297 104.16.249.249 → 192.168.212.132 TCP 60 443 → 40474 [SYN, ACK] Seq=0 Ack=1 Win=64240 Len=0 MSS=1460
   64 0.607955791 192.168.212.132 → 104.16.249.249 TCP 54 40474 → 443 [ACK] Seq=1 Ack=1 Win=64240 Len=0
   65 0.612246272 192.168.212.132 → 104.16.249.249 TLSv1 571 Client Hello
   66 0.612402917 104.16.249.249 → 192.168.212.132 TCP 60 443 → 40474 [ACK] Seq=1 Ack=518 Win=64240 Len=0
   67 0.612799506 192.168.212.132 → 104.16.249.249 TCP 74 40478 → 443 [SYN] Seq=0 Win=64240 Len=0 MSS=1460 SACK_PERM=1 TSval=3336495833 TSecr=0 WS=128
   68 0.636820970 104.16.249.249 → 192.168.212.132 TLSv1.3 1442 Server Hello, Change Cipher Spec
   69 0.636841649 192.168.212.132 → 104.16.249.249 TCP 54 40476 → 443 [ACK] Seq=518 Ack=1389 Win=63848 Len=0
   70 0.637055232 104.16.249.249 → 192.168.212.132 TCP 1442 443 → 40476 [PSH, ACK] Seq=1389 Ack=518 Win=64240 Len=1388 [TCP segment of a reassembled PDU]
   71 0.637063240 192.168.212.132 → 104.16.249.249 TCP 54 40476 → 443 [ACK] Seq=518 Ack=2777 Win=62460 Len=0
   72 0.637165669 104.16.249.249 → 192.168.212.132 TLSv1.3 165 Application Data
   73 0.637168945 192.168.212.132 → 104.16.249.249 TCP 54 40476 → 443 [ACK] Seq=518 Ack=2888 Win=62460 Len=0
   74 0.644895763 104.16.249.249 → 192.168.212.132 TLSv1.3 1442 Server Hello, Change Cipher Spec
   75 0.644912967 192.168.212.132 → 104.16.249.249 TCP 54 40472 → 443 [ACK] Seq=518 Ack=1389 Win=63848 Len=0
   76 0.645065470 104.16.249.249 → 192.168.212.132 TCP 1442 443 → 40472 [PSH, ACK] Seq=1389 Ack=518 Win=64240 Len=1388 [TCP segment of a reassembled PDU]
   77 0.645073805 192.168.212.132 → 104.16.249.249 TCP 54 40472 → 443 [ACK] Seq=518 Ack=2777 Win=62460 Len=0
   78 0.645099714 104.16.249.249 → 192.168.212.132 TLSv1.3 166 Application Data
   79 0.645102499 192.168.212.132 → 104.16.249.249 TCP 54 40472 → 443 [ACK] Seq=518 Ack=2889 Win=62460 Len=0
   80 0.649313085 34.107.221.82 → 192.168.212.132 HTTP 352 HTTP/1.1 200 OK  (text/html)
   81 0.649333004 192.168.212.132 → 34.107.221.82 TCP 54 37884 → 80 [ACK] Seq=302 Ack=299 Win=63942 Len=0
   82 0.660967294 104.16.249.249 → 192.168.212.132 TCP 60 443 → 40478 [SYN, ACK] Seq=0 Ack=1 Win=64240 Len=0 MSS=1460
   83 0.661008863 192.168.212.132 → 104.16.249.249 TCP 54 40478 → 443 [ACK] Seq=1 Ack=1 Win=64240 Len=0
   84 0.662727933 192.168.212.132 → 104.16.249.249 TLSv1 571 Client Hello
   85 0.662881527 104.16.249.249 → 192.168.212.132 TCP 60 443 → 40478 [ACK] Seq=1 Ack=518 Win=64240 Len=0
   86 0.663455324 192.168.212.132 → 192.168.212.2 DNS 71 Standard query 0x2044 A example.org
   87 0.663557999 192.168.212.132 → 192.168.212.2 DNS 71 Standard query 0x7a53 AAAA example.org
   88 0.664244825 192.168.212.132 → 192.168.212.2 DNS 73 Standard query 0xae1d A ipv4only.arpa
   89 0.664327753 192.168.212.132 → 192.168.212.2 DNS 73 Standard query 0x3d57 AAAA ipv4only.arpa
   90 0.664957582 192.168.212.132 → 34.107.221.82 TCP 74 37894 → 80 [SYN] Seq=0 Win=64240 Len=0 MSS=1460 SACK_PERM=1 TSval=3836530675 TSecr=0 WS=128
   91 0.667491173 192.168.212.2 → 192.168.212.132 DNS 99 Standard query response 0x7a53 AAAA example.org AAAA 2606:2800:220:1:248:1893:25c8:1946
   92 0.668539184 192.168.212.2 → 192.168.212.132 DNS 87 Standard query response 0x2044 A example.org A 93.184.216.34
   93 0.668604066 192.168.212.2 → 192.168.212.132 DNS 105 Standard query response 0xae1d A ipv4only.arpa A 192.0.0.171 A 192.0.0.170
   94 0.679105746 104.16.249.249 → 192.168.212.132 TLSv1.3 1442 Server Hello, Change Cipher Spec
   95 0.679134000 192.168.212.132 → 104.16.249.249 TCP 54 40474 → 443 [ACK] Seq=518 Ack=1389 Win=63848 Len=0
   96 0.679288974 104.16.249.249 → 192.168.212.132 TCP 1442 443 → 40474 [PSH, ACK] Seq=1389 Ack=518 Win=64240 Len=1388 [TCP segment of a reassembled PDU]
   97 0.679295339 192.168.212.132 → 104.16.249.249 TCP 54 40474 → 443 [ACK] Seq=518 Ack=2777 Win=62460 Len=0
   98 0.679403467 104.16.249.249 → 192.168.212.132 TLSv1.3 165 Application Data
   99 0.679406234 192.168.212.132 → 104.16.249.249 TCP 54 40474 → 443 [ACK] Seq=518 Ack=2888 Win=62460 Len=0
  100 0.692812904 192.168.212.2 → 192.168.212.132 DNS 130 Standard query response 0x3d57 AAAA ipv4only.arpa SOA sns.dns.icann.org
  101 0.722630900 104.16.249.249 → 192.168.212.132 TLSv1.3 1442 Server Hello, Change Cipher Spec
  102 0.722652634 192.168.212.132 → 104.16.249.249 TCP 54 40478 → 443 [ACK] Seq=518 Ack=1389 Win=63848 Len=0
  103 0.732753506 192.168.212.132 → 192.168.212.2 DNS 86 Standard query 0xd114 A forcesafesearch.google.com
  104 0.732869868 192.168.212.132 → 192.168.212.2 DNS 74 Standard query 0xdb92 A www.google.com
  105 0.732947788 192.168.212.132 → 192.168.212.2 DNS 70 Standard query 0x3f2c A google.com
  106 0.733034296 192.168.212.132 → 192.168.212.2 DNS 75 Standard query 0xe0d4 A www.youtube.com
  107 0.733542012 192.168.212.132 → 192.168.212.2 DNS 73 Standard query 0x10b7 A m.youtube.com
  108 0.733613309 192.168.212.132 → 192.168.212.2 DNS 83 Standard query 0x49f9 A youtubei.googleapis.com
  109 0.733689938 192.168.212.132 → 192.168.212.2 DNS 82 Standard query 0x1e0c A youtube.googleapis.com
  110 0.734954998 104.16.249.249 → 192.168.212.132 TCP 1442 443 → 40478 [PSH, ACK] Seq=1389 Ack=518 Win=64240 Len=1388 [TCP segment of a reassembled PDU]
  111 0.734976202 192.168.212.132 → 104.16.249.249 TCP 54 40478 → 443 [ACK] Seq=518 Ack=2777 Win=63848 Len=0
  112 0.735012076 104.16.249.249 → 192.168.212.132 TLSv1.3 165 Application Data
  113 0.735024257 192.168.212.132 → 104.16.249.249 TCP 54 40478 → 443 [ACK] Seq=518 Ack=2888 Win=63848 Len=0
  114 0.736716121 192.168.212.2 → 192.168.212.132 DNS 102 Standard query response 0xd114 A forcesafesearch.google.com A 216.239.38.120
  115 0.737083238 192.168.212.132 → 192.168.212.2 DNS 84 Standard query 0xd316 A www.youtube-nocookie.com
  116 0.747225250 192.168.212.132 → 104.16.249.249 TCP 74 40482 → 443 [SYN] Seq=0 Win=64240 Len=0 MSS=1460 SACK_PERM=1 TSval=3336495967 TSecr=0 WS=128
  117 0.747347798 192.168.212.132 → 104.16.249.249 TCP 74 40484 → 443 [SYN] Seq=0 Win=64240 Len=0 MSS=1460 SACK_PERM=1 TSval=3336495967 TSecr=0 WS=128
  118 0.750141246 34.107.221.82 → 192.168.212.132 TCP 60 80 → 37894 [SYN, ACK] Seq=0 Ack=1 Win=64240 Len=0 MSS=1460
  119 0.750183085 192.168.212.132 → 34.107.221.82 TCP 54 37894 → 80 [ACK] Seq=1 Ack=1 Win=64240 Len=0
  120 0.750322393 192.168.212.132 → 34.107.221.82 HTTP 357 GET /success.txt?ipv4 HTTP/1.1 
  121 0.750395448 34.107.221.82 → 192.168.212.132 TCP 60 80 → 37894 [ACK] Seq=1 Ack=304 Win=64240 Len=0
  122 0.756283606 192.168.212.2 → 192.168.212.132 DNS 90 Standard query response 0xdb92 A www.google.com A 216.58.210.164
  123 0.756927038 192.168.212.132 → 192.168.212.2 DNS 80 Standard query 0xbff3 A restrict.youtube.com
  124 0.769177941 192.168.212.2 → 192.168.212.132 DNS 86 Standard query response 0x3f2c A google.com A 216.58.209.174
  125 0.769750855 192.168.212.132 → 192.168.212.2 DNS 88 Standard query 0x3436 A restrictmoderate.youtube.com
  126 0.770085052 192.168.212.2 → 192.168.212.132 DNS 152 Standard query response 0xe0d4 A www.youtube.com CNAME youtube-ui.l.google.com CNAME wide-youtube.l.google.com A 173.194.222.198
  127 0.770439482 192.168.212.132 → 192.168.212.2 DNS 82 Standard query 0xa96c A sitereview.zscaler.com
  128 0.771417605 192.168.212.2 → 192.168.212.132 DNS 89 Standard query response 0x10b7 A m.youtube.com A 216.58.209.174
  129 0.772022833 192.168.212.132 → 192.168.212.2 DNS 83 Standard query 0x552a A use-application-dns.net
  130 0.774848568 192.168.212.2 → 192.168.212.132 DNS 227 Standard query response 0x49f9 A youtubei.googleapis.com A 64.233.165.95 A 64.233.161.95 A 64.233.164.95 A 209.85.233.95 A 142.250.150.95 A 173.194.222.95 A 142.251.1.95 A 108.177.14.95 A 64.233.163.95
  131 0.774884376 192.168.212.2 → 192.168.212.132 DNS 242 Standard query response 0x1e0c A youtube.googleapis.com A 173.194.73.95 A 64.233.161.95 A 64.233.164.95 A 108.177.14.95 A 74.125.205.95 A 209.85.233.95 A 173.194.222.95 A 64.233.162.95 A 64.233.165.95 A 142.250.150.95
  132 0.775015827 192.168.212.2 → 192.168.212.132 DNS 161 Standard query response 0xd316 A www.youtube-nocookie.com CNAME youtube-ui.l.google.com CNAME wide-youtube.l.google.com A 173.194.222.198
  133 0.785334834 104.16.249.249 → 192.168.212.132 TCP 60 443 → 40484 [SYN, ACK] Seq=0 Ack=1 Win=64240 Len=0 MSS=1460
  134 0.785382836 192.168.212.132 → 104.16.249.249 TCP 54 40484 → 443 [ACK] Seq=1 Ack=1 Win=64240 Len=0
  135 0.785414406 104.16.249.249 → 192.168.212.132 TCP 60 443 → 40482 [SYN, ACK] Seq=0 Ack=1 Win=64240 Len=0 MSS=1460
  136 0.785419108 192.168.212.132 → 104.16.249.249 TCP 54 40482 → 443 [ACK] Seq=1 Ack=1 Win=64240 Len=0
  137 0.787173752 192.168.212.132 → 104.16.249.249 TLSv1 571 Client Hello
  138 0.787296565 104.16.249.249 → 192.168.212.132 TCP 60 443 → 40484 [ACK] Seq=1 Ack=518 Win=64240 Len=0
  139 0.788796726 192.168.212.132 → 104.16.249.249 TLSv1 571 Client Hello
  140 0.788904049 104.16.249.249 → 192.168.212.132 TCP 60 443 → 40482 [ACK] Seq=1 Ack=518 Win=64240 Len=0
  141 0.791981081 192.168.212.2 → 192.168.212.132 DNS 96 Standard query response 0xbff3 A restrict.youtube.com A 216.239.38.120
  142 0.803010044 192.168.212.2 → 192.168.212.132 DNS 104 Standard query response 0x3436 A restrictmoderate.youtube.com A 216.239.38.119
  143 0.803046056 192.168.212.2 → 192.168.212.132 DNS 98 Standard query response 0xa96c A sitereview.zscaler.com A 104.129.193.93
  144 0.812440906 192.168.212.2 → 192.168.212.132 DNS 131 Standard query response 0x552a A use-application-dns.net A 44.236.48.31 A 44.236.72.93 A 44.235.246.155
  145 0.844022838 104.16.249.249 → 192.168.212.132 TLSv1.3 1442 Server Hello, Change Cipher Spec
  146 0.844050357 192.168.212.132 → 104.16.249.249 TCP 54 40484 → 443 [ACK] Seq=518 Ack=1389 Win=63848 Len=0
  147 0.844200602 104.16.249.249 → 192.168.212.132 TCP 1442 443 → 40484 [PSH, ACK] Seq=1389 Ack=518 Win=64240 Len=1388 [TCP segment of a reassembled PDU]
  148 0.844209493 192.168.212.132 → 104.16.249.249 TCP 54 40484 → 443 [ACK] Seq=518 Ack=2777 Win=62460 Len=0
  149 0.844340806 104.16.249.249 → 192.168.212.132 TLSv1.3 165 Application Data
  150 0.844345453 192.168.212.132 → 104.16.249.249 TCP 54 40484 → 443 [ACK] Seq=518 Ack=2888 Win=62460 Len=0
  151 0.867495069 34.107.221.82 → 192.168.212.132 HTTP 270 HTTP/1.1 200 OK  (text/plain)
  152 0.867520213 192.168.212.132 → 34.107.221.82 TCP 54 37894 → 80 [ACK] Seq=304 Ack=217 Win=64024 Len=0
  153 0.880558399 104.16.249.249 → 192.168.212.132 TLSv1.3 1442 Server Hello, Change Cipher Spec
  154 0.880583150 192.168.212.132 → 104.16.249.249 TCP 54 40482 → 443 [ACK] Seq=518 Ack=1389 Win=63848 Len=0
  155 0.885993336 104.16.249.249 → 192.168.212.132 TCP 1442 443 → 40482 [PSH, ACK] Seq=1389 Ack=518 Win=64240 Len=1388 [TCP segment of a reassembled PDU]
  156 0.886017972 192.168.212.132 → 104.16.249.249 TCP 54 40482 → 443 [ACK] Seq=518 Ack=2777 Win=63848 Len=0
  157 0.886061494 104.16.249.249 → 192.168.212.132 TLSv1.3 166 Application Data
  158 0.886066911 192.168.212.132 → 104.16.249.249 TCP 54 40482 → 443 [ACK] Seq=518 Ack=2889 Win=63848 Len=0
  159 1.179084884 192.168.212.132 → 104.16.248.249 TCP 74 [TCP Retransmission] 34866 → 443 [SYN] Seq=0 Win=64240 Len=0 MSS=1460 SACK_PERM=1 TSval=2107526580 TSecr=0 WS=128
  160 1.250328733 104.16.248.249 → 192.168.212.132 TCP 60 443 → 34866 [RST, ACK] Seq=1 Ack=1 Win=64240 Len=0
  161 1.250762163 192.168.212.132 → 104.16.249.249 TCP 74 40486 → 443 [SYN] Seq=0 Win=64240 Len=0 MSS=1460 SACK_PERM=1 TSval=3336496471 TSecr=0 WS=128
  162 1.293935140 104.16.249.249 → 192.168.212.132 TCP 60 443 → 40486 [SYN, ACK] Seq=0 Ack=1 Win=64240 Len=0 MSS=1460
  163 1.293969510 192.168.212.132 → 104.16.249.249 TCP 54 40486 → 443 [ACK] Seq=1 Ack=1 Win=64240 Len=0
  164 1.295838213 192.168.212.132 → 104.16.249.249 TLSv1 571 Client Hello
  165 1.296006660 104.16.249.249 → 192.168.212.132 TCP 60 443 → 40486 [ACK] Seq=1 Ack=518 Win=64240 Len=0
  166 1.376999956 104.16.249.249 → 192.168.212.132 TLSv1.3 1442 Server Hello, Change Cipher Spec
  167 1.377019106 192.168.212.132 → 104.16.249.249 TCP 54 40486 → 443 [ACK] Seq=518 Ack=1389 Win=63848 Len=0
  168 1.377212996 104.16.249.249 → 192.168.212.132 TCP 1442 443 → 40486 [PSH, ACK] Seq=1389 Ack=518 Win=64240 Len=1388 [TCP segment of a reassembled PDU]
  169 1.377219349 192.168.212.132 → 104.16.249.249 TCP 54 40486 → 443 [ACK] Seq=518 Ack=2777 Win=62460 Len=0
  170 1.377320547 104.16.249.249 → 192.168.212.132 TLSv1.3 165 Application Data
  171 1.377323127 192.168.212.132 → 104.16.249.249 TCP 54 40486 → 443 [ACK] Seq=518 Ack=2888 Win=62460 Len=0
  172 1.847979417 192.168.212.132 → 104.16.249.249 TCP 54 40466 → 443 [FIN, ACK] Seq=518 Ack=2888 Win=63848 Len=0
  173 1.848437124 104.16.249.249 → 192.168.212.132 TCP 60 443 → 40466 [ACK] Seq=2888 Ack=519 Win=64239 Len=0
  174 1.848480487 192.168.212.132 → 104.16.249.249 TCP 54 40468 → 443 [FIN, ACK] Seq=518 Ack=2887 Win=63848 Len=0
  175 1.848745177 104.16.249.249 → 192.168.212.132 TCP 60 443 → 40468 [ACK] Seq=2887 Ack=519 Win=64239 Len=0
  176 1.849425114 192.168.212.132 → 104.16.249.249 TCP 74 40488 → 443 [SYN] Seq=0 Win=64240 Len=0 MSS=1460 SACK_PERM=1 TSval=3336497070 TSecr=0 WS=128
  177 1.849573265 192.168.212.132 → 104.16.249.249 TCP 74 40490 → 443 [SYN] Seq=0 Win=64240 Len=0 MSS=1460 SACK_PERM=1 TSval=3336497070 TSecr=0 WS=128
  178 1.919835868 104.16.249.249 → 192.168.212.132 TCP 60 443 → 40466 [FIN, PSH, ACK] Seq=2888 Ack=519 Win=64239 Len=0
  179 1.919877046 192.168.212.132 → 104.16.249.249 TCP 54 40466 → 443 [ACK] Seq=519 Ack=2889 Win=63848 Len=0
  180 1.919903571 104.16.249.249 → 192.168.212.132 TCP 60 443 → 40468 [FIN, PSH, ACK] Seq=2887 Ack=519 Win=64239 Len=0
  181 1.919906422 192.168.212.132 → 104.16.249.249 TCP 54 40468 → 443 [ACK] Seq=519 Ack=2888 Win=63848 Len=0
  182 1.931555671 104.16.249.249 → 192.168.212.132 TCP 60 443 → 40488 [SYN, ACK] Seq=0 Ack=1 Win=64240 Len=0 MSS=1460
  183 1.931600479 192.168.212.132 → 104.16.249.249 TCP 54 40488 → 443 [ACK] Seq=1 Ack=1 Win=64240 Len=0
  184 1.933491030 192.168.212.132 → 104.16.249.249 TLSv1 571 Client Hello
  185 1.933771596 104.16.249.249 → 192.168.212.132 TCP 60 443 → 40488 [ACK] Seq=1 Ack=518 Win=64240 Len=0
  186 1.991817016 104.16.249.249 → 192.168.212.132 TCP 60 443 → 40490 [SYN, ACK] Seq=0 Ack=1 Win=64240 Len=0 MSS=1460
  187 1.991872644 192.168.212.132 → 104.16.249.249 TCP 54 40490 → 443 [ACK] Seq=1 Ack=1 Win=64240 Len=0
  188 1.993468767 192.168.212.132 → 104.16.249.249 TLSv1 571 Client Hello
  189 1.993791067 104.16.249.249 → 192.168.212.132 TCP 60 443 → 40490 [ACK] Seq=1 Ack=518 Win=64240 Len=0
  190 2.006589243 104.16.249.249 → 192.168.212.132 TLSv1.3 1442 Server Hello, Change Cipher Spec
  191 2.006625265 192.168.212.132 → 104.16.249.249 TCP 54 40488 → 443 [ACK] Seq=518 Ack=1389 Win=63848 Len=0
  192 2.006674008 104.16.249.249 → 192.168.212.132 TCP 1442 443 → 40488 [PSH, ACK] Seq=1389 Ack=518 Win=64240 Len=1388 [TCP segment of a reassembled PDU]
  193 2.006680760 192.168.212.132 → 104.16.249.249 TCP 54 40488 → 443 [ACK] Seq=518 Ack=2777 Win=62460 Len=0
  194 2.006702342 104.16.249.249 → 192.168.212.132 TLSv1.3 166 Application Data
  195 2.006706888 192.168.212.132 → 104.16.249.249 TCP 54 40488 → 443 [ACK] Seq=518 Ack=2889 Win=62460 Len=0
  196 2.006771491 192.168.212.132 → 104.16.249.249 TCP 54 40472 → 443 [FIN, ACK] Seq=518 Ack=2889 Win=63848 Len=0
  197 2.006835902 104.16.249.249 → 192.168.212.132 TCP 60 443 → 40472 [ACK] Seq=2889 Ack=519 Win=64239 Len=0
  198 2.009010466 192.168.212.132 → 104.16.249.249 TCP 74 40492 → 443 [SYN] Seq=0 Win=64240 Len=0 MSS=1460 SACK_PERM=1 TSval=3336497229 TSecr=0 WS=128
  199 2.010012874 192.168.212.132 → 104.16.249.249 TCP 54 40474 → 443 [FIN, ACK] Seq=518 Ack=2888 Win=63848 Len=0
  200 2.010239365 192.168.212.132 → 104.16.249.249 TCP 54 40476 → 443 [FIN, ACK] Seq=518 Ack=2888 Win=63848 Len=0
  201 2.010265896 104.16.249.249 → 192.168.212.132 TCP 60 443 → 40474 [ACK] Seq=2888 Ack=519 Win=64239 Len=0
  202 2.010353506 104.16.249.249 → 192.168.212.132 TCP 60 443 → 40476 [ACK] Seq=2888 Ack=519 Win=64239 Len=0
  203 2.010714743 192.168.212.132 → 104.16.249.249 TCP 74 40494 → 443 [SYN] Seq=0 Win=64240 Len=0 MSS=1460 SACK_PERM=1 TSval=3336497231 TSecr=0 WS=128
  204 2.010801888 192.168.212.132 → 104.16.249.249 TCP 74 40496 → 443 [SYN] Seq=0 Win=64240 Len=0 MSS=1460 SACK_PERM=1 TSval=3336497231 TSecr=0 WS=128
  205 2.057909516 104.16.249.249 → 192.168.212.132 TCP 60 443 → 40476 [FIN, PSH, ACK] Seq=2888 Ack=519 Win=64239 Len=0
  206 2.057962020 192.168.212.132 → 104.16.249.249 TCP 54 40476 → 443 [ACK] Seq=519 Ack=2889 Win=63848 Len=0
  207 2.057999143 104.16.249.249 → 192.168.212.132 TCP 60 443 → 40474 [FIN, PSH, ACK] Seq=2888 Ack=519 Win=64239 Len=0
  208 2.058002500 192.168.212.132 → 104.16.249.249 TCP 54 40474 → 443 [ACK] Seq=519 Ack=2889 Win=63848 Len=0
  209 2.058017884 104.16.249.249 → 192.168.212.132 TCP 60 443 → 40472 [FIN, PSH, ACK] Seq=2889 Ack=519 Win=64239 Len=0
  210 2.058020285 192.168.212.132 → 104.16.249.249 TCP 54 40472 → 443 [ACK] Seq=519 Ack=2890 Win=63848 Len=0
  211 2.063267699 104.16.249.249 → 192.168.212.132 TCP 60 443 → 40496 [SYN, ACK] Seq=0 Ack=1 Win=64240 Len=0 MSS=1460
  212 2.063318453 192.168.212.132 → 104.16.249.249 TCP 54 40496 → 443 [ACK] Seq=1 Ack=1 Win=64240 Len=0
  213 2.065067842 192.168.212.132 → 104.16.249.249 TLSv1 571 Client Hello
  214 2.065283812 104.16.249.249 → 192.168.212.132 TCP 60 443 → 40496 [ACK] Seq=1 Ack=518 Win=64240 Len=0
  215 2.079099470 104.16.249.249 → 192.168.212.132 TLSv1.3 1442 Server Hello, Change Cipher Spec
  216 2.079176921 192.168.212.132 → 104.16.249.249 TCP 54 40490 → 443 [ACK] Seq=518 Ack=1389 Win=63848 Len=0
  217 2.079410543 104.16.249.249 → 192.168.212.132 TCP 1442 443 → 40490 [PSH, ACK] Seq=1389 Ack=518 Win=64240 Len=1388 [TCP segment of a reassembled PDU]
  218 2.079433084 192.168.212.132 → 104.16.249.249 TCP 54 40490 → 443 [ACK] Seq=518 Ack=2777 Win=62460 Len=0
  219 2.079500370 104.16.249.249 → 192.168.212.132 TLSv1.3 165 Application Data
  220 2.079503100 192.168.212.132 → 104.16.249.249 TCP 54 40490 → 443 [ACK] Seq=518 Ack=2888 Win=62460 Len=0
  221 2.081732468 104.16.249.249 → 192.168.212.132 TCP 60 443 → 40492 [SYN, ACK] Seq=0 Ack=1 Win=64240 Len=0 MSS=1460
  222 2.081765032 192.168.212.132 → 104.16.249.249 TCP 54 40492 → 443 [ACK] Seq=1 Ack=1 Win=64240 Len=0
  223 2.083363455 192.168.212.132 → 104.16.249.249 TLSv1 571 Client Hello
  224 2.083533984 104.16.249.249 → 192.168.212.132 TCP 60 443 → 40492 [ACK] Seq=1 Ack=518 Win=64240 Len=0
  225 2.087753948 104.16.249.249 → 192.168.212.132 TCP 60 443 → 40494 [SYN, ACK] Seq=0 Ack=1 Win=64240 Len=0 MSS=1460
  226 2.087815901 192.168.212.132 → 104.16.249.249 TCP 54 40494 → 443 [ACK] Seq=1 Ack=1 Win=64240 Len=0
  227 2.090375660 192.168.212.132 → 104.16.249.249 TLSv1 571 Client Hello
  228 2.090688008 104.16.249.249 → 192.168.212.132 TCP 60 443 → 40494 [ACK] Seq=1 Ack=518 Win=64240 Len=0
  229 2.101428050 192.168.212.132 → 104.16.249.249 TCP 54 40488 → 443 [FIN, ACK] Seq=518 Ack=2889 Win=63848 Len=0
  230 2.101641550 192.168.212.132 → 104.16.249.249 TCP 54 40478 → 443 [FIN, ACK] Seq=518 Ack=2888 Win=63848 Len=0
  231 2.101740828 104.16.249.249 → 192.168.212.132 TCP 60 443 → 40488 [ACK] Seq=2889 Ack=519 Win=64239 Len=0
  232 2.101775049 104.16.249.249 → 192.168.212.132 TCP 60 443 → 40478 [ACK] Seq=2888 Ack=519 Win=64239 Len=0
  233 2.102633808 192.168.212.132 → 104.16.249.249 TCP 74 40498 → 443 [SYN] Seq=0 Win=64240 Len=0 MSS=1460 SACK_PERM=1 TSval=3336497323 TSecr=0 WS=128
  234 2.102815833 192.168.212.132 → 104.16.249.249 TCP 74 40500 → 443 [SYN] Seq=0 Win=64240 Len=0 MSS=1460 SACK_PERM=1 TSval=3336497323 TSecr=0 WS=128
  235 2.106130924 192.168.212.132 → 104.16.249.249 TCP 54 40492 → 443 [FIN, ACK] Seq=518 Ack=1 Win=64240 Len=0
  236 2.106338327 192.168.212.132 → 104.16.249.249 TCP 54 40490 → 443 [FIN, ACK] Seq=518 Ack=2888 Win=63848 Len=0
  237 2.106440801 104.16.249.249 → 192.168.212.132 TCP 60 443 → 40492 [ACK] Seq=1 Ack=519 Win=64239 Len=0
  238 2.106466987 104.16.249.249 → 192.168.212.132 TCP 60 443 → 40490 [ACK] Seq=2888 Ack=519 Win=64239 Len=0
  239 2.107298365 192.168.212.132 → 104.16.249.249 TCP 74 40502 → 443 [SYN] Seq=0 Win=64240 Len=0 MSS=1460 SACK_PERM=1 TSval=3336497327 TSecr=0 WS=128
  240 2.107479477 192.168.212.132 → 104.16.249.249 TCP 74 40504 → 443 [SYN] Seq=0 Win=64240 Len=0 MSS=1460 SACK_PERM=1 TSval=3336497328 TSecr=0 WS=128
  241 2.127144447 104.16.249.249 → 192.168.212.132 TLSv1.3 1442 Server Hello, Change Cipher Spec
  242 2.127177330 192.168.212.132 → 104.16.249.249 TCP 54 40496 → 443 [ACK] Seq=518 Ack=1389 Win=63848 Len=0
  243 2.127269665 104.16.249.249 → 192.168.212.132 TCP 1442 443 → 40496 [PSH, ACK] Seq=1389 Ack=518 Win=64240 Len=1388 [TCP segment of a reassembled PDU]
  244 2.127282766 192.168.212.132 → 104.16.249.249 TCP 54 40496 → 443 [ACK] Seq=518 Ack=2777 Win=62460 Len=0
  245 2.127331982 104.16.249.249 → 192.168.212.132 TLSv1.3 164 Application Data
  246 2.127339739 192.168.212.132 → 104.16.249.249 TCP 54 40496 → 443 [ACK] Seq=518 Ack=2887 Win=62460 Len=0
  247 2.139995101 104.16.249.249 → 192.168.212.132 TCP 60 443 → 40478 [FIN, PSH, ACK] Seq=2888 Ack=519 Win=64239 Len=0
  248 2.140034300 192.168.212.132 → 104.16.249.249 TCP 54 40478 → 443 [ACK] Seq=519 Ack=2889 Win=63848 Len=0
  249 2.140087137 104.16.249.249 → 192.168.212.132 TCP 60 443 → 40488 [FIN, PSH, ACK] Seq=2889 Ack=519 Win=64239 Len=0
  250 2.140093508 192.168.212.132 → 104.16.249.249 TCP 54 40488 → 443 [ACK] Seq=519 Ack=2890 Win=63848 Len=0
  251 2.152469304 104.16.249.249 → 192.168.212.132 TCP 60 443 → 40490 [FIN, PSH, ACK] Seq=2888 Ack=519 Win=64239 Len=0
  252 2.152507366 192.168.212.132 → 104.16.249.249 TCP 54 40490 → 443 [ACK] Seq=519 Ack=2889 Win=63848 Len=0
  253 2.152567859 104.16.249.249 → 192.168.212.132 TCP 60 443 → 40502 [SYN, ACK] Seq=0 Ack=1 Win=64240 Len=0 MSS=1460
  254 2.152619792 192.168.212.132 → 104.16.249.249 TCP 54 40502 → 443 [ACK] Seq=1 Ack=1 Win=64240 Len=0
  255 2.152662407 104.16.249.249 → 192.168.212.132 TCP 60 443 → 40500 [SYN, ACK] Seq=0 Ack=1 Win=64240 Len=0 MSS=1460
  256 2.152670214 192.168.212.132 → 104.16.249.249 TCP 54 40500 → 443 [ACK] Seq=1 Ack=1 Win=64240 Len=0
  257 2.157001664 192.168.212.132 → 104.16.249.249 TLSv1 571 Client Hello
  258 2.157295994 104.16.249.249 → 192.168.212.132 TCP 60 443 → 40500 [ACK] Seq=1 Ack=518 Win=64240 Len=0
  259 2.161435487 192.168.212.132 → 104.16.249.249 TLSv1 571 Client Hello
  260 2.161687094 104.16.249.249 → 192.168.212.132 TCP 60 443 → 40502 [ACK] Seq=1 Ack=518 Win=64240 Len=0
  261 2.162397865 104.16.249.249 → 192.168.212.132 TLSv1.3 1442 Server Hello, Change Cipher Spec
  262 2.162420540 192.168.212.132 → 104.16.249.249 TCP 54 40492 → 443 [RST] Seq=519 Win=0 Len=0
  263 2.162720662 104.16.249.249 → 192.168.212.132 TLSv1.3 1553 Application Data
  264 2.162733510 192.168.212.132 → 104.16.249.249 TCP 54 40492 → 443 [RST] Seq=519 Win=0 Len=0
  265 2.168378326 104.16.249.249 → 192.168.212.132 TLSv1.3 1442 Server Hello, Change Cipher Spec
  266 2.168402454 192.168.212.132 → 104.16.249.249 TCP 54 40494 → 443 [ACK] Seq=518 Ack=1389 Win=63848 Len=0
  267 2.168526713 104.16.249.249 → 192.168.212.132 TCP 1442 443 → 40494 [PSH, ACK] Seq=1389 Ack=518 Win=64240 Len=1388 [TCP segment of a reassembled PDU]
  268 2.168536601 192.168.212.132 → 104.16.249.249 TCP 54 40494 → 443 [ACK] Seq=518 Ack=2777 Win=62460 Len=0
  269 2.168575327 104.16.249.249 → 192.168.212.132 TLSv1.3 165 Application Data
  270 2.168580241 192.168.212.132 → 104.16.249.249 TCP 54 40494 → 443 [ACK] Seq=518 Ack=2888 Win=62460 Len=0
  271 2.179088692 104.16.249.249 → 192.168.212.132 TCP 60 443 → 40498 [SYN, ACK] Seq=0 Ack=1 Win=64240 Len=0 MSS=1460
  272 2.179141779 192.168.212.132 → 104.16.249.249 TCP 54 40498 → 443 [ACK] Seq=1 Ack=1 Win=64240 Len=0
  273 2.183129053 192.168.212.132 → 104.16.249.249 TLSv1 571 Client Hello
  274 2.183477729 104.16.249.249 → 192.168.212.132 TCP 60 443 → 40498 [ACK] Seq=1 Ack=518 Win=64240 Len=0
  275 2.189607406 104.16.249.249 → 192.168.212.132 TCP 60 443 → 40504 [SYN, ACK] Seq=0 Ack=1 Win=64240 Len=0 MSS=1460
  276 2.189671588 192.168.212.132 → 104.16.249.249 TCP 54 40504 → 443 [ACK] Seq=1 Ack=1 Win=64240 Len=0
  277 2.193719797 192.168.212.132 → 104.16.249.249 TLSv1 571 Client Hello
  278 2.193952078 104.16.249.249 → 192.168.212.132 TCP 60 443 → 40504 [ACK] Seq=1 Ack=518 Win=64240 Len=0
  279 2.244895847 104.16.249.249 → 192.168.212.132 TLSv1.3 1442 Server Hello, Change Cipher Spec
  280 2.244924442 192.168.212.132 → 104.16.249.249 TCP 54 40500 → 443 [ACK] Seq=518 Ack=1389 Win=63848 Len=0
  281 2.245004821 104.16.249.249 → 192.168.212.132 TCP 1442 443 → 40500 [PSH, ACK] Seq=1389 Ack=518 Win=64240 Len=1388 [TCP segment of a reassembled PDU]
  282 2.245018032 192.168.212.132 → 104.16.249.249 TCP 54 40500 → 443 [ACK] Seq=518 Ack=2777 Win=62460 Len=0
  283 2.245085148 104.16.249.249 → 192.168.212.132 TLSv1.3 165 Application Data
  284 2.245090389 192.168.212.132 → 104.16.249.249 TCP 54 40500 → 443 [ACK] Seq=518 Ack=2888 Win=62460 Len=0
  285 2.245130466 104.16.249.249 → 192.168.212.132 TLSv1.3 1442 Server Hello, Change Cipher Spec
  286 2.245135048 192.168.212.132 → 104.16.249.249 TCP 54 40502 → 443 [ACK] Seq=518 Ack=1389 Win=63848 Len=0
  287 2.245476658 104.16.249.249 → 192.168.212.132 TCP 1442 443 → 40502 [PSH, ACK] Seq=1389 Ack=518 Win=64240 Len=1388 [TCP segment of a reassembled PDU]
  288 2.245496850 192.168.212.132 → 104.16.249.249 TCP 54 40502 → 443 [ACK] Seq=518 Ack=2777 Win=62460 Len=0
  289 2.245559946 104.16.249.249 → 192.168.212.132 TLSv1.3 165 Application Data
  290 2.245565343 192.168.212.132 → 104.16.249.249 TCP 54 40502 → 443 [ACK] Seq=518 Ack=2888 Win=62460 Len=0
  291 2.256566144 104.16.249.249 → 192.168.212.132 TLSv1.3 1442 Server Hello, Change Cipher Spec
  292 2.256591301 192.168.212.132 → 104.16.249.249 TCP 54 40504 → 443 [ACK] Seq=518 Ack=1389 Win=63848 Len=0
  293 2.256677514 104.16.249.249 → 192.168.212.132 TCP 1442 443 → 40504 [PSH, ACK] Seq=1389 Ack=518 Win=64240 Len=1388 [TCP segment of a reassembled PDU]
  294 2.256686288 192.168.212.132 → 104.16.249.249 TCP 54 40504 → 443 [ACK] Seq=518 Ack=2777 Win=62460 Len=0
  295 2.256737588 104.16.249.249 → 192.168.212.132 TLSv1.3 165 Application Data
  296 2.256742503 192.168.212.132 → 104.16.249.249 TCP 54 40504 → 443 [ACK] Seq=518 Ack=2888 Win=62460 Len=0
  297 2.266682777 192.168.212.132 → 104.16.249.249 TCP 54 40502 → 443 [FIN, ACK] Seq=518 Ack=2888 Win=63848 Len=0
  298 2.266960584 104.16.249.249 → 192.168.212.132 TCP 60 443 → 40502 [ACK] Seq=2888 Ack=519 Win=64239 Len=0
  299 2.267040600 192.168.212.132 → 104.16.249.249 TCP 54 40500 → 443 [FIN, ACK] Seq=518 Ack=2888 Win=63848 Len=0
  300 2.267217999 104.16.249.249 → 192.168.212.132 TCP 60 443 → 40500 [ACK] Seq=2888 Ack=519 Win=64239 Len=0
  301 2.267904187 192.168.212.132 → 104.16.249.249 TCP 74 40506 → 443 [SYN] Seq=0 Win=64240 Len=0 MSS=1460 SACK_PERM=1 TSval=3336497488 TSecr=0 WS=128
  302 2.268094476 192.168.212.132 → 104.16.249.249 TCP 74 40508 → 443 [SYN] Seq=0 Win=64240 Len=0 MSS=1460 SACK_PERM=1 TSval=3336497488 TSecr=0 WS=128
  303 2.269281770 104.16.249.249 → 192.168.212.132 TLSv1.3 1442 Server Hello, Change Cipher Spec
  304 2.269302963 192.168.212.132 → 104.16.249.249 TCP 54 40498 → 443 [ACK] Seq=518 Ack=1389 Win=63848 Len=0
  305 2.269397271 104.16.249.249 → 192.168.212.132 TCP 1442 443 → 40498 [PSH, ACK] Seq=1389 Ack=518 Win=64240 Len=1388 [TCP segment of a reassembled PDU]
  306 2.269409999 192.168.212.132 → 104.16.249.249 TCP 54 40498 → 443 [ACK] Seq=518 Ack=2777 Win=62460 Len=0
  307 2.269456831 104.16.249.249 → 192.168.212.132 TLSv1.3 165 Application Data
  308 2.269462529 192.168.212.132 → 104.16.249.249 TCP 54 40498 → 443 [ACK] Seq=518 Ack=2888 Win=62460 Len=0
  309 2.299251626 104.16.249.249 → 192.168.212.132 TCP 60 443 → 40500 [FIN, PSH, ACK] Seq=2888 Ack=519 Win=64239 Len=0
  310 2.299285268 192.168.212.132 → 104.16.249.249 TCP 54 40500 → 443 [ACK] Seq=519 Ack=2889 Win=63848 Len=0
  311 2.299345432 104.16.249.249 → 192.168.212.132 TCP 60 443 → 40502 [FIN, PSH, ACK] Seq=2888 Ack=519 Win=64239 Len=0
  312 2.299351953 192.168.212.132 → 104.16.249.249 TCP 54 40502 → 443 [ACK] Seq=519 Ack=2889 Win=63848 Len=0
  313 2.315515705 192.168.212.132 → 104.16.249.249 TCP 54 40504 → 443 [FIN, ACK] Seq=518 Ack=2888 Win=63848 Len=0
  314 2.315820161 104.16.249.249 → 192.168.212.132 TCP 60 443 → 40504 [ACK] Seq=2888 Ack=519 Win=64239 Len=0
  315 2.316751559 192.168.212.132 → 104.16.249.249 TCP 74 40510 → 443 [SYN] Seq=0 Win=64240 Len=0 MSS=1460 SACK_PERM=1 TSval=3336497537 TSecr=0 WS=128
  316 2.316938771 192.168.212.132 → 104.16.249.249 TCP 74 40512 → 443 [SYN] Seq=0 Win=64240 Len=0 MSS=1460 SACK_PERM=1 TSval=3336497537 TSecr=0 WS=128
  317 2.331114488 104.16.249.249 → 192.168.212.132 TCP 60 443 → 40508 [SYN, ACK] Seq=0 Ack=1 Win=64240 Len=0 MSS=1460
  318 2.331183784 192.168.212.132 → 104.16.249.249 TCP 54 40508 → 443 [ACK] Seq=1 Ack=1 Win=64240 Len=0
  319 2.335246466 192.168.212.132 → 104.16.249.249 TLSv1 571 Client Hello
  320 2.335465379 104.16.249.249 → 192.168.212.132 TCP 60 443 → 40508 [ACK] Seq=1 Ack=518 Win=64240 Len=0
  321 2.349197708 104.16.249.249 → 192.168.212.132 TCP 60 443 → 40506 [SYN, ACK] Seq=0 Ack=1 Win=64240 Len=0 MSS=1460
  322 2.349232578 192.168.212.132 → 104.16.249.249 TCP 54 40506 → 443 [RST] Seq=1 Win=0 Len=0
  323 2.356886888 192.168.212.132 → 104.16.249.249 TCP 54 40508 → 443 [FIN, ACK] Seq=518 Ack=1 Win=64240 Len=0
  324 2.357196042 104.16.249.249 → 192.168.212.132 TCP 60 443 → 40508 [ACK] Seq=1 Ack=519 Win=64239 Len=0
  325 2.357809219 192.168.212.132 → 104.16.249.249 TCP 74 40514 → 443 [SYN] Seq=0 Win=64240 Len=0 MSS=1460 SACK_PERM=1 TSval=3336497578 TSecr=0 WS=128
  326 2.358076579 192.168.212.132 → 104.16.249.249 TCP 74 40516 → 443 [SYN] Seq=0 Win=64240 Len=0 MSS=1460 SACK_PERM=1 TSval=3336497578 TSecr=0 WS=128
  327 2.361308650 104.16.249.249 → 192.168.212.132 TCP 60 443 → 40504 [FIN, PSH, ACK] Seq=2888 Ack=519 Win=64239 Len=0
  328 2.361337695 192.168.212.132 → 104.16.249.249 TCP 54 40504 → 443 [ACK] Seq=519 Ack=2889 Win=63848 Len=0
  329 2.391266344 104.16.249.249 → 192.168.212.132 TCP 60 443 → 40510 [SYN, ACK] Seq=0 Ack=1 Win=64240 Len=0 MSS=1460
  330 2.391314755 192.168.212.132 → 104.16.249.249 TCP 54 40510 → 443 [RST] Seq=1 Win=0 Len=0
  331 2.396659274 104.16.249.249 → 192.168.212.132 TCP 60 443 → 40512 [SYN, ACK] Seq=0 Ack=1 Win=64240 Len=0 MSS=1460
  332 2.396736455 192.168.212.132 → 104.16.249.249 TCP 54 40512 → 443 [ACK] Seq=1 Ack=1 Win=64240 Len=0
  333 2.396878888 104.16.249.249 → 192.168.212.132 TLSv1.3 1442 Server Hello, Change Cipher Spec
  334 2.396898388 192.168.212.132 → 104.16.249.249 TCP 54 40508 → 443 [RST] Seq=519 Win=0 Len=0
  335 2.397003260 104.16.249.249 → 192.168.212.132 TCP 1442 443 → 40508 [PSH, ACK] Seq=1389 Ack=519 Win=64239 Len=1388 [TCP segment of a reassembled PDU]
  336 2.397015974 192.168.212.132 → 104.16.249.249 TCP 54 40508 → 443 [RST] Seq=519 Win=0 Len=0
  337 2.397126836 104.16.249.249 → 192.168.212.132 TLSv1.3 166 Application Data
  338 2.397138413 192.168.212.132 → 104.16.249.249 TCP 54 40508 → 443 [RST] Seq=519 Win=0 Len=0
  339 2.400994340 192.168.212.132 → 104.16.249.249 TLSv1 571 Client Hello
  340 2.401385274 104.16.249.249 → 192.168.212.132 TCP 60 443 → 40512 [ACK] Seq=1 Ack=518 Win=64240 Len=0
  341 2.430376845 104.16.249.249 → 192.168.212.132 TCP 60 443 → 40516 [SYN, ACK] Seq=0 Ack=1 Win=64240 Len=0 MSS=1460
  342 2.430465378 192.168.212.132 → 104.16.249.249 TCP 54 40516 → 443 [ACK] Seq=1 Ack=1 Win=64240 Len=0
  343 2.435090297 192.168.212.132 → 104.16.249.249 TLSv1 571 Client Hello
  344 2.435378488 104.16.249.249 → 192.168.212.132 TCP 60 443 → 40516 [ACK] Seq=1 Ack=518 Win=64240 Len=0
  345 2.457556640 192.168.212.132 → 104.16.249.249 TCP 54 40512 → 443 [FIN, ACK] Seq=518 Ack=1 Win=64240 Len=0
  346 2.457859148 104.16.249.249 → 192.168.212.132 TCP 60 443 → 40512 [ACK] Seq=1 Ack=519 Win=64239 Len=0
  347 2.458889315 192.168.212.132 → 104.16.249.249 TCP 74 40518 → 443 [SYN] Seq=0 Win=64240 Len=0 MSS=1460 SACK_PERM=1 TSval=3336497679 TSecr=0 WS=128
  348 2.459151362 192.168.212.132 → 104.16.249.249 TCP 74 40520 → 443 [SYN] Seq=0 Win=64240 Len=0 MSS=1460 SACK_PERM=1 TSval=3336497679 TSecr=0 WS=128
  349 2.469456942 104.16.249.249 → 192.168.212.132 TLSv1.3 1442 Server Hello, Change Cipher Spec
  350 2.469501401 192.168.212.132 → 104.16.249.249 TCP 54 40512 → 443 [RST] Seq=519 Win=0 Len=0
  351 2.469565313 104.16.249.249 → 192.168.212.132 TCP 1442 443 → 40512 [PSH, ACK] Seq=1389 Ack=519 Win=64239 Len=1388 [TCP segment of a reassembled PDU]
  352 2.469574700 192.168.212.132 → 104.16.249.249 TCP 54 40512 → 443 [RST] Seq=519 Win=0 Len=0
