    1 0.000000000 192.168.49.141 → 104.16.248.249 TCP 76 40542 → 443 [SYN] Seq=0 Win=64240 Len=0 MSS=1460 SACK_PERM=1 TSval=1814068401 TSecr=0 WS=128
    2 0.233982409 192.168.49.141 → 34.120.208.123 TLSv1.2 224 Application Data
    3 0.234047848 192.168.49.141 → 34.120.208.123 TCP 1516 [TCP segment of a reassembled PDU]
    4 0.234108041 192.168.49.141 → 34.120.208.123 TLSv1.2 104 Application Data
    5 0.234228407 192.168.49.141 → 34.120.208.123 TCP 1516 [TCP segment of a reassembled PDU]
    6 0.234302220 192.168.49.141 → 34.120.208.123 TCP 1516 52020 → 443 [ACK] Seq=3137 Ack=1 Win=62780 Len=1460 [TCP segment of a reassembled PDU]
    7 0.234349476 34.120.208.123 → 192.168.49.141 TCP 62 443 → 52020 [ACK] Seq=1 Ack=169 Win=64240 Len=0
    8 0.234357261 34.120.208.123 → 192.168.49.141 TCP 62 443 → 52020 [ACK] Seq=1 Ack=1629 Win=64240 Len=0
    9 0.234359772 34.120.208.123 → 192.168.49.141 TCP 62 443 → 52020 [ACK] Seq=1 Ack=1677 Win=64240 Len=0
   10 0.234365463 192.168.49.141 → 34.120.208.123 TCP 1516 52020 → 443 [PSH, ACK] Seq=4597 Ack=1 Win=62780 Len=1460 [TCP segment of a reassembled PDU]
   11 0.234506322 34.120.208.123 → 192.168.49.141 TCP 62 443 → 52020 [ACK] Seq=1 Ack=3137 Win=64240 Len=0
   12 0.234518964 192.168.49.141 → 34.120.208.123 TCP 1516 52020 → 443 [ACK] Seq=6057 Ack=1 Win=62780 Len=1460 [TCP segment of a reassembled PDU]
   13 0.234550820 192.168.49.141 → 34.120.208.123 TCP 1516 52020 → 443 [ACK] Seq=7517 Ack=1 Win=62780 Len=1460 [TCP segment of a reassembled PDU]
   14 0.234597704 192.168.49.141 → 34.120.208.123 TCP 1516 52020 → 443 [PSH, ACK] Seq=8977 Ack=1 Win=62780 Len=1460 [TCP segment of a reassembled PDU]
   15 0.234624087 34.120.208.123 → 192.168.49.141 TCP 62 443 → 52020 [ACK] Seq=1 Ack=4597 Win=64240 Len=0
   16 0.234629296 34.120.208.123 → 192.168.49.141 TCP 62 443 → 52020 [ACK] Seq=1 Ack=6057 Win=64240 Len=0
   17 0.234631970 34.120.208.123 → 192.168.49.141 TCP 62 443 → 52020 [ACK] Seq=1 Ack=7517 Win=64240 Len=0
   18 0.234777134 34.120.208.123 → 192.168.49.141 TCP 62 443 → 52020 [ACK] Seq=1 Ack=8977 Win=64240 Len=0
   19 0.234787117 192.168.49.141 → 34.120.208.123 TCP 1516 52020 → 443 [ACK] Seq=10437 Ack=1 Win=62780 Len=1460 [TCP segment of a reassembled PDU]
   20 0.234835136 192.168.49.141 → 34.120.208.123 TCP 1516 52020 → 443 [ACK] Seq=11897 Ack=1 Win=62780 Len=1460 [TCP segment of a reassembled PDU]
   21 0.234854125 192.168.49.141 → 34.120.208.123 TCP 1516 52020 → 443 [ACK] Seq=13357 Ack=1 Win=62780 Len=1460 [TCP segment of a reassembled PDU]
   22 0.234896534 192.168.49.141 → 34.120.208.123 TCP 1516 52020 → 443 [ACK] Seq=14817 Ack=1 Win=62780 Len=1460 [TCP segment of a reassembled PDU]
   23 0.234919763 192.168.49.141 → 34.120.208.123 TLSv1.2 1516 Application Data [TCP segment of a reassembled PDU]
   24 0.234966297 34.120.208.123 → 192.168.49.141 TCP 62 443 → 52020 [ACK] Seq=1 Ack=10437 Win=64240 Len=0
   25 0.235082829 34.120.208.123 → 192.168.49.141 TCP 62 443 → 52020 [ACK] Seq=1 Ack=11897 Win=64240 Len=0
   26 0.235111642 192.168.49.141 → 34.120.208.123 TLSv1.2 1085 Application Data
   27 0.235192648 34.120.208.123 → 192.168.49.141 TCP 62 443 → 52020 [ACK] Seq=1 Ack=13357 Win=64240 Len=0
   28 0.235341783 34.120.208.123 → 192.168.49.141 TCP 62 443 → 52020 [ACK] Seq=1 Ack=14817 Win=64240 Len=0
   29 0.235348960 34.120.208.123 → 192.168.49.141 TCP 62 443 → 52020 [ACK] Seq=1 Ack=16277 Win=64240 Len=0
   30 0.236173306 34.120.208.123 → 192.168.49.141 TCP 62 443 → 52020 [ACK] Seq=1 Ack=17737 Win=64240 Len=0
   31 0.236192547 34.120.208.123 → 192.168.49.141 TCP 62 443 → 52020 [ACK] Seq=1 Ack=18766 Win=64240 Len=0
   32 0.239152038 192.168.49.141 → 34.120.208.123 TLSv1.2 200 Application Data
   33 0.239646419 34.120.208.123 → 192.168.49.141 TCP 62 443 → 52020 [ACK] Seq=1 Ack=18910 Win=64240 Len=0
   34 0.239875925 192.168.49.141 → 34.120.208.123 TCP 1516 [TCP segment of a reassembled PDU]
   35 0.239912542 192.168.49.141 → 34.120.208.123 TLSv1.2 104 Application Data
   36 0.240136779 34.120.208.123 → 192.168.49.141 TCP 62 443 → 52020 [ACK] Seq=1 Ack=20370 Win=64240 Len=0
   37 0.240147691 192.168.49.141 → 34.120.208.123 TCP 1516 [TCP segment of a reassembled PDU]
   38 0.240182920 192.168.49.141 → 34.120.208.123 TLSv1.2 447 Application Data
   39 0.240224286 34.120.208.123 → 192.168.49.141 TCP 62 443 → 52020 [ACK] Seq=1 Ack=20418 Win=64240 Len=0
   40 0.240375932 34.120.208.123 → 192.168.49.141 TCP 62 443 → 52020 [ACK] Seq=1 Ack=21878 Win=64240 Len=0
   41 0.240379841 34.120.208.123 → 192.168.49.141 TCP 62 443 → 52020 [ACK] Seq=1 Ack=22269 Win=64240 Len=0
   42 0.240527640 192.168.49.141 → 104.16.249.249 TLSv1.2 112 Application Data
   43 0.240583700 192.168.49.141 → 104.16.249.249 TLSv1.2 215 Application Data
   44 0.240671894 104.16.249.249 → 192.168.49.141 TCP 62 443 → 35488 [ACK] Seq=1 Ack=57 Win=64240 Len=0
   45 0.240739915 104.16.249.249 → 192.168.49.141 TCP 62 443 → 35488 [ACK] Seq=1 Ack=216 Win=64240 Len=0
   46 0.240750485 192.168.49.141 → 104.16.249.249 TLSv1.2 112 Application Data
   47 0.240813860 192.168.49.141 → 104.16.249.249 TLSv1.2 215 Application Data
   48 0.240950129 104.16.249.249 → 192.168.49.141 TCP 62 443 → 35488 [ACK] Seq=1 Ack=272 Win=64240 Len=0
   49 0.240954423 104.16.249.249 → 192.168.49.141 TCP 62 443 → 35488 [ACK] Seq=1 Ack=431 Win=64240 Len=0
   50 0.250423827 192.168.49.141 → 104.16.248.249 TCP 76 40550 → 443 [SYN] Seq=0 Win=64240 Len=0 MSS=1460 SACK_PERM=1 TSval=1814068652 TSecr=0 WS=128
   51 0.295568721 104.16.249.249 → 192.168.49.141 TLSv1.2 91 Application Data
   52 0.295587065 192.168.49.141 → 104.16.249.249 TCP 56 35488 → 443 [ACK] Seq=431 Ack=36 Win=62780 Len=0
   53 0.351494620 104.16.249.249 → 192.168.49.141 TLSv1.2 91 Application Data
   54 0.351510909 192.168.49.141 → 104.16.249.249 TCP 56 35488 → 443 [ACK] Seq=431 Ack=71 Win=62780 Len=0
   55 0.363910795 104.16.249.249 → 192.168.49.141 TLSv1.2 1143 Application Data, Application Data
   56 0.363927783 192.168.49.141 → 104.16.249.249 TCP 56 35488 → 443 [ACK] Seq=431 Ack=1158 Win=62780 Len=0
   57 0.549632304 34.120.208.123 → 192.168.49.141 TLSv1.2 140 Application Data
   58 0.550389524 192.168.49.141 → 34.120.208.123 TLSv1.2 95 Application Data
   59 0.550930828 34.120.208.123 → 192.168.49.141 TCP 62 443 → 52020 [ACK] Seq=85 Ack=22308 Win=64240 Len=0
   60 0.555056450 34.120.208.123 → 192.168.49.141 TLSv1.2 123 Application Data
   61 0.597938623 192.168.49.141 → 34.120.208.123 TCP 56 52020 → 443 [ACK] Seq=22308 Ack=152 Win=62780 Len=0
   62 1.017902170 192.168.49.141 → 104.16.248.249 TCP 76 [TCP Retransmission] 40542 → 443 [SYN] Seq=0 Win=64240 Len=0 MSS=1460 SACK_PERM=1 TSval=1814069419 TSecr=0 WS=128
   63 1.106804605    127.0.0.1 → 127.0.0.53   DNS 97 Standard query 0xeb8a A detectportal.firefox.com OPT
   64 1.107056609 192.168.49.141 → 192.168.49.2 DNS 97 Standard query 0x8944 A detectportal.firefox.com OPT
   65 1.107104460 192.168.49.141 → 34.107.221.82 HTTP 365 GET /canonical.html HTTP/1.1 
   66 1.107200542    127.0.0.1 → 127.0.0.53   DNS 97 Standard query 0x5999 AAAA detectportal.firefox.com OPT
   67 1.107272284 192.168.49.141 → 192.168.49.2 DNS 97 Standard query 0x574e AAAA detectportal.firefox.com OPT
   68 1.107644556 34.107.221.82 → 192.168.49.141 TCP 62 80 → 41400 [ACK] Seq=1 Ack=310 Win=64240 Len=0
   69 1.193484566 34.107.221.82 → 192.168.49.141 HTTP 354 HTTP/1.1 200 OK  (text/html)
   70 1.193500633 192.168.49.141 → 34.107.221.82 TCP 56 41400 → 80 [ACK] Seq=310 Ack=299 Win=63942 Len=0
   71 1.194361837    127.0.0.1 → 127.0.0.53   DNS 86 Standard query 0x5466 A ipv4only.arpa OPT
   72 1.194387224    127.0.0.1 → 127.0.0.53   DNS 86 Standard query 0x5c70 AAAA ipv4only.arpa OPT
   73 1.194595794 192.168.49.141 → 192.168.49.2 DNS 86 Standard query 0xf522 A ipv4only.arpa OPT
   74 1.194643812 192.168.49.141 → 34.107.221.82 HTTP 367 GET /success.txt?ipv4 HTTP/1.1 
   75 1.194772211 192.168.49.141 → 192.168.49.2 DNS 86 Standard query 0xe5fd AAAA ipv4only.arpa OPT
   76 1.194885683    127.0.0.1 → 127.0.0.53   DNS 97 Standard query 0x6da9 A detectportal.firefox.com OPT
   77 1.194912063    127.0.0.1 → 127.0.0.53   DNS 97 Standard query 0x4bb0 AAAA detectportal.firefox.com OPT
   78 1.195124014 34.107.221.82 → 192.168.49.141 TCP 62 80 → 41404 [ACK] Seq=1 Ack=312 Win=64240 Len=0
   79 1.198292880 192.168.49.2 → 192.168.49.141 DNS 208 Standard query response 0x8944 A detectportal.firefox.com CNAME detectportal.prod.mozaws.net CNAME prod.detectportal.prod.cloudops.mozgcp.net A 34.107.221.82 OPT
   80 1.198642485   127.0.0.53 → 127.0.0.1    DNS 208 Standard query response 0xeb8a A detectportal.firefox.com CNAME detectportal.prod.mozaws.net CNAME prod.detectportal.prod.cloudops.mozgcp.net A 34.107.221.82 OPT
   81 1.198782317   127.0.0.53 → 127.0.0.1    DNS 208 Standard query response 0x6da9 A detectportal.firefox.com CNAME detectportal.prod.mozaws.net CNAME prod.detectportal.prod.cloudops.mozgcp.net A 34.107.221.82 OPT
   82 1.262620336 192.168.49.2 → 192.168.49.141 DNS 220 Standard query response 0x574e AAAA detectportal.firefox.com CNAME detectportal.prod.mozaws.net CNAME prod.detectportal.prod.cloudops.mozgcp.net AAAA 2600:1901:0:38d7:: OPT
   83 1.262923166   127.0.0.53 → 127.0.0.1    DNS 220 Standard query response 0x5999 AAAA detectportal.firefox.com CNAME detectportal.prod.mozaws.net CNAME prod.detectportal.prod.cloudops.mozgcp.net AAAA 2600:1901:0:38d7:: OPT
   84 1.263070973   127.0.0.53 → 127.0.0.1    DNS 220 Standard query response 0x4bb0 AAAA detectportal.firefox.com CNAME detectportal.prod.mozaws.net CNAME prod.detectportal.prod.cloudops.mozgcp.net AAAA 2600:1901:0:38d7:: OPT
   85 1.277398711 192.168.49.141 → 104.16.248.249 TCP 76 [TCP Retransmission] 40550 → 443 [SYN] Seq=0 Win=64240 Len=0 MSS=1460 SACK_PERM=1 TSval=1814069679 TSecr=0 WS=128
   86 1.281145762 34.107.221.82 → 192.168.49.141 HTTP 272 HTTP/1.1 200 OK  (text/plain)
   87 1.281164246 192.168.49.141 → 34.107.221.82 TCP 56 41404 → 80 [ACK] Seq=312 Ack=217 Win=64024 Len=0
   88 1.286300431 192.168.49.2 → 192.168.49.141 DNS 118 Standard query response 0xf522 A ipv4only.arpa A 192.0.0.170 A 192.0.0.171 OPT
   89 1.286607328   127.0.0.53 → 127.0.0.1    DNS 118 Standard query response 0x5466 A ipv4only.arpa A 192.0.0.170 A 192.0.0.171 OPT
   90 1.313162622 192.168.49.2 → 192.168.49.141 DNS 143 Standard query response 0xe5fd AAAA ipv4only.arpa SOA sns.dns.icann.org OPT
   91 1.313367356   127.0.0.53 → 127.0.0.1    DNS 86 Standard query response 0x5c70 AAAA ipv4only.arpa OPT
   92 1.314085196    127.0.0.1 → 127.0.0.53   DNS 86 Standard query 0x3e09 A ipv4only.arpa OPT
   93 1.314776369    127.0.0.1 → 127.0.0.53   DNS 86 Standard query 0x7a0d AAAA ipv4only.arpa OPT
   94 1.314852144   127.0.0.53 → 127.0.0.1    DNS 118 Standard query response 0x3e09 A ipv4only.arpa A 192.0.0.171 A 192.0.0.170 OPT
   95 1.314916367   127.0.0.53 → 127.0.0.1    DNS 86 Standard query response 0x7a0d AAAA ipv4only.arpa OPT
   96 1.731303152    127.0.0.1 → 224.0.0.251  MDNS 185 Standard query 0x0000 PTR _ipp._tcp.local, "QM" question PTR _nfs._tcp.local, "QM" question PTR _afpovertcp._tcp.local, "QM" question PTR _smb._tcp.local, "QM" question PTR _sftp-ssh._tcp.local, "QM" question PTR _webdavs._tcp.local, "QM" question PTR _webdav._tcp.local, "QM" question PTR _ftp._tcp.local, "QM" question PTR _ipps._tcp.local, "QM" question
   97 2.266271033 192.168.49.141 → 93.184.220.29 TCP 56 37106 → 80 [ACK] Seq=1 Ack=1 Win=63840 Len=0
   98 2.266460494 93.184.220.29 → 192.168.49.141 TCP 62 [TCP ACKed unseen segment] 80 → 37106 [ACK] Seq=1 Ack=2 Win=64240 Len=0
   99 3.037520082 192.168.49.141 → 104.16.248.249 TCP 76 [TCP Retransmission] 40542 → 443 [SYN] Seq=0 Win=64240 Len=0 MSS=1460 SACK_PERM=1 TSval=1814071439 TSecr=0 WS=128
  100 3.107992069 192.168.49.141 → 34.117.237.239 TLSv1.2 95 Application Data
  101 3.108311865 192.168.49.141 → 18.165.122.14 TLSv1.2 102 Application Data
  102 3.108783511 34.117.237.239 → 192.168.49.141 TCP 62 443 → 58934 [ACK] Seq=1 Ack=40 Win=64240 Len=0
  103 3.108960438 18.165.122.14 → 192.168.49.141 TCP 62 443 → 45886 [ACK] Seq=1 Ack=47 Win=64240 Len=0
  104 3.162099382 18.165.122.14 → 192.168.49.141 TLSv1.2 102 Application Data
  105 3.162134425 192.168.49.141 → 18.165.122.14 TCP 56 45886 → 443 [ACK] Seq=47 Ack=47 Win=63000 Len=0
  106 3.191985407 34.117.237.239 → 192.168.49.141 TLSv1.2 95 Application Data
  107 3.192003544 192.168.49.141 → 34.117.237.239 TCP 56 58934 → 443 [ACK] Seq=40 Ack=40 Win=62780 Len=0
  108 3.289364857 192.168.49.141 → 104.16.248.249 TCP 76 [TCP Retransmission] 40550 → 443 [SYN] Seq=0 Win=64240 Len=0 MSS=1460 SACK_PERM=1 TSval=1814071691 TSecr=0 WS=128
  109 3.814736328 192.168.49.141 → 34.120.208.123 TLSv1.2 200 Application Data
  110 3.814808624 192.168.49.141 → 34.120.208.123 TLSv1.2 396 Application Data
  111 3.815094690 34.120.208.123 → 192.168.49.141 TCP 62 443 → 52020 [ACK] Seq=152 Ack=22452 Win=64240 Len=0
  112 3.815104205 34.120.208.123 → 192.168.49.141 TCP 62 443 → 52020 [ACK] Seq=152 Ack=22792 Win=64240 Len=0
  113 3.817371173    127.0.0.1 → 127.0.0.53   DNS 99 Standard query 0x1fb1 A mozilla.cloudflare-dns.com OPT
  114 3.817416931    127.0.0.1 → 127.0.0.53   DNS 99 Standard query 0x23ba AAAA mozilla.cloudflare-dns.com OPT
  115 3.817618071 192.168.49.141 → 192.168.49.2 DNS 99 Standard query 0x8a6f A mozilla.cloudflare-dns.com OPT
  116 3.817930475 192.168.49.141 → 104.16.249.249 TLSv1.2 112 Application Data
  117 3.817948692 192.168.49.141 → 104.16.249.249 TLSv1.2 215 Application Data
  118 3.818083615 192.168.49.141 → 192.168.49.2 DNS 99 Standard query 0xfb29 AAAA mozilla.cloudflare-dns.com OPT
  119 3.818604479 192.168.49.141 → 104.16.249.249 TLSv1.2 112 Application Data
  120 3.818654912 192.168.49.141 → 104.16.249.249 TLSv1.2 215 Application Data
  121 3.818753053 104.16.249.249 → 192.168.49.141 TCP 62 443 → 35488 [ACK] Seq=1158 Ack=487 Win=64240 Len=0
  122 3.818763043 104.16.249.249 → 192.168.49.141 TCP 62 443 → 35488 [ACK] Seq=1158 Ack=646 Win=64240 Len=0
  123 3.818764131 104.16.249.249 → 192.168.49.141 TCP 62 443 → 35488 [ACK] Seq=1158 Ack=702 Win=64240 Len=0
  124 3.818765319 104.16.249.249 → 192.168.49.141 TCP 62 443 → 35488 [ACK] Seq=1158 Ack=861 Win=64240 Len=0
  125 3.830155544 192.168.49.141 → 104.16.249.249 TLSv1.2 112 Application Data
  126 3.830214687 192.168.49.141 → 104.16.249.249 TLSv1.2 215 Application Data
  127 3.830245760 104.16.249.249 → 192.168.49.141 TCP 62 443 → 35488 [ACK] Seq=1158 Ack=917 Win=64240 Len=0
  128 3.830349050 104.16.249.249 → 192.168.49.141 TCP 62 443 → 35488 [ACK] Seq=1158 Ack=1076 Win=64240 Len=0
  129 3.830500465 192.168.49.141 → 104.16.249.249 TLSv1.2 112 Application Data
  130 3.830544215 192.168.49.141 → 104.16.249.249 TLSv1.2 215 Application Data
  131 3.830577450 104.16.249.249 → 192.168.49.141 TCP 62 443 → 35488 [ACK] Seq=1158 Ack=1132 Win=64240 Len=0
  132 3.830678598 104.16.249.249 → 192.168.49.141 TCP 62 443 → 35488 [ACK] Seq=1158 Ack=1291 Win=64240 Len=0
  133 3.830916159 192.168.49.141 → 104.16.249.249 TLSv1.2 112 Application Data
  134 3.830948650 192.168.49.141 → 104.16.249.249 TLSv1.2 215 Application Data
  135 3.831173647 104.16.249.249 → 192.168.49.141 TCP 62 443 → 35488 [ACK] Seq=1158 Ack=1347 Win=64240 Len=0
  136 3.831178670 104.16.249.249 → 192.168.49.141 TCP 62 443 → 35488 [ACK] Seq=1158 Ack=1506 Win=64240 Len=0
  137 3.903081749 104.16.249.249 → 192.168.49.141 TLSv1.2 91 Application Data
  138 3.903099797 192.168.49.141 → 104.16.249.249 TCP 56 35488 → 443 [ACK] Seq=1506 Ack=1193 Win=62780 Len=0
  139 3.909493758 192.168.49.2 → 192.168.49.141 DNS 131 Standard query response 0x8a6f A mozilla.cloudflare-dns.com A 104.16.249.249 A 104.16.248.249 OPT
  140 3.909682013   127.0.0.53 → 127.0.0.1    DNS 131 Standard query response 0x1fb1 A mozilla.cloudflare-dns.com A 104.16.249.249 A 104.16.248.249 OPT
  141 3.919574112 192.168.49.2 → 192.168.49.141 DNS 155 Standard query response 0xfb29 AAAA mozilla.cloudflare-dns.com AAAA 2606:4700::6810:f8f9 AAAA 2606:4700::6810:f9f9 OPT
  142 3.919755847   127.0.0.53 → 127.0.0.1    DNS 155 Standard query response 0x23ba AAAA mozilla.cloudflare-dns.com AAAA 2606:4700::6810:f8f9 AAAA 2606:4700::6810:f9f9 OPT
  143 3.963973917 104.16.249.249 → 192.168.49.141 TLSv1.2 1217 Application Data, Application Data, Application Data
  144 3.963990502 192.168.49.141 → 104.16.249.249 TCP 56 35488 → 443 [ACK] Seq=1506 Ack=2354 Win=62780 Len=0
  145 3.964031352 104.16.249.249 → 192.168.49.141 TLSv1.2 1516 Application Data, Application Data
  146 3.964036767 192.168.49.141 → 104.16.249.249 TCP 56 35488 → 443 [ACK] Seq=1506 Ack=3814 Win=62780 Len=0
  147 3.964051333 104.16.249.249 → 192.168.49.141 TLSv1.2 192 Application Data
  148 3.964054340 192.168.49.141 → 104.16.249.249 TCP 56 35488 → 443 [ACK] Seq=1506 Ack=3950 Win=62780 Len=0
  149 3.973790940 192.168.49.141 → 64.233.165.198 TCP 76 45178 → 443 [SYN] Seq=0 Win=64240 Len=0 MSS=1460 SACK_PERM=1 TSval=3888534376 TSecr=0 WS=128
  150 4.079395744 64.233.165.198 → 192.168.49.141 TCP 62 443 → 45178 [SYN, ACK] Seq=0 Ack=1 Win=64240 Len=0 MSS=1460
  151 4.079437936 192.168.49.141 → 64.233.165.198 TCP 56 45178 → 443 [ACK] Seq=1 Ack=1 Win=64240 Len=0
  152 4.080804226 192.168.49.141 → 64.233.165.198 TLSv1 573 Client Hello
  153 4.080987125 64.233.165.198 → 192.168.49.141 TCP 62 443 → 45178 [ACK] Seq=1 Ack=518 Win=64240 Len=0
  154 4.179733669 34.120.208.123 → 192.168.49.141 TLSv1.2 140 Application Data
  155 4.179848005 192.168.49.141 → 34.120.208.123 TCP 56 52020 → 443 [ACK] Seq=22792 Ack=236 Win=62780 Len=0
  156 4.180292376 192.168.49.141 → 34.120.208.123 TLSv1.2 95 Application Data
  157 4.180714515 34.120.208.123 → 192.168.49.141 TCP 62 443 → 52020 [ACK] Seq=236 Ack=22831 Win=64240 Len=0
  158 4.380096611 64.233.165.198 → 192.168.49.141 TLSv1.3 1516 Server Hello, Change Cipher Spec
  159 4.380112903 192.168.49.141 → 64.233.165.198 TCP 56 45178 → 443 [ACK] Seq=518 Ack=1461 Win=62780 Len=0
  160 4.380154476 64.233.165.198 → 192.168.49.141 TCP 1516 443 → 45178 [ACK] Seq=1461 Ack=518 Win=64240 Len=1460 [TCP segment of a reassembled PDU]
  161 4.380159954 192.168.49.141 → 64.233.165.198 TCP 56 45178 → 443 [ACK] Seq=518 Ack=2921 Win=62780 Len=0
  162 4.380174098 64.233.165.198 → 192.168.49.141 TCP 1516 443 → 45178 [ACK] Seq=2921 Ack=518 Win=64240 Len=1460 [TCP segment of a reassembled PDU]
  163 4.380177099 192.168.49.141 → 64.233.165.198 TCP 56 45178 → 443 [ACK] Seq=518 Ack=4381 Win=61320 Len=0
  164 4.380192209 64.233.165.198 → 192.168.49.141 TCP 1516 443 → 45178 [ACK] Seq=4381 Ack=518 Win=64240 Len=1460 [TCP segment of a reassembled PDU]
  165 4.380195324 192.168.49.141 → 64.233.165.198 TCP 56 45178 → 443 [ACK] Seq=518 Ack=5841 Win=61320 Len=0
  166 4.380208789 64.233.165.198 → 192.168.49.141 TLSv1.3 986 Application Data
  167 4.380212524 192.168.49.141 → 64.233.165.198 TCP 56 45178 → 443 [ACK] Seq=518 Ack=6771 Win=60390 Len=0
  168 4.387886235 192.168.49.141 → 104.16.249.249 TLSv1.2 112 Application Data
  169 4.388018867 192.168.49.141 → 104.16.249.249 TLSv1.2 215 Application Data
  170 4.388255257 192.168.49.141 → 104.16.249.249 TLSv1.2 112 Application Data
  171 4.388330990 192.168.49.141 → 104.16.249.249 TLSv1.2 215 Application Data
  172 4.389003922 104.16.249.249 → 192.168.49.141 TCP 62 443 → 35488 [ACK] Seq=3950 Ack=1562 Win=64240 Len=0
  173 4.389038484 104.16.249.249 → 192.168.49.141 TCP 62 443 → 35488 [ACK] Seq=3950 Ack=1721 Win=64240 Len=0
  174 4.389041893 104.16.249.249 → 192.168.49.141 TCP 62 443 → 35488 [ACK] Seq=3950 Ack=1777 Win=64240 Len=0
  175 4.389044295 104.16.249.249 → 192.168.49.141 TCP 62 443 → 35488 [ACK] Seq=3950 Ack=1936 Win=64240 Len=0
  176 4.425900467 104.16.249.249 → 192.168.49.141 TLSv1.2 91 Application Data
  177 4.425916835 192.168.49.141 → 104.16.249.249 TCP 56 35488 → 443 [ACK] Seq=1936 Ack=3985 Win=62780 Len=0
  178 4.474230625 104.16.249.249 → 192.168.49.141 TLSv1.2 91 Application Data
  179 4.474250258 192.168.49.141 → 104.16.249.249 TCP 56 35488 → 443 [ACK] Seq=1936 Ack=4020 Win=62780 Len=0
  180 4.488082898 104.16.249.249 → 192.168.49.141 TLSv1.2 611 Application Data
  181 4.488102805 192.168.49.141 → 104.16.249.249 TCP 56 35488 → 443 [ACK] Seq=1936 Ack=4575 Win=62780 Len=0
  182 4.488247099 104.16.249.249 → 192.168.49.141 TLSv1.2 588 Application Data
  183 4.488253714 192.168.49.141 → 104.16.249.249 TCP 56 35488 → 443 [ACK] Seq=1936 Ack=5107 Win=62780 Len=0
  184 4.488787075 192.168.49.141 → 64.233.164.94 TCP 76 46206 → 80 [SYN] Seq=0 Win=64240 Len=0 MSS=1460 SACK_PERM=1 TSval=4172316308 TSecr=0 WS=128
  185 4.564143456 64.233.164.94 → 192.168.49.141 TCP 62 80 → 46206 [SYN, ACK] Seq=0 Ack=1 Win=64240 Len=0 MSS=1460
  186 4.564183068 192.168.49.141 → 64.233.164.94 TCP 56 46206 → 80 [ACK] Seq=1 Ack=1 Win=64240 Len=0
  187 4.564369351 192.168.49.141 → 64.233.164.94 OCSP 490 Request
  188 4.564576231 64.233.164.94 → 192.168.49.141 TCP 62 80 → 46206 [ACK] Seq=1 Ack=435 Win=64240 Len=0
  189 4.615912680 64.233.164.94 → 192.168.49.141 OCSP 757 Response
  190 4.615937795 192.168.49.141 → 64.233.164.94 TCP 56 46206 → 80 [ACK] Seq=435 Ack=702 Win=63791 Len=0
  191 4.618655705 192.168.49.141 → 64.233.165.198 TLSv1.3 120 Change Cipher Spec, Application Data
  192 4.619265058 64.233.165.198 → 192.168.49.141 TCP 62 443 → 45178 [ACK] Seq=6771 Ack=582 Win=64240 Len=0
  193 4.620243065 192.168.49.141 → 64.233.165.198 TLSv1.3 226 Application Data
  194 4.620501833 192.168.49.141 → 64.233.165.198 TLSv1.3 387 Application Data
  195 4.620897196 64.233.165.198 → 192.168.49.141 TCP 62 443 → 45178 [ACK] Seq=6771 Ack=752 Win=64240 Len=0
  196 4.620949702 64.233.165.198 → 192.168.49.141 TCP 62 443 → 45178 [ACK] Seq=6771 Ack=1083 Win=64240 Len=0
  197 4.742494445 64.233.165.198 → 192.168.49.141 TLSv1.3 670 Application Data, Application Data
  198 4.742535502 192.168.49.141 → 64.233.165.198 TCP 56 45178 → 443 [ACK] Seq=1083 Ack=7385 Win=62780 Len=0
  199 4.743832623 192.168.49.141 → 64.233.165.198 TLSv1.3 87 Application Data
  200 4.744315464 64.233.165.198 → 192.168.49.141 TCP 62 443 → 45178 [ACK] Seq=7385 Ack=1114 Win=64240 Len=0
  201 4.854365060 192.168.49.141 → 192.168.49.254 DHCP 344 DHCP Request  - Transaction ID 0x6f2fa15f
  202 4.854947825 192.168.49.254 → 192.168.49.141 DHCP 344 DHCP ACK      - Transaction ID 0x6f2fa15f
  203 4.861408951 64.233.165.198 → 192.168.49.141 TLSv1.3 87 Application Data
  204 4.861426300 192.168.49.141 → 64.233.165.198 TCP 56 45178 → 443 [ACK] Seq=1114 Ack=7416 Win=62780 Len=0
  205 5.054241463 64.233.165.198 → 192.168.49.141 TLSv1.3 1101 Application Data
  206 5.054292710 192.168.49.141 → 64.233.165.198 TCP 56 45178 → 443 [ACK] Seq=1114 Ack=8461 Win=62780 Len=0
  207 5.109596977 192.168.49.141 → 34.160.144.191 TLSv1.2 102 Application Data
  208 5.109989839 34.160.144.191 → 192.168.49.141 TCP 62 443 → 46744 [ACK] Seq=1 Ack=47 Win=64240 Len=0
  209 5.159243437 34.160.144.191 → 192.168.49.141 TLSv1.2 102 Application Data
  210 5.201364758 192.168.49.141 → 34.160.144.191 TCP 56 46744 → 443 [ACK] Seq=47 Ack=47 Win=62780 Len=0
  211 5.326225602 64.233.165.198 → 192.168.49.141 TLSv1.3 1516 Application Data
  212 5.326241943 192.168.49.141 → 64.233.165.198 TCP 56 45178 → 443 [ACK] Seq=1114 Ack=9921 Win=62780 Len=0
  213 5.326271915 64.233.165.198 → 192.168.49.141 TLSv1.3 1516 Application Data [TCP segment of a reassembled PDU]
  214 5.326276972 192.168.49.141 → 64.233.165.198 TCP 56 45178 → 443 [ACK] Seq=1114 Ack=11381 Win=62780 Len=0
  215 5.326296352 64.233.165.198 → 192.168.49.141 TLSv1.3 1516 Application Data [TCP segment of a reassembled PDU]
  216 5.326299616 192.168.49.141 → 64.233.165.198 TCP 56 45178 → 443 [ACK] Seq=1114 Ack=12841 Win=61320 Len=0
  217 5.326350276 64.233.165.198 → 192.168.49.141 TLSv1.3 1516 Application Data [TCP segment of a reassembled PDU]
  218 5.326355874 192.168.49.141 → 64.233.165.198 TCP 56 45178 → 443 [ACK] Seq=1114 Ack=14301 Win=61320 Len=0
  219 5.326371990 64.233.165.198 → 192.168.49.141 TLSv1.3 1516 Application Data [TCP segment of a reassembled PDU]
  220 5.326374752 192.168.49.141 → 64.233.165.198 TCP 56 45178 → 443 [ACK] Seq=1114 Ack=15761 Win=59860 Len=0
  221 5.326405586 64.233.165.198 → 192.168.49.141 TLSv1.3 1516 Application Data [TCP segment of a reassembled PDU]
  222 5.326410946 192.168.49.141 → 64.233.165.198 TCP 56 45178 → 443 [ACK] Seq=1114 Ack=17221 Win=58400 Len=0
  223 5.326429165 64.233.165.198 → 192.168.49.141 TLSv1.3 143 Application Data
  224 5.326432721 192.168.49.141 → 64.233.165.198 TCP 56 45178 → 443 [ACK] Seq=1114 Ack=17308 Win=58400 Len=0
  225 5.331960293 192.168.49.141 → 64.233.165.198 UDP 1401 44730 → 443 Len=1357
  226 5.338653065 64.233.165.198 → 192.168.49.141 TLSv1.3 1516 Application Data
  227 5.338677537 192.168.49.141 → 64.233.165.198 TCP 56 45178 → 443 [ACK] Seq=1114 Ack=18768 Win=62780 Len=0
  228 5.338709086 64.233.165.198 → 192.168.49.141 TLSv1.3 1516 Application Data [TCP segment of a reassembled PDU]
  229 5.338713426 192.168.49.141 → 64.233.165.198 TCP 56 45178 → 443 [ACK] Seq=1114 Ack=20228 Win=62780 Len=0
  230 5.338760033 64.233.165.198 → 192.168.49.141 TLSv1.3 1516 Application Data, Application Data
  231 5.338763848 192.168.49.141 → 64.233.165.198 TCP 56 45178 → 443 [ACK] Seq=1114 Ack=21688 Win=61320 Len=0
  232 5.338780666 64.233.165.198 → 192.168.49.141 TLSv1.3 1516 Application Data [TCP segment of a reassembled PDU]
  233 5.338783878 192.168.49.141 → 64.233.165.198 TCP 56 45178 → 443 [ACK] Seq=1114 Ack=23148 Win=61320 Len=0
  234 5.338819567 64.233.165.198 → 192.168.49.141 TLSv1.3 1516 Application Data [TCP segment of a reassembled PDU]
  235 5.338823166 192.168.49.141 → 64.233.165.198 TCP 56 45178 → 443 [ACK] Seq=1114 Ack=24608 Win=59860 Len=0
  236 5.338838530 64.233.165.198 → 192.168.49.141 TLSv1.3 1516 Application Data [TCP segment of a reassembled PDU]
  237 5.339050681 64.233.165.198 → 192.168.49.141 TLSv1.3 1516 Application Data, Application Data, Application Data, Application Data, Application Data, Application Data, Application Data, Application Data
  238 5.339055771 64.233.165.198 → 192.168.49.141 TLSv1.3 1516 Application Data [TCP segment of a reassembled PDU]
  239 5.339102381 64.233.165.198 → 192.168.49.141 TLSv1.3 1516 Application Data [TCP segment of a reassembled PDU]
  240 5.339107192 64.233.165.198 → 192.168.49.141 TLSv1.3 1516 Application Data [TCP segment of a reassembled PDU]
  241 5.339126622 64.233.165.198 → 192.168.49.141 TLSv1.3 1516 Application Data [TCP segment of a reassembled PDU]
  242 5.339130414 64.233.165.198 → 192.168.49.141 TLSv1.3 1516 Application Data [TCP segment of a reassembled PDU]
  243 5.339337648 64.233.165.198 → 192.168.49.141 TLSv1.3 1516 Application Data [TCP segment of a reassembled PDU]
  244 5.339344458 64.233.165.198 → 192.168.49.141 TLSv1.3 1516 Application Data, Application Data
  245 5.339377341 64.233.165.198 → 192.168.49.141 TLSv1.3 1516 Application Data [TCP segment of a reassembled PDU]
  246 5.339383539 64.233.165.198 → 192.168.49.141 TLSv1.3 1516 Application Data, Application Data, Application Data
  247 5.339430442 64.233.165.198 → 192.168.49.141 TLSv1.3 1516 Application Data [TCP segment of a reassembled PDU]
  248 5.339442456 64.233.165.198 → 192.168.49.141 TLSv1.3 1516 Application Data [TCP segment of a reassembled PDU]
  249 5.339466473 64.233.165.198 → 192.168.49.141 TLSv1.3 1516 Application Data [TCP segment of a reassembled PDU]
  250 5.339471185 64.233.165.198 → 192.168.49.141 TLSv1.3 1516 Application Data [TCP segment of a reassembled PDU]
  251 5.339499792 64.233.165.198 → 192.168.49.141 TLSv1.3 1516 Application Data, Application Data
  252 5.339506377 64.233.165.198 → 192.168.49.141 TLSv1.3 1516 Application Data [TCP segment of a reassembled PDU]
  253 5.339710983 64.233.165.198 → 192.168.49.141 TLSv1.3 1516 Application Data, Application Data
  254 5.339716921 64.233.165.198 → 192.168.49.141 TLSv1.3 1516 Application Data [TCP segment of a reassembled PDU]
  255 5.339755781 64.233.165.198 → 192.168.49.141 TLSv1.3 1516 Application Data [TCP segment of a reassembled PDU]
  256 5.339760888 64.233.165.198 → 192.168.49.141 TLSv1.3 1516 Application Data, Application Data
  257 5.339803395 64.233.165.198 → 192.168.49.141 TLSv1.3 1516 Application Data [TCP segment of a reassembled PDU]
  258 5.339808377 64.233.165.198 → 192.168.49.141 TLSv1.3 1516 Application Data [TCP segment of a reassembled PDU]
  259 5.339854054 64.233.165.198 → 192.168.49.141 TLSv1.3 719 Application Data [TCP segment of a reassembled PDU]
  260 5.339857426 64.233.165.198 → 192.168.49.141 TLSv1.3 1456 Application Data [TCP segment of a reassembled PDU]
  261 5.340023766 192.168.49.141 → 64.233.165.198 TCP 56 45178 → 443 [ACK] Seq=1114 Ack=60251 Win=35040 Len=0
  262 5.352008338 64.233.165.198 → 192.168.49.141 TLSv1.3 1456 Application Data, Application Data
  263 5.352031770 64.233.165.198 → 192.168.49.141 TLSv1.3 1456 Application Data [TCP segment of a reassembled PDU]
  264 5.352041892 192.168.49.141 → 64.233.165.198 TCP 56 45178 → 443 [ACK] Seq=1114 Ack=63051 Win=63000 Len=0
  265 5.356786540 64.233.165.198 → 192.168.49.141 TLSv1.3 1516 Application Data [TCP segment of a reassembled PDU]
  266 5.356811037 64.233.165.198 → 192.168.49.141 TLSv1.3 1396 Application Data, Application Data
  267 5.356822764 192.168.49.141 → 64.233.165.198 TCP 56 45178 → 443 [ACK] Seq=1114 Ack=65851 Win=63000 Len=0
  268 5.357021191 64.233.165.198 → 192.168.49.141 TLSv1.3 1456 Application Data [TCP segment of a reassembled PDU]
  269 5.357159680 192.168.49.141 → 64.233.165.198 TCP 56 45178 → 443 [ACK] Seq=1114 Ack=67251 Win=63000 Len=0
  270 5.357269536 64.233.165.198 → 192.168.49.141 TLSv1.3 1456 Application Data [TCP segment of a reassembled PDU]
  271 5.357315314 192.168.49.141 → 64.233.165.198 TCP 56 45178 → 443 [ACK] Seq=1114 Ack=68651 Win=65535 Len=0
  272 5.361721981 64.233.165.198 → 192.168.49.141 TLSv1.3 1456 Application Data [TCP segment of a reassembled PDU]
  273 5.361763602 192.168.49.141 → 64.233.165.198 TCP 56 45178 → 443 [ACK] Seq=1114 Ack=70051 Win=65535 Len=0
  274 5.363831983 64.233.165.198 → 192.168.49.141 TLSv1.3 1456 Application Data [TCP segment of a reassembled PDU]
  275 5.363897291 192.168.49.141 → 64.233.165.198 TCP 56 45178 → 443 [ACK] Seq=1114 Ack=71451 Win=65535 Len=0
  276 5.369112953 64.233.165.198 → 192.168.49.141 TLSv1.3 1165 Application Data, Application Data, Application Data, Application Data, Application Data
  277 5.369140764 192.168.49.141 → 64.233.165.198 TCP 56 45178 → 443 [ACK] Seq=1114 Ack=72560 Win=65535 Len=0
  278 5.369358630 192.168.49.141 → 64.233.165.198 TLSv1.3 95 Application Data
  279 5.370605095 192.168.49.141 → 34.120.208.123 TLSv1.2 201 Application Data
  280 5.370913143 192.168.49.141 → 34.120.208.123 TLSv1.2 485 Application Data
  281 5.371379485 64.233.165.198 → 192.168.49.141 TCP 62 443 → 45178 [ACK] Seq=72560 Ack=1153 Win=64240 Len=0
  282 5.371390487 34.120.208.123 → 192.168.49.141 TCP 62 443 → 52020 [ACK] Seq=236 Ack=22976 Win=64240 Len=0
  283 5.371393084 34.120.208.123 → 192.168.49.141 TCP 62 443 → 52020 [ACK] Seq=236 Ack=23405 Win=64240 Len=0
  284 5.373537015 192.168.49.141 → 104.16.249.249 TLSv1.2 112 Application Data
  285 5.373652344 192.168.49.141 → 104.16.249.249 TLSv1.2 215 Application Data
  286 5.373893398 192.168.49.141 → 104.16.249.249 TLSv1.2 112 Application Data
  287 5.373968890 104.16.249.249 → 192.168.49.141 TCP 62 443 → 35488 [ACK] Seq=5107 Ack=1992 Win=64240 Len=0
  288 5.373974391 104.16.249.249 → 192.168.49.141 TCP 62 443 → 35488 [ACK] Seq=5107 Ack=2151 Win=64240 Len=0
  289 5.374026276 192.168.49.141 → 104.16.249.249 TLSv1.2 215 Application Data
  290 5.374076686 104.16.249.249 → 192.168.49.141 TCP 62 443 → 35488 [ACK] Seq=5107 Ack=2207 Win=64240 Len=0
  291 5.374167377 104.16.249.249 → 192.168.49.141 TCP 62 443 → 35488 [ACK] Seq=5107 Ack=2366 Win=64240 Len=0
  292 5.374307846 192.168.49.141 → 104.16.249.249 TLSv1.2 112 Application Data
  293 5.374413579 104.16.249.249 → 192.168.49.141 TCP 62 443 → 35488 [ACK] Seq=5107 Ack=2422 Win=64240 Len=0
  294 5.374457499 192.168.49.141 → 104.16.249.249 TLSv1.2 215 Application Data
  295 5.374513546 64.233.165.198 → 192.168.49.141 UDP 1401 443 → 44730 Len=1357
  296 5.374521768 104.16.249.249 → 192.168.49.141 TCP 62 443 → 35488 [ACK] Seq=5107 Ack=2581 Win=64240 Len=0
  297 5.374710008 192.168.49.141 → 104.16.249.249 TLSv1.2 112 Application Data
  298 5.374763530 104.16.249.249 → 192.168.49.141 TCP 62 443 → 35488 [ACK] Seq=5107 Ack=2637 Win=64240 Len=0
  299 5.374863180 192.168.49.141 → 104.16.249.249 TLSv1.2 215 Application Data
  300 5.374917170 104.16.249.249 → 192.168.49.141 TCP 62 443 → 35488 [ACK] Seq=5107 Ack=2796 Win=64240 Len=0
  301 5.375746242 192.168.49.141 → 64.233.165.198 UDP 84 44730 → 443 Len=40
  302 5.377177458 192.168.49.141 → 34.120.208.123 TLSv1.2 179 Application Data
  303 5.377322203 34.120.208.123 → 192.168.49.141 TCP 62 443 → 52020 [ACK] Seq=236 Ack=23528 Win=64240 Len=0
  304 5.377484756 192.168.49.141 → 34.120.208.123 TLSv1.2 679 Application Data
  305 5.377622532 34.120.208.123 → 192.168.49.141 TCP 62 443 → 52020 [ACK] Seq=236 Ack=24151 Win=64240 Len=0
  306 5.388072168 64.233.165.198 → 192.168.49.141 UDP 1401 443 → 44730 Len=1357
  307 5.388133814 64.233.165.198 → 192.168.49.141 UDP 1401 443 → 44730 Len=1357
  308 5.388554431 192.168.49.141 → 64.233.165.198 UDP 86 44730 → 443 Len=42
  309 5.391501096 192.168.49.141 → 104.16.249.249 TLSv1.2 112 Application Data
  310 5.391674109 104.16.249.249 → 192.168.49.141 TCP 62 443 → 35488 [ACK] Seq=5107 Ack=2852 Win=64240 Len=0
  311 5.392125908 192.168.49.141 → 104.16.249.249 TLSv1.2 215 Application Data
  312 5.392314608 104.16.249.249 → 192.168.49.141 TCP 62 443 → 35488 [ACK] Seq=5107 Ack=3011 Win=64240 Len=0
  313 5.394309487 192.168.49.141 → 104.16.249.249 TLSv1.2 112 Application Data
  314 5.394699845 192.168.49.141 → 104.16.249.249 TLSv1.2 215 Application Data
  315 5.395229799 104.16.249.249 → 192.168.49.141 TCP 62 443 → 35488 [ACK] Seq=5107 Ack=3067 Win=64240 Len=0
  316 5.395241871 104.16.249.249 → 192.168.49.141 TCP 62 443 → 35488 [ACK] Seq=5107 Ack=3226 Win=64240 Len=0
  317 5.414556445 104.16.249.249 → 192.168.49.141 TLSv1.2 91 Application Data
  318 5.414575613 192.168.49.141 → 104.16.249.249 TCP 56 35488 → 443 [ACK] Seq=3226 Ack=5142 Win=62780 Len=0
  319 5.455891293 64.233.165.198 → 192.168.49.141 UDP 1401 443 → 44730 Len=1357
  320 5.456310042 104.16.249.249 → 192.168.49.141 TLSv1.2 143 Application Data
  321 5.456323073 192.168.49.141 → 104.16.249.249 TCP 56 35488 → 443 [ACK] Seq=3226 Ack=5229 Win=62780 Len=0
  322 5.456492985 192.168.49.141 → 64.233.165.198 UDP 86 44730 → 443 Len=42
  323 5.466822002 64.233.165.198 → 192.168.49.141 UDP 1401 443 → 44730 Len=1357
  324 5.467014944 64.233.165.198 → 192.168.49.141 UDP 1401 443 → 44730 Len=1357
  325 5.467017458 192.168.49.141 → 64.233.165.198 UDP 86 44730 → 443 Len=42
  326 5.467039377 64.233.165.198 → 192.168.49.141 UDP 373 443 → 44730 Len=329
  327 5.468051703 104.16.249.249 → 192.168.49.141 TLSv1.2 611 Application Data
  328 5.468065910 192.168.49.141 → 104.16.249.249 TCP 56 35488 → 443 [ACK] Seq=3226 Ack=5784 Win=62780 Len=0
  329 5.468465273 192.168.49.141 → 64.233.165.198 UDP 87 44730 → 443 Len=43
  330 5.472916189 192.168.49.141 → 64.233.165.198 UDP 152 44730 → 443 Len=108
  331 5.473044326 192.168.49.141 → 64.233.165.198 UDP 110 44730 → 443 Len=66
  332 5.473239724 104.16.249.249 → 192.168.49.141 TLSv1.2 588 Application Data
  333 5.473265667 192.168.49.141 → 104.16.249.249 TCP 56 35488 → 443 [ACK] Seq=3226 Ack=6316 Win=62780 Len=0
  334 5.473416664 192.168.49.141 → 64.233.165.198 TLSv1.3 95 Application Data
  335 5.473586715 64.233.165.198 → 192.168.49.141 TCP 62 443 → 45178 [ACK] Seq=72560 Ack=1192 Win=64240 Len=0
  336 5.474215736 104.16.249.249 → 192.168.49.141 TLSv1.2 1120 Application Data, Application Data
  337 5.474221904 192.168.49.141 → 104.16.249.249 TCP 56 35488 → 443 [ACK] Seq=3226 Ack=7380 Win=62780 Len=0
  338 5.474250807 104.16.249.249 → 192.168.49.141 TLSv1.2 1120 Application Data, Application Data
  339 5.474257246 192.168.49.141 → 104.16.249.249 TCP 56 35488 → 443 [ACK] Seq=3226 Ack=8444 Win=62780 Len=0
  340 5.476517646 192.168.49.141 → 64.233.165.198 TLSv1.3 80 Application Data
  341 5.476586900 192.168.49.141 → 64.233.165.198 TCP 56 45178 → 443 [FIN, ACK] Seq=1216 Ack=72560 Win=65535 Len=0
  342 5.476762597 64.233.165.198 → 192.168.49.141 TCP 62 443 → 45178 [ACK] Seq=72560 Ack=1216 Win=64240 Len=0
  343 5.476863803 64.233.165.198 → 192.168.49.141 TCP 62 443 → 45178 [ACK] Seq=72560 Ack=1217 Win=64239 Len=0
  344 5.502691909 192.168.49.141 → 64.233.165.198 UDP 436 44730 → 443 Len=392
  345 5.503760332 192.168.49.141 → 64.233.165.198 UDP 392 44730 → 443 Len=348
  346 5.504726668 192.168.49.141 → 104.16.249.249 TLSv1.2 112 Application Data
  347 5.504781856 192.168.49.141 → 104.16.249.249 TLSv1.2 215 Application Data
  348 5.504898195 104.16.249.249 → 192.168.49.141 TCP 62 443 → 35488 [ACK] Seq=8444 Ack=3282 Win=64240 Len=0
  349 5.504907109 104.16.249.249 → 192.168.49.141 TCP 62 443 → 35488 [ACK] Seq=8444 Ack=3441 Win=64240 Len=0
  350 5.504912820 192.168.49.141 → 104.16.249.249 TLSv1.2 112 Application Data
  351 5.504980593 192.168.49.141 → 104.16.249.249 TLSv1.2 215 Application Data
  352 5.505003576 104.16.249.249 → 192.168.49.141 TCP 62 443 → 35488 [ACK] Seq=8444 Ack=3497 Win=64240 Len=0
  353 5.505095977 104.16.249.249 → 192.168.49.141 TCP 62 443 → 35488 [ACK] Seq=8444 Ack=3656 Win=64240 Len=0
  354 5.505568108 192.168.49.141 → 104.16.249.249 TLSv1.2 112 Application Data
  355 5.505617074 192.168.49.141 → 104.16.249.249 TLSv1.2 215 Application Data
  356 5.505641615 104.16.249.249 → 192.168.49.141 TCP 62 443 → 35488 [ACK] Seq=8444 Ack=3712 Win=64240 Len=0
  357 5.505734061 104.16.249.249 → 192.168.49.141 TCP 62 443 → 35488 [ACK] Seq=8444 Ack=3871 Win=64240 Len=0
  358 5.509114586 192.168.49.141 → 64.233.165.198 UDP 663 44730 → 443 Len=619
  359 5.511891377 192.168.49.141 → 64.233.165.198 UDP 371 44730 → 443 Len=327
  360 5.513370322 192.168.49.141 → 64.233.165.198 UDP 350 44730 → 443 Len=306
  361 5.514178313 192.168.49.141 → 64.233.165.198 UDP 367 44730 → 443 Len=323
  362 5.517327439 192.168.49.141 → 64.233.165.198 UDP 356 44730 → 443 Len=312
  363 5.521070261 192.168.49.141 → 64.233.165.198 UDP 341 44730 → 443 Len=297
  364 5.522409824 192.168.49.141 → 64.233.165.198 UDP 347 44730 → 443 Len=303
  365 5.527149770 192.168.49.141 → 64.233.165.198 UDP 378 44730 → 443 Len=334
  366 5.528939727 192.168.49.141 → 64.233.165.198 UDP 361 44730 → 443 Len=317
  367 5.530766274 192.168.49.141 → 64.233.165.198 UDP 424 44730 → 443 Len=380
  368 5.533213202 192.168.49.141 → 104.16.249.249 TLSv1.2 112 Application Data
  369 5.533400724 104.16.249.249 → 192.168.49.141 TCP 62 443 → 35488 [ACK] Seq=8444 Ack=3927 Win=64240 Len=0
  370 5.533539399 192.168.49.141 → 104.16.249.249 TLSv1.2 215 Application Data
  371 5.533658069 104.16.249.249 → 192.168.49.141 TCP 62 443 → 35488 [ACK] Seq=8444 Ack=4086 Win=64240 Len=0
  372 5.533795999 192.168.49.141 → 104.16.249.249 TLSv1.2 112 Application Data
  373 5.533908819 104.16.249.249 → 192.168.49.141 TCP 62 443 → 35488 [ACK] Seq=8444 Ack=4142 Win=64240 Len=0
  374 5.533992035 192.168.49.141 → 104.16.249.249 TLSv1.2 215 Application Data
  375 5.534063223 104.16.249.249 → 192.168.49.141 TCP 62 443 → 35488 [ACK] Seq=8444 Ack=4301 Win=64240 Len=0
  376 5.534302518 192.168.49.141 → 104.16.249.249 TLSv1.2 112 Application Data
  377 5.534365242 104.16.249.249 → 192.168.49.141 TCP 62 443 → 35488 [ACK] Seq=8444 Ack=4357 Win=64240 Len=0
  378 5.534468753 192.168.49.141 → 104.16.249.249 TLSv1.2 215 Application Data
  379 5.534528206 104.16.249.249 → 192.168.49.141 TCP 62 443 → 35488 [ACK] Seq=8444 Ack=4516 Win=64240 Len=0
  380 5.537710675 192.168.49.141 → 64.233.165.198 UDP 379 44730 → 443 Len=335
  381 5.543060950 104.16.249.249 → 192.168.49.141 TLSv1.2 91 Application Data
  382 5.543210230 192.168.49.141 → 104.16.249.249 TCP 56 35488 → 443 [ACK] Seq=4516 Ack=8479 Win=63840 Len=0
