    1 0.000000000 192.168.49.131 → 192.168.49.132 TCP 76 33100 → 21 [SYN] Seq=0 Win=64240 Len=0 MSS=1460 SACK_PERM=1 TSval=559634157 TSecr=0 WS=128
    2 0.000942401 192.168.49.132 → 192.168.49.131 TCP 76 21 → 33100 [SYN, ACK] Seq=0 Ack=1 Win=65160 Len=0 MSS=1460 SACK_PERM=1 TSval=2549697805 TSecr=559634157 WS=128
    3 0.001022854 192.168.49.131 → 192.168.49.132 TCP 68 33100 → 21 [ACK] Seq=1 Ack=1 Win=64256 Len=0 TSval=559634158 TSecr=2549697805
    4 0.006340091 192.168.49.132 → 192.168.49.131 FTP 88 Response: 220 (vsFTPd 3.0.3)
    5 0.006418506 192.168.49.131 → 192.168.49.132 TCP 68 33100 → 21 [ACK] Seq=1 Ack=21 Win=64256 Len=0 TSval=559634163 TSecr=2549697810
    6 2.856943759 192.168.49.131 → 192.168.49.132 FTP 81 Request: USER server
    7 2.857867399 192.168.49.132 → 192.168.49.131 TCP 68 21 → 33100 [ACK] Seq=21 Ack=14 Win=65280 Len=0 TSval=2549700661 TSecr=559637014
    8 2.858221041 192.168.49.132 → 192.168.49.131 FTP 102 Response: 331 Please specify the password.
    9 2.858243369 192.168.49.131 → 192.168.49.132 TCP 68 33100 → 21 [ACK] Seq=14 Ack=55 Win=64256 Len=0 TSval=559637015 TSecr=2549700661
   10 4.466093491 192.168.49.131 → 198.16.70.53 TLSv1.2 124 Application Data
   11 4.466399147 192.168.49.131 → 198.16.70.53 TLSv1.2 124 Application Data
   12 4.466509806 198.16.70.53 → 192.168.49.131 TCP 62 425 → 56518 [ACK] Seq=1 Ack=69 Win=64240 Len=0
   13 4.466564249 198.16.70.53 → 192.168.49.131 TCP 62 425 → 38688 [ACK] Seq=1 Ack=69 Win=64240 Len=0
   14 4.553181558 198.16.70.53 → 192.168.49.131 TLSv1.2 124 Application Data
   15 4.553219273 192.168.49.131 → 198.16.70.53 TCP 56 56518 → 425 [ACK] Seq=69 Ack=69 Win=64016 Len=0
   16 4.600508497 198.16.70.53 → 192.168.49.131 TLSv1.2 124 Application Data
   17 4.600545701 192.168.49.131 → 198.16.70.53 TCP 56 38688 → 425 [ACK] Seq=69 Ack=69 Win=62780 Len=0
   18 8.448940332 192.168.49.131 → 192.168.49.132 FTP 82 Request: PASS rusanow
   19 8.449929737 192.168.49.132 → 192.168.49.131 TCP 68 21 → 33100 [ACK] Seq=55 Ack=28 Win=65280 Len=0 TSval=2549706252 TSecr=559642606
   20 8.502148573 192.168.49.132 → 192.168.49.131 FTP 91 Response: 230 Login successful.
   21 8.502170103 192.168.49.131 → 192.168.49.132 TCP 68 33100 → 21 [ACK] Seq=28 Ack=78 Win=64256 Len=0 TSval=559642659 TSecr=2549706304
   22 8.502411043 192.168.49.131 → 192.168.49.132 FTP 74 Request: SYST
   23 8.502586033 192.168.49.132 → 192.168.49.131 TCP 68 21 → 33100 [ACK] Seq=78 Ack=34 Win=65280 Len=0 TSval=2549706304 TSecr=559642659
   24 8.502690280 192.168.49.132 → 192.168.49.131 FTP 87 Response: 215 UNIX Type: L8
   25 8.502694415 192.168.49.131 → 192.168.49.132 TCP 68 33100 → 21 [ACK] Seq=34 Ack=97 Win=64256 Len=0 TSval=559642659 TSecr=2549706305
   26 13.900059451 192.168.49.131 → 192.168.49.132 FTP 97 Request: PORT 192,168,49,131,167,179
   27 13.901071320 192.168.49.132 → 192.168.49.131 TCP 68 21 → 33100 [ACK] Seq=97 Ack=63 Win=65280 Len=0 TSval=2549711701 TSecr=559648057
   28 13.901642105 192.168.49.132 → 192.168.49.131 FTP 119 Response: 200 PORT command successful. Consider using PASV.
   29 13.901668581 192.168.49.131 → 192.168.49.132 TCP 68 33100 → 21 [ACK] Seq=63 Ack=148 Win=64256 Len=0 TSval=559648058 TSecr=2549711702
   30 13.901927184 192.168.49.131 → 192.168.49.132 FTP 74 Request: LIST
   31 13.902663648 192.168.49.132 → 192.168.49.131 TCP 68 21 → 33100 [ACK] Seq=148 Ack=69 Win=65280 Len=0 TSval=2549711703 TSecr=559648059
   32 13.904125361 192.168.49.132 → 192.168.49.131 TCP 76 20 → 42931 [SYN] Seq=0 Win=64240 Len=0 MSS=1460 SACK_PERM=1 TSval=2549711705 TSecr=0 WS=128
   33 13.904167210 192.168.49.131 → 192.168.49.132 TCP 76 42931 → 20 [SYN, ACK] Seq=0 Ack=1 Win=65160 Len=0 MSS=1460 SACK_PERM=1 TSval=559648061 TSecr=2549711705 WS=128
   34 13.905056546 192.168.49.132 → 192.168.49.131 TCP 68 20 → 42931 [ACK] Seq=1 Ack=1 Win=64256 Len=0 TSval=2549711705 TSecr=559648061
   35 13.905235164 192.168.49.132 → 192.168.49.131 FTP 107 Response: 150 Here comes the directory listing.
   36 13.905248041 192.168.49.131 → 192.168.49.132 TCP 68 33100 → 21 [ACK] Seq=69 Ack=187 Win=64256 Len=0 TSval=559648062 TSecr=2549711706
   37 13.905670414 192.168.49.132 → 192.168.49.131 FTP-DATA 271 FTP Data: 203 bytes (PORT) (LIST)
   38 13.905690537 192.168.49.131 → 192.168.49.132 TCP 68 42931 → 20 [ACK] Seq=1 Ack=204 Win=65024 Len=0 TSval=559648062 TSecr=2549711706
   39 13.905784562 192.168.49.132 → 192.168.49.131 TCP 68 20 → 42931 [FIN, ACK] Seq=204 Ack=1 Win=64256 Len=0 TSval=2549711706 TSecr=559648061
   40 13.905890162 192.168.49.131 → 192.168.49.132 TCP 68 42931 → 20 [FIN, ACK] Seq=1 Ack=205 Win=65024 Len=0 TSval=559648063 TSecr=2549711706
   41 13.906272397 192.168.49.132 → 192.168.49.131 TCP 68 20 → 42931 [ACK] Seq=205 Ack=2 Win=64256 Len=0 TSval=2549711707 TSecr=559648063
   42 13.906346889 192.168.49.132 → 192.168.49.131 FTP 92 Response: 226 Directory send OK.
   43 13.906359974 192.168.49.131 → 192.168.49.132 TCP 68 33100 → 21 [ACK] Seq=69 Ack=211 Win=64256 Len=0 TSval=559648063 TSecr=2549711707
   44 15.112452328 192.168.49.131 → 198.16.70.53 TLSv1.2 202 Application Data
   45 15.112919209 198.16.70.53 → 192.168.49.131 TCP 62 425 → 52014 [ACK] Seq=1 Ack=147 Win=64240 Len=0
   46 15.158049355 198.16.70.53 → 192.168.49.131 TLSv1.2 123 Application Data
   47 15.158086012 192.168.49.131 → 198.16.70.53 TCP 56 52014 → 425 [ACK] Seq=147 Ack=68 Win=62780 Len=0
   48 19.381478893 192.168.49.131 → 192.168.49.132 FTP 76 Request: TYPE I
   49 19.382522624 192.168.49.132 → 192.168.49.131 TCP 68 21 → 33100 [ACK] Seq=211 Ack=77 Win=65280 Len=0 TSval=2549717182 TSecr=559653538
   50 19.382766029 192.168.49.132 → 192.168.49.131 FTP 99 Response: 200 Switching to Binary mode.
   51 19.382785428 192.168.49.131 → 192.168.49.132 TCP 68 33100 → 21 [ACK] Seq=77 Ack=242 Win=64256 Len=0 TSval=559653540 TSecr=2549717182
   52 19.382982485 192.168.49.131 → 192.168.49.132 FTP 96 Request: PORT 192,168,49,131,189,45
   53 19.384016175 192.168.49.132 → 192.168.49.131 FTP 119 Response: 200 PORT command successful. Consider using PASV.
   54 19.384036045 192.168.49.131 → 192.168.49.132 TCP 68 33100 → 21 [ACK] Seq=105 Ack=293 Win=64256 Len=0 TSval=559653541 TSecr=2549717183
   55 19.384230593 192.168.49.131 → 192.168.49.132 FTP 82 Request: RETR 123.txt
   56 19.385884016 192.168.49.132 → 192.168.49.131 TCP 76 20 → 48429 [SYN] Seq=0 Win=64240 Len=0 MSS=1460 SACK_PERM=1 TSval=2549717185 TSecr=0 WS=128
   57 19.385925097 192.168.49.131 → 192.168.49.132 TCP 76 48429 → 20 [SYN, ACK] Seq=0 Ack=1 Win=65160 Len=0 MSS=1460 SACK_PERM=1 TSval=559653543 TSecr=2549717185 WS=128
   58 19.386448902 192.168.49.132 → 192.168.49.131 TCP 68 20 → 48429 [ACK] Seq=1 Ack=1 Win=64256 Len=0 TSval=2549717186 TSecr=559653543
   59 19.386712634 192.168.49.132 → 192.168.49.131 FTP 132 Response: 150 Opening BINARY mode data connection for 123.txt (4 bytes).
   60 19.386737378 192.168.49.131 → 192.168.49.132 TCP 68 33100 → 21 [ACK] Seq=119 Ack=357 Win=64256 Len=0 TSval=559653543 TSecr=2549717186
   61 19.387542395 192.168.49.132 → 192.168.49.131 FTP-DATA 72 FTP Data: 4 bytes (PORT) (RETR 123.txt)
   62 19.387542767 192.168.49.132 → 192.168.49.131 TCP 68 20 → 48429 [FIN, ACK] Seq=5 Ack=1 Win=64256 Len=0 TSval=2549717187 TSecr=559653543
   63 19.387571706 192.168.49.131 → 192.168.49.132 TCP 68 48429 → 20 [ACK] Seq=1 Ack=5 Win=65280 Len=0 TSval=559653544 TSecr=2549717187
   64 19.387915801 192.168.49.131 → 192.168.49.132 TCP 68 48429 → 20 [FIN, ACK] Seq=1 Ack=6 Win=65280 Len=0 TSval=559653545 TSecr=2549717187
   65 19.388634277 192.168.49.132 → 192.168.49.131 TCP 68 20 → 48429 [ACK] Seq=6 Ack=2 Win=64256 Len=0 TSval=2549717188 TSecr=559653545
   66 19.388899352 192.168.49.132 → 192.168.49.131 FTP 92 Response: 226 Transfer complete.
   67 19.388912450 192.168.49.131 → 192.168.49.132 TCP 68 33100 → 21 [ACK] Seq=119 Ack=381 Win=64256 Len=0 TSval=559653546 TSecr=2549717188
   68 19.546727414 192.168.49.131 → 152.199.19.161 TCP 56 43166 → 443 [ACK] Seq=1 Ack=1 Win=62780 Len=0
   69 19.546948726 152.199.19.161 → 192.168.49.131 TCP 62 [TCP ACKed unseen segment] 443 → 43166 [ACK] Seq=1 Ack=2 Win=64240 Len=0
   70 32.233397951 192.168.49.131 → 192.168.49.132 FTP 97 Request: PORT 192,168,49,131,147,115
   71 32.234795862 192.168.49.132 → 192.168.49.131 FTP 119 Response: 200 PORT command successful. Consider using PASV.
   72 32.234829897 192.168.49.131 → 192.168.49.132 TCP 68 33100 → 21 [ACK] Seq=148 Ack=432 Win=64256 Len=0 TSval=559666392 TSecr=2549730032
   73 32.235051004 192.168.49.131 → 192.168.49.132 FTP 85 Request: STOR README.txt
   74 32.262313700 192.168.49.132 → 192.168.49.131 TCP 76 20 → 37747 [SYN] Seq=0 Win=64240 Len=0 MSS=1460 SACK_PERM=1 TSval=2549730060 TSecr=0 WS=128
   75 32.262359109 192.168.49.131 → 192.168.49.132 TCP 76 37747 → 20 [SYN, ACK] Seq=0 Ack=1 Win=65160 Len=0 MSS=1460 SACK_PERM=1 TSval=559666419 TSecr=2549730060 WS=128
   76 32.262835128 192.168.49.132 → 192.168.49.131 TCP 68 20 → 37747 [ACK] Seq=1 Ack=1 Win=64256 Len=0 TSval=2549730060 TSecr=559666419
   77 32.262902497 192.168.49.132 → 192.168.49.131 FTP 90 Response: 150 Ok to send data.
   78 32.263933640 192.168.49.131 → 192.168.49.132 FTP-DATA 2815 FTP Data: 2747 bytes (PORT) (STOR README.txt)
   79 32.264077372 192.168.49.131 → 192.168.49.132 TCP 68 37747 → 20 [FIN, ACK] Seq=2748 Ack=1 Win=65280 Len=0 TSval=559666421 TSecr=2549730060
   80 32.264570342 192.168.49.132 → 192.168.49.131 TCP 68 20 → 37747 [ACK] Seq=1 Ack=1449 Win=64128 Len=0 TSval=2549730062 TSecr=559666421
   81 32.264786873 192.168.49.132 → 192.168.49.131 TCP 68 20 → 37747 [FIN, ACK] Seq=1 Ack=2749 Win=64128 Len=0 TSval=2549730062 TSecr=559666421
   82 32.264799555 192.168.49.131 → 192.168.49.132 TCP 68 37747 → 20 [ACK] Seq=2749 Ack=2 Win=65280 Len=0 TSval=559666422 TSecr=2549730062
   83 32.265271637 192.168.49.132 → 192.168.49.131 FTP 92 Response: 226 Transfer complete.
   84 32.265297239 192.168.49.131 → 192.168.49.132 TCP 68 33100 → 21 [ACK] Seq=165 Ack=478 Win=64256 Len=0 TSval=559666422 TSecr=2549730061
   85 36.616618863 192.168.49.131 → 192.168.49.132 FTP 73 Request: PWD
   86 36.617843674 192.168.49.132 → 192.168.49.131 FTP 113 Response: 257 "/home/server" is the current directory
   87 36.658723253 192.168.49.131 → 192.168.49.132 TCP 68 33100 → 21 [ACK] Seq=170 Ack=523 Win=64256 Len=0 TSval=559670815 TSecr=2549734415
   88 38.396653245 192.168.49.131 → 192.168.49.132 FTP 76 Request: TYPE A
   89 38.397994311 192.168.49.132 → 192.168.49.131 FTP 98 Response: 200 Switching to ASCII mode.
   90 38.398020509 192.168.49.131 → 192.168.49.132 TCP 68 33100 → 21 [ACK] Seq=178 Ack=553 Win=64256 Len=0 TSval=559672555 TSecr=2549736195
   91 38.398190146 192.168.49.131 → 192.168.49.132 FTP 97 Request: PORT 192,168,49,131,182,109
   92 38.399135370 192.168.49.132 → 192.168.49.131 FTP 119 Response: 200 PORT command successful. Consider using PASV.
   93 38.399149314 192.168.49.131 → 192.168.49.132 TCP 68 33100 → 21 [ACK] Seq=207 Ack=604 Win=64256 Len=0 TSval=559672556 TSecr=2549736196
   94 38.399278019 192.168.49.131 → 192.168.49.132 FTP 74 Request: LIST
   95 38.399981218 192.168.49.132 → 192.168.49.131 TCP 76 20 → 46701 [SYN] Seq=0 Win=64240 Len=0 MSS=1460 SACK_PERM=1 TSval=2549736197 TSecr=0 WS=128
   96 38.400013130 192.168.49.131 → 192.168.49.132 TCP 76 46701 → 20 [SYN, ACK] Seq=0 Ack=1 Win=65160 Len=0 MSS=1460 SACK_PERM=1 TSval=559672557 TSecr=2549736197 WS=128
   97 38.400552860 192.168.49.132 → 192.168.49.131 TCP 68 20 → 46701 [ACK] Seq=1 Ack=1 Win=64256 Len=0 TSval=2549736197 TSecr=559672557
   98 38.400812288 192.168.49.132 → 192.168.49.131 FTP 107 Response: 150 Here comes the directory listing.
   99 38.400835440 192.168.49.131 → 192.168.49.132 TCP 68 33100 → 21 [ACK] Seq=213 Ack=643 Win=64256 Len=0 TSval=559672558 TSecr=2549736198
  100 38.400983928 192.168.49.132 → 192.168.49.131 FTP-DATA 339 FTP Data: 271 bytes (PORT) (LIST)
  101 38.400993444 192.168.49.131 → 192.168.49.132 TCP 68 46701 → 20 [ACK] Seq=1 Ack=272 Win=64896 Len=0 TSval=559672558 TSecr=2549736198
  102 38.401245969 192.168.49.132 → 192.168.49.131 TCP 68 20 → 46701 [FIN, ACK] Seq=272 Ack=1 Win=64256 Len=0 TSval=2549736198 TSecr=559672557
  103 38.401285546 192.168.49.131 → 192.168.49.132 TCP 68 46701 → 20 [FIN, ACK] Seq=1 Ack=273 Win=64896 Len=0 TSval=559672558 TSecr=2549736198
  104 38.402067197 192.168.49.132 → 192.168.49.131 TCP 68 20 → 46701 [ACK] Seq=273 Ack=2 Win=64256 Len=0 TSval=2549736199 TSecr=559672558
  105 38.402200195 192.168.49.132 → 192.168.49.131 FTP 92 Response: 226 Directory send OK.
  106 38.402207454 192.168.49.131 → 192.168.49.132 TCP 68 33100 → 21 [ACK] Seq=213 Ack=667 Win=64256 Len=0 TSval=559672559 TSecr=2549736199
  107 41.467482971 192.168.49.131 → 104.16.249.249 TLSv1.2 95 Application Data
  108 41.467789721 104.16.249.249 → 192.168.49.131 TCP 62 443 → 60124 [ACK] Seq=1 Ack=40 Win=64240 Len=0
  109 41.523412464 104.16.249.249 → 192.168.49.131 TLSv1.2 95 Application Data
  110 41.523449939 192.168.49.131 → 104.16.249.249 TCP 56 60124 → 443 [ACK] Seq=40 Ack=40 Win=62780 Len=0
  111 43.336792731 192.168.49.131 → 104.16.249.249 TLSv1.2 95 Application Data
  112 43.337282913 104.16.249.249 → 192.168.49.131 TCP 62 443 → 60116 [ACK] Seq=1 Ack=40 Win=64240 Len=0
  113 43.544679841 104.16.249.249 → 192.168.49.131 TLSv1.2 95 Application Data
  114 43.544750461 192.168.49.131 → 104.16.249.249 TCP 56 60116 → 443 [ACK] Seq=40 Ack=40 Win=63984 Len=0
  115 48.591783451 192.168.49.131 → 192.168.49.132 FTP 74 Request: QUIT
  116 48.592537230 192.168.49.132 → 192.168.49.131 FTP 82 Response: 221 Goodbye.
  117 48.592569015 192.168.49.131 → 192.168.49.132 TCP 68 33100 → 21 [ACK] Seq=219 Ack=681 Win=64256 Len=0 TSval=559682749 TSecr=2549746388
  118 48.593097620 192.168.49.131 → 192.168.49.132 TCP 68 33100 → 21 [FIN, ACK] Seq=219 Ack=681 Win=64256 Len=0 TSval=559682750 TSecr=2549746388
  119 48.593216638 192.168.49.132 → 192.168.49.131 TCP 68 21 → 33100 [FIN, ACK] Seq=681 Ack=219 Win=65280 Len=0 TSval=2549746388 TSecr=559682749
  120 48.593227323 192.168.49.131 → 192.168.49.132 TCP 68 33100 → 21 [ACK] Seq=220 Ack=682 Win=64256 Len=0 TSval=559682750 TSecr=2549746388
  121 48.593632812 192.168.49.132 → 192.168.49.131 TCP 68 21 → 33100 [ACK] Seq=682 Ack=220 Win=65280 Len=0 TSval=2549746389 TSecr=559682750
