    1 0.000000000 192.168.49.2 → 192.168.49.139 DNS 223 Standard query response 0x4e2d A mobile.events.data.microsoft.com CNAME mobile.events.data.trafficmanager.net CNAME onedscolprdeus00.eastus.cloudapp.azure.com A 20.42.72.131 OPT
    2 0.016826509 192.168.49.2 → 192.168.49.139 DNS 267 Standard query response 0x12d8 AAAA mobile.events.data.microsoft.com CNAME mobile.events.data.trafficmanager.net CNAME onedscolprdwus10.westus.cloudapp.azure.com SOA ns1-02.azure-dns.com OPT
    3 0.017197264 192.168.49.139 → 192.168.49.2 DNS 113 Standard query 0xe78f AAAA onedscolprdwus10.westus.cloudapp.azure.com OPT
    4 0.048589344 192.168.49.2 → 192.168.49.139 DNS 183 Standard query response 0xe78f AAAA onedscolprdwus10.westus.cloudapp.azure.com SOA ns1-02.azure-dns.com OPT
    5 0.049101643 192.168.49.139 → 20.42.72.131 TCP 74 38482 → 443 [SYN] Seq=0 Win=64240 Len=0 MSS=1460 SACK_PERM=1 TSval=1553070363 TSecr=0 WS=128
    6 0.217236351 20.42.72.131 → 192.168.49.139 TCP 60 443 → 38482 [SYN, ACK] Seq=0 Ack=1 Win=64240 Len=0 MSS=1460
    7 0.217268409 192.168.49.139 → 20.42.72.131 TCP 54 38482 → 443 [ACK] Seq=1 Ack=1 Win=64240 Len=0
    8 0.218079472 192.168.49.139 → 20.42.72.131 TLSv1 571 Client Hello
    9 0.218693555 20.42.72.131 → 192.168.49.139 TCP 60 443 → 38482 [ACK] Seq=1 Ack=518 Win=64240 Len=0
   10 0.398066081 20.42.72.131 → 192.168.49.139 TCP 1514 [TCP segment of a reassembled PDU]
   11 0.398099433 192.168.49.139 → 20.42.72.131 TCP 54 38482 → 443 [ACK] Seq=518 Ack=1461 Win=62780 Len=0
   12 0.398191107 20.42.72.131 → 192.168.49.139 TCP 1394 443 → 38482 [PSH, ACK] Seq=1461 Ack=518 Win=64240 Len=1340 [TCP segment of a reassembled PDU]
   13 0.398208803 192.168.49.139 → 20.42.72.131 TCP 54 38482 → 443 [ACK] Seq=518 Ack=2801 Win=62780 Len=0
   14 0.408559978 20.42.72.131 → 192.168.49.139 TCP 1454 443 → 38482 [PSH, ACK] Seq=2801 Ack=518 Win=64240 Len=1400 [TCP segment of a reassembled PDU]
   15 0.408587131 192.168.49.139 → 20.42.72.131 TCP 54 38482 → 443 [ACK] Seq=518 Ack=4201 Win=62780 Len=0
   16 0.408648837 20.42.72.131 → 192.168.49.139 TLSv1.2 360 Server Hello, Certificate, Server Key Exchange, Server Hello Done
   17 0.408656750 192.168.49.139 → 20.42.72.131 TCP 54 38482 → 443 [ACK] Seq=518 Ack=4507 Win=62780 Len=0
   18 0.411472846 192.168.49.139 → 20.42.72.131 TLSv1.2 212 Client Key Exchange, Change Cipher Spec, Encrypted Handshake Message
   19 0.411744285 20.42.72.131 → 192.168.49.139 TCP 60 443 → 38482 [ACK] Seq=4507 Ack=676 Win=64240 Len=0
   20 0.597824788 20.42.72.131 → 192.168.49.139 TLSv1.2 105 Change Cipher Spec, Encrypted Handshake Message
   21 0.597863713 192.168.49.139 → 20.42.72.131 TCP 54 38482 → 443 [ACK] Seq=676 Ack=4558 Win=62780 Len=0
   22 0.600570507 192.168.49.139 → 20.42.72.131 TCP 1514 [TCP segment of a reassembled PDU]
   23 0.600708188 192.168.49.139 → 20.42.72.131 TCP 1514 38482 → 443 [PSH, ACK] Seq=2136 Ack=4558 Win=62780 Len=1460 [TCP segment of a reassembled PDU]
   24 0.601333855 20.42.72.131 → 192.168.49.139 TCP 60 443 → 38482 [ACK] Seq=4558 Ack=2136 Win=64240 Len=0
   25 0.601372636 192.168.49.139 → 20.42.72.131 TLSv1.2 1231 Application Data
   26 0.601496509 20.42.72.131 → 192.168.49.139 TCP 60 443 → 38482 [ACK] Seq=4558 Ack=3596 Win=64240 Len=0
   27 0.601897844 20.42.72.131 → 192.168.49.139 TCP 60 443 → 38482 [ACK] Seq=4558 Ack=4773 Win=64240 Len=0
   28 0.944998698 20.42.72.131 → 192.168.49.139 TLSv1.2 1133 Application Data
   29 0.945476771 192.168.49.139 → 20.42.72.131 TLSv1.2 85 Encrypted Alert
   30 0.945724523 20.42.72.131 → 192.168.49.139 TCP 60 443 → 38482 [ACK] Seq=5638 Ack=4804 Win=64240 Len=0
   31 0.945738926 192.168.49.139 → 20.42.72.131 TCP 54 38482 → 443 [FIN, ACK] Seq=4804 Ack=5638 Win=62780 Len=0
   32 0.945973608 20.42.72.131 → 192.168.49.139 TCP 60 443 → 38482 [ACK] Seq=5638 Ack=4805 Win=64239 Len=0
   33 0.964655843 192.168.49.139 → 173.194.73.94 TCP 54 44440 → 80 [ACK] Seq=1 Ack=1 Win=63791 Len=0
   34 0.964824793 173.194.73.94 → 192.168.49.139 TCP 60 [TCP ACKed unseen segment] 80 → 44440 [ACK] Seq=1 Ack=2 Win=64240 Len=0
   35 1.732817286 192.168.49.139 → 93.184.220.29 TCP 54 49376 → 80 [ACK] Seq=1 Ack=1 Win=64000 Len=0
   36 1.732992800 93.184.220.29 → 192.168.49.139 TCP 60 [TCP ACKed unseen segment] 80 → 49376 [ACK] Seq=1 Ack=2 Win=64240 Len=0
